Start Timestamp;End Timestamp;Transcript
01:00:58,840;01:01:00,040;"this is probably a good time to bring this up."
01:01:00,040;01:01:03,120;"He was playing like in front of his family."
01:01:03,120;01:01:04,680;"They were talking about how..."
01:01:04,680;01:01:05,520;"- Yeah."
01:01:05,520;01:01:07,880;"- I think it was in the paper that he,"
01:01:07,880;01:01:11,360;"like this, because he's from, I think he's from North Carolina."
01:01:11,360;01:01:12,800;"- We stat-chuck this."
01:01:12,800;01:01:14,480;"I'm gonna keep getting rid of some stuff."
01:01:14,480;01:01:16,680;"- I honestly don't care about the fact"
01:01:16,680;01:01:18,400;"that there's two Carolinas."
01:01:18,400;01:01:19,560;"No offense, Greg."
01:01:19,560;01:01:20,880;"I mean, you can take offense if you want to really care."
01:01:20,880;01:01:23,280;"- You don't care that there's two?"
01:01:23,280;01:01:25,520;"- I do, but I don't care to,"
01:01:25,520;01:01:27,240;"if somebody tells me they're from one of them,"
01:01:27,240;01:01:29,440;"I'm not going to remember which one."
01:01:29,440;01:01:31,640;"- They're culturally very different, Andy."
01:01:31,640;01:01:33,120;"Maybe you should read a book."
01:01:33,120;01:01:35,560;"- Not about the Carolinas."
01:01:35,560;01:01:37,280;"- Get your head out of your ass."
01:01:37,280;01:01:40,960;"Get your dick out of your hand."
01:01:40,960;01:01:43,960;"Oh boy."
01:01:43,960;01:01:47,360;"We had to eat, baby."
01:01:47,360;01:01:53,360;"So Troy Brown comes home to his home state."
01:01:53,360;01:01:56,760;"And they're talking about how he bought like a hundred tickets for this game for"
01:01:56,760;01:01:57,760;"like friends and family."
01:01:57,760;01:02:01,060;"And I think he brought like a Pee Wee football team in the game and something"
01:02:01,060;01:02:01,560;"like that."
01:02:01,560;01:02:08,260;"And this was a great game to watch if you're a Troy Brown fan."
01:02:08,760;01:02:11,320;"Like I said, he had that 61 year apartment turn for a touchdown."
01:02:11,320;01:02:16,860;"He also eventually set the all time Patriot single season reception record,"
01:02:16,860;01:02:20,800;"which if you remember, it was like, I think it was like right before the half."
01:02:20,800;01:02:26,640;"And he had to catch that, that set the record, but then it got challenged and overturned"
01:02:26,640;01:02:27,920;"because he didn't completely catch it."
01:02:27,920;01:02:30,520;"And then they kept like showing him the camera on him."
01:02:30,520;01:02:32,280;"He just like laughing and smiling."
01:02:32,280;01:02:34,360;"You can tell he's like kind of pissed off."
01:02:34,360;01:02:35,040;"It doesn't want to show."
01:02:35,040;01:02:36,920;"He's like, God, that was that fucking record."
01:02:37,360;01:02:38,080;"And the only did it."
01:02:38,080;01:02:39,560;"They didn't say exactly."
01:02:39,560;01:02:40,060;"Yeah."
01:02:40,060;01:02:42,760;"And it didn't happen much longer afterwards, but."
01:02:42,760;01:02:47,200;"Yeah, no, like video montage."
01:02:47,200;01:02:49,600;"I was expecting it with Drew Brees."
01:02:49,600;01:02:52,960;"They stopped the fucking game and like the unplug out there."
01:02:52,960;01:02:54,080;"Where's Troy Brown's black?"
01:02:54,080;01:02:54,600;"Dude, I."
01:02:54,600;01:02:57,440;"Oh, that was the worst."
01:02:57,440;01:02:58,960;"They did it again this year too."
01:02:58,960;01:03:03,040;"Oh, when you did the touchdown record this year?"
01:03:03,040;01:03:04,040;"Yeah."
01:03:04,040;01:03:06,320;"No, no, no, no, the regular season touchdown record."
01:03:06,320;01:03:06,680;"Yeah."
01:03:06,680;01:03:11,680;"right. On a Monday night game. And I had friggin Michael Thomas."
01:03:11,680;01:03:15,920;"Who's the last? And they just pulled them in like the second quarter."
01:03:15,920;01:03:21,320;"It was like 38 nothing. And all he announces would talk about his"
01:03:21,320;01:03:24,500;"Drew Brees. Of course. Yeah. I was so mad."
01:03:24,500;01:03:30,240;"But back to why this is a great Troy Brown game is that in Tuan Smith"
01:03:30,240;01:03:33,180;"running touchdown. Like I think it was the first touchdown for the"
01:03:33,180;01:03:38,360;"conference order along. Troy Brown has his guy the"
01:03:38,360;01:03:41,420;"cornerback on like roller skates and he's like pushing"
01:03:41,420;01:03:44,020;"him all the way back in the end zone from like 25 yards"
01:03:44,020;01:03:46,900;"out. Oh yeah. That's classic Troy Brown right"
01:03:46,900;01:03:50,540;"there. Just blocking like a beast on the edge to get"
01:03:50,540;01:03:53,060;"one untouched and right. Yeah."
01:03:53,060;01:03:57,780;"There's also a good tie log game. It was a great"
01:03:57,780;01:04:01,500;"tough. I thought I thought it was a fantastic Otis Smith"
01:04:01,500;01:04:06,500;"game. He had two picks, which technically returned both for a touchdown. One guy called back."
01:04:06,500;01:04:10,660;"He broke up a ton of deep passes. We probably should have had like three or four picks in this"
01:04:10,660;01:04:20,140;"game. He just can't catch. And I was going to say this for my best, but there was one play where"
01:04:20,140;01:04:26,500;"he was lined up on the far side of the field and he came on a corner blitz and you got to watch"
01:04:26,500;01:04:30,700;"the entire thing unfold and it felt like watching like a"
01:04:30,700;01:04:35,140;"National Geographic thing where you can have the line like"
01:04:35,140;01:04:38,500;"hunting like coming down on the on the prey. You're like,"
01:04:38,500;01:04:40,380;"always going to get him. He's going to get him. You better"
01:04:40,380;01:04:42,700;"throw that football and Chris Winky just didn't even feel"
01:04:42,700;01:04:47,660;"like for a second. You got lit up. That was that was just"
01:04:47,660;01:04:50,340;"fantastic television. Yeah, because I was not a camera"
01:04:50,340;01:04:56,300;"angle and everything. Yeah. So I have a note on here."
01:04:56,300;01:05:03,780;"That missed tackle by Winky and then the high step pick six that's Otis is like pick six in the fourth quarter"
01:05:03,780;01:05:06,500;"Yeah, is the gift of Winky's career"
01:05:06,500;01:05:09,540;"You think so get a sum it up"
01:05:09,540;01:05:12,860;"Hey, you're great in the pros, but then"
01:05:12,860;01:05:18,660;"Down 31 six make it 31 eight week your third pick six of the game"
01:05:18,660;01:05:23,980;"Yes"
01:05:23,980;01:05:32,180;"No, no, not the NFL to breath then winky"
01:05:32,180;01:05:42,860;"Nicely done. You just come up with these are these are the existing. Oh, no, Chris. I wish I wish I were an Oscar Meyer winky"
01:05:42,860;01:05:46,740;"Yeah, you're you're fine. Oh"
01:05:47,980;01:05:53,780;"Is digging deep for these he's up in Zobo. It's a website called the berman files"
01:05:53,780;01:05:59,940;"No, it is you you hear a name like winky and you're like there's a nickname for that"
01:05:59,940;01:06:09,020;"Yeah, they're all amazing websites today. I know right. I will have to put all these links in the show notes so that other people can"
01:06:09,020;01:06:13,980;"Oh, there was one there was one where I didn't want to interrupt you guys on the"
01:06:13,980;01:06:14,480;"Yeah."
01:06:14,480;01:06:18,980;"We'll also."
01:06:18,980;01:06:19,420;"Yeah."
01:06:19,420;01:06:21,500;"So the dumpster fire one."
01:06:21,500;01:06:25,100;"Purple-headed Christian meat missile."
01:06:25,100;01:06:28,460;"How does that have anything to do with dumpster fire?"
01:06:28,460;01:06:29,980;"Who knows, dude."
01:06:29,980;01:06:33,380;"It's just sometimes words go well together."
01:06:33,380;01:06:36,060;"Yeah, give me that one more time."
01:06:36,060;01:06:38,100;"Purple-headed Christian meat missile."
01:06:38,100;01:06:43,180;"Kirk Cousins' real name."
01:06:43,180;01:06:44,380;"This nickname in high school."
01:06:44,380;01:06:47,260;"Holy shit."
01:06:47,260;01:06:49,560;"Whoo."
01:06:49,560;01:06:53,320;"No, I have one more thing about Troy Brown."
01:06:53,320;01:06:57,940;"Um, that I forgot to bring up at the beginning of this and before we get"
01:06:57,940;01:07:04,220;"sidetracked again, uh, before this game, um, pro bowl was"
01:07:04,220;01:07:08,700;"renounced Brady and Maloy both made the pro bowl, but Troy Brown didn't,"
01:07:08,700;01:07:12,000;"which is kind of bullshit because he had like one of the best seasons."
01:07:12,700;01:07:16,500;"receiving in the league and he was also like yeah exactly."
01:07:16,500;01:07:18,500;"So, um,"
01:07:18,500;01:07:23,420;"there's a Boston Globe article about it and everybody was pissed for him."
01:07:23,420;01:07:23,920;"Apparently."
01:07:23,920;01:07:27,020;"And, uh, this is what the, the globe had to say."
01:07:27,020;01:07:31,040;"His friends and fans were angry upon learning Troy Brown had been overlooked"
01:07:31,040;01:07:33,440;"for the AAC Pro Bowl team, but not Brown himself."
01:07:33,440;01:07:36,900;"No big deal said Brown who will officially be named an alternate to the"
01:07:36,900;01:07:37,980;"Pro Bowl later this week."
01:07:37,980;01:07:40,540;"There are a lot of great players who were selected ahead of me."
01:07:40,540;01:07:42,020;"There's nothing I can say about it."
01:07:42,260;01:07:44,900;"A lot of guys in here on the team weren't happy about it,"
01:07:44,900;01:07:46,460;"but it's out of my control."
01:07:46,460;01:07:48,020;"The important thing is that I have the respect"
01:07:48,020;01:07:50,660;"of my teammates and that we're heading into the playoffs"
01:07:50,660;01:07:52,500;"and trying to get to the Super Bowl."
01:07:52,500;01:07:54,460;"I'm not upset or angry or anything like that."
01:07:54,460;01:07:55,980;"I've just tried to go out every week"
01:07:55,980;01:07:58,900;"and do whatever it takes to help the team."
01:07:58,900;01:08:00,180;"I can Troy Brown, man."
01:08:00,180;01:08:02,660;"Oh, I give a hundred and 10%."
01:08:02,660;01:08:03,500;"Fucking love him."
01:08:03,500;01:08:05,020;"That's just who he is though."
01:08:05,020;01:08:06,620;"Oh, yeah."
01:08:06,620;01:08:07,900;"He's like, oh, this is cool."
01:08:07,900;01:08:08,740;"That's okay."
01:08:09,620;01:08:14,300;"I was always with my favorite Patience player forever. Yeah."
01:08:14,300;01:08:19,580;"Have you seen that Brendan Fraser movie where he's like the sweaty guy in the locker room?"
01:08:19,580;01:08:22,300;"Boy Brown is the sweaty guy."
01:08:22,300;01:08:26,100;"No, Brendan Fraser is where we tie in the same."
01:08:26,100;01:08:32,260;"Yeah, where is it? They're interviewing him and he's talking about, oh, I just gave 110%."
01:08:32,260;01:08:37,620;"That sounds familiar. What? Never mind."
01:08:37,620;01:08:38,880;"Do you cut this fire?"
01:08:38,880;01:08:46,080;"But I'm going to send you guys the link after and you'll be like, oh, man, that's funny."
01:08:46,080;01:08:51,760;"And every time I hear a player give him a bullshit response like that."
01:08:51,760;01:08:55,260;"That's all I don't think that's right."
01:08:55,260;01:08:56,100;"Brown is bullsey."
01:08:56,100;01:08:57,660;"Yeah, that's just who he's always been though."
01:08:57,660;01:08:59,040;"That's why I like bell check."
01:08:59,040;01:08:59,240;"Love."
01:08:59,240;01:09:02,940;"I mean, that could have been bell check, like, wrote that response for him."
01:09:02,940;01:09:03,680;"Right."
01:09:03,680;01:09:05,740;"All I care about is winning."
01:09:05,740;01:09:07,580;"I don't care about individual accolades."
01:09:07,580;01:09:11,500;"I just set my team, you know, we're going to the playoffs, right?"
01:09:11,500;01:09:16,420;"Like, yeah, that's classic Belichick and I'll take a load there for them, right?"
01:09:16,420;01:09:22,220;"I don't care about the roster bonus I get for the pro bowl, you know,"
01:09:22,220;01:09:24,300;"couple extra million."
01:09:24,300;01:09:26,420;"I just, I just like, it was just happy with play."
01:09:26,420;01:09:28,460;"I meant a drama."
01:09:28,460;01:09:28,740;"Great."
01:09:28,740;01:09:30,780;"Brown read his read his biography."
01:09:30,780;01:09:35,300;"I have not read that handy melodice to me."
01:09:35,300;01:09:35,860;"If you have it."
01:09:36,940;01:09:37,780;"Yeah, I can get it to you."
01:09:37,780;01:09:43,260;"It's a, I don't think it was written by Troy Brown, but it kind of has a feel"
01:09:43,260;01:09:45,300;"like it was so I know we had a hand in it."
01:09:45,300;01:09:47,260;"It's got some interesting stuff in it."
01:09:47,260;01:09:50,700;"I would hope you had a hand in it."
01:09:50,700;01:09:52,300;"It was very well."
01:09:52,300;01:09:53,940;"I think it was like ghost written for him, you know?"
01:09:53,940;01:09:54,940;"Yeah."
01:09:54,940;01:09:58,820;"It still it still sounds like Troy Brown is what I'm saying."
01:09:58,820;01:10:00,420;"It's a good book."
01:10:00,420;01:10:03,940;"Oh, Greg, I have a stat check note."
01:10:05,220;01:10:07,980;"What like, what was the last coach or what other coaches were"
01:10:07,980;01:10:08,780;"traded for a pick?"
01:10:08,780;01:10:10,780;"Because the commentators are talking about how Belljack"
01:10:10,780;01:10:11,780;"was traded for a pick."
01:10:11,780;01:10:12,700;"He was."
01:10:12,700;01:10:13,700;"Docker Rivers."
01:10:13,700;01:10:15,900;"And Gruden is the obvious answer, right?"
01:10:15,900;01:10:16,460;"Grooden."
01:10:16,460;01:10:17,900;"Who we'll see next week."
01:10:17,900;01:10:20,700;"But has everyone anybody since then?"
01:10:20,700;01:10:21,620;"Now I can remember."
01:10:21,620;01:10:23,860;"Docker Rivers."
01:10:23,860;01:10:25,700;"Was he?"
01:10:25,700;01:10:26,660;"Yeah."
01:10:26,660;01:10:27,220;"Yeah."
01:10:27,220;01:10:30,900;"I can't think of any off top of my head."
01:10:30,900;01:10:33,540;"I think about how many guns he really."
01:10:33,540;01:10:34,180;"Yeah."
01:10:34,180;01:10:38,180;"Oh wait, no, that's the Gerudin one."
01:10:38,180;01:10:39,180;"Wait."
01:10:39,180;01:10:40,180;"Yeah."
01:10:40,180;01:10:42,180;"Oh, here we go."
01:10:42,180;01:10:45,180;"Because they're like, yeah, I'll attract."
01:10:45,180;01:10:47,180;"And that's what grew up."
01:10:47,180;01:10:50,180;"Her med words, apparently."
01:10:50,180;01:10:53,180;"Who paid a pick for her?"
01:10:53,180;01:10:57,180;"So knowing Kansas City was interested in hiring him to succeed the retiring Dick for meal,"
01:10:57,180;01:10:59,740;"interested in hiring him to succeed the retiring Dick Fermil,"
01:10:59,740;01:11:02,060;"Edward attempted to strong arm the Jets into a contract"
01:11:02,060;01:11:05,700;"extension and include a raise. His move didn't work. The two"
01:11:05,700;01:11:08,060;"teams eventually settle on a deal in which Kansas City sent"
01:11:08,060;01:11:12,000;"the Jets a fourth, a fourth pick. I was a fourth pick or a"
01:11:12,000;01:11:14,900;"fourth round pick in exchange to release Edwards from his"
01:11:14,900;01:11:15,540;"contract."
01:11:15,540;01:11:20,900;"My home grin from the Packers to Seahawks. Eight year contract"
01:11:20,900;01:11:23,460;"value at $4 million a year in total control over football"
01:11:23,460;01:11:30,420;"operations, lured Hombre into Ciala 99. Hombre was not only coach, but also executive vice"
01:11:30,420;01:11:34,740;"president for the operations and general manager. The Packers received the Seahawks second round"
01:11:34,740;01:11:40,420;"pick 47th overall and the 99 draft. And to build Parcels."
01:11:40,420;01:11:51,300;"Yeah. Yep. He so Hombre was pre-bell check, but post-parcels? No."
01:11:53,300;01:11:55,500;"Uh, home, it was home."
01:11:55,500;01:12:00,100;"It was 99 and Parcells was right around then, right?"
01:12:00,100;01:12:01,100;"Seven."
01:12:01,100;01:12:02,500;"Yeah."
01:12:02,500;01:12:04,900;"So this is good."
01:12:04,900;01:12:06,700;"Uh, blah, blah."
01:12:06,700;01:12:09,700;"Yeah."
01:12:09,700;01:12:10,100;"Oh, yeah."
01:12:10,100;01:12:13,500;"So he just named Bill Belichick Parcells, some systems head coach and sign"
01:12:13,500;01:12:14,700;"Parcells as a consultant."
01:12:14,700;01:12:18,400;"The Patriots balked in NFL Commissioner Paul Tagli boo worked a deal."
01:12:18,400;01:12:22,300;"They gave the Patriots the Jets third and fourth round picks in 97, a second"
01:12:22,300;01:12:27,300;"and a first round in '99."
01:12:27,300;01:12:32,660;"On top of that, the Jets also donated $300,000 to a Patriots charity in exchange for New"
01:12:32,660;01:12:34,660;"England releasing Parcells."
01:12:34,660;01:12:40,700;"Okay, so for Parcells, we got a first, a second, a third and a fourth?"
01:12:40,700;01:12:41,700;"Yes."
01:12:41,700;01:12:42,700;"Wow."
01:12:42,700;01:12:46,820;"And $300,000 donated to a Patriots charity."
01:12:46,820;01:12:49,820;"And then Bellcheckers just the first rounder, right?"
01:12:49,820;01:12:58,060;"that we check was I believe so here we go. The Patriots were awarded."
01:12:58,060;01:13:00,020;"What?"
01:13:00,020;01:13:05,860;"The Patriots were awarded the Jets fifth round pick in 2001 and seventh round pick in 2002."
01:13:05,860;01:13:08,500;"That doesn't make sense."
01:13:08,500;01:13:14,980;"Oh okay now here we go NFL commissioner Paul Taglova awarded the Jets the Patriots first"
01:13:14,980;01:13:18,820;"round pick in 2000 and fourth and seventh round pick in 2001."
01:13:18,820;01:13:22,620;"And the Patriots got the Jets fifth round picking 01 and seventh"
01:13:22,620;01:13:23,460;"round picking 0-2."
01:13:23,460;01:13:24,500;"So some late picks."
01:13:24,500;01:13:26,620;"First and a first."
01:13:26,620;01:13:30,300;"This is like a you don't see coaches being traded."
01:13:30,300;01:13:32,260;"Like it does not happen."
01:13:32,260;01:13:33,580;"15 years."
01:13:33,580;01:13:34,860;"It's basically those five."
01:13:34,860;01:13:35,340;"Yeah."
01:13:35,340;01:13:35,860;"Yeah."
01:13:35,860;01:13:39,300;"And two or like one same guys going back and forth between the"
01:13:39,300;01:13:39,780;"patients."
01:13:39,780;01:13:40,460;"Well, Bell check."
01:13:40,460;01:13:44,820;"Parcels, Holngren, all within four years."
01:13:44,820;01:13:46,820;"Yeah, keep it taken."
01:13:46,820;01:13:51,820;"So maybe that was the coach trading era of the NFL."
01:13:51,820;01:13:53,820;"- Only if that'll ever come back?"
01:13:53,820;01:13:54,820;"Probably not."
01:13:54,820;01:13:58,820;"I think it was harder to find a franchise QB or a franchise coach."
01:13:58,820;01:14:02,820;"- Question."
01:14:02,820;01:14:06,820;"- I guess that goes back to question."
01:14:06,820;01:14:09,820;"Would you rather start a team with Belichick or Brady?"
01:14:09,820;01:14:13,820;"- Well, at this point, I think it's somewhat obvious, right?"
01:14:13,820;01:14:16,020;"Brady has a couple of years left."
01:14:16,020;01:14:17,820;"I'll check has however long you want."
01:14:17,820;01:14:19,340;"I'm at like from the beginning."
01:14:19,340;01:14:20,180;"Right."
01:14:20,180;01:14:20,900;"I was one."
01:14:20,900;01:14:23,740;"I probably want the coach, I would think."
01:14:23,740;01:14:29,140;"Let me just look at what's his name from the Chiefs."
01:14:29,140;01:14:29,980;"Andy Reed."
01:14:29,980;01:14:31,900;"Yeah, you like."
01:14:31,900;01:14:35,100;"He's he's he's he's been able to do it."
01:14:35,100;01:14:35,940;"It's yes."
01:14:35,940;01:14:37,820;"He's elevated any team he's been on."
01:14:37,820;01:14:38,340;"Yeah."
01:14:38,340;01:14:40,300;"I think you can say the same with Bell Parcells too."
01:14:40,300;01:14:42,740;"Parcells would always create playoff teams."
01:14:42,740;01:14:49,160;"You never quite as successful without Bellin Check, but he was still you took the Cowboys and playoffs, right?"
01:14:49,160;01:14:52,620;"Same with the Jets took them to play us. Yeah"
01:14:52,620;01:15:02,620;"All right, got anything else you want to talk about in this game you want to do best or worst"
01:15:02,620;01:15:06,340;"Let me review my notes easy"
01:15:06,340;01:15:09,140;"Did you see Chris Slade out there?"
01:15:09,860;01:15:17,060;"Yes, I didn't actually see him out there, but he was on the list of players on this team. They called them out a little bit"
01:15:17,060;01:15:23,700;"Did they? I missed this was his this was his kind of swollen song after coming to use like a trip"
01:15:23,700;01:15:25,700;"This is his last season in the NFL"
01:15:25,700;01:15:28,540;"He was actually third on the team with two and a half sacks though"
01:15:28,540;01:15:33,300;"This is the only season without not on the Patriots I"
01:15:34,060;01:15:41,860;"Did have a note that like Brady had 17 TDs 10 INTs and then throws two more in this game"
01:15:41,860;01:15:44,940;"So you end the year with what 17 and 12 and that's his pro bowl"
01:15:44,940;01:15:47,740;"Yeah, just crazy. I mean"
01:15:47,740;01:15:53,180;"Today to think about like oh, yeah, it's got 17 TDs and 12 bind teas. It's like"
01:15:53,180;01:15:55,740;"That's not even replacement level"
01:15:55,740;01:16:00,220;"I mean it was a different actually no, you're absolutely you did throw a touchdown"
01:16:00,220;01:16:02,900;"You threw on the Wiggins"
01:16:02,900;01:16:04,900;"and"
01:16:04,900;01:16:11,340;"Yes, it's like Wiggins like fell down check he got it. Oh, it's right. Yeah, he did"
01:16:11,340;01:16:17,140;"Yeah, you know you're right which I have another and he has probably important like Wiggins had a couple catches in this game"
01:16:17,140;01:16:22,120;"And then you have a huge catch against the Raiders"
01:16:22,120;01:16:26,380;"Spoiler over maybe this game or will he"
01:16:27,980;01:16:33,060;"Find him next week. So so you're right. He threw 18 touchdowns this season"
01:16:33,060;01:16:37,420;"To anybody know here's a quiz for you"
01:16:37,420;01:16:42,100;"How many did he throw in the playoffs this in 2001 touchdowns?"
01:16:42,100;01:16:49,220;"Because this surprised me one"
01:16:49,220;01:16:56,720;"Right Brown nailed it one. Yeah, David the Rams game the Super Bowl. Yeah, right before I"
01:16:57,260;01:17:03,580;"Yep, it's only touch down he threw he ran for one and so and braided through one against Pittsburgh"
01:17:03,580;01:17:10,940;"You mean Bob bloods up? Yeah, which was the same one that Brady would throw in the Super Bowl. Yeah"
01:17:10,940;01:17:14,040;"Yeah, corner route to patent in the end"
01:17:14,040;01:17:21,340;"Yeah, I looked into that Ray karoo thing a little more that we talked out talked about with Bob"
01:17:21,340;01:17:22,940;"Yeah"
01:17:22,940;01:17:26,740;"Yeah, anything juicy? Well, the only thing I think of note is"
01:17:26,740;01:17:30,820;"is how he got caught and arrested."
01:17:30,820;01:17:32,820;"- Oh boy, yeah, we didn't touch on that."
01:17:32,820;01:17:37,420;"- Yeah, so he hires the guy that shoots"
01:17:37,420;01:17:40,700;"his eight month pregnant wife or girlfriend, right?"
01:17:40,700;01:17:43,500;"She didn't die immediately."
01:17:43,500;01:17:47,220;"She went into a coma and when they like"
01:17:47,220;01:17:50,140;"arraigned him or whatever, he paid the bail,"
01:17:50,140;01:17:51,620;"like a three million dollar bail."
01:17:51,620;01:17:55,900;"So he got out and then she died after that."
01:17:55,900;01:17:58,600;"So that's when he tried to like escape"
01:17:58,600;01:18:01,520;"in the trunk of a car of a friend."
01:18:01,520;01:18:04,720;"They said when they arrested him,"
01:18:04,720;01:18:08,240;"he was like, hold up in like the trunk of a car."
01:18:08,240;01:18:11,980;"$3,900 worth of cash,"
01:18:11,980;01:18:14,260;"bottles to hold his own urine."
01:18:14,260;01:18:15,580;"This sounds familiar."
01:18:15,580;01:18:17,340;"Candy bars and a cell phone."
01:18:17,340;01:18:19,160;"Yeah, I feel like this was actually on the news"
01:18:19,160;01:18:20,560;"where they had like surrounded the cops"
01:18:20,560;01:18:21,840;"and surrounded the car and they were like"
01:18:21,840;01:18:23,080;"pulling them out of the trunk."
01:18:23,080;01:18:23,920;"Yeah."
01:18:23,920;01:18:24,760;"Where was he trying to go?"
01:18:24,760;01:18:34,920;"of it. California. And then you have that former boss in Nissan. Do you hear about that guy? No."
01:18:34,920;01:18:40,680;"Oh, yeah. He got indicted in Japan for like, thought and stuff and he like, flood the country"
01:18:40,680;01:18:49,160;"in a violin case. I'm really like, I'm on the plate with the Middle East and he's got free."
01:18:49,160;01:18:53,960;"He's always like, can't be extradited. That's the most Japanese thing ever. Everybody else"
01:18:53,960;01:18:55,280;"It's got to be a cello case."
01:18:55,280;01:18:56,520;"He's a fucking violin."
01:18:56,520;01:19:00,920;"Breaker is a car pissed in a bottle."
01:19:00,920;01:19:02,760;"Did a violin."
01:19:02,760;01:19:04,560;"He's in a goddamn Nissan probably."
01:19:04,560;01:19:08,480;"Oh, Jesus."
01:19:08,480;01:19:11,240;"Yeah, I sure remember that."
01:19:11,240;01:19:17,080;"The only other note I had was they were talking about the fans at the stadium."
01:19:17,080;01:19:21,200;"They said 40% were wearing Patriots gear."
01:19:21,560;01:19:25,700;"Yeah, and that they heard a let's go Jets fan are changed."
01:19:25,700;01:19:26,160;"Oh, yeah."
01:19:26,160;01:19:27,560;"Chagriets fans because."
01:19:27,560;01:19:29,200;"Yeah, way to give away my worst."
01:19:29,200;01:19:36,440;"So you'll touch on that because we kind of almost talked"
01:19:36,440;01:19:38,480;"about the beginning, but this game"
01:19:38,480;01:19:42,720;"did have playoff implications for the Patriots because they"
01:19:42,720;01:19:44,880;"had to win this game."
01:19:44,880;01:19:48,280;"And the Jets had to beat the Raiders for the Patriots"
01:19:48,280;01:19:51,080;"to get the number two seed in a first round buy."
01:19:51,080;01:19:57,800;"And of course, our friend fucking Ron Borges decided that would be a terrible idea."
01:19:57,800;01:20:03,240;"And so he wrote a bunch of articles in the bossing guild the week before saying,"
