Start Timestamp;End Timestamp;Transcript
59:10,640;59:15,740;"Oh, yeah, yeah, which was a ballsy gutsy call and I don't think"
59:15,740;59:19,980;"It was something Belichick was too fond of like he was saying"
59:19,980;59:25,820;"I think it may have been thinking outside the box, but he got a yard and three quarters, which definitely didn't help"
59:25,820;59:26,660;"- Right."
59:26,660;59:31,880;"- And then worse moments, I would say,"
59:31,880;59:36,880;"the 64 yard return that they had after the Patriots"
59:36,880;59:40,980;"first touchdown was sort of back-breaking, I feel like."
59:40,980;59:43,660;"- I was surprised at how,"
59:43,660;59:48,060;"on Patriot, like the special teams looked,"
59:48,060;59:50,940;"like they didn't be very crisp on any of the execution"
59:50,940;59:51,780;"anywhere."
59:51,780;59:53,340;"- Yeah, that was rough,"
59:53,340;59:56,420;"'cause I mean, you light out the gate,"
59:56,420;59:57,740;"you're scoring a touchdown,"
59:57,740;01:00:01,100;"you're the lowly patriot, so it's this boost,"
01:00:01,100;01:00:05,460;"and then literally, next play, it's sort of shattered."
01:00:05,460;01:00:07,460;"- Yeah, no, you're absolutely right, it did."
01:00:07,460;01:00:11,980;"- And then I'll throw out an honorable mention"
01:00:11,980;01:00:13,660;"for this as well."
01:00:13,660;01:00:15,820;"It's more of a cringe-worthy thing,"
01:00:15,820;01:00:18,060;"but I don't know if you heard the announcer go like,"
01:00:18,060;01:00:21,100;"""Oh, Greg Robinson, Orlando, what kind of a guy"
01:00:21,100;01:00:26,060;"two names and then the other announcer goes, ""Oh, he took on his dad's"
01:00:26,060;01:00:29,180;"every past."" I'm like, ""Oh, that is well."""
01:00:29,180;01:00:36,300;"You could just, you could feel the silence after that too, yeah."
01:00:36,300;01:00:39,580;"That was pretty awesome."
01:00:39,580;01:00:43,820;"Brutally, I think that was, like, that was a brand-owned special that was."
01:00:43,820;01:00:45,580;"Okay, yeah."
01:00:45,580;01:00:50,780;"Two names, and Gus Johnson was like, ""Well, actually, he took his dad's name because his dad passed"
01:00:50,780;01:00:53,360;"and like, oh boy."
01:00:53,360;01:00:57,160;"- I mean, that's some comedy right there."
01:00:57,160;01:00:58,740;"- Yeah, that was classic."
01:00:58,740;01:01:01,820;"All right, so add to that,"
01:01:01,820;01:01:03,420;"I'll give you some honorable mentions too,"
01:01:03,420;01:01:05,060;"some things that we didn't touch on yet."
01:01:05,060;01:01:08,860;"I liked how excited the commentating team was"
01:01:08,860;01:01:12,020;"about what they called the shadow box."
01:01:12,020;01:01:13,180;"- Oh, which was okay, yes."
01:01:13,180;01:01:15,220;"- Scores from around the league."
01:01:15,220;01:01:16,300;"- Yes, it's brand new things."
01:01:16,300;01:01:17,940;"Like you might notice in the top corner"
01:01:17,940;01:01:19,540;"we have what we're calling the shadow box."
01:01:19,540;01:01:22,540;"is going to show you updated scores around the league as they happen."
01:01:22,540;01:01:24,700;"Well, yeah, I mean,"
01:01:24,700;01:01:27,940;"did they have the score on the screen at the same time?"
01:01:27,940;01:01:31,780;"Cause I don't remember ever seeing the score, but I was seeing the other game"
01:01:31,780;01:01:32,780;"scores."
01:01:32,780;01:01:36,900;"No, they did have the score in the, the top left hand corner, but it was,"
01:01:36,900;01:01:38,860;"but it was constantly super hard to read."
01:01:38,860;01:01:40,820;"Oh, okay."
01:01:40,820;01:01:43,340;"But yeah, but then the"
01:01:43,340;01:01:47,380;"where they had what they were calling the shadow box, which is just like a gray"
01:01:47,380;01:01:48,700;"box with white scores in it."
01:01:48,700;01:01:57,700;"they were super excited to be announcing that week one. They were able to show scores of other games while this game was happening."
01:01:57,700;01:02:03,700;"Which I really thought they'd already been doing, but apparently not."
01:02:03,700;01:02:12,700;"And then the honorable mention for the worst was the upcoming schedule."
01:02:12,700;01:02:20,420;"Which I was not particularly funny, but they kept showing the paths playing the Panthers next week."
01:02:20,420;01:02:22,320;"Oh, right, right."
01:02:22,320;01:02:26,520;"Kept tripping me up and I was thinking, am I watching the wrong game here?"
01:02:26,520;01:02:27,620;"I had to go double check."
01:02:27,620;01:02:29,380;"I'm like, no, this is the right thing, those game."
01:02:29,380;01:02:31,180;"Why are they saying the Panthers were next week?"
01:02:31,180;01:02:38,180;"And then it finally clicked that between this game and the game schedule for next week was when 9/11 happened."
01:02:38,180;01:02:40,780;"So they canceled those games and pushed them to the end of the season."
01:02:41,660;01:02:46,140;"Yeah, so a little bit of a downer 10 this because why not right?"
01:02:46,140;01:02:47,300;"It gives everybody that's true."
01:02:47,300;01:02:48,900;"I mean, I can turn it around if you want."
01:02:48,900;01:02:50,220;"Yes, please."
01:02:50,220;01:02:56,420;"I could tell you that because of that, though, they played the jets and that's"
01:02:56,420;01:02:58,980;"the Maluis hit, which the bloods allowed."
01:02:58,980;01:03:04,460;"So it could be said that Tom Brady and the dynasty happened because of 9/11."
01:03:04,460;01:03:08,460;"Oh, wait, wait, it bring that up a notch."
01:03:08,460;01:03:09,540;"All right."
01:03:10,620;01:03:11,820;"I guess that's it guys."
01:03:11,820;01:03:16,660;"And on that note, we'll, uh, we'll be back."
01:03:16,660;01:03:24,020;"We'll react next time to talk about, uh, 2001 week two, which as we all know now is, uh,"
01:03:24,020;01:03:29,300;"not against the Carolina Panthers, but we'll be reverse the New York Jets in the game that"
01:03:29,300;01:03:29,900;"changed at all."
01:03:29,900;01:03:34,060;"So thanks for joining us and we will talk to you next time."
01:03:34,060;01:03:36,020;"Later."
01:03:36,020;01:03:37,060;"Whoa."
01:03:37,060;01:03:37,900;"Bye."