Start Timestamp;End Timestamp;Transcript
39:23,100;39:28,580;"Guess we're back. I don't know how to transition out of that. I don't remember how we ended it. So thanks Bobby"
39:28,580;39:34,580;"It's week 17, you know, you're gonna transitions down. Yeah, the endy Jesus. I do but not for"
39:34,580;39:40,820;"Interviews because they haven't ever done one before it's a good point. Yeah, so I"
39:40,820;39:44,540;"Well, I guess now that Bobby has told us how much the"
39:44,540;39:47,180;"2001 Carolina Panthers have sucked"
39:47,180;39:52,280;"We should probably start there. Don't you think I was I was personally surprised at how"
39:53,020;40:02,380;"little I knew about the man there's for one and also that this was kind of their lowest"
40:02,380;40:07,300;"of the low moments in history. And then like when Bobby said, because I hadn't watched"
40:07,300;40:11,980;"the game when we did the interview and when Bobby said that there was only like what 16,000"
40:11,980;40:17,540;"people this game? Oh, yeah, it seemed like less. Yeah, I was going to say like, I don't"
40:17,540;40:22,980;"even think it was half that and of those, they were saying like 60% were Patriots fans."
40:22,980;40:28,980;"I will say that you said they quit on a team and they actually played pretty hard from one and 14 team"
40:28,980;40:32,580;"I thought it was like, you know, you see it in score"
40:32,580;40:36,500;"Which I don't forget what I was but I was a shitload to nothing and you're like wow"
40:36,500;40:41,700;"We just rolled them over right away, but it really wasn't like that. Yeah. Yeah, I thought that the first half"
40:41,700;40:43,700;"I thought they competed"
40:43,700;40:44,900;"definitely did"
40:44,900;40:47,940;"So the the second half was hot garbage"
40:48,500;40:54,100;"Football reference says it's the attendance was 71,000. I was gonna bring that up"
40:54,100;40:59,140;"No way because I looked up to get an actual number. Yes, it's 71,907"
40:59,140;41:03,500;"Maybe as a typo. It's supposed to be one seven instead of seven one. I"
41:03,500;41:08,060;"Mean maybe they sold that me tickets, but there is like they were it was empty"
41:08,060;41:12,900;"You would like look at the lower bowl and you see some people sitting at the top of the lower bowl"
41:12,900;41:14,900;"And you're like what are you doing move down"
41:15,300;41:18,860;"So it reminded me of the few games"
41:18,860;41:21,700;"MLS games I've gone to"
41:21,700;41:27,060;"Agilets stadium for like the revolution back in the day when you get free tickets because they couldn't sell it"
41:27,060;41:30,980;"I'd how Dave disrespect the reps like I'm not I'm just I'm just"
41:30,980;41:38,360;"Equating this where they would shut down the top bowl so that it wouldn't look as empty and they put it on one side of the fields"
41:38,360;41:40,460;"Yeah opposite the camera"
41:42,380;41:45,780;"Red's considered that too. They've like blocked off part of their upper bowl"
41:45,780;41:51,480;"Right like they've like put like permanent like fencing remember Greg. We're sitting against that fencing"
41:51,480;41:56,900;"Yes, he's behind us and then like it was like like chain link fenced and then like carps over it"
41:56,900;42:04,980;"Jesus so like to like have their percentage full be higher. Yeah, they were they were social distancing before it was cool"
42:04,980;42:09,780;"Ten years before it was cool"
42:09,780;42:15,780;"So yeah, a bit about these Panthers."
42:15,780;42:20,700;"I mean, you've heard a little bit from Bob already, but as we discussed there, they would"
42:20,700;42:27,140;"finish 1 in 15, which the commentators pointed out nicely at the end of this game that they"
42:27,140;42:30,500;"won their first game of the season and then went on to lose the rest of them."
42:30,500;42:35,620;"And that was the longest losing streak in an NFL season ever."
42:35,620;42:38,420;"Nobody had lost more than 15 games in a row."
42:38,420;42:44,420;"the lions or like hold my beer. Right. Eventually that would be broken a few years after this"
42:44,420;42:51,140;"but that was for a single season right? Yes. Yeah. Yeah. For one season. It was the most"
42:51,140;42:57,220;"it was the longest losing streak in one season. Who has the longest losing streak ever? Is it"
42:57,220;43:02,260;"the old bucks or was it the lions? I guess the box. I think it's the box. Yeah. I agree."
43:02,260;43:07,460;"All the Browns. I don't know what theirs look like. Those two years where they wouldn't"
43:07,460;43:13,220;"one and 32. That's got to be up there, depending on when that win game."
43:13,220;43:19,060;"Because then they go one and 15 and then I went 16 the next year."
43:19,060;43:21,380;"I'm going to say the box because fuck the box."
43:21,380;43:25,580;"Yeah, there was like, I think I looked briefly and it was like 23 straight"
43:25,580;43:29,580;"games or something. That's not great."
43:29,580;43:34,220;"Yeah, we talked about George C. Fred already."
43:34,900;43:36,060;"Well, not anymore."
43:36,060;43:37,420;"They got braiding now."
43:37,420;43:39,580;"They're about to go on a 23 game winning streak."
43:39,580;43:44,700;"What was longer the bucks losing streak or the Patriots winning streak when they"
43:44,700;43:48,460;"went like was it 0304 or they won a ton in a row?"
43:48,460;43:49,820;"One in a row, right?"
43:49,820;43:50,740;"I believe it was."
43:50,740;43:53,540;"They did win a shitload in a row."
43:53,540;43:54,140;"I remember that."
43:54,140;43:55,660;"I think it was 21 in a row."
43:55,660;43:58,060;"That's the longest active NFL win streak."
43:58,060;43:59,100;"Yes."
43:59,100;44:01,980;"We're all time."
44:01,980;44:02,580;"Yeah."
44:02,580;44:03,140;"Yeah."
44:03,260;44:10,520;"And you could say the Patriots have the most of the longest single season winning streak as well because they won 18 games in the season."
44:10,520;44:11,820;"That's true."
44:11,820;44:21,740;"So I was, I was looking up the best, the best way to describe their season."
44:21,740;44:22,700;"Yeah."
44:22,700;44:27,260;"And I don't know if you've ever been on urban the source, but it's fucking awesome."
44:27,260;44:29,420;"Wait, there's an urban for source."
44:29,420;44:29,980;"Really?"
44:29,980;44:31,980;"Or just gives you like equivalent words."
44:32,180;44:34,180;"I only knew about the"
44:34,180;44:40,180;"Yeah, I do. I suggest you go to urban the source at some point because it's so funny. So I put in dumpster fire"
44:40,180;44:46,500;"Some of this shit is hilarious trash your face. Oh"
44:46,500;44:49,780;"Oh, both salad"
44:49,780;44:57,040;"The dead man's dumpster diving oh boy"
44:57,040;45:00,460;"Necro pyro bestiality"
45:01,620;45:06,360;"Darker as you go along Alaskan fire dragon"
45:06,360;45:08,900;"Lovito sewer"
45:08,900;45:16,220;"I can read the shit all day. There's like oh my god"
45:16,220;45:19,380;"Idea"
45:26,820;45:32,060;"This whole podcast has been worth it just for that one little nugget of knowledge."
45:32,060;45:32,860;"Right."
45:32,860;45:37,660;"I wish we knew this so we could ask Bobby that question of what better describes this"
45:37,660;45:41,100;"season of these four options."
45:41,100;45:42,260;"What would you choose?"
45:42,260;45:46,060;"Dumpster fire anal backcraft."
45:46,060;45:46,940;"What?"
45:46,940;45:47,620;"Yeah, the ones."
45:47,620;45:49,620;"I don't know."
45:49,620;45:52,580;"Sudo pyro homo necro beastie."
45:52,580;45:53,180;"El Yak."
45:53,180;45:55,140;"All right."
45:55,140;45:56,220;"Now we're getting crazy."
45:56,220;46:05,740;"Yeah. So speaking of dumps of fires, this coaching staff, we talked about George C."
46:05,740;46:10,540;"for already. Some of the other coaches you may recognize Mike McCoy. Remember"
46:10,540;46:19,980;"him? Chargers coach from like 2013, 2016. He was their wider receivers coach. And"
46:19,980;46:22,400;"Then also Greg Roman you might recognize"
46:22,400;46:30,460;"Who is currently the offensive coordinator for the Baltimore Ravens and that record"
46:30,460;46:33,920;"He's in high demand. He really is"
46:33,920;46:37,880;"He wasn't back then if you look at this offense"
46:37,880;46:41,060;"because I"
46:41,060;46:45,820;"Did my best to come up with names you guys on this offense there really aren't any"
46:46,620;46:53,420;"The winky man. Yeah, former Heisman winners. That what they said. Yeah, it was really good in college. Yeah, and"
46:53,420;46:56,380;"the"
46:56,380;47:03,300;"Who are the commentators the commentator duo of Kevin Harlan and Craig James our own Craig James were doing this game"
47:03,300;47:07,700;"I did I actually like them. Yeah, yeah, they did all right"
47:07,700;47:13,340;"And that's going from Andy you know, they were great. They're definitely not the A team though"
47:13,340;47:17,980;"I will say that and I think they knew it so they would just have fun with it, which is why right?"
47:17,980;47:23,260;"Like when he calls out the block like the on the touchdown run they got called back"
47:23,260;47:27,420;"Yeah, and then rest immediately. He's like what a great block like in the play"
47:27,420;47:30,060;"Yeah, yeah, that guy"
47:30,060;47:32,700;"Yeah, that's Compton"
47:32,700;47:36,540;"Yeah, there's some love Compton wearing the visor. It's like"
47:36,540;47:42,860;"like drizzling overcast in December. There's snow in North Carolina"
47:42,860;47:50,140;"got the visor on. Yeah, it was. It was like 36 degrees and like freezing rain and you could see"
47:50,140;47:55,340;"snow around the sidelines and stuff. Yeah. I don't think it's snow down there, Greg. I'm surprised"
47:55,340;47:59,420;"anybody was able to get to the stadium. Once he figured they would have shut down the state."
47:59,420;48:09,740;"So Chris Winky, fun fact, he spent six years at the Blue Jays before going to Florida State."
48:09,740;48:14,580;"So he was 26 when he enrolled at Florida State."
48:14,580;48:18,140;"So he must have been close to 30 by the time he got drafted."
48:18,140;48:22,740;"Because I remember that he was what was the other guy that from Oklahoma State"
48:22,740;48:24,180;"and the brown."
48:24,180;48:25,540;"Yes, Brandon Wina."
48:25,540;48:27,340;"He was the same type of guy."
48:27,340;48:28,740;"Yeah."
48:28,740;48:29,740;"Huh?"
48:29,740;48:34,300;"Didn't help him much that that time in the blue jays, I don't think"
48:34,300;48:36,460;"his completion percentage."
48:36,460;48:38,940;"I looked it up with 54% on the year."
48:38,940;48:41,520;"for the families."
48:41,520;48:44,320;"- I think that's average 56."
48:44,320;48:46,860;"- Yeah, that doesn't sound right."
48:46,860;48:48,280;"- That sounds low."
48:48,280;48:50,000;"- That sounds low."
48:50,000;48:51,520;"54 is not great."
48:51,520;48:52,360;"It's easy."
48:52,360;48:55,140;"He completes just barely one of every two passes."
48:55,140;48:58,520;"And a lot of those are to the other team."
48:58,520;49:01,120;"He had 11 touchdowns and 19 interceptions."
49:01,120;49:07,080;"- Yeah, he threw a couple of bad pick sixes in this game."
49:07,080;49:07,920;"Yeah."
49:07,920;49:10,460;"You threw more than a couple."
49:10,460;49:13,660;"He just got lucky that one of them got called back for holding on the return."
49:13,660;49:16,460;"The one the tie law was so bad though."
49:16,460;49:19,100;"Just not, not the second one."
49:19,100;49:20,700;"Like got deflected right."
49:20,700;49:22,140;"And you can call that on the field."
49:22,140;49:25,320;"It wasn't a great throw, but a little lucky, but yeah, one the tie"
49:25,320;49:25,840;"law."
49:25,840;49:27,340;"It's just awful."
49:27,340;49:27,940;"Yeah."
49:27,940;49:32,660;"So he just, I don't know if it's a, uh, a flaw of his that nobody knew about,"
49:32,660;49:34,900;"but the guy couldn't throw an out pattern to save his life."
49:35,580;49:39,420;"literally the reception that he threw was on an out pattern."
49:39,420;49:44,060;"And he just hit the defensive back right in the hands with nobody in front of him."
49:44,060;49:44,980;"Oh, yeah."
49:44,980;49:45,660;"No, nobody."
49:45,660;49:46,540;"Go."
49:46,540;49:46,980;"I did."
49:46,980;49:50,260;"I have a no here, but Steve Smith was a guy that's targeting."
49:50,260;49:51,820;"And this is rookie year."
49:51,820;49:54,420;"And Bobby said it took him a couple of years, figured out, I don't know,"
49:54,420;49:56,060;"Steve Smith flashed in this game."
49:56,060;49:58,180;"A little bumbled."
49:58,180;50:01,820;"Yeah, I was just going to say, so like Bob, who was saying,"
50:01,820;50:07,240;"see Smith's first few years was more of a kick returner and once the pro bowl for kick returns in this season"
50:07,240;50:13,820;"But his kick returning in his game was God awful awful like every time he I mean"
50:13,820;50:17,720;"there was a bunch of kickoffs page scored 38 points in this game and"
50:17,720;50:22,720;"Every single one of them. He ran directly into the nearest defender and"
50:22,720;50:27,260;"Got just ragdolled every time it felt like yeah"
50:27,740;50:29,980;"Like he was like as a receiver, he was pretty solid."
50:29,980;50:32,260;"I mean, he had that one big play that got called back."
50:32,260;50:32,860;"Yeah."
50:32,860;50:35,020;"He was, I have a note on here."
50:35,020;50:37,420;"He's spinning the ball down 31."
50:37,420;50:43,180;"Every time he caught the ball, he would, he would catch it near the sidelines."
50:43,180;50:48,340;"Instead of stepping out, he would hit the guy, the defender and try to like lower"
50:48,340;50:50,700;"shoulder and try to get knocked out of bounds anyway, because he's so small."
50:50,700;50:52,540;"And then spin the ball and start yapping."
50:52,540;50:53,340;"Yeah."
50:53,340;50:55,020;"I mean, that's 31 to six."
50:55,020;50:56,020;"Yeah."
50:56,620;50:58,260;"So until forever."
50:58,260;51:01,700;"Yeah, 100% compete 100% of the time."
51:01,700;51:06,660;"I will say there weren't many plays that I thought he was but whole naked open."
51:06,660;51:12,340;"It's an interesting way to describe naked, but sure."
51:12,340;51:14,380;"That was his quote, remember?"
51:14,380;51:16,260;"Yeah."
51:16,260;51:21,020;"They made the mistake of putting him behind a desk at a half time show."
51:21,020;51:25,780;"I don't know what gives him the idea that that would go well."
51:25,780;51:31,540;"I don't think that but I think that was this quote is you got to yeah something about being but all naked open."
51:31,540;51:37,020;"We talked about ad nauseam in the episode we're all together."
51:37,020;51:39,620;"Yes, Steve. Come on. Pay attention."
51:39,620;51:41,380;"No, I was thinking a lot."
51:41,380;51:42,060;"That episode."
51:42,060;51:46,060;"No kidding. Didn't show it all. Don't worry."
51:46,060;51:50,180;"I like I like him because he's like."
51:50,180;51:55,060;"He knows a lot of like false bravado in the NFL."
51:55,580;51:58,380;"Oh, yeah. The Josh Normans of the world."
51:58,380;52:00,180;"Yeah. The come at me, bros."
52:00,180;52:05,860;"Yeah. He strikes me as like a legitimate crazy man bravado"
52:05,860;52:11,020;"where he authentically believes he's that much better than everybody."
52:11,020;52:16,860;"Yeah. And I would I would be willing to bet that he would fight literally anyone."
52:16,860;52:18,820;"Yeah. Like a hammer."
52:18,820;52:21,980;"Yeah. Just just thinking he would be able to win every fight."
52:21,980;52:25,060;"Do you think T.O. Isn't that like how do you put T.O."
52:25,060;52:31,180;"to you always a bit self-aware for me you know yeah similar but not the same"
52:31,180;52:35,260;"more like a new what he was doing almost yeah he knew what he was doing he was"
52:35,260;52:39,640;"he was like playing the media to a certain degree oh definitely whereas"
52:39,640;52:44,480;"Steve Smith is just like he's out of his mind yeah I think he was more of a"
52:44,480;52:48,520;"showman yeah like he was gonna put on a show and he was talented enough to do"
52:48,520;52:52,580;"that like he was gonna pull the Sharpie out of his sock or go stand on the the"
52:52,580;52:54,900;"the star and Dallas, you know, that's fair."
52:54,900;53:00,940;"Who else is authentic crazy man?"
53:00,940;53:03,660;"Brevada, which was the closest comp to that."
53:03,660;53:07,380;"Heinz, Ronnie Harrison's always struck me as like that."
53:07,380;53:08,860;"Now he's too quiet."
53:08,860;53:09,900;"Yeah, he was."
53:09,900;53:10,460;"But he was."
53:10,460;53:13,180;"He was fearless though."
53:13,180;53:13,620;"Yeah."
53:13,620;53:14,060;"Oh, yeah."
53:14,060;53:15,780;"In the same way that Steve Smith is."
53:15,780;53:19,060;"Hmm."
53:19,060;53:21,900;"Actually wrote a, I wrote a blog on it, Andy."
53:22,460;53:24,220;"You did on what on Steve Smith?"
53:24,220;53:28,060;"It was actually on Jalen Ramsey when he was being a clown."
53:28,060;53:29,900;"Oh, yeah. Yeah."
53:29,900;53:33,380;"What's our website called Brownboro Sports."
53:33,380;53:35,860;"She probably didn't know that."
53:35,860;53:39,740;"Apparently you've been writing recently, too."
53:39,740;53:44,300;"Isn't it?"
53:44,300;53:46,780;"Isn't it linked on the Patriots dynasty site as well?"
53:46,780;53:50,740;"Maybe."
53:50,740;53:51,740;"I don't know."
53:52,220;53:54,820;"Did you even read the blog I wrote recently?"
53:54,820;53:57,620;"They have a blog recently."
53:57,620;53:59,740;"Yeah, I have about Alex van pal."
53:59,740;54:01,500;"No, I didn't know you wrote it."
54:01,500;54:06,620;"Yeah, it's a the title of the blog is Alex van pal is your wife's favorite player."
54:06,620;54:13,020;"And it's just, it's not many words and it's just pictures of him looking like a stud."
54:13,020;54:20,100;"That the last thing you have friends could read."
54:20,300;54:22,940;"Yeah, the 50 shades of Rex or whatever it was."
54:22,940;54:24,460;"That's when it started getting weird."
54:24,460;54:25,460;"Yeah."
54:25,460;54:26,980;"That was when it started getting good."
54:26,980;54:29,820;"Yeah, then he stopped writing."
54:29,820;54:31,140;"Oh, Kobe Bryant."
54:31,140;54:33,820;"He's another one that was like authentic."
54:33,820;54:34,940;"Oh, yes."
54:34,940;54:35,700;"Yeah. Yeah."
54:35,700;54:36,900;"That's a great comp."
54:36,900;54:37,900;"Yeah."
54:37,900;54:43,140;"What about Pedro?"
54:43,140;54:46,100;"He's also a little quiet."
54:46,100;54:49,300;"He wasn't really though."
54:49,300;54:52,020;"But Manny to to there is a good comp."
54:52,020;54:53,820;"Yeah, I would give you that."
54:53,820;54:56,140;"Maybe like putting on a show."
54:56,140;54:59,860;"All right."
54:59,860;55:05,020;"Uh, speak, speaking of the Panthers game way the fuck off track yet again."
55:05,020;55:09,620;"Um, any other names you guys recognized?"
55:09,620;55:15,540;"Uh, I, I, I, I, I did not recognize was there running back."
55:15,540;55:17,740;"Richard, yeah."
55:18,340;55:19,780;"Did what was his final stat line?"
55:19,780;55:22,260;"I was a lot."
55:22,260;55:24,900;"He was that's that check."
55:24,900;55:26,900;"Crushing on though."
55:26,900;55:31,020;"He played a hundred yards by like mid second quarter."
55:31,020;55:34,100;"Twenty one carries a hundred and sixty eight rushing yards."
55:34,100;55:34,900;"Yeah."
55:34,900;55:38,980;"And like a hundred of those plus came by in the first quarter and a half."
55:38,980;55:39,460;"Yeah."
55:39,460;55:40,900;"That's not like it is."
55:40,900;55:41,820;"It was a close game."
55:41,820;55:47,340;"So just for some context, he led the lead the team in rushing"
55:47,740;55:49,580;"with 665 yards."
55:49,580;55:51,940;"And you got a hundred and seven."
55:51,940;55:53,980;"And he got almost out of the 70 in this game."
55:53,980;55:55,180;"Oh my God."
55:55,180;55:58,420;"Yeah, they had the worst rushing offense in the league and they're sitting there"
55:58,420;56:00,060;"just gashing the pages over and over."
56:00,060;56:00,860;"Yeah."
56:00,860;56:03,300;"Like we fumbled on the one yard line, right?"
56:03,300;56:04,380;"Yeah."
56:04,380;56:08,660;"So they were yeah, they were like three and gold goes and got a field"
56:08,660;56:10,060;"a lot of it or some shit like that."
56:10,060;56:11,220;"Yeah."
56:11,220;56:12,220;"So yeah."
56:12,220;56:16,180;"So the first round of the Patriots had like they got first in goal from like the"
56:16,180;56:17,140;"four or the five."
56:17,140;56:25,480;"And they actually scored the touchdown that you talked about, but they got called back for holding my Compton on the fantastic block that Craig Jameson."
56:25,480;56:28,200;"And then they end up settling for field goal."
56:28,200;56:36,320;"And then like a few plays later, Winky throws his first pick six of the game."
56:36,320;56:40,600;"Yeah, by law, who outrun Steve Smith, which I thought was pretty cool."
56:40,800;56:46,040;"If he's diff arm on the way, if you did a visual of that pick six,"
56:46,040;56:49,200;"just imagine the one on the Super Bowl on the other side of the field."
56:49,200;56:50,520;"Yeah."
56:50,520;56:52,000;"Because they are the same thing."
56:52,000;56:52,800;"Oh, row."
56:52,800;56:53,400;"Yeah."
56:53,400;56:55,280;"That throws it behind their seat or title."
56:55,280;56:56,040;"I just catches it."
56:56,040;56:56,400;"Exactly."
56:56,400;56:59,640;"Chris would be wasn't pressured at all and just through a terrible pass."
56:59,640;57:00,600;"That's true."
57:00,600;57:05,600;"Um, and so they get the, they get the ball back and literally the next play"
57:05,600;57:08,400;"when he throws another, what should have been a pick six?"
57:08,400;57:08,840;"Yeah."
57:08,840;57:15,720;"Otis Smith, which only wasn't because it got called back for holding on the return by whoever the defender was"
57:15,720;57:19,900;"So the paths get the ball unlike on the 35"
57:19,900;57:25,400;"convert a fourth in two get to fourth in goal like the two and"
57:25,400;57:31,840;"As Antoine Smith is running into the end zone. He fumbles it on the goal line and the Panthers recover"
57:31,840;57:35,320;"Then like their first"
57:35,480;57:39,400;"Play from the one-yard line was a hand off to that dude and he ran to like the 25"
57:39,400;57:44,600;"Then they give you yeah, like the 45 and this is like oh my god. Yeah"
57:44,600;57:47,320;"Yeah, it was"
57:47,320;57:49,320;"He was basically"
57:49,320;57:51,560;"The entire Panthers offense"
57:51,560;57:54,280;"Me entire game really"
57:54,280;58:00,000;"Yeah, he had more rushing yards than winky at passing yards"
58:04,560;58:07,900;"And he stopped getting the ball on the second quarter to it was crazy"
58:07,900;58:10,520;"Yeah, the guy down so bad"
58:10,520;58:15,220;"It was not great. Yeah, Carolina finished with 193 total rushing yards"
58:15,220;58:18,980;"Which is brutal and no touchdowns"
58:18,980;58:24,280;"But the name of the game was turnovers"
58:24,280;58:27,000;"Carolina had six of them"
58:27,000;58:29,400;"To the Patriots three which still not"
58:29,920;58:35,760;"I'm saying yeah, but I mean, I don't know how you guys felt about this, but watching this game. I didn't think I"
58:35,760;58:38,120;"Can see how this team on the Super Bowl?"
58:38,120;58:44,480;"Because like you said go in the middle the this game is absolute drumming ends 38 to 6 and"
58:44,480;58:51,000;"Like oh yeah, I feel like I remember them just like beating the shit out of the Panthers and kind of"
58:51,000;58:54,720;"in the passing defense. Yeah, because the"
58:56,280;59:01,040;"Pages defense outscored the Panthers offense technically because they had two pick sixes"
59:01,040;59:02,800;"but"
59:02,800;59:07,880;"They were getting gashed in the run and the commentators were talking about how you know they have to worry about"
59:07,880;59:10,360;"he was the Steelers running game and"
59:10,360;59:16,040;"The Ravens as well who'd won the Super Bowl the year before you don't want to you don't want to face them and all that stuff"
59:16,040;59:19,920;"Right exactly well. I mean I"
59:19,920;59:22,200;"think it was like"
59:22,200;59:25,880;"You can if you look at it from like Bella Chex view right where like"
59:25,880;59:30,080;"complimentary football and it's not just about the off because the offense was not very good"
59:30,080;59:33,240;"But there is a you know the defense"
59:33,240;59:40,600;"The they punted and got him down to the one right and then the defense held them and then they punted it too far and Troy Brown took that to the house"
59:40,600;59:42,280;"and that's like"
59:42,280;59:46,880;"See fence the special teams creates defense creates special teams to create touch down blah blah blah"
59:46,880;59:49,740;"Steve I was gonna make the same point"
59:50,880;59:57,480;"Damn, I believe I had a written down in my notes Bella check football"
59:57,480;01:00:03,560;"It was actually a very similar return to that Steelers game"
01:00:03,560;01:00:09,860;"Yeah, very astute of you Steve and then Troy took it right up the gut and then you're like"
01:00:09,860;01:00:11,700;"There's the punter gonna get him. Yeah"
01:00:11,700;01:00:19,560;"Dude as soon as you guys pass that first wave there wasn't somebody within like 20 yards of Troy Brown"
01:00:19,560;01:00:23,220;"That has Troy Brown ever been tackled by a punter kicker"
01:00:23,220;01:00:26,600;"Probably not never"
01:00:26,600;01:00:34,700;"Because he's never really were turned a kick against Adam and Terry apparently that's right. Yeah, oh that would be"
01:00:34,700;01:00:38,540;"That would be a matchup. I hope the home a drill with"
01:00:44,280;01:00:46,920;"Troy Brown and current after the very that would be amazing."
01:00:46,920;01:00:49,080;"- My money's on current Troy Brown, I don't care."
01:00:49,080;01:00:49,920;"- Yeah."
01:00:49,920;01:00:51,280;"- Troy Brown, he's shifty, man."
01:00:51,280;01:00:56,440;"- Well, he's our cousin, you got it bad on him."
01:00:56,440;01:00:57,400;"- Well, I guess."
01:00:57,400;01:00:58,840;"Well, speaking of Troy Brown,"
