Start Timestamp;End Timestamp;Transcript
01:01:46,660;01:01:47,500;"- Right."
01:01:47,500;01:01:49,980;"I mean, and, you know, obviously I'm giving you shit,"
01:01:49,980;01:01:54,980;"but to your point, it's just tough to assess that situation,"
01:01:54,980;01:01:58,100;"especially without knowing what was going on"
01:01:58,100;01:01:59,500;"without social media."
01:01:59,500;01:02:02,940;"So it's just what we know based on what Terry Glenn told us"
01:02:02,940;01:02:04,580;"and the timing of it."
01:02:04,580;01:02:05,580;"I got to go guys."
01:02:05,580;01:02:06,580;"All right."
01:02:06,580;01:02:07,580;"Is that it?"
01:02:07,580;01:02:10,580;"Is he just going to say that leave?"
01:02:10,580;01:02:11,580;"Yep."
01:02:11,580;01:02:12,580;"Thanks."
01:02:12,580;01:02:13,580;"All right."
01:02:13,580;01:02:15,580;"Who do we have left?"
01:02:15,580;01:02:17,580;"Is Greg still here?"
01:02:17,580;01:02:18,580;"No, he left here."
01:02:18,580;01:02:20,580;"Just me and you."
01:02:20,580;01:02:21,580;"Awesome."
01:02:21,580;01:02:22,580;"Way to go guys."
01:02:22,580;01:02:25,580;"Way to, you know, well, we knew Greg was even."
01:02:25,580;01:02:26,580;"Right."
01:02:26,580;01:02:28,580;"Way to let them, uh, viewers now."
01:02:28,580;01:02:30,580;"But anyways, too, to wrap that up."
01:02:30,580;01:02:33,580;"I mean, I don't have to go."
01:02:33,580;01:02:35,580;"I'm really excited."
01:02:35,580;01:02:36,580;"I'm not just there."
01:02:36,580;01:02:37,580;"You have to go."
01:02:37,580;01:02:39,580;"Fuck out of here."
01:02:39,580;01:02:40,580;"Bye."
01:02:40,580;01:02:41,580;"Diddy."
01:02:41,580;01:02:42,580;"Where?"
01:02:42,580;01:02:44,580;"Oh, there's a chat here."
01:02:44,580;01:02:47,580;"He's got to say bye to the viewers, man."
01:02:47,580;01:02:48,580;"Oh, he's saying by them."
01:02:48,580;01:02:52,580;"And then I interrupted you twice, which is also going to fit the viewers."
01:02:52,580;01:02:53,580;"Yeah."
01:02:53,580;01:02:54,580;"I'm cutting this whole thing out."
01:02:54,580;01:02:56,580;"We're just going to play it off like you were."
01:02:56,580;01:02:57,580;"No, no, this is."
01:02:57,580;01:02:59,580;"We've been in there, man."
01:02:59,580;01:03:00,580;"Let it be messy."
01:03:00,580;01:03:01,580;"We'll see."
01:03:01,580;01:03:02,860;"I had to be messy."
01:03:02,860;01:03:03,860;"I don't even know."
01:03:03,860;01:03:04,860;"I gotta go fucking save."
01:03:04,860;01:03:05,860;"All right, then."
01:03:05,860;01:03:06,860;"Good chatting."
01:03:06,860;01:03:07,860;"Right."
01:03:07,860;01:03:08,860;"Later."
01:03:08,860;01:03:14,300;"I think you should leave that all in there because this is life and whoever's listening"
01:03:14,300;01:03:16,740;"at this point, yes it is."
01:03:16,740;01:03:21,700;"And speaking on that, the messiness of the Terry Glenn situation."
01:03:21,700;01:03:22,700;"Yeah."
01:03:22,700;01:03:29,700;"So yeah, to your point, he, it did seem like he, you know, he did some things like he"
01:03:29,700;01:03:34,540;"miss him drug test for whatever reason at the time. And then yeah, months later, he said"
01:03:34,540;01:03:38,340;"that it was because of that. Now, it doesn't, it doesn't mean that he's not dealing with"
01:03:38,340;01:03:43,180;"that. Maybe he is using that to justify it later as a like legal way. But I just thought"
01:03:43,180;01:03:46,940;"it was interesting because I didn't, I didn't really remember this going on. Maybe I was"
01:03:46,940;01:03:53,060;"a little bit too young to, you know, understand. But I think it is an interesting thing because"
01:03:53,060;01:03:59,340;"a lot of the articles that you had put up that I was looking over, it was like about,"
01:03:59,340;01:04:05,340;"they were interviewing doctors and trying to figure out from psychiatrists of how this manifests itself."
01:04:05,340;01:04:11,580;"And people didn't really know how to deal with the mental health aspect of athletics,"
01:04:11,580;01:04:17,900;"back then. I don't think we're at the point where we know how to handle that now."
01:04:17,900;01:04:26,380;"But yeah, this was before CTE was even a thought, a possibility."
01:04:27,180;01:04:33,100;"But yeah, I think you're even in the articles, all the even"
01:04:33,100;01:04:36,980;"explanations from these doctors felt really almost simplistic."
01:04:36,980;01:04:38,180;"Yeah, I agree."
01:04:38,180;01:04:39,060;"Yep."
01:04:39,060;01:04:42,180;"You could you could almost tell that there hadn't really been a lot"
01:04:42,180;01:04:45,140;"of emphasis on that side of things."
01:04:45,140;01:04:49,980;"But it wasn't even just the depression and stuff because it was"
01:04:49,980;01:04:53,500;"there was another article to focus like specifically focusing on"
01:04:54,140;01:04:58,780;"Terry Glenn's mental health and the quote that I pull from that was"
01:04:58,780;01:05:03,680;"The Norfolk County District Attorney's Office dismissed the felony"
01:05:03,680;01:05:08,540;"Intimidation of a witness charge against Glenn stemming from a May 16 incident"
01:05:08,540;01:05:13,100;"Which he allegedly assaulted Kimberly Combs the mother of Glenn's six-year-old son"
01:05:13,100;01:05:17,540;"Right, and I saw that and I didn't remember that happening either"
01:05:17,540;01:05:20,620;"So again, I don't know if this was like public knowledge"
01:05:21,300;01:05:27,140;"Or maybe I was paying attention to it because I doubt I was reading newspapers and like you know around this time, but right yeah"
01:05:27,140;01:05:35,040;"I mean obviously we would hear about it more with the social media aspect of today, but I just thought it was interesting. I mean and"
01:05:35,040;01:05:39,980;"It's also I don't know it"
01:05:39,980;01:05:43,980;"It's a tough thing to talk about because it is a very real thing"
01:05:43,980;01:05:45,980;"I think that now a lot of more people"
01:05:46,260;01:05:51,340;"understand what it is, or at least experience it a little bit more and I'm willing to talk about it."
01:05:51,340;01:05:58,140;"Is it fair that Terry Glenn was using it the way that he did? Again, probably not because it doesn't necessarily advance"
01:05:58,140;01:06:06,500;"the study and understanding of depression and anxiety and all these things that, you know, I think is very much in play today."
01:06:06,500;01:06:08,300;"But"
01:06:08,300;01:06:14,420;"it was very interesting to hear that. And obviously, you know, if you're dealing with depression and anxiety,"
01:06:14,500;01:06:19,500;"You're trying to get help that also doesn't excuse behavior like what he was accused of and"
01:06:19,500;01:06:26,860;"You know it doesn't help that situation either in getting that discussion going but I do think it's uh"
01:06:26,860;01:06:31,700;"It's interesting because now it is and I think social media has a lot to do with it"
01:06:31,700;01:06:35,060;"But we see a lot of athletes dealing with this and just people in their everyday life"
01:06:35,060;01:06:43,220;"and now we're just starting to talk about those things and try to figure out as a society how to deal with it"
01:06:43,220;01:06:47,060;"But right. Can you imagine like 20 years ago dealing with it?"
01:06:47,060;01:06:48,820;"If he in fact was, I don't know."
01:06:48,820;01:06:53,780;"Yeah, I mean, I mean, he's he was definitely dealing with something, whether"
01:06:53,780;01:06:59,540;"whatever it is, were turned out to be. Right."
01:06:59,540;01:07:06,260;"Just yeah, it feels like, you know, shades of even like an air in Hernandez or like you"
01:07:06,260;01:07:11,060;"talking about Antonio Brown, like this, there's just things going on."
01:07:11,060;01:07:14,060;"Like this does feel very similar."
01:07:14,060;01:07:18,260;"Like the more that we get into it, it feels very similar to an Antonio Brown situation."
01:07:18,260;01:07:19,260;"Right."
01:07:19,260;01:07:23,420;"Which hopefully the ending is a little bit different because I don't, I'm not seeing"
01:07:23,420;01:07:28,780;"anything substance wise with him at the moment, but there is like, you know, a lot of the"
01:07:28,780;01:07:34,180;"illegal stuff up in the air and, you know, hopefully, I mean, he said he's talking to"
01:07:34,180;01:07:35,180;"a therapist."
01:07:35,180;01:07:37,940;"I don't know if Terry Leno is at the time."
01:07:37,940;01:07:41,780;"But then again, I don't know if this is interesting"
01:07:41,780;01:07:43,540;"for anybody who's listening or not."
01:07:43,540;01:07:46,140;"But I'm fascinated by this stuff because also"
01:07:46,140;01:07:48,740;"if you're a football player, let's say you're Terry Glenn,"
01:07:48,740;01:07:53,540;"and Parcels was already on a little bit"
01:07:53,540;01:07:55,420;"for being soft in this and that."
01:07:55,420;01:07:57,260;"That's not necessarily the environment"
01:07:57,260;01:08:00,220;"that promotes you to share your feelings"
01:08:00,220;01:08:03,780;"or at least explain that things don't feel right."
01:08:03,780;01:08:06,420;"And I don't know, it must have been tough."
01:08:06,420;01:08:08,780;"And like you said, for Aaron Hernandez,"
01:08:08,780;01:08:10,180;"there's a documentary that's coming out."
01:08:10,180;01:08:11,420;"I don't know what it's about."
01:08:11,420;01:08:13,940;"I mean, by the time this is released,"
01:08:13,940;01:08:15,220;"it will have been out."
01:08:15,220;01:08:18,180;"But based on what I've read on him,"
01:08:18,180;01:08:20,920;"I mean, he lived a sort of life that,"
01:08:20,920;01:08:23,100;"as a football player and as a tough guy,"
01:08:23,100;01:08:25,260;"but then he had other feelings as well."
01:08:25,260;01:08:28,120;"And it's like, if you don't have an outlet for that,"
01:08:28,120;01:08:31,180;"then it's gotta be extremely tough."
01:08:31,180;01:08:33,540;"Again, it doesn't excuse his behavior"
01:08:33,540;01:08:37,280;"or how he acted dealing with certain situations,"
01:08:37,280;01:08:39,420;"but it's gotta be tough."
01:08:39,420;01:08:45,960;"- Yeah, and I think the fact that it's becoming more"
01:08:45,960;01:08:48,680;"talked about these days is probably"
01:08:48,680;01:08:52,940;"heading in the right direction,"
01:08:52,940;01:08:55,200;"opposed to just what it was then"
01:08:55,200;01:08:58,120;"and people just trying to deal with it on their own."
01:08:58,120;01:08:58,960;"- Right."
01:08:58,960;01:09:00,780;"- So as much as we give Terry Glenn shit"
01:09:00,780;01:09:03,080;"and talk about how much of a circus this is,"
01:09:03,080;01:09:11,240;"I think there's definitely some deep faines of some sad shit that runs through all of this."
01:09:11,240;01:09:12,080;"Sure."
01:09:12,080;01:09:17,040;"And if I'm being honest, I don't actually remember how this ends."
01:09:17,040;01:09:20,360;"The whole terrible ending, because I don't remember him ever playing again, but"
01:09:20,360;01:09:21,320;"Me neither, man."
01:09:21,320;01:09:22,440;"I don't remember."
01:09:22,440;01:09:27,720;"I mean, he obviously went to the Cowboys with the blood zone and Parceles reunion, but I"
01:09:27,720;01:09:32,000;"It's not like he played any of these playoff games or like Super Bowls that I"
01:09:32,000;01:09:35,760;"that I remember because I remember those those games pretty vividly."
01:09:35,760;01:09:38,320;"And he was in a par on so I don't know."
01:09:38,320;01:09:42,840;"What happens with Terry Glenn this year, so I think we're gonna have to."
01:09:42,840;01:09:45,840;"I think we'll probably stumble across that together as we go here."
01:09:45,840;01:09:49,320;"Right. I mean, that is the interesting thing about looking back at these things"
01:09:49,320;01:09:51,840;"are just kind of like understanding what was going on behind the scenes"
01:09:51,840;01:09:54,240;"that we didn't quite have an understanding for."
01:09:54,240;01:09:57,680;"Yeah, because I think especially with with these, you know,"
01:09:57,680;01:10:04,400;"positive football seasons. The things you remember are all the good things, you know?"
01:10:04,400;01:10:10,320;"Right. Well, for the postpart. Yeah. Well, I mean, what negative stuff did you remember about the"
01:10:10,320;01:10:16,400;"2001 season before we started doing it? Oh, the 2001, now much. That's what I mean. It was all pretty"
01:10:16,400;01:10:22,080;"exciting. Yeah. I mean, when it comes to sports, I think you remember the good bits. And then,"
01:10:23,440;01:10:28,400;"for the most part unless there's some really heart-wrenching thing like the helmet catch or something"
01:10:28,400;01:10:30,960;"You don't really remember the bad stuff"
01:10:30,960;01:10:32,400;"Yeah, that's true"
01:10:32,400;01:10:35,680;"I mean, I'm also wondering around this time because obviously"
01:10:35,680;01:10:41,680;"Dollar check was establishing this like culture, right and it might not be the easiest thing to deal with when"
01:10:41,680;01:10:48,000;"A player is sort of acting up or acting differently. Don't you know, he's not towing the line for whatever reason"
01:10:48,000;01:10:50,480;"And you know as a coach"
01:10:50,560;01:10:54,080;"He obviously was like, you know, we're going to do it this way and I don't want to be distraction."
01:10:54,080;01:10:58,000;"So it's not necessarily the most encouraging environment anyway, but I also understand that"
01:10:58,000;01:11:02,080;"because you're trying to implement this sort of structure in this like, you know, what this team"
01:11:02,080;01:11:09,200;"is going to become and what it became. But we also see like, because outside of like mental health or,"
01:11:09,200;01:11:14,000;"you know, you know, sitting, tearing land and making those decisions maybe doesn't play the"
01:11:14,000;01:11:18,880;"rest of the year, I don't know. Or like you said, you don't see them show up in any game. So,"
01:11:19,520;01:11:22,720;"I mean, maybe that was a Belichick thing to just try to make a point."
01:11:22,720;01:11:26,240;"I mean, there were articles about how he was already screwing around with the injury report."
01:11:26,240;01:11:28,800;"It was at 1.18 players on it or something like that."
01:11:28,800;01:11:29,360;"- Yeah."
01:11:29,360;01:11:30,720;"- So I mean--"
01:11:30,720;01:11:34,080;"- Because he got reprimanded as on the, yeah,"
01:11:34,080;01:11:36,080;"here, the Belichick was asked if he had issues."
01:11:36,080;01:11:41,280;"If he had issued such a lengthy injury report at the behest of the league office,"
01:11:41,280;01:11:44,240;"which sometimes questions such reports when a few injuries were listed."
01:11:44,880;01:11:49,760;"Four times, Belichick was asked if the 18 men list was a result of such a reprimand."
01:11:49,760;01:11:54,880;"His replies were as follows, ""No, nope, no, not that I'm aware of."""
01:11:54,880;01:11:59,040;"But yeah, right. He was definitely like playing games with that whole"
01:11:59,040;01:12:03,360;"injury report thing, even back in 2001."
01:12:03,360;01:12:11,120;"Right. So, I mean, I think all these things come into play. Obviously, I think he's softened"
01:12:11,120;01:12:15,040;"over the years because with the Josh Gordon situation, I think they were a little bit more"
01:12:15,040;01:12:23,520;"well, a lot more accommodating. Yeah, I feel like the Corey Dills and the Randy Moss has kind of"
01:12:23,520;01:12:29,360;"softened him to bring it in those way because he sees that it can work as long as the"
01:12:29,360;01:12:34,080;"the player has the right mindset. Right, right. But yeah, I agree."
01:12:34,080;01:12:40,640;"Yeah, so anyways, I mean, it'll be interesting to see how it plays out and, you know, I'm just"
01:12:40,640;01:12:46,160;"interested as I get older as well and as society progresses in whatever way it's going. It's"
01:12:46,160;01:12:51,120;"interesting to look back and I'm sure there's going to be other situations where we get a little"
01:12:51,120;01:12:56,800;"bit more insight. We're like, ""Oh, okay."" Maybe there's something more going on."
01:12:56,800;01:12:58,400;"Yeah, absolutely."
01:12:58,400;01:13:02,800;"Yeah, I don't know if anybody wants to listen to this stuff. There you go."
01:13:03,520;01:13:05,040;"- No, that was great stuff."
01:13:05,040;01:13:09,680;"So let's, I think we should wrap this up."
01:13:09,680;01:13:13,920;"I think we've talked for quite a bit about all sorts today."
01:13:13,920;01:13:17,360;"Maybe even some builds game."
01:13:17,360;01:13:20,400;"You wanna start your best and worst?"
01:13:20,400;01:13:24,960;"- Yeah, I mean, the obvious best,"
01:13:24,960;01:13:27,600;"which I wanted to avoid picking this,"
01:13:27,600;01:13:31,640;"but it was the best, was the Antoine Smith"
01:13:31,640;01:13:35,240;"sort of touchdown that sealed the game."
01:13:35,240;01:13:39,740;"I think it was 157 left on the clock."
01:13:39,740;01:13:40,840;"They're trying to kill time."
01:13:40,840;01:13:44,940;"And then Antoine Smith blows through pretty much everybody"
01:13:44,940;01:13:46,200;"that was trying to tackle them."
01:13:46,200;01:13:49,740;"It's a monster 42 yard run, makes a score 21-11"
01:13:49,740;01:13:51,640;"and that pretty much seals the deal."
01:13:51,640;01:13:58,080;"Before that to show how bad this game was,"
01:13:58,080;01:14:01,540;"my best play was a Patrick Pass kickoff return"
01:14:01,540;01:14:03,460;"that was fumbled, picked up."
01:14:03,460;01:14:05,860;"He runs across the field, bounces off a few guys"
01:14:05,860;01:14:08,980;"for 19 return, a 19-year return."
01:14:08,980;01:14:10,940;"That was my best play before that."
01:14:10,940;01:14:13,580;"- I mean, it was exciting."
01:14:13,580;01:14:15,260;"- Sure."
01:14:15,260;01:14:19,620;"- Wait, you like the Troy Brown end-around"
01:14:19,620;01:14:21,100;"that got called back for holding?"
01:14:21,100;01:14:22,020;"- The reverse?"
01:14:22,020;01:14:22,860;"- Yeah."
01:14:22,860;01:14:23,700;"- Yeah."
01:14:23,700;01:14:27,300;"- No, that was one of my notes about"
01:14:27,300;01:14:28,500;"Gus Johnson and Brett Jones."
01:14:28,500;01:14:30,100;"That's not a fucking reverse."
01:14:30,100;01:14:30,940;"- Right."
01:14:30,940;01:14:38,220;"Right and I did the right a note on that though. I love Brady's hand off because he timed it perfectly to him. Oh, yeah"
01:14:38,220;01:14:41,420;"He held it long enough"
01:14:41,420;01:14:45,600;"To make the play work obviously didn't but no yeah"
01:14:45,600;01:14:48,500;"All right, so then what was your worst?"
01:14:48,500;01:14:50,860;"Something game"
01:14:50,860;01:14:55,520;"Well the worst I would say is just any offensive line"
01:14:56,140;01:15:00,420;"Play that allowed a sack. I mean any even like the hurries. I'd say"
01:15:00,420;01:15:04,100;"Yeah, the offensive line was terrible"
01:15:04,100;01:15:10,460;"Which again, I saw another article that they were talking about oh well, maybe"
01:15:10,460;01:15:12,900;"Bledsoe was better"
01:15:12,900;01:15:19,420;"You know because he would have been better if he had a better offensive line or whatever they were talking about the offensive line play"
01:15:19,420;01:15:24,340;"Was a little bit better in you know Brady's tenure in 2001"
01:15:24,340;01:15:26,460;"And I'm like, I think they were the same."
01:15:26,460;01:15:30,300;"It's just sort of the decision making and whatever that comes with it."
01:15:30,300;01:15:31,820;"No, you're right."
01:15:31,820;01:15:33,940;"But I did like the quote from that article."
01:15:33,940;01:15:40,460;"Here in 1999, let's go play behind a line from which only one player remains."
01:15:40,460;01:15:43,780;"When I say that, I don't mean still remains in New England."
01:15:43,780;01:15:45,500;"I mean, still remains in pro football."
01:15:45,500;01:15:47,220;"All right."
01:15:47,220;01:15:50,260;"Well, that's a major point right there."
01:15:50,260;01:15:51,940;"But yeah, so, so not great."
01:15:51,940;01:15:58,740;"So I mean, I don't think this is head and shoulders better than the 1999, but it was"
01:15:58,740;01:16:03,180;"99 was was this is what I'm talking about when I'm talking about"
01:16:03,180;01:16:08,220;"Drew Blitzer like dragging this team to victories is that's what he was dealing with."
01:16:08,220;01:16:09,180;"Right."
01:16:09,180;01:16:15,660;"And I will say that I also wanted to touch on this game was so bad."
01:16:15,660;01:16:18,020;"I wanted to get the other guys on here and see what they thought."
01:16:18,020;01:16:23,960;"But when they put up, so you know, they put up like all kinds of posts, like there's the NFL"
01:16:23,960;01:16:28,360;"dot com one, where this time the Patriots were finally mentioned."
01:16:28,360;01:16:33,680;"So first time all year, the the the the poll, front of all dot com actually referenced the"
01:16:33,680;01:16:34,680;"Patriots."
01:16:34,680;01:16:40,540;"Yeah, I have it here was what has been the most surprising aspect of the 2001 season thus far"
01:16:40,540;01:16:45,580;"and the first option is emergence of Tom Brady, which Jones picked."
01:16:45,580;01:16:50,020;"out exactly. So I thought it was because he's in New England. But actually it was just because"
01:16:50,020;01:16:55,180;"he's in New England. Right. If you know, if anybody has listened to some of these, they'll"
01:16:55,180;01:16:59,420;"know that there's been a bunch of these kind of all the temples and they have nothing to"
01:16:59,420;01:17:04,300;"do with the Patriots, even though they're during the Patriots game. But then the best"
01:17:04,300;01:17:08,260;"thing that I thought they put up there was they were talking about Ted Johnson's favorite"
01:17:08,260;01:17:13,740;"book. You can steal the reader. No, go for it. Go for it. Go. All right. That's a great"
01:17:13,740;01:17:15,660;"- I said, ""Yeah, no, my best."""
01:17:15,660;01:17:17,060;"I actually had two."
01:17:17,060;01:17:18,780;"They're talking about Ted Johnson being an avid reader."
01:17:18,780;01:17:22,060;"Like you said, turns out his favorite book"
01:17:22,060;01:17:24,340;"is the notebook by Nicholas Sparks, apparently."
01:17:24,340;01:17:25,460;"- That's so good."
01:17:25,460;01:17:30,460;"- Which those of you who have or are currently dating somebody,"
01:17:30,460;01:17:33,540;"you know that got turned into a movie with Ryan Gosling."
01:17:33,540;01:17:34,740;"- And it was fantastic."
01:17:34,740;01:17:37,940;"- Yes, and we'll make your significant other very mad at you"
01:17:37,940;01:17:40,620;"after watching it, 'cause you're not"
01:17:40,620;01:17:42,380;"a Nicholas Sparks character."
01:17:42,380;01:17:49,340;"Well, I will admit that I watched that movie on my own at like 3 a.m. by myself."
01:17:49,340;01:17:50,540;"That's not that right."
01:17:50,540;01:17:52,100;"You know, I needed to know what it was about."
01:17:52,100;01:17:56,900;"And by the end, because I think it's a horror film and nobody wants to talk about that,"
01:17:56,900;01:17:58,780;"but it is a horror film."
01:17:58,780;01:18:05,660;"And by the end, I think I cried by myself for at least 35 minutes, not out of like the love story,"
01:18:05,660;01:18:09,020;"but out of sheer fear because of like the possibility."
01:18:11,100;01:18:12,900;"I mean, yeah, that's fair."
01:18:12,900;01:18:15,400;"But yeah, that graphic that you're talking about."
01:18:15,400;01:18:17,220;"They actually list like go on."
01:18:17,220;01:18:17,940;"So they put up the graphic."
01:18:17,940;01:18:19,020;"I have it here."
01:18:19,020;01:18:22,220;"I took a screenshot of it so I wouldn't forget it."
01:18:22,220;01:18:25,820;"Ted Johnson's favorite authors, Deepak Chopra."
01:18:25,820;01:18:29,860;"Nelson DeMille, I believe is pronounced."
01:18:29,860;01:18:31,820;"John Grisham, which OK, great."
01:18:31,820;01:18:33,740;"Robert Ludlam, of course."
01:18:33,740;01:18:35,820;"M. Scott Peck, who I don't actually know."
01:18:35,820;01:18:38,940;"And then the aforementioned Nicholas Sparks."
01:18:38,940;01:18:40,540;"That is so funny, though, that they--"
01:18:40,540;01:18:49,100;"avid reader for especially for a run stopping linebacker who from the the picture that they"
01:18:49,100;01:18:56,540;"showed next to this these names of authors his neck is actually wider than his head. Oh yeah."
01:18:56,540;01:19:02,860;"Not shaped man. I don't remember that about. Yeah. And so yeah just not something you expect"
01:19:02,860;01:19:08,540;"and my actually had another favorite and this is just a small thing but the page is"
01:19:08,540;01:19:11,620;"ran a direct snap to Kevin Falk on like third and 12."
01:19:11,620;01:19:13,340;"You see that play?"
01:19:13,340;01:19:14,620;"I don't remember that one."
01:19:14,620;01:19:18,340;"Yeah, it was halfway through like the second or third quarter."
01:19:18,340;01:19:20,500;"And like they didn't convert it or anything."
01:19:20,500;01:19:21,900;"So it didn't really work."
01:19:21,900;01:19:24,420;"But I think it got like eight yards."
01:19:24,420;01:19:33,500;"But on the direct snap to Falk, Tom Brady's play fake was amazing."
01:19:33,500;01:19:37,540;"He literally acted like he caught the ball and like was doing his whole"
01:19:37,540;01:19:42,060;"drop back and like looking looking across the field. Oh, yeah. Now to remember the,"
01:19:42,060;01:19:46,980;"the announcers were talking about that too. Yeah. It was amazing. It was so like rookie,"
01:19:46,980;01:19:52,220;"Tom Brady, like making sure everything is, is exactly how it should be."
01:19:52,220;01:19:57,940;"Are you calling him a hardo? Oh, yeah. I don't even call him a hardo all day. Well,"
01:19:57,940;01:20:04,420;"all all season, I guess. I didn't know that. I know, I know, J.J. Watt is a hardo."
01:20:04,420;01:20:07,660;"So I know no rookie Tom Bray is a super hard."
01:20:07,660;01:20:09,220;"Amazing."
01:20:09,220;01:20:14,020;"And then my worst a lot to pick from."
01:20:14,020;01:20:21,460;"I think we'll go back to the kicking game kicker in this game is Jake Arians."
