Start Timestamp;End Timestamp;Transcript
21:00,500;21:04,040;"lopsided towards the end, but I don't know."
21:04,040;21:05,680;"I feel like, didn't you have a rap"
21:05,680;21:07,880;"for being kind of soft sometimes?"
21:07,880;21:10,340;"- That's what I'm thinking."
21:10,340;21:11,800;"I know the whole team, but Edgar and James,"
21:11,800;21:14,080;"like he never seemed to finish or run."
21:14,080;21:16,480;"Every time I got hit, he just kind of went down."
21:16,480;21:18,960;"- I mean, he'd be like quite fresh of yards."
21:18,960;21:20,640;"- But-- - Oh yeah, he's great in space."
21:20,640;21:21,480;"He'd make people miss."
21:21,480;21:24,880;"He never seemed to like try to get that extra yard."
21:24,880;21:26,720;"- Yeah, I don't think that was style."
21:26,720;21:30,320;"couple of like third ones where they ran off the mail. He was like hit somebody and fell over."
21:30,320;21:34,480;"And that was it. So I don't know if it was like if you was dealing injury or what, but I mean,"
21:34,480;21:41,000;"he was kind of responsible for a lot of the mistakes on the Colts offense in this game."
21:41,000;21:43,120;"Like he had a rough game."
21:43,120;21:46,760;"I don't know. Peyton Manning threw some brutal interceptions."
21:46,760;21:55,040;"He did. And I think, I mean, this is a bill bell check defense going against the young"
21:55,040;22:02,960;"quarterback. Because let's see, Peyton Manning, how many years had he been in the league at this point?"
22:02,960;22:11,040;"Two or three? Yeah, but I mean, he was crushing it. Even in the year prior,"
22:11,040;22:17,200;"I mean, his first year was awash, but I mean, he was kind of evolving the offensive side of things"
22:18,000;22:24,120;"football wise. So I mean, yeah, he was young, but I mean, we got to give"
22:24,120;22:28,640;"Belichick credit for coming up with a game plan that he was sort of blowing"
22:28,640;22:35,360;"up other teams with. And yeah, sure, I mean, it, as he got more seasoned,"
22:35,360;22:40,560;"it was a little bit more of a chess match, but he still was a pretty"
22:40,560;22:42,240;"experienced guy at this point, I feel."
22:42,240;22:47,040;"Yeah, I mean, I've been looking at it now. His rookie year was 98. So this is"
22:47,040;22:53,000;"this fourth year in the league. Yeah, you'd thrown for his first year, you threw for 3700"
22:53,000;22:58,480;"yards and everything after that was at least 4000 yards. And in the two seasons prior to"
22:58,480;23:02,240;"this, you got 13 and three and then 10 and six. So I mean, they've been putting up numbers,"
23:02,240;23:09,680;"you've been throwing touchdowns and they were winning games. But still, he just looked lost"
23:09,680;23:13,680;"in this game. I mean, there were some mistakes that weren't necessarily his, like a couple"
23:13,680;23:17,600;"interceptions were bounced off of receivers hands, stuff like that. Like one of the ones"
23:17,600;23:23,600;"Edgar and James had a pass out of the backfield that he bobbled straight up into"
23:23,600;23:30,480;"with Roman Fife for his hands. God, so soft. So soft. And then the one where, even Edgar and James,"
23:30,480;23:37,120;"he caught a screen pass and then tried to switch the ball from one hand to another and just straight"
23:37,120;23:42,120;"dropped it. That's just soft."
23:42,120;23:50,040;"Well, and also, I mean, as we'll see as the season goes on, the way that they did play"
23:50,040;23:55,120;"defense, like Steve was talking about, they were like mauling wide receivers and that"
23:55,120;23:59,840;"was something that Peyton obviously couldn't adapt to and his receivers couldn't either."
23:59,840;24:04,400;"So it's sort of like, I think, a perfect storm for every part of that offense to kind"
24:04,400;24:05,880;"to be affected in one way or another."
24:05,880;24:10,440;"Yeah, I think the book is at that time match up really well with their"
24:10,440;24:11,960;"offenses to have a play."
24:11,960;24:13,480;"Hmm."
24:13,480;24:14,440;"Yeah."
24:14,440;24:17,760;"Yeah, they were very kind of big physical corners."
24:17,760;24:22,640;"Even Tai Law, who you don't really think of as a physical corner."
24:22,640;24:27,960;"Um, because of the time he played in was, I mean, you look at him play now and"
24:27,960;24:30,080;"he was all over people."
24:30,080;24:32,520;"I mean, to Bucky Jones closed on to do."
24:33,440;24:34,160;"Exactly."
24:34,160;24:38,960;"Let's see."
24:38,960;24:45,480;"I wanted to ask you about the so Gus Johnson and Brent Jones were the commentators"
24:45,480;24:49,920;"that you have any level of hatred towards those fellows."
24:49,920;24:54,080;"Gus Johnson was pretty dumb, but I like not."
24:54,080;24:57,200;"What's the best?"
24:57,200;25:00,160;"Yeah, no, so yeah, Brent Jones was kind of like whatever."
25:00,160;25:01,640;"I don't think he really knew he was talking about."
25:01,640;25:02,640;"No, Gus Jones is great."
25:03,080;25:04,880;"He can make anything sound exciting."
25:04,880;25:08,520;"Yeah, he's he's one of my all time favorites."
25:08,520;25:10,120;"Yeah, no Gus Johnson's great."
25:10,120;25:14,280;"He had the final four is is just music to my ears."
25:14,280;25:16,520;"From the parking lot."
25:16,520;25:21,000;"So routine from the parking lot."
25:21,000;25:22,440;"Exactly."
25:22,440;25:24,840;"But he's still with the cat much."
25:24,840;25:32,000;"But even this, you have a was the Irish road down pretty through a frozen rope."
25:32,000;25:33,000;"Yeah."
25:33,000;25:36,920;"It was like a 20 yard in."
25:36,920;25:37,920;"It was great."
25:37,920;25:42,000;"I mean, he hucked it, but he just gets so excited."
25:42,000;25:43,880;"I also liked how they were."
25:43,880;25:44,880;"He was."
25:44,880;25:45,880;"He was."
25:45,880;25:47,600;"He he bet Brent Johnson."
25:47,600;25:51,360;"He's like, I will carry a luggage for us a year if the Colts get shut out."
25:51,360;25:53,600;"A calf way through the third quarter."
25:53,600;25:57,080;"And then I had to stop and look at the score and be like, did they not?"
25:57,080;25:58,440;"I think I should have."
25:58,440;26:04,280;"And then they showed the shot of the leader of the Boston Symphony."
26:04,280;26:08,440;"And Frank goes, ""Oh, you like the Symphony Gus?"""
26:08,440;26:10,480;"And Gus is like, ""Nah, it's not my thing."""
26:10,480;26:12,120;"And then he's kind of moved on."
26:12,120;26:15,600;"Glad we brought that up, boys."
26:15,600;26:16,400;"All right."
26:16,400;26:23,440;"Yeah, before we get to the game, was there any other like, like non-football related"
26:23,440;26:25,320;"stuff that you guys noticed?"
26:25,320;26:26,520;"Because I had a couple of things."
26:27,320;26:29,920;"I noticed that Brady look goofy as hell."
26:29,920;26:31,920;"Oh, absolutely."
26:31,920;26:35,160;"And it's amazing how he could take a team and get everyone on board."
26:35,160;26:42,800;"And like, obviously, the way he is now, Mr. Model and, you know, pristine everything."
26:42,800;26:47,360;"And I feel like that sort of was that the most handsome man alive?"
26:47,360;26:49,040;"Yeah, pretty much that."
26:49,040;26:50,040;"Yeah."
26:50,040;26:52,960;"And I feel like that turned around like maybe like, oh, seven."
26:52,960;26:55,400;"So before that he was sort of like this regular guy."
26:55,400;27:00,280;"But that was just fun to kind of see this wide eyed kid who's a little dopey and like"
27:00,280;27:03,280;"goofy and he is he's such a goober."
27:03,280;27:10,680;"It's a little bit he's a he's a what is that like Andy Griffith character in Happy"
27:10,680;27:16,520;"Days whatever like Ron Howard was he reminds me of that kid."
27:16,520;27:20,440;"Opie I don't know."
27:20,440;27:22,320;"We didn't watch TV in the brown house growing up."
27:22,320;27:23,320;"It was just for."
27:23,320;27:24,320;"That's right."
27:24,320;27:25,320;"It was PBS, right?"
27:25,320;27:26,320;"Yeah."
27:26,320;27:27,320;"It was Mr. Rogers in football on Sundays."
27:27,320;27:28,320;"That was it."
27:28,320;27:29,560;"I don't think you need anything else."
27:29,560;27:30,560;"We couldn't even call it TV."
27:30,560;27:32,480;"We had to call it, you know what?"
27:32,480;27:33,480;"Oh, it's right."
27:33,480;27:37,280;"We're allowed to say the word TV because otherwise we wouldn't be allowed to get to"
27:37,280;27:38,280;"watch TV."
27:38,280;27:39,280;"Yeah."
27:39,280;27:40,280;"Especially."
27:40,280;27:42,680;"How did you guys deal with this?"
27:42,680;27:43,680;"I'm growing up."
27:43,680;27:44,680;"You know what?"
27:44,680;27:45,680;"Oh boy."
27:45,680;27:48,680;"Even that one works."
27:48,680;27:51,480;"jokes on you mom I'm addicted to Netflix."
27:51,480;27:54,080;"She did her best."
27:54,080;27:58,080;"I'm watching TV as we're doing this podcast right now."
27:58,080;27:59,080;"Good."
27:59,080;28:03,080;"Yeah, I definitely went through a phase where if a TV was on I couldn't not watch it."
28:03,080;28:05,080;"And that was a detriment."
28:05,080;28:07,080;"Oh, I can't follow things beyond."
28:07,080;28:08,080;"Oh, God."
28:08,080;28:09,080;"No."
28:09,080;28:12,080;"Did you guys notice the old school Tushion song?"
28:12,080;28:14,480;"That was one of the things I want to bring up."
28:14,480;28:15,480;"What was that?"
28:15,480;28:16,480;"Yeah."
28:16,480;28:17,480;"Hey."
28:17,480;28:22,260;"Hey, oh, yeah, yeah, I always like that one. Yeah. Yeah. I'm like, oh, why'd they get rid of it?"
28:22,260;28:24,260;"So I looked it up"
28:24,260;28:26,700;"It was written by Gary glitter who?"
28:26,700;28:35,700;"Turns out was convicted of downloading over four thousand pornographic images of children and sent to jail. Oh man"
28:35,700;28:38,900;"It was also tried to having sex with underage girl then in March"
28:38,900;28:43,620;"2006 glitter was convicted of molesting two girls age 11 and 12 in Vietnam and jail for three years"
28:43,620;28:46,460;"Wow, wait to bring it down. I know I know"
28:46,460;28:47,300;"- No."
28:47,300;28:49,640;"- As much as I like the song,"
28:49,640;28:54,400;"I kind of understand why they don't play that one anymore."
28:54,400;28:56,760;"- Yeah, give me crazy training, I'm good."
28:56,760;28:58,160;"- Yeah, but I love saying--"
28:58,160;29:00,000;"- Although, did you hear what happened"
29:00,000;29:02,040;"to Ozzy Osbourne recently?"
29:02,040;29:03,640;"- No, child porn?"
29:03,640;29:05,800;"- I don't know, I'm just throwing it up."
29:05,800;29:06,640;"- I feel like we're headed."
29:06,640;29:08,000;"(laughing)"
29:08,000;29:10,600;"I have no idea what's going on with Ozzy."
29:10,600;29:12,200;"- There's like truth to that."
29:12,200;29:15,360;"Like if you look up all those like hair metal guys"
29:15,360;29:20,360;"from the eighties almost all of them have like under age women rumors."
29:20,360;29:22,160;"Yeah, that sounds about right."
29:22,160;29:25,360;"I mean, they all dressed under seven."
29:25,360;29:29,280;"I hope they were, they were carting them."
29:29,280;29:31,480;"That's all I want. Oh, they definitely were."
29:31,480;29:33,080;"I'm sure they were checking IDs at the door."
29:33,080;29:36,800;"We're on track for a while there. Yeah, not really."
29:36,800;29:44,360;"The other thing that I do wish they kept was every time the page"
29:44,360;29:45,840;"Sean defense and it was third down."
29:45,840;29:47,840;"They had that like bell tolling."
29:47,840;29:49,640;"Oh, yeah."
29:49,640;29:55,120;"I know they have the whatever horn it is now, but that bell tolling is ominous as hell."
29:55,120;29:56,280;"You know why they stopped that?"
29:56,280;29:56,680;"Like you did."
29:56,680;29:58,920;"What is stopping like?"
29:58,920;30:08,640;"Because the guy that would ring that one thing he was caught doing things with the turtle and people were pretty upset about that."
30:08,640;30:10,280;"I don't know if you remember this or not."
30:10,280;30:12,000;"You're involved."
30:12,000;30:13,760;"Yes."
30:13,760;30:14,760;"I got the right to the Yes, you're in the future."
30:14,760;30:15,760;"You're in the future."
30:15,760;30:18,760;"No, you're I'm being serious guys."
30:18,760;30:26,760;"If you look it up Google it, just type in guy who control the fog horn for Foxboro"
30:26,760;30:30,760;"turtle and you'll know exactly what I'm talking about."
30:30,760;30:31,760;"All right."
30:31,760;30:34,760;"I'm working on a horse news to do that in Google."
30:34,760;30:35,760;"It shows up."
30:35,760;30:36,760;"It does."
30:36,760;30:51,940;"is it? No, I didn't. That's I don't like that. Great. It was. You made the lie up,"
30:51,940;31:02,920;"dude. I can't get for tonight. All right. So with that out of the way, let's talk about"
31:02,920;31:16,240;"the game itself, it was felt like it was over from the first quarter to me. And I kind of"
31:16,240;31:24,120;"forget what this feels like to be an underdog and take the lead in a game, because I couldn't"
31:24,120;31:31,200;"tell you the last time it happened, like recently. Because usually it's the other way around"
31:31,200;31:34,040;"where the Patriots are the favorite and it's an underdog beating them."
31:34,040;31:38,600;"And I know what that feels like because we had that was it last year against the Titans"
31:38,600;31:41,960;"where you kind of feel it in the first quarter."
31:41,960;31:43,400;"Like this isn't going to go well."
31:43,400;31:46,400;"If the Patriots win, it's going to be ugly and they don't deserve it."
31:46,400;31:50,080;"And the Titans just outplayed him."
31:50,080;31:52,200;"Yeah, me and Greg were there for that."
31:52,200;31:53,600;"Yeah, that's right."
31:53,600;31:56,000;"I was actually supposed to go to that game and I'm glad I didn't."
31:56,000;31:58,600;"Although at the very end, I'm glad you didn't too."
32:00,600;32:04,360;"At the very end, I was like in the fourth quarter, like five minutes left."
32:04,360;32:05,460;"I was like, Greg, let's leave."
32:05,460;32:06,520;"And he's like, Nope."
32:06,520;32:07,380;"Yeah."
32:07,380;32:09,200;"So you're like your licks, bro."
32:09,200;32:10,320;"That's right."
32:10,320;32:11,920;"True."
32:11,920;32:12,680;"Yeah."
32:12,680;32:13,500;"Yeah."
32:13,500;32:16,880;"And then the same year we woke them up in the playoffs."
32:16,880;32:18,440;"No, I didn't plan to play outside."
32:18,440;32:18,880;"You did we?"
32:18,880;32:19,440;"Yeah."
32:19,440;32:20,200;"This is last year."
32:20,200;32:20,640;"Yeah."
32:20,640;32:21,480;"This is this past year."
32:21,480;32:24,240;"But it was, it was all part of the journey."
32:24,240;32:25,640;"Yes."
32:25,640;32:30,360;"But like, yeah, I forgot what it feels like to be the underdog and take that"
32:30,360;32:36,840;"lead like into the into the first quarter because it was how's that pumpkin going Greg?"
32:36,840;32:43,000;"It sucks dude. Carbon pumpkin blows. It sounds like you're slurping on something."
32:43,000;32:46,520;"It's already coming all like shit I just gave up."
32:46,520;32:56,920;"Oh god. Not an artist. No I mean either. I'm gonna artist."
32:58,120;33:04,120;"No, you're not. But yeah, I mean, this game, like the past just came out and controlled it from the beginning. They had"
33:04,120;33:10,280;"was 103 rushing yards to the Colts 13 in the first quarter alone,"
33:10,280;33:17,960;"which was basically all Antoine Smith. Like that dude is an absolute monster."
33:17,960;33:22,040;"He reminds me of like a skinnier, legaret blunt."
33:22,040;33:23,160;"Yes."
33:24,520;33:26,040;"Like he"
33:26,040;33:31,080;"He's not the fastest guy. I mean, he was quick, but he wasn't like he wasn't gonna pull away from people"
33:31,080;33:35,240;"Like defensive backs if he's if he breaks off a run like they'll catch up to him"
33:35,240;33:37,960;"But he's gonna he's gonna make him earn that tackle"
33:37,960;33:40,920;"Well, he had a 70 yard run"
33:40,920;33:43,560;"Not in this game"
33:43,560;33:45,560;"pretty sure"
33:45,560;33:49,480;"It was like 30 or 40 yards, but yeah like in the first quarter that early one"
33:49,480;33:54,440;"I don't remember this is that man. Oh wait. Yeah, it was a it was a 39 yarder in the first quarter with"
33:54,440;33:56,400;"with a man, he stiff-armed guys."
33:56,400;33:58,080;"He was doing a sideline."
33:58,080;33:58,840;"Yeah, I remember that."
33:58,840;33:59,920;"That was awesome."
33:59,920;34:02,080;"Yeah, that stiff arm was dirty."
34:02,080;34:04,840;"And it was just very blunt to ask."
34:04,840;34:07,160;"OK, he's just-- he's like, well, I'm not going to run you,"
34:07,160;34:08,920;"but I mean, you're not going to attack on me either."
34:08,920;34:10,920;"So I'm just going to put my fist in your face"
34:10,920;34:13,160;"and we'll see what happens."
34:13,160;34:13,960;"And you have like what?"
34:13,960;34:18,520;"Like 90-plus yards and two touchdowns, I think?"
34:18,520;34:21,240;"Yeah, I think you went over 100 yards, isn't he?"
34:21,240;34:21,960;"Was he?"
34:21,960;34:22,440;"I don't know."
34:22,440;34:23,600;"I mean, he had a great game though."
34:23,600;34:25,680;"Oh, no, you're right."
34:25,680;34:26,600;"You had 94 yards."
34:26,600;34:27,720;"Wow."
34:27,720;34:28,240;"I'm surprising."
34:28,240;34:28,600;"Go over."
34:28,600;34:31,200;"It's called Chopra, Andy."
34:31,200;34:32,040;"Yeah."
34:32,040;34:37,960;"Well, I feel like between the four of us will all do like one"
34:37,960;34:40,520;"will eventually get in the right area."
34:40,520;34:42,960;"And we got there eventually, right?"
34:42,960;34:43,760;"That's good teamwork."
34:43,760;34:46,000;"Just like the Patriots off into the line."
34:46,000;34:46,720;"That's right."
34:46,720;34:48,800;"Oh, oh, and speaking of the offensive line, sorry."
34:48,800;34:50,080;"Um, that's a good point though."
34:50,080;34:52,280;"I was like, um, just looking at it."
34:52,320;34:53,640;"Like just watching the game."
34:53,640;34:58,920;"I'm like, it's amazing how many guys on the offensive line were mainstays for the team."
34:58,920;35:03,080;"Like just jotting down Matt, like Damien Woody, Joey and Druzy."
35:03,080;35:05,360;"So it was a pretty solid foundation."
35:05,360;35:06,120;"Yeah."
35:06,120;35:08,520;"And even Mike Compton was the, I mean, Oh, true."
35:08,520;35:08,880;"Yeah."
35:08,880;35:14,000;"It wasn't a long time, but he is he the only offensive lineman who war"
35:14,000;35:16,520;"advisor that was sick."
35:16,520;35:20,720;"I remember thinking that was like the coolest thing back in the day."
35:20,720;35:21,440;"I do not."
35:21,440;35:22,400;"Why do they not wear that?"
35:22,400;35:25,200;"Cause you probably get poking a fair amount down there in the trenches."
35:25,200;35:25,480;"Yeah."
35:25,480;35:25,720;"You would."
35:25,720;35:26,400;"You would play some shit."
35:26,400;35:26,900;"Yes."
35:26,900;35:31,640;"But, uh, I also noticed that I don't know if he did it in this game as much."
35:31,640;35:33,000;"Cause they didn't play the shotgun, but."
35:33,000;35:39,400;"I think there was an issue with Damien, Damien Woody's shotgun snap."
35:39,400;35:42,920;"So they were kind of switch positions."
35:42,920;35:48,320;"If the quarterback was in the shotgun and Compton would be the, the, the center"
35:48,320;35:49,800;"and would be snapping shotgun."
35:49,840;35:52,080;"Wow, that is detailed observation right there."
35:52,080;35:53,240;"I did not notice that."
35:53,240;35:53,640;"Yeah."
35:53,640;35:57,640;"So you're talking about something that's like, I know, right?"
35:57,640;36:00,240;"You say that, but I actually noticed it in the Jets game,"
36:00,240;36:01,040;"and I forgot to mention it."
36:01,040;36:03,960;"So damn."
36:03,960;36:05,720;"Much in the all 22s."
36:05,720;36:06,440;"Oh, yeah."
36:06,440;36:07,520;"I don't think they had those back then."
36:07,520;36:09,080;"But yeah, damn right."
36:09,080;36:11,160;"And I think eventually they'll talk about it"
36:11,160;36:14,840;"because I feel like it comes up like in the playoffs."
36:14,840;36:19,640;"Well, speaking of equipment, Brian Cox's,"
36:19,640;36:23,540;"whatever that thing is on the back of his neck is still the best thing in the world."
36:23,540;36:28,100;"I want to call a neck roll, but it extends above his helmet."
36:28,100;36:30,200;"So at that point, I think it's a role anymore."
36:30,200;36:30,920;"It's like a plank."
36:30,920;36:31,920;"Yeah."
36:31,920;36:35,960;"And I don't know why it looks so intimidating, but that is the best thing in the world."
36:35,960;36:37,040;"It's great."
36:37,040;36:41,040;"It looks like he ripped out the headrest of his car."
36:41,040;36:43,320;"He's stuck it down the back of his shirt."
36:43,320;36:45,440;"I don't see that very often nowadays."
36:45,440;36:49,480;"I mean, it probably like constricts you pretty well, but, and it's probably due to an"
36:49,480;36:53,320;"injury or something coming to think of it, but still a pretty bad ass."
36:53,320;36:54,920;"I mean, he wore it a lot."
36:54,920;36:56,240;"Cause that's why, uh,"
36:56,240;36:59,040;"Leighton van der Ash wears it."
36:59,040;37:00,160;"Cause he had a neck injury."
37:00,160;37:00,760;"I'm pretty sure."
37:00,760;37:01,640;"Hmm."
37:01,640;37:03,120;"After the Cowboys."
37:03,120;37:06,720;"Well, I think the main piece of it is the intimidation factor."
37:06,720;37:08,240;"Definitely helps."
37:08,240;37:10,280;"Cause a lot of the fullbacks wear them still."
37:10,280;37:13,400;"Like, um, James Devlin."
37:13,400;37:15,960;"Oh, he has that like big role."
37:15,960;37:16,560;"Yeah."
37:16,560;37:19,360;"It's not a, it's not as pronounced, but he's definitely got"
37:19,360;37:21,200;"that role. Yeah."
37:21,200;37:25,280;"So I think it's basically if you're leaning with your head into people,"
37:25,280;37:29,600;"which are basically fullbacks and run stuffing linebackers."
37:29,600;37:34,040;"It's usually what, uh, what happened to those guys though,"
37:34,040;37:36,840;"like remember like John Randall and the Vikings were you to like wear like"
37:36,840;37:38,920;"war paint on his face. Yeah."
37:38,920;37:43,000;"I feel like that that's missing. Now it is. Yeah."
37:43,000;37:45,360;"And that that's kind of that was one of my points over."
37:45,360;37:51,800;"like has there ever been a more psychotic linebacker core than Brian Cox and Teddy"
37:51,800;37:52,800;"Bruceky in the middle?"
37:52,800;37:54,880;"Yeah, that's, that's insane."
37:54,880;38:00,080;"Those two, like it just looks like they want to hit anything."
38:00,080;38:01,200;"Like it doesn't even have to be a person."
38:01,200;38:05,520;"I feel like they just like come out at the beginning, like before the game"
38:05,520;38:07,760;"and just start like running into the goalposts to warm up."
38:07,760;38:09,000;"I don't know."
38:09,000;38:12,040;"Psychotic, you could just like Vontay is perfect than anybody else."
38:12,040;38:14,640;"That's true."
38:14,800;38:18,640;"That's iconic. That's just work. Yeah. Yeah."
38:18,640;38:21,000;"I mean, this iconic. I don't know. I'm sure."
38:21,000;38:21,400;"No, I'm not."
38:21,400;38:22,760;"You was on that list."
38:22,760;38:27,080;"I feel like that guy pretty much created the present day Antonio Brown."
38:27,080;38:33,000;"Yeah, suppose. Remember that game that he like laid him out and he was unconscious for like three weeks."
38:33,000;38:35,880;"Oh, that's right. Yeah. In the playoffs. Yeah."
38:35,880;38:40,120;"I feel like Antonio Brown is slightly different since that day."
38:40,120;38:43,640;"He's never recovered. I think you're right. Yeah. That was brutal."
38:43,840;38:46,540;"Remember what a mom wrote that letter to the NFL."
38:46,540;38:48,040;"Did she?"
38:48,040;38:49,480;"Yes."
38:49,480;38:50,640;"I don't remember that."
38:50,640;38:53,300;"Um, it was a"
38:53,300;38:57,480;"it was the dolphins pull off game against the Steelers."
38:57,480;39:01,320;"Oh, back up quarterback."
39:01,320;39:01,920;"I think it was."
39:01,920;39:02,820;"It wasn't Tana Hill."
39:02,820;39:03,800;"It was like Matt Moore."
39:03,800;39:04,680;"Yeah."
39:04,680;39:08,680;"He was just like sliding and just got like blown up."
39:08,680;39:09,560;"Yeah."
39:09,560;39:12,520;"No, he was rolling out and he threw the ball away."
39:12,640;39:16,320;"Yeah, and took his fuck do pre. Yeah, took a helmet right."
39:16,320;39:17,920;"Kind of feelers. Yeah."
39:17,920;39:21,640;"Dude, mom, I was watching that game of mom."
39:21,640;39:25,080;"She legitimately sent an email to the NFL."
39:25,080;39:29,080;"Because I was also going to explain."
39:29,080;39:32,520;"Yeah, I explained the rule in college where you can review those things."
39:32,520;39:35,080;"And she's like, they need that in the fucking NFL."
39:35,080;39:37,080;"She's emailing."
39:37,080;39:39,200;"Your mom's awesome."
39:39,200;39:41,360;"Like, I remember like being at some game."
39:41,360;39:46,200;"I don't know if it was soccer game or whatever, but everyone was"
39:46,200;39:49,760;"booing and she was disgusted and yelling at everybody for having like"
39:49,760;39:50,660;"no class."
39:50,660;39:52,120;"And I thought that was pretty awesome."
39:52,120;39:54,000;"Yeah, that's that's our mother."
39:54,000;40:01,120;"Yeah, I feel like we should kind of touch on her because I think she"
40:01,120;40:06,160;"is the reason we're into football, which is unusual, especially since I"
40:06,160;40:11,040;"don't think most listeners know that she, her and dad were both born and"
40:11,040;40:16,960;"raised in England and move here when they were like 30 late 20s early 30s."
40:16,960;40:18,640;"No, it's early in that."
40:18,640;40:26,080;"It was like, uh, yeah, it was probably mid to late 20s because I was born when they were 27."
40:26,080;40:29,360;"So also, Andy, you said most listeners, we have no listeners."
40:29,360;40:33,600;"Well, we'll say, well, actually, yeah, our listeners mom anyway, so we'll talk about her."
40:33,600;40:33,960;"Yeah."
