Start Timestamp;End Timestamp;Transcript
40:33,960;40:34,200;"Right."
40:34,200;40:35,440;"No, that's hurt."
40:37,720;40:51,680;"Yeah, but she the story that I was told, and I think we'll probably have to have her on to explain this in more detail, but she because dad came over for a job. So he had a green card to work and stuff, but she didn't. She just came over because she was married to him."
40:51,680;40:55,800;"So she couldn't get a job over here. So she's kind of sitting around doing nothing."
40:55,800;41:06,760;"And so she decided to learn about football. So she was watching it. But obviously, if you've come from a country that doesn't have football, you try to just like cold get into it. You have no idea what's going on."
41:07,440;41:14,840;"So what she would do is she would write down questions she would have about the game, like, you know, what's the first down or, you know, what is off sides."
41:14,840;41:23,160;"And she would send it to work with dad who would then take this piece of paper that his wife had written football questions on and give them to coworkers, American coworkers."
41:23,160;41:29,840;"And they would write down the answers for him or explain them to him and he would come back and report, you know, what off size was"
41:29,840;41:33,640;"Did your mom kind of invent Google?"
41:36,440;41:38,080;"That's what that was. That's cool."
41:38,080;41:39,040;"That's yeah."
41:39,040;41:40,840;"That's amazing."
41:40,840;41:42,600;"It's like an ass."
41:42,600;41:43,320;"Jeez, right?"
41:43,320;41:44,320;"Yeah."
41:44,320;41:47,080;"But I think it was ass ass and Mick."
41:47,080;41:47,880;"Yeah."
41:47,880;41:50,640;"So there should have been which is big about it."
41:50,640;41:53,840;"When she was like watching all the sports, like Holly and the Boston"
41:53,840;41:54,800;"teams are sick."
41:54,800;41:56,520;"The Bruins bad ass."
41:56,520;41:58,880;"The Celtics are winning like championships every year."
41:58,880;42:01,880;"That's also really good then, too."
42:01,880;42:04,240;"And the Patriots crash."
42:04,240;42:06,000;"Yeah, but that was always her thing is"
42:06,000;42:11,840;"even in England, she would always pick the shittiest soccer team to root for because she's just"
42:11,840;42:16,320;"loved the underdog. So coming here, like the Patriots fit perfectly because this was like the"
42:16,320;42:21,360;"Rod Rusted era when they're going 1 in 15 and coaches were getting electrocuted at the podium."
42:21,360;42:25,200;"So to shoot sounds like Greg moving to Raleigh and being an NC State fan."
42:25,200;42:31,760;"And same I do. Why she used to go to your soccer games in high school, Andy?"
42:31,760;42:35,920;"That's true. Yeah. We don't have any of those. She never came in last"
42:35,920;42:46,560;"games you didn't play. 14 in the country baby undefeated right my my soccer team I don't think so."
42:46,560;42:49,920;"I was on a soccer team and I don't think I played much either."
42:49,920;42:58,920;"Right. No. No. No you didn't last a long. We did play one year of football though that didn't last long either."
42:58,920;43:03,920;"Now my my parents pulled me out for four grades."
43:03,920;43:05,020;"Oh, that's right."
43:05,020;43:06,220;"Yeah, for academic reasons."
43:06,220;43:07,520;"Yeah, that's a shame."
43:07,520;43:12,220;"I think we'll you credit the end, Mike."
43:12,220;43:13,420;"I know, man."
43:13,420;43:15,320;"I remember some scrimmage."
43:15,320;43:16,720;"I almost got a sack."
43:16,720;43:17,920;"So that was pretty cool."
43:17,920;43:20,320;"I don't know what I was doing playing linebacker, but hey."
43:20,320;43:26,120;"I remember being scout team wide receiver and getting lit the fuck up."
43:26,120;43:27,820;"Brian Cox style."
43:27,820;43:34,680;"That those guys I mean football is fun to play and all but when you're like I feel like we're undersized"
43:34,680;43:41,520;"So I kind of empathize with like these David patents of the world and they really love to like light you up. I think oh"
43:41,520;43:43,800;"yeah, I"
43:43,800;43:48,840;"Remember I was I mean my helmet was too tight my my pants didn't quite fit"
43:48,840;43:55,660;"It was a disaster, but I think that was the most pain overall over the course of several months"
43:55,660;43:58,220;"I've ever been in. So props to these guys."
43:58,220;44:00,260;"Yeah, I would agree. I don't know how they do it."
44:00,260;44:03,860;"Me neither. Yeah. Now I would dominate."
44:03,860;44:06,980;"Oh, absolutely. Yeah. Now I don't feel pain."
44:06,980;44:09,540;"Right. I'm dead inside. It's beautiful."
44:09,540;44:11,980;"I put on some weight. So I'm ready to go."
44:11,980;44:18,220;"This is true. I've also put on weight, but not in a good way."
44:18,220;44:21,060;"So speaking of football, right?"
44:21,060;44:24,060;"I like how you track for like two minutes."
44:24,060;44:25,060;"It has good work."
44:25,340;44:26,340;"Yeah, we'll kill it."
44:26,340;44:29,780;"Let's see."
44:29,780;44:31,140;"We're talking about Antoine Smith."
44:31,140;44:36,940;"He was kind of the driver in the offense."
44:36,940;44:39,940;"And we talked about Brian Cox, who was the driver of the defense."
44:39,940;44:46,780;"And he was actually, he was the lead blocker on the last Patriots rushing touchdown as well,"
44:46,780;44:48,540;"which is pretty cool."
44:48,540;44:53,460;"So he was, I think he probably got the bell check game ball in this game."
44:53,820;44:54,940;"That was a physical win."
44:54,940;44:55,620;"Right."
44:55,620;45:00,300;"It was a it was it was like one of those, like how you remember the pages beating the Colts."
45:00,300;45:01,500;"Yeah."
45:01,500;45:08,940;"I mean, you look at the score and there was like a lot of points, but that team, the offense and the defense were just knocking people around."
45:08,940;45:09,660;"Yeah."
45:09,660;45:10,620;"Kind of miss it."
45:10,620;45:11,980;"Oh, yeah."
45:11,980;45:13,860;"I mean, but obviously these guys."
45:13,860;45:19,140;"Yeah, but they, I don't think they lasted as long either or maybe they did."
45:19,140;45:20,420;"And now they're all just a little."
45:20,420;45:21,540;"Yeah."
45:21,980;45:27,260;"It was longer than I fella, but meal brains not in life. Yeah, exactly. Yeah, like you Milo. Oh"
45:27,260;45:33,580;"Man, I I suffered a beating. I'm telling you my home. It was two sizes too small"
45:33,580;45:38,940;"I had like black and blue ears just by putting the helmet on my was too big. Okay, you sound like"
45:38,940;45:42,140;"Brown"
45:42,140;45:48,780;"Hey, Andy was there through it. Okay. They didn't have anything else. All right. I was like I was like third string like full back"
45:49,180;45:50,940;"Okay. Yeah. Yeah. Me too."
45:50,940;45:52,340;"They didn't care about me."
45:52,340;45:55,060;"And I was I was six to 150 pounds."
45:55,060;45:56,620;"I had me at running back."
45:56,620;45:58,660;"Get mad at it."
45:58,660;45:59,180;"What the hell?"
45:59,180;46:00,820;"I have the full."
46:00,820;46:01,740;"We got the drags."
46:01,740;46:03,780;"We got the drags of the equipment."
46:03,780;46:06,260;"Yeah, man. I just remember."
46:06,260;46:07,620;"I might have not even been 100 pounds."
46:07,620;46:08,820;"And I'm full back."
46:08,820;46:10,260;"Kind of coach was running this thing."
46:10,260;46:13,500;"You coach."
46:13,500;46:16,060;"Oh, it was did."
46:16,060;46:17,020;"Well, he was varsity."
46:17,020;46:18,100;"We were in on varsity."
46:18,100;46:18,660;"We were."
46:18,660;46:22,660;"Yeah, it was just the freshman team. That's right. He was in the vicinity."
46:22,660;46:27,220;"Was that who it was? Oh, I know. I think."
46:27,220;46:34,660;"And then there was some marine guy that was there. Oh, yeah. Whatever."
46:34,660;46:39,220;"Like I figured the kids in. I don't know. You're something like that. Yeah."
46:39,220;46:41,140;"I don't know. Do you ask me what role he's?"
46:41,140;46:45,700;"I don't think we did because I made friends with all the seniors. So."
46:46,580;46:52,820;"Oh, yeah, I'm not a watch out managed to bypass all that but we may have seen some hazing back in the day. Yeah"
46:52,820;46:58,900;"Yeah, a lot of what a lot of lot of lot of lot of petals. Yes. Yeah"
46:58,900;47:01,460;"Yeah"
47:01,460;47:08,020;"Everywhere to go to the restroom. You go to the restroom people taking crafts with like the stalls, you know wide open"
47:08,020;47:13,300;"Um, I think we were afraid to take showers. I pretty much washed up in the lake nearby"
47:14,100;47:20,660;"When we went to camp I mean yeah, oh I didn't share that whole that whole camp. I just fuck it. There's no shower"
47:20,660;47:31,460;"You don't want to be a freshman in those showers"
47:31,460;47:35,940;"Dude, I've been a freshman in showers. It's not that bro"
47:35,940;47:39,860;"These are different there are different animal. I don't know if they exist now it is"
47:40,740;47:43,580;"You just strut in there, dick hang, and you'll be fine."
47:43,580;47:45,180;"My dick was not hanging."
47:45,180;47:48,980;"It was not the way I was talking."
47:48,980;47:55,140;"Like I said, I had to put makeup on my ears so they wouldn't laugh at like my"
47:55,140;47:56,220;"bruised ears from."
47:56,220;48:01,860;"At different time."
48:01,860;48:02,620;"Yeah."
48:02,620;48:06,580;"And seeing dick is one thing, but like having a touch in you is something else."
48:06,580;48:07,460;"Whoa."
48:07,460;48:09,140;"Like was naked and self-look feminine."
48:09,180;48:10,940;"Just just right on your shoulders."
48:10,940;48:12,300;"What what happened?"
48:12,300;48:13,020;"Andy?"
48:13,020;48:14,140;"Well, what was it else?"
48:14,140;48:15,220;"But didn't."
48:15,220;48:15,780;"Oh, yeah."
48:15,780;48:16,220;"Yeah."
48:16,220;48:16,780;"No, yeah."
48:16,780;48:20,500;"There's I don't know if we should be talking about this, but no, this is this."
48:20,500;48:20,780;"You know what?"
48:20,780;48:21,860;"This should come to light."
48:21,860;48:23,660;"No, you cannot cut this."
48:23,660;48:28,860;"This is to be stated that some crazy shit was going down and we were we were"
48:28,860;48:30,740;"silenced and we let it happen."
48:30,740;48:31,140;"OK."
48:31,140;48:33,180;"So do you do you want to describe the helicopter?"
48:33,180;48:33,740;"Should I?"
48:33,740;48:35,980;"You can go for it, but I can vote for it."
48:35,980;48:37,420;"You're you're not talking about it."
48:37,420;48:37,820;"Sorry."
48:37,820;48:38,380;"Yeah."
48:38,540;48:40,140;"No, I don't think it is."
48:40,140;48:42,540;"We won't say his name, but there's a gentleman."
48:42,540;48:43,940;"I don't remember saying what I blocked it."
48:43,940;48:45,100;"All right, well, there you go."
48:45,100;48:47,620;"There's a gentleman who can do things with his balls"
48:47,620;48:51,380;"that I've never seen since then or heard of."
48:51,380;48:52,140;"Yeah."
48:52,140;48:56,020;"Yeah, he was able to twist them around the shaft multiple times."
48:56,020;48:58,100;"And they get spin like a helicopter."
48:58,100;48:58,740;"Yeah."
48:58,740;49:01,740;"And then he would release it and it would kind of rotate"
49:01,740;49:04,100;"as if it were trying to take off from his body."
49:04,100;49:07,740;"It was oddly hypnotic, I have to say."
49:07,740;49:11,180;"He would also sort of place his car."
49:11,180;49:14,540;"Well, yeah, that too, but we won't talk about that."
49:14,540;49:19,020;"He would take out his member and gently place it"
49:19,020;49:21,600;"in front of sleeping guys' faces"
49:21,600;49:23,460;"and then gently wake them up"
49:23,460;49:25,940;"so they woke up with wiener in their face."
49:25,940;49:28,100;"I believe this is called sexual harassment, guys."
49:28,100;49:28,940;"- I think so."
49:28,940;49:30,600;"- That's just boys being boys."
49:30,600;49:32,700;"(laughing)"
49:32,700;49:34,540;"But somehow, Andy and I--"
49:34,540;49:37,460;"- Love how on top of we've been this whole time."
49:37,460;49:39,540;"Yeah, football."
49:39,540;49:41,060;"This is a little say."
49:41,060;49:42,060;"Somehow."
49:42,060;49:45,340;"And I avoided to avoid it."
49:45,340;49:45,860;"Most of that."
49:45,860;49:47,780;"I don't know how, but I don't need it."
49:47,780;49:51,420;"Well, I avoided because I was friends with you and you somehow were like"
49:51,420;49:53,780;"that infiltrated right."
49:53,780;49:58,420;"The pet of all the senior offensive lineman."
49:58,420;50:01,460;"Yeah, it's a way they like they protected me."
50:01,460;50:05,260;"And then they kind of let me like, I remember one time being woken up and"
50:05,260;50:08,620;"everybody was wearing just underwear and their helmets."
50:08,620;50:12,220;"And they're like, Hey, Milo, it's a let's go bang on everybody's cabin door."
50:12,220;50:13,220;"And I thought this was insane."
50:13,220;50:14,020;"Now it's sleeping."
50:14,020;50:17,980;"So most people were forced to do it, but I was like, Nah, you"
50:17,980;50:20,220;"bind if I said this one out and they were cool with it."
50:20,220;50:21,220;"So I have no idea."
50:21,220;50:23,220;"I did not partake for the record."
50:23,220;50:26,940;"I was now part of the sexual harassment of Andy Brown or anybody else."
50:26,940;50:27,540;"Nope."
50:27,540;50:29,540;"This is true."
50:29,540;50:30,380;"I'll vouch for that."
50:30,380;50:32,420;"But this is where he got his nickname from."
50:32,420;50:33,940;"This is where Milo came from."
50:33,940;50:34,860;"That's true."
50:34,860;50:46,860;"So I can keep all kale because I was selected to do the Matthew Slater where I would have to do like the speech, you know, because they thought it was funny like this hundred five pound kid."
50:46,860;50:50,860;"It would have them like do the raw rod thing. So as I was doing it."
50:50,860;51:02,860;"Some guy, the team captain got my name wrong and he thought it was hilarious. So nobody knew who I was before. And then I became known as a guy for my mispronouncing name."
51:02,860;51:04,300;"So it was fantastic."
51:04,300;51:06,140;"He was Milo from then on."
51:06,140;51:09,580;"They, they, you know, I was friends with those guys."
51:09,580;51:11,500;"They, they were great."
51:11,500;51:12,860;"I bet you were."
51:12,860;51:13,540;"Yeah."
51:13,540;51:15,020;"All right."
51:15,020;51:16,540;"Anyway, it's moving on."
51:16,540;51:20,740;"Speaking of decks, how about the cold kicker, Mike Van der"
51:20,740;51:21,100;"jerk?"
51:21,100;51:23,140;"That guy's a dick."
51:23,140;51:25,580;"He's pretty good though."
51:25,580;51:27,540;"Um, what do you sober?"
51:27,540;51:27,820;"Yeah."
51:27,820;51:31,020;"Well, even when he was at, can you imagine kicking a little"
51:31,020;51:32,340;"smashed?"
51:32,660;51:35,160;"Uh, yeah, that would be tougher."
51:35,160;51:37,760;"Not exactly performance enhancing is that although it probably"
51:37,760;51:39,320;"common the nurse depending on how many you had."
51:39,320;51:40,420;"Oh, true."
51:40,420;51:40,960;"True."
51:40,960;51:41,220;"So."
51:41,220;51:44,120;"I mean, it's like golf, right?"
51:44,120;51:45,140;"A little swing oil."
51:45,140;51:46,460;"Yeah, exactly."
51:46,460;51:48,040;"Just a little liquid courage."
51:48,040;51:49,060;"Yeah."
51:49,060;51:51,720;"They want those nerves, Janglin."
51:51,720;51:58,020;"Uh, speaking of kickers though, I don't know why, but again, third week in a row, I've"
51:58,020;52:01,180;"have a Lee Johnson's name down with a big star next to it."
52:01,180;52:05,100;"So I thought the punting in this game wasn't that great."
52:05,100;52:06,100;"All right."
52:06,100;52:08,100;"The kicking in the end zone by like 10 yards."
52:08,100;52:13,140;"Yeah, the Colts puncher is kicking it literally out of the back of the end zone on a punt."
52:13,140;52:17,340;"Like I know it was windy, but like, come on, dude, you play for the Colts."
52:17,340;52:21,700;"They don't punt from their own side of the field ever."
52:21,700;52:23,940;"Like you should learn how to drop it inside the 20."
52:23,940;52:25,940;"I would think I'm winning."
52:25,940;52:29,380;"I don't want to spoil my best off the game, but I'm gonna alright"
52:29,380;52:35,020;"Right, okay, I'll first Mike Bribble appearance"
52:35,020;52:37,780;"Yeah, oh, that's right now"
52:37,780;52:44,300;"That was good some might say that's the first connection of braiding and fribble"
52:44,300;52:51,220;"Which the rumors have stated that if he leaves New England you could join Vribble in Tennessee"
52:51,220;52:53,940;"Well, all right 20 years later, baby"
52:53,940;52:56,820;"I don't I heard you like country music too."
52:56,820;52:59,900;"Five or eight or Brady."
52:59,900;53:00,660;"Oh Brady."
53:00,660;53:01,740;"What?"
53:01,740;53:02,740;"Yeah."
53:02,740;53:03,700;"You like you like."
53:03,700;53:05,140;"Yeah."
53:05,140;53:08,700;"Tennessee going to Nashville."
53:08,700;53:09,780;"I mean, it makes sense."
53:09,780;53:13,780;"I don't feel I don't feel that you should you should write that up, Greg,"
53:13,780;53:16,980;"and get that out there because if you don't chef or will"
53:16,980;53:20,260;"just email Felger."
53:22,420;53:23,940;"Oh, I feel like there's all the fuck over it."
53:23,940;53:25,780;"I really, I promise you that."
53:25,780;53:31,140;"So Greg, I'm a little disappointed in you that you haven't actually brought up"
53:31,140;53:31,780;"Tyler yet."
53:31,780;53:34,060;"Oh man, he's an absolute stud."
53:34,060;53:36,860;"That's better."
53:36,860;53:39,340;"He shot Marvin Harrison."
53:39,340;53:40,660;"They were like, talk, they gave his numbers."
53:40,660;53:44,060;"Like all those times he played the path before like six touchdowns and five"
53:44,060;53:44,860;"games or something."
53:44,860;53:48,020;"Ty lost steps in and just bully balls."
53:48,020;53:50,980;"You know, just shoving around the field doing"
53:50,980;53:55,620;"whatever he wanted with him. He really was. He's the best athlete in the second"
53:55,620;54:01,780;"during the path to every scene. You think so? Yeah. From like size, speed,"
54:01,780;54:07,860;"ball skills. He wasn't surprisingly. He was a good guy. Yeah. Some might say"
54:07,860;54:15,100;"he's in the hall of fame. That's true. Some could say that. Yeah. Even Otis was"
54:15,100;54:20,260;"pretty good. Yeah. Oh, TIS, baby. Although who on get his"
54:20,260;54:25,420;"Otis was end of the second quarter, the culture driving for a"
54:25,420;54:31,340;"score. And then, uh, painting through a pick to Otis Smith."
54:31,340;54:36,780;"Well, seven, eight hours. Oh my God. That could return. That's"
54:36,780;54:42,820;"moments. But who threw the, uh, the block to get Otis Smith"
54:42,820;54:44,940;"actually around the corner and into the end zone."
54:44,940;54:46,740;"Die law."
54:46,740;54:47,500;"That's right."
54:47,500;54:49,100;"The lead blocker."
54:49,100;54:50,580;"That's right."
54:50,580;54:54,420;"And then Peyton Manning getting thrown out of the club by Anthony"
54:54,420;54:56,860;"Pleasant or some defensive lineman."
54:56,860;54:59,260;"On the replay."
54:59,260;55:00,700;"They try to put the meaning."
55:00,700;55:04,180;"So we haven't even talked about that."
55:04,180;55:06,860;"Hey, dude, it's so good to see it again."
55:06,860;55:07,940;"Oh, man, I wrote that."
55:07,940;55:08,340;"Yeah."
55:08,340;55:10,900;"At least eight different times in that game."
55:11,540;55:13,200;"So many times it's so"
55:13,200;55:17,860;"where you're like, you'll throw someone like a tough pass and they won't catch it."
55:17,860;55:21,500;"And then you'll, you'll just look at him with this like mopey look on his."
55:21,500;55:23,460;"It's so perfect."
55:23,460;55:25,860;"And just kind of throws hands up."
55:25,860;55:27,900;"What are you doing?"
55:27,900;55:28,660;"Yeah."
55:28,660;55:30,500;"It's like, dude, he's a bad throw."
55:30,500;55:34,020;"It was beautiful."
55:34,020;55:38,340;"Although I have to say, I forgot how obnoxious Manning was pre snap."
55:39,100;55:49,000;"And it gave me flashbacks to playing Madden back in the day, where they had like programmed that in that he would just make audibles until the clock ran out and then he would hike the ball."
55:49,000;55:52,180;"And you're sitting there waiting like, I just just hiked the ball."
55:52,180;55:53,100;"We know what's happening here."
55:53,100;55:54,540;"I have this game on easy."
55:54,540;55:57,860;"I'm going to sack you on this play because that's why I have it on easy."
55:57,860;56:00,660;"So just fucking get over it and like call a play."
56:00,660;56:02,620;"Yeah, he was the worst."
56:02,620;56:07,980;"He, uh, it was fun to watch, but it's hard to like the guy."
56:08,980;56:13,240;"I started liking him as soon as he started making commercials."
56:13,240;56:15,100;"So he started chatting like a man."
56:15,100;56:16,600;"Yeah."
56:16,600;56:19,240;"He's got like a little YouTube series."
56:19,240;56:20,380;"So have any of you watched it?"
56:20,380;56:22,280;"No."
56:22,280;56:23,980;"Oh, is that in the clips?"
56:23,980;56:27,660;"Where you like breaks down stuff or something?"
56:27,660;56:34,240;"Yeah, because he did one on Brady's overtime drive against the chiefs and the playoffs last year."
56:34,240;56:36,160;"And it's actually really good because obviously."
56:36,160;56:37,540;"Oh, you're talking about that thing."
56:37,540;56:38,260;"Yeah."
56:38,340;56:39,820;"Because he's got a show now too."
56:39,820;56:40,580;"Really?"
56:40,580;56:43,980;"I thought that was a comedy show thing."
56:43,980;56:44,700;"Oh, really?"
56:44,700;56:47,300;"Yeah, where he goes around like interviewing"
56:47,300;56:49,460;"like famous players like Franco Harrison,"
56:49,460;56:50,460;"shit."
56:50,460;56:52,540;"Are you sure that's not a state farm commercial?"
56:52,540;56:55,180;"Well, it's fun to be."
56:55,180;56:56,300;"It could be sponsored by state."
56:56,300;56:58,300;"I can only start doing commercials."
56:58,300;57:00,140;"So like what his third year in the league."
57:00,140;57:01,100;"Right."
57:01,100;57:02,620;"I went over and did cut that meat."
57:02,620;57:04,620;"Oh, I know."
57:04,620;57:07,540;"Um, I know one of the guys in that commercial."
57:07,620;57:10,060;"He got to share some screen time with"
57:10,060;57:12,260;"pigman. I think he was the guy that was"
57:12,260;57:14,220;"asking him to sign the loaf of bread."
57:14,220;57:19,220;"You get screen credit for that?"
57:19,220;57:22,340;"I don't think so, but he probably got a good chunk of change."
57:22,340;57:24,900;"All right. All right. What's it? What's he doing now? He's"
57:24,900;57:26,780;"a lot of that was obviously like a stepping stone to start him,"
57:26,780;57:30,940;"right? He is doing some fun. His name is Jesse Gavin."
57:30,940;57:35,060;"He's doing some great videos online. He's also a successful"
57:35,060;57:37,100;"commercial actor. So shout out to Jesse Gavin."
57:37,460;57:42,220;"I actually recognize that name probably from you. I would imagine I was the guy that you banged Mike"
57:42,220;57:44,300;"Yeah, would you think that I"
57:44,300;57:49,260;"Would you have sex with a mic?"
57:49,260;57:50,820;"what I"
57:50,820;57:58,140;"Or this is not the same guy that like hook up of Tom Brady and Aaron Rodgers. He's two separate people"
57:58,140;58:01,020;"Yeah, yeah, sure there. Yeah, understand"
58:01,500;58:09,560;"Well, yeah, I still like no he's been this second this day at age guys. I mean come on really come on you better than that"
58:09,560;58:17,800;"I think my girlfriend has got home, so she's not gonna like any of this so hush hush"
58:17,800;58:23,780;"Would you bang her?"
58:26,780;58:27,620;"You know, I don't want to."
58:27,620;58:28,460;"- Which beg me, mommy."
58:28,460;58:31,340;"- I don't want to hear dirty laundry,"
58:31,340;58:34,180;"but you Greg, you kind of look like Tom Brady."
58:34,180;58:35,700;"I'm not gonna lie, so."
58:35,700;58:37,620;"- My mom says it all the time."
58:37,620;58:38,460;"- Yeah."
58:38,460;58:41,300;"- So, she says it's all of us, Greg."
58:41,300;58:42,140;"- No."
58:42,140;58:43,780;"- She doesn't say it to me."
58:43,780;58:45,820;"(laughs)"
58:45,820;58:47,220;"Sorry, Steve."
58:47,220;58:48,820;"- Last thing I'll say on paid manning though,"
58:48,820;58:53,820;"is I did love how he sort of managed to bypass"
58:54,700;58:59,280;"whole HGA thing. And we never hear about it again. So kudos to him for"
58:59,280;59:03,960;"shucking the system. Yeah. Why you think he did it?"
59:03,960;59:08,560;"All right. His wife seems like she could be on HGA. I mean, I don't know. It seems"
59:08,560;59:13,040;"like a plausible story to me, right? No, no, I have a strong opinion on this."
59:13,040;59:17,960;"Okay. We can't call witch hunt for breeding the flake gate and then turn"
59:17,960;59:21,040;"around and witch hunt Manning. Okay."
59:21,240;59:23,080;"Alberism at its finest."
59:23,080;59:23,820;"All right."
59:23,820;59:24,720;"Consistent."
59:24,720;59:27,540;"Do you realize what podcast this is?"
59:27,540;59:28,280;"Yeah."
59:28,280;59:30,360;"That's what I'm trying to add."
59:30,360;59:32,200;"Some bounce."
59:32,200;59:34,080;"Oh, we'll get to the flake game, man."
59:34,080;59:35,640;"I mean, Brady is guilty."
59:35,640;59:36,240;"Oh, yeah."
59:36,240;59:37,840;"Don't get started on that shit."
59:37,840;59:39,440;"Oh, God."
59:39,440;59:41,560;"It destroyed his phone, Mike."
59:41,560;59:43,200;"Yeah."
59:43,200;59:43,720;"You don't do that."
59:43,720;59:48,880;"Evidence number one out of 352 and we'll go over every one of them."
59:50,480;59:51,320;"We could do that."
59:51,320;59:57,040;"This time, I'm pretty sure the people on this on this podcast could do that."
59:57,040;59:58,840;"I don't know."
59:58,840;01:00:03,680;"I, whatever that report was, it's been vector, the specter."
01:00:03,680;01:00:04,240;"Vector."
01:00:04,240;01:00:04,680;"Yes."
01:00:04,680;01:00:04,880;"Yeah."
