Start Timestamp;End Timestamp;Transcript
19:57,660;19:59,260;"And Charlotte's you know, it's too much on the border"
19:59,260;20:04,100;"But it was very conscious to try to grow a large fan base knowing that an uphill battle decline"
20:04,100;20:07,620;"with college basketball with the red skins with baseball"
20:08,560;20:13,480;"And honestly, it's really since 2002 and up that they've actually been able to successfully"
20:13,480;20:17,080;"like they basically put that argument to rest that they weren't going to be able to thrive"
20:17,080;20:18,640;"as a small market franchise."
20:18,640;20:20,360;"Yeah, I would agree with that."
20:20,360;20:24,160;"So is Charlotte Pantherstown?"
20:24,160;20:33,600;"Just because Raleigh Durham, not really in my experience, so I live in Durham and that"
20:33,600;20:36,640;"is definitely like college basketball."
20:36,640;20:41,800;"Yeah, like I'm a C Duke and C state are definitely the highest priority"
20:41,800;20:48,660;"Is that a percent football fans that are local or probably they're like yeah, I'm a Panthers fan, but it's not like"
20:48,660;20:55,080;"You get Patriots fans back home. We're like ride or die, you know, I"
20:55,080;21:01,760;"Think that's totally true and I think that that part of the state will always put college sports first and foremost"
21:01,760;21:07,480;"I think Charlotte and Western or Carolina are different and honestly the thing that gets forgotten to what I just said is like"
21:07,480;21:13,440;"A huge part of their fan base is South Carolina, which has always been more football territory anyway"
21:13,440;21:17,520;"Yeah, and like they do draw a huge base of their support there"
21:17,520;21:24,240;"Particularly like the black portion of the fan base is really really heavily draws on like"
21:24,240;21:29,760;"population of South Carolina, which part of the reason why cam has been such a big deal. Yeah"
21:29,760;21:30,600;"- Yeah."
21:30,600;21:36,140;"- So are you glad Cam's gone?"
21:36,140;21:38,680;"- No, I'm super sad."
21:38,680;21:39,520;"- Good."
21:39,520;21:40,520;"- Hey, we get it."
21:40,520;21:43,440;"- No, it's a very sad moment for the franchise"
21:43,440;21:44,600;"and for everybody."
21:44,600;21:45,600;"- Yeah, good."
21:45,600;21:48,080;"- What do you think about Bridgewater?"
21:48,080;21:50,640;"- I mean, it's a savvy signing,"
21:50,640;21:52,320;"like, you know, if you look at the market"
21:52,320;21:53,680;"or the leagues at right now, sure."
21:53,680;21:55,520;"It's like a decent contract."
21:55,520;21:58,080;"It's like, it makes sense."
21:58,080;22:02,120;"And like, you know, you got to view this through the prism of newish owner who wants"
22:02,120;22:04,640;"to make his mark and new coach, sure fine."
22:04,640;22:09,320;"But at the same time, from a standpoint of what we've accomplished, like, it's tough."
22:09,320;22:12,960;"And it's really sad to see things in this way."
22:12,960;22:16,200;"And you know, the injury has really derailed the last two years."
22:16,200;22:20,160;"And like, I still look back on that stupid ass preseason game last season when they played"
22:20,160;22:21,960;"Cam and didn't need to any hurt his butt."
22:21,960;22:23,600;"Yeah, against the past."
22:23,600;22:24,600;"Against the finishes."
22:24,600;22:29,420;"can't help but wonder how things play out differently with everybody with Ron, with"
22:29,420;22:33,820;"Cam the season. It's hard to stomach that. And I've been a little on the outside of it"
22:33,820;22:38,460;"the last year and a half, but it's just, it's just tough thinking about it should have played"
22:38,460;22:43,860;"out differently. And Cam, I mean, I would posit Cam's the most important player in franchise"
22:43,860;22:48,500;"history in many ways. And he doesn't get, I think in retrospect, it'll be interesting"
22:48,500;22:53,940;"to see how his narrative plays out because it's tough because he's been under constant"
22:53,940;22:57,860;"fire the whole time that he's been our quarterback and a lot of it has been"
22:57,860;23:04,660;"undeserved in my opinion. Yeah, I agree. I don't know if he doesn't like do"
23:04,660;23:08,980;"himself that many favors with his. I do put his foot in his mouth five times"
23:08,980;23:14,260;"a season. And he hit the way like his have you seen his like cryptic"
23:14,260;23:20,180;"uh fine. Oh yeah. Oh, it's so stupid. Like I'll say if I could talk to Cam,"
23:20,180;23:22,900;"I would be like, hey man, look, I love you. And let me tell you all the reasons"
23:22,900;23:25,620;"I'm a huge fan also. Let me tell you three stupid ass things"
23:25,620;23:28,620;"Man, can you put that shit out?"
23:28,620;23:38,540;"Well the fucking Instagram font or whatever it is, you know, I'll do the social media thing, but I knew what the font is and it's"
23:38,540;23:42,500;"I don't know man"
23:42,500;23:46,680;"You know the fashion things interesting. I think it's more the like"
23:46,680;23:52,660;"He didn't do himself favors early on with like the pouting and it's like hey"
23:52,660;23:56,700;"man, it's actually good for you to be fucking pissed, but you're not taking notes on how"
23:56,700;24:02,580;"that's accepted. Like Brady can be pissed, but like you can't, you can't, it just came"
24:02,580;24:06,820;"across as pouty early in his career. And I think it's from a guy who like was used to"
24:06,820;24:12,580;"just being successful. And like honestly, the thing that the narrative that was wrong"
24:12,580;24:16,140;"was that it impacted the team. Because I really don't think it ever did. I think that the"
24:16,140;24:20,140;"players always had his back and understood where he's coming from and took it the right"
24:20,140;24:25,820;"way of I do really fucking wants to win. But from a broader narrative standpoint, he just"
24:25,820;24:32,000;"like that shit really sank him. But then I mean, we could spend a whole nother podcast"
24:32,000;24:37,100;"going into the way which all of this shit was unfairly judged through a lens of race"
24:37,100;24:42,740;"and like the way his like charisma and sort of defiance and like fashion. Like, honestly,"
24:42,740;24:45,660;"all of that stuff is like he's really unfairly criticized for."
24:45,660;24:49,660;"Sounds like you just saw your own podcast Bob."
24:49,660;24:50,660;"Yeah maybe."
24:50,660;24:51,660;"Maybe one day."
24:51,660;24:54,660;"Probably the time on your hands."
24:54,660;24:59,660;"Alright so my last question we may have already touched on this."
24:59,660;25:03,660;"What is your favorite Patriots Panthers game?"
25:03,660;25:07,660;"Favorite Patriots Panthers game."
25:07,660;25:10,660;"Yeah we kind of talked through them a little bit."
25:10,660;25:16,660;"I mean the honorable mention that 2013 game I remember well"
25:16,660;25:19,900;"Ellie and I were living with Williamsburg I was watching on my TV and I remember"
25:19,900;25:23,980;"you know you have those memories watching a football or any sports where like the"
25:23,980;25:28,620;"game happens and like you win or whatever happens and like you just have"
25:28,620;25:33,020;"that fucking high like I remember it was like it was like I think it was Sunday"
25:33,020;25:36,580;"night football and it was like mad fucking late it was like 11 I had to be"
25:36,580;25:39,700;"up ridiculously or for school in exterior I drank like fucking eight"
25:39,700;25:44,420;"or something. I was like, this is stupid. I'm gonna feel like shit tomorrow. But I had to just,"
25:44,420;25:48,660;"I just had to go out. I went and fucking took a walk around the neighborhood and put my headphones"
25:48,660;25:54,100;"and so I was just so gacked up. And I just remember that. But that, I mean, I still can't put that"
25:54,100;26:00,820;"in first place because like that's Super Bowl. The 2003 just mitts so much. Like it really just"
26:00,820;26:06,260;"sparked, for me personally, it sparked like a turbocharged phase of like, I mean, I would say"
26:06,260;26:10,820;"Panthers and football, but honestly sports fandom in general like I don't without that"
26:10,820;26:15,480;"I don't know if I become a read ESPN every several times every day comes sports fan. I really don't"
26:15,480;26:22,200;"Yeah, I would agree with you that probably what happened to me too in 2001 with the Patriots"
26:22,200;26:29,420;"Superloh there right yeah, absolutely. Yeah, I've always thought that of like would I be a huge?"
26:29,420;26:33,300;"Football slash Patriots fan if it wasn't for the Pats"
26:34,220;26:38,220;"Because it was Red Sox City before all this happened, you know."
26:38,220;26:43,820;"Oh, yeah. The Patriots were always that laughing stock of, you know, they'll eventually fuck this up somehow"
26:43,820;26:46,220;"as you some matter of how they're going to do it. Yeah."
26:46,220;26:51,220;"Which I think is probably pretty common in a lot of a lot of towns with a lot of sports, you know, a lot of teams."
26:51,220;26:54,220;"I was like Bob with the Bruins when I was a little kid."
26:54,220;26:59,220;"I have my first Bruins game ticket for 97 when the fleet center opened."
26:59,220;27:00,220;"Oh, yeah."
27:00,220;27:01,220;"Oh yeah."
27:01,220;27:02,220;"Sweet center."
27:02,220;27:03,220;"Right?"
27:03,220;27:05,220;"Jesus, that's a throwback."
27:05,220;27:09,220;"Do you boys have any other questions for Bob?"
27:09,220;27:10,220;"Oh yeah."
27:10,220;27:12,220;"All right, let's hear it."
27:12,220;27:18,420;"Who's your favorite Panthers player both all time and now?"
27:18,420;27:20,220;"All time is Steve Smith."
27:20,220;27:21,940;"Of course."
27:21,940;27:27,820;"I like he really represented that second era of Panthers football in so many ways."
27:27,820;27:30,940;"It was like the underdog status, the chip in his shoulder."
27:30,940;27:32,420;"It was the fact that like the Panthers"
27:32,420;27:33,700;"don't have a lot of swagger,"
27:33,700;27:36,020;"but Steve Smith had a fucking mountain of swagger"
27:36,020;27:37,540;"and wasn't afraid to tell you."
27:37,540;27:39,860;"There's just so many moments."
27:39,860;27:43,100;"Like I always remember the moment"
27:43,100;27:45,700;"when he like destroyed Fred Smoot on the Vikings"
27:45,700;27:48,740;"and ruined his career and told him to ice up after the game."
27:48,740;27:50,140;"- I forgot about that."
27:50,140;27:52,620;"- Well, in the playoff run,"
27:52,620;27:54,060;"they went to the Super Bowl to play"
27:54,060;27:57,180;"that I'll always remember is we played the Rams"
27:57,180;28:00,460;"in the divisional round and it went to double over time."
28:00,460;28:01,660;"And that was like low key."
28:01,660;28:02,500;"It was interesting."
28:02,500;28:04,140;"It was past the like,"
28:04,140;28:05,460;"ratio and turf Rams,"
28:05,460;28:07,180;"but it was still like kind of the remnants of that"
28:07,180;28:08,380;"with Mark Bulger."
28:08,380;28:09,700;"And there were 12 before that year"
28:09,700;28:12,420;"and like on paper a lot better than us."
28:12,420;28:13,540;"And I remember double over time."
28:13,540;28:14,420;"I just remember the,"
28:14,420;28:15,260;"it was like,"
28:15,260;28:17,420;"I think it was the first play of double over time."
28:17,420;28:19,020;"And it was just like,"
28:19,020;28:20,040;"Steve Smith,"
28:20,040;28:23,060;"straight up,"
28:23,060;28:24,300;"slant route up there,"
28:24,300;28:26,540;"the cut through the corner back in the safety,"
28:26,540;28:28,460;"just streaking down the field, catching the ball"
28:28,460;28:29,340;"into the end zone."
28:29,340;28:31,740;"And I was watching the play at some friend's house,"
28:31,740;28:34,820;"and things got heated, right?"
28:34,820;28:37,140;"It was a back and forth game."
28:37,140;28:39,460;"But I'll never forget that play."
28:39,460;28:42,020;"And I remember my friend's mom after that."
28:42,020;28:43,260;"We were over there with a bunch of guys,"
28:43,260;28:45,620;"not all of whom were actual football fans."
28:45,620;28:46,900;"It was like me and my friend Daniel"
28:46,900;28:48,500;"and a bunch of other kids we just hung out with."
28:48,500;28:51,180;"And after the game, everybody gradually moved away"
28:51,180;28:53,100;"from the room that I was watching the game in"
28:53,100;28:55,580;"because of my composure."
28:55,580;28:59,900;"I can't remember a friend's mom saying to me later after that game"
28:59,900;29:03,420;"She's like if the pants are the if the Panthers have lost this game at all"
29:03,420;29:07,000;"I don't think I would have let my sons hang out with you anymore"
29:07,000;29:15,400;"So definitely definitely Steve Smith like he's in my mind the most iconic player in my sister"
29:15,400;29:22,820;"And finally enough his first season was this 2001 season it was it was and made the Pro Bowl as a return man"
29:23,020;29:28,860;"Exactly. Yeah, then 2003 was the Super Bowl season was really has break out of the receiver. Yeah. Yeah, we"
29:28,860;29:31,420;"Yeah, yeah"
29:31,420;29:33,740;"current, I mean"
29:33,740;29:35,740;"if we're counting last season"
29:35,740;29:38,540;"um"
29:38,540;29:46,300;"I mean wow kekley, it's just like i'm not ready to process his retirement so i'll put that there but honestly like also low key like"
29:47,020;29:51,820;"Greg Olson, and he's one of the rare players who's come to the Panthers, who is a transplant,"
29:51,820;29:55,100;"who wasn't drafted by us, has become, I would argue, like in the like,"
29:55,100;30:01,260;"I would go so far as like top 10 pantheon in terms of like important voices for the franchise."
30:01,260;30:02,780;"Wow, who drafted Greg Olson?"
30:02,780;30:05,260;"The Bears."
30:05,260;30:07,420;"Oh, that's right. Yeah, they did. Yeah."
30:07,420;30:09,020;"I've always associated with the Panthers."
30:09,020;30:10,700;"Yeah, you see, exactly."
30:10,700;30:16,540;"And I don't, I can't really think of another guy for the Panthers who's in that level"
30:16,540;30:21,980;"with the franchise who we didn't draft. Like they low key have had a lot of success with like"
30:21,980;30:28,380;"franchise level players they drafted. The franchise not so much which is why I think Olson stands"
30:28,380;30:33,420;"out so much and like it's also an indicator of like how sour things have gotten in the past"
30:33,420;30:39,420;"three to four years with ownership and the management that like he went out pretty vocally being like"
30:39,420;30:45,820;"yeah hook these guys and like when Cam posted his shit about recently about like don't try to"
30:45,820;30:47,420;"I pretend like I asked you for this trade."
30:47,420;30:48,260;"- Oh, that's right."
30:48,260;30:49,900;"- Like, responded to that shit and was like,"
30:49,900;30:51,060;"yeah, that sounds right."
30:51,060;30:54,400;"And like, Olsen has enough capital"
30:54,400;30:57,300;"to publicly fucking call the team out on shit like that."
30:57,300;31:01,340;"But anyway, sad to see both those guys go."
31:01,340;31:03,660;"- So it's kind of almost feels like"
31:03,660;31:05,540;"another parallel with the Patriots this year,"
31:05,540;31:07,140;"and it feels like they're almost kind of"
31:07,140;31:09,340;"cleaning house as well with Brady leaving"
31:09,340;31:14,140;"and everybody else seeming to be getting signed the other way."
31:14,140;31:15,500;"- Yeah, new era, man."
31:15,500;31:19,380;"Yeah. So we feel your love."
31:19,380;31:20,940;"Who's your least favorite panther?"
31:20,940;31:23,860;"Also Steve Smith."
31:23,860;31:26,700;"That's a really interesting question."
31:26,700;31:28,700;"Oh man, there's a lot."
31:28,700;31:32,620;"The fact you have about that."
31:32,620;31:37,780;"No, I'm trying to think about that for a moment of like who pissed me off the most"
31:37,780;31:38,420;"of the year."
31:38,420;31:39,260;"Jimmy Clausen."
31:39,260;31:40,220;"Ooh."
31:40,220;31:44,060;"Boston was just like not to even be considered a, you know what I mean?"
31:44,060;31:46,020;"She's like, this guy, get the fuck out."
31:46,020;31:49,100;"Least favorite panther."
31:49,100;31:51,820;"Man, who was really frustrating over the years?"
31:51,820;31:56,340;"- I mean, Greg Hardy, but that was more like,"
31:56,340;31:58,340;"what an idiot."
31:58,340;32:01,380;"- Yeah, not like frustrating as much as like, fuck that guy."
32:01,380;32:02,740;"- Yeah, no, what a, what a, what a,"
32:02,740;32:04,380;"what a, what a just like not good person."
32:04,380;32:09,780;"I would say Least favorite panther."
32:13,860;32:15,100;"I'm trying to figure out the guys,"
32:15,100;32:17,380;"but they're always the guys who you never trusted, right?"
32:17,380;32:19,260;"Like in the big moment who are always like,"
32:19,260;32:21,980;"you know what, you just, nope, get off the field."
32:21,980;32:26,740;"- Like a record all type of guy."
32:26,740;32:29,460;"- Yeah, I would say every number two receiver"
32:29,460;32:33,060;"in Panthers history, except for Moose and Muhammad."
32:33,060;32:35,500;"- Yeah, that's funny."
32:35,500;32:36,660;"That's a good one."
32:36,660;32:37,500;"It is true."
32:37,500;32:39,940;"And if you look at like that team"
32:39,940;32:43,820;"that Cam Newton took to the Super Bowl, the 15 and one team,"
32:43,820;32:44,820;"What a joke."
32:44,820;32:45,820;"Yeah."
32:45,820;32:47,460;"The receiving core is laughable."
32:47,460;32:49,820;"It's truly so names."
32:49,820;32:57,220;"It was a I mean, Ted again was basically the number one tag in 10 touchdowns that season"
32:57,220;32:59,020;"Devin Funchiss, right?"
32:59,020;33:00,500;"Oh, yeah."
33:00,500;33:03,860;"And then from there, it's dudes like you wouldn't even recognize their name."
33:03,860;33:04,860;"No."
33:04,860;33:05,860;"Holy shit."
33:05,860;33:06,860;"Let's say."
33:06,860;33:07,860;"Yeah."
33:07,860;33:08,860;"All right."
33:08,860;33:10,660;"So top receiving guys."
33:10,660;33:13,660;"Let's do it by yards."
33:13,660;33:15,780;"Greg Olson led the team in receiving the arts."
33:15,780;33:16,420;"Yeah."
33:16,420;33:16,900;"That's it."
33:16,900;33:20,020;"Ted Ginn Jericho, Cottrey."
33:20,020;33:21,940;"Oh, that's right."
33:21,940;33:22,620;"It's one song."
33:22,620;33:23,380;"It's a lot of country."
33:23,380;33:24,460;"I love Cottrey."
33:24,460;33:25,580;"That's an NC State guy."
33:25,580;33:26,420;"Oh, there you go."
33:26,420;33:31,060;"Homegrown boy, Devin Fungis and then Corey Brown."
33:31,060;33:33,260;"Who is that cousin?"
33:33,260;33:34,420;"Bagley from."
33:34,420;33:36,620;"They called him Billy Brown."
33:36,620;33:37,540;"Yeah."
33:37,540;33:39,020;"Bailey Brown."
33:39,020;33:39,620;"Yeah."
33:39,620;33:42,700;"A bunch of dudes that really didn't really didn't have business starting."
33:42,700;33:44,620;"and then you fell much less on the Super Bowl team."
33:44,620;33:45,460;"- Yeah."
33:45,460;33:46,660;"- Yeah, you're not kidding."
33:46,660;33:49,420;"And after that, you're full back Mike Tolbert."
33:49,420;33:52,020;"- Tolbert, love Tolbert."
33:52,020;33:56,420;"- He went to the Pro Bowl that year apparently."
33:56,420;33:59,940;"- Yeah, Tolbert, Tolbert was good people."
33:59,940;34:03,580;"His impact was probably overstated on the field,"
34:03,580;34:05,140;"but he was good people."
34:05,140;34:06,660;"- That's fair."
34:06,660;34:09,420;"So here's just a little tidbit for you."
34:09,420;34:12,300;"Just you can take to your Panthers parties."
34:12,300;34:14,380;"Steve Smith, you know, his actual name."
34:14,380;34:21,020;"Stavon, Stavon Latral Smith."
34:21,020;34:21,860;"- Your state."
34:21,860;34:24,060;"- So there you go."
34:24,060;34:28,620;"You wanna know Ray Carus' real name?"
34:28,620;34:29,460;"(laughing)"
34:29,460;34:30,300;"Yes."
34:30,300;34:31,300;"- Oh."
34:31,300;34:35,860;"- Ray, Ray Lamar Theotis Wiggins."
34:35,860;34:36,700;"- Ray."
34:36,700;34:38,420;"- Wait, what?"
34:38,420;34:40,180;"- That's why it seems like Carus."
34:40,180;34:43,220;"I think it was his stepdad or something like that."
34:43,220;34:45,660;"- I mean, Loki, there's been a lot of contribs like that,"
34:45,660;34:47,980;"but she was gonna start up in the last year or two"
34:47,980;34:49,660;"'cause he got released from jail like he did."
34:49,660;34:50,580;"- He did, yeah."
34:50,580;34:51,900;"- Oh."
34:51,900;34:52,740;"- Did I not?"
34:52,740;34:57,740;"- Yeah, and then basically decided to continue being"
34:57,740;35:00,180;"a really awful person in the public eye."
35:00,180;35:01,420;"Like he started off with, he's like,"
35:01,420;35:03,300;"""You know what, I'm gonna apologize."""
35:03,300;35:05,260;"And then took that apology really south."
35:07,340;35:10,300;"How much do you guys remember to know the story?"
35:10,300;35:13,180;"- I read about it a bit today."
35:13,180;35:18,180;"- The headline is he paid a guy, a friend of his,"
35:18,180;35:23,340;"to do a drive-by shooting at the car of his girlfriend"
35:23,340;35:27,780;"who was pregnant with his eight-month-old unborn child."
35:27,780;35:31,620;"And so she dies."
35:31,620;35:34,900;"They do an emergency C-section to deliver the baby."
35:34,900;35:39,300;"the baby however had like some re-roll palsy and other things because it's been like 70"
35:39,300;35:44,620;"minutes without air oxygen during this whole process. Anyway, the baby is still alive."
35:44,620;35:48,140;"He's a guy. His name's Chancellor. He's alive now. His grandmother or the girl's mom has"
35:48,140;35:52,140;"taken care of him. This motherfucker Ray Cruth gets out of jail and has the gall to be like,"
35:52,140;35:56,060;"""Guys, what a apologize."" And also, I'd like to get custody of my son and everybody's like,"
35:56,060;35:59,460;"""Like Charlotte Lawson. Charlotte Lawson's fucking mine."""
35:59,460;36:01,460;"I can't imagine why."
36:01,460;36:06,740;"It's like hey, man. He's been 90 years in prison. He just quietly fucking disappeared somewhere. He's just Christ"
36:06,740;36:11,320;"That's pretty bad anyway, so that's how I'm going that's a thing"
36:11,320;36:20,140;"Well, all right, there's a new leader in the clubhouse for least favorite panther"
36:20,140;36:29,460;"There's never really an argument if you come down to that. No, it's really tarnish. He truly tarnished the franchise in a way that was like"
36:30,380;36:35,620;"I don't see anybody topping that yeah, he was the first round pick too. He was wow"
36:35,620;36:39,060;"Was any good on the field"
36:39,060;36:42,340;"He was for one season and then he was like injured and shit"
36:42,340;36:45,580;"All right"
36:45,580;36:48,700;"Yeah, I didn't put a much numbers all right fuck him"
36:48,700;36:56,380;"So Bob are they Patriots here number two team now or is it like the North Carolina Panthers and Buffalo?"
36:56,380;36:59,380;"Steve"
36:59,380;37:01,380;"Steve"
37:01,380;37:04,180;"Steve there's no such thing as a number two team"
37:04,180;37:11,060;"That's there are 30 there are 32 teams and you cheer for one and you don't cheer for the other 31. All right. Well, that's my philosophy"
37:11,060;37:16,340;"Let me tweak that a little bit. Um, are you going to root for cam Newton wherever he goes this year?"
37:16,340;37:18,900;"That's we've been having with Brady"
37:18,900;37:25,460;"I'm gonna I'm gonna hope cam does well because I really think he deserves a shot"
37:25,460;37:28,420;"I think if he gets healthy, I think he can be good and"
37:28,420;37:30,420;"and"
37:30,420;37:33,380;"and I won't I won't come to do well I'm not gonna cheer for his team but"
37:33,380;37:37,220;"I hope him does well and I think it's important that he does well"
37:37,220;37:40,020;"what if he goes to the pages then will you cheer for his team"
37:40,020;37:43,140;"and I got your first team now I've already made a clear Steve"
37:43,140;37:47,620;"but I will support him and I hope he does well what about your wife"
37:47,620;37:51,220;"and your two daughters I mean they're all pages fans"
37:51,220;37:57,220;"that's that's fine I don't I don't I don't support them in that"
37:57,220;37:59,080;"She's the support of dad and husband."
37:59,080;37:59,580;"God, Bob."
37:59,580;38:00,080;"Yeah."
38:00,080;38:02,020;"Not going to win."
38:02,020;38:03,180;"Yeah, I am."
38:03,180;38:05,560;"All right, transitioning that to my next question."
38:05,560;38:06,700;"Who's your favorite brother in law?"
38:06,700;38:12,000;"All right, let's let's roll off of that."
38:12,000;38:13,260;"Who's your least favorite brother?"
38:13,260;38:14,800;"There we go."
38:14,800;38:17,860;"Is it just based on this podcast or in general?"
38:17,860;38:19,300;"Do both."
38:19,300;38:20,900;"Yeah, great."
38:20,900;38:22,260;"Great."
38:22,260;38:23,340;"Yeah, I'm going to."
38:23,340;38:25,580;"You know, this is going to be lengthy."
38:25,580;38:29,300;"I'm on the podcast. I'm gonna start next. I'm gonna do an episode on this. All right"
38:29,300;38:33,580;"I love it"
38:33,580;38:38,020;"All right, well, we've kept you long enough away from your family"
38:38,020;38:41,180;"We appreciate you doing this Bob. Thanks for joining us"
38:41,180;38:44,460;"Indeed this has been great. Yeah"
38:44,460;38:49,300;"Hope the hope the game talk is what the game talk is as good as the prelude. Oh"
38:49,300;38:53,220;"It usually isn't but yes, I appreciate that"
38:53,900;38:55,900;"We didn't really talk about the game. Yeah"
38:55,900;39:02,820;"Fair enough, but I think we'll have to have you back the next time we talk about the Panthers because that will be in"
39:02,820;39:05,020;"2003 in the Super Bowl"
39:05,020;39:10,780;"Count me in so all right. Love it and this time. We'll actually have you on for like the whole game because that one is actually"
39:10,780;39:12,460;"Probably when you'll want to watch"
39:12,460;39:19,020;"Indeed cool. All right. Thanks a lot Bob. Thanks Bob. Thanks. Bye. It's Gary on talk to you soon"
