Start Timestamp;End Timestamp;Transcript
39:25,920;39:28,320;"You can check out the participants list."
39:28,320;39:29,880;"Oh, yeah."
39:29,880;39:33,040;"But yeah, I can't believe we didn't even touch on like the kicking game."
39:33,040;39:34,880;"And that was like the highlight of this whole thing."
39:34,880;39:37,360;"You have the really?"
39:37,360;39:39,240;"Yeah, you have."
39:39,240;39:40,800;"Venetary, right?"
39:40,800;39:41,160;"Yeah."
39:41,160;39:45,480;"I mean, money and snow already at that point, building a name for himself."
39:45,480;39:46,880;"The opposite."
39:46,880;39:49,200;"You have Neil Rackers, which."
39:49,200;39:55,280;"I mean, the year before he went, I can't believe they kept him, but he went 12 for 21."
39:55,280;39:58,040;"Oh, that's rough."
39:58,040;40:00,800;"That's like the opposite end of the spectrum there."
40:00,800;40:02,520;"Yeah, that's what I'm saying."
40:02,520;40:07,480;"And then we have like the greatest punter of all time on our team."
40:07,480;40:11,920;"Apparently, you really realize how nasty this guy was."
40:11,920;40:17,960;"I it felt like the way they were talking about him, it didn't feel like he was the best"
40:17,960;40:18,800;"punter of all time."
40:18,800;40:24,800;"it felt like he was the punter who had lasted along us on the worst teams."
40:24,800;40:25,280;"Yeah."
40:25,280;40:25,760;"Yeah."
40:25,760;40:28,520;"It felt like the Vinny Testa Verde type of."
40:28,520;40:28,720;"Yeah."
40:28,720;40:32,840;"Cause they, cause one of these things, like I did the math and Lee Johnson has"
40:32,840;40:35,280;"a over 28 miles of punting yards."
40:35,280;40:36,720;"Yeah."
40:36,720;40:38,160;"It's insane."
40:38,160;40:42,320;"And I mean, one of the highlights of the game was at 76 yard punt."
40:42,320;40:43,280;"Yes."
40:43,280;40:43,560;"Yeah."
40:43,560;40:46,120;"I had there in two in the four quarters."
40:47,080;40:50,400;"If that was like the Patriots team today, that shit would have been down to"
40:50,400;40:51,120;"Apple one."
40:51,120;40:54,280;"So we're actually, I mean, it would be a 76 yard punt."
40:54,280;40:55,320;"Like for real."
40:55,320;40:56,400;"Yeah."
40:56,400;40:56,840;"Oh, yeah."
40:56,840;41:02,080;"But it was like, I was surprised at how quickly they were jumping on those."
41:02,080;41:04,920;"Like as soon as the ball hit the ground, all those like jumped on and didn't"
41:04,920;41:07,160;"like let it bounce and see where it would end up."
41:07,160;41:09,840;"It was very unpaid."
41:09,840;41:10,640;"Like it felt like."
41:10,640;41:11,160;"Yeah."
41:11,160;41:16,320;"I mean, it was kind of a right sloppy execution, but I mean, yeah, I do"
41:16,320;41:17,320;"It was cool."
41:17,320;41:22,320;"You know, it's a shame that the punter is one of my highlights."
41:22,320;41:28,320;"But hey, yeah, so far the punter and the highlights."
41:28,320;41:34,320;"Well, hey, those are the building blocks of Bellatex teams."
41:34,320;41:37,040;"Yeah, I mean, you're not wrong."
41:37,040;41:41,320;"I think Troy Brown was also a highlight if we're going to talk about highlights."
41:41,320;41:46,240;"Yeah, if you want to be real about it, then I mean, if we're doing the play, you know,"
41:46,240;41:48,440;"player of the game here, he's obviously the one."
41:48,440;41:51,080;"You know, what do you have?"
41:51,080;41:53,920;"100, 170 yards or something like that in the touchdown?"
41:53,920;41:56,600;"I'm like, yeah, yeah, that touchdown in the second quarter."
41:56,600;42:01,680;"And just felt like he was the only guy who was doing any sort of like big"
42:01,680;42:02,800;"plays on offense."
42:02,800;42:04,240;"Like they didn't have any real big players."
42:04,240;42:06,600;"They had one past the tight end."
42:06,600;42:10,600;"I think that was probably the longest technical play."
42:10,600;42:12,360;"I think it was the Jermaine Wiggins maybe."
42:12,360;42:16,080;"Um, but it was Troy Brown, who was the only one getting open."
42:16,080;42:20,720;"like every time they needed something, like in the fourth quarter where they were like"
42:20,720;42:26,440;"stuck in their own territory, like on the touchdown drive, um, the last drive they were"
42:26,440;42:30,720;"on there, like they're inside their own 10. And it was third and third and long and,"
42:30,720;42:36,920;"um, somehow blood so fitted through two defenders to a falling over Troy Brown. So like, you"
42:36,920;42:41,880;"know, that's, that's what I remember. Like I didn't actually remember anything from this"
42:41,880;42:46,280;"game, but that play I think was the most familiar out of all of it."
42:46,280;42:52,040;"Yeah, it was interesting. Same for me. I was wondering as we kind of look back at"
42:52,040;42:57,600;"these games, how much I would actually remember this one didn't really stick with me."
42:57,600;43:00,360;"No, I had no memory of this game whatsoever."
43:00,360;43:06,000;"And I thought I remember the storylines around it, you know, but I remember like"
43:06,000;43:09,080;"the buying cocks signing, which I was pretty into Roman Pfeiffer."
43:09,640;43:15,880;"But, and there was also interesting speaking to those guys, I mean, part of the issue,"
43:15,880;43:20,040;"I think with the defense was they were saying, and I looked into a couple other things like"
43:20,040;43:25,720;"Richard Seymour was out, you know, Ted Johnson was, was out."
43:25,720;43:30,120;"He was dealing with an injury, which kind of reminded me a little bit of the Gronk injury"
43:30,120;43:32,320;"on that like field goal that like shattered his arm."
43:32,320;43:35,400;"But yeah, because he was, it was in preseason."
43:35,400;43:37,160;"He was on like, punt duty or something like that."
43:37,160;43:37,800;"Yep."
43:38,360;43:42,840;"and got some sort of hip injury, or I can't remember exactly what they said."
43:42,840;43:43,760;"It was some leg injury."
43:43,760;43:44,800;"Yeah."
43:44,800;43:48,480;"And then because the papers were all up in arms about like, Oh, well, this is why"
43:48,480;43:53,320;"you don't have your starters playing punt on in the preseason."
43:53,320;43:55,920;"I thought, well, that's, that's who Belichick is."
43:55,920;43:56,680;"They just don't know this."
43:56,680;43:57,360;"Yeah."
43:57,360;43:58,120;"Right."
43:58,120;44:03,120;"I mean, I mean, he, there was never a departure from that, but it was also"
44:03,120;44:07,320;"interesting because I don't know if you saw the, the stuff that just came out"
44:07,320;44:10,220;"with Tijansen about talking about Belichick and their relationship."
44:10,220;44:15,220;"But I guess they had a rocky relationship for pretty much the entire,"
44:15,220;44:21,320;"the maybe first three years that you, you work with like a Belichick."
44:21,320;44:26,120;"And then Belichick sort of went up to him and kind of was accountable for the way"
44:26,120;44:27,420;"he was treating him or whatever."
44:27,420;44:33,120;"Maybe it stemmed from this, but they sort of made amends and then things"
44:33,120;44:34,920;"were solid from that point on."
44:35,520;44:39,080;"- Yeah, 'cause I remember when Ted Johnson retired"
44:39,080;44:43,840;"or shortly afterwards, there was a lot of talk about him"
44:43,840;44:46,160;"talking about how the pages kind of took advantage of him"
44:46,160;44:48,480;"'cause he was the runstufferin."
44:48,480;44:51,120;"He was a guy that was always like the one the clock has"
44:51,120;44:55,520;"and he felt like they hadn't really protected him very well"
44:55,520;44:58,080;"from like head injuries and things like that, I think."
44:58,080;44:59,800;"So I remember that coming out when it,"
44:59,800;45:02,160;"like when he first retired and that was like kind of"
45:02,160;45:04,760;"some of the reasoning why he did it, why he retired."
45:04,760;45:06,360;"Yeah. It's kind of, yeah."
45:06,360;45:12,120;"But yeah, so he just came out and was kind of talking about sort of"
45:12,120;45:18,200;"Belichick's personality and demeanor, how he treats his players, but then like how he gets them back. So, like the,"
45:18,200;45:24,800;"I mean, it's also, I mean, this is for another another day, but he is also talking about how the buttler thing,"
45:24,800;45:30,880;"how he was benching the Super Bowl. And obviously it was serious. And then Belichick reached out to him afterwards and kind of made a men."
45:30,880;45:36,100;"And so Ted Johnson's point was that it might have been a tactic on Bellagex part to treat"
45:36,100;45:40,300;"people the way that he does and kind of play the puppets here, but for another day."
45:40,300;45:41,300;"Yeah."
45:41,300;45:45,660;"I mean, you can kind of see that being his MO, whether it is or isn't."
45:45,660;45:51,740;"But yeah, you see that kind of that mystique around himself, I think."
45:51,740;45:52,740;"Yeah."
45:52,740;45:53,740;"And it works."
45:53,740;45:59,580;"You know, if you're looking for results, I mean, can't argue, but exactly."
45:59,580;46:01,680;"And then yeah, and then I just had a good."
46:01,680;46:06,060;"I was just going to say, I think the reason that Corey Dillon had such a good"
46:06,060;46:09,540;"game was because it was no Ted Johnson or Richard Seymour because he rushed for"
46:09,540;46:12,480;"like 140 yards in this game, something along those lines."
46:12,480;46:18,780;"I think the team ran for like 140, but I think 157 actually."
46:18,780;46:21,620;"Corey Dilla, I know he had over a hundred."
46:21,620;46:22,500;"He did."
46:22,500;46:23,660;"Yeah."
46:23,660;46:28,140;"Oh yeah, it was 104, but yeah, that has a team that ran for like a buck 50."
46:29,220;46:32,920;"And I think part of it was just that it was hot as balls,"
46:32,920;46:35,720;"apparently, and you could just see the offense start to,"
46:35,720;46:39,520;"but the defense start to kind of lose their steam slowly"
46:39,520;46:41,840;"every drive because the offense in the third quarter"
46:41,840;46:42,680;"couldn't stay on the field."
46:42,680;46:46,840;"But I think not having those two players,"
46:46,840;46:50,440;"those two like run defense specialists on the field"
46:50,440;46:52,320;"didn't help either."
46:52,320;46:56,360;"Yeah, and then also the, they were saying that Willie"
46:56,360;47:01,960;"the Guinness just what he was sort of trying to get back from back surgery and then Taiwan"
47:01,960;47:05,000;"had to put in your degree. So there's a lot of stuff going on."
47:05,000;47:12,520;"Yeah, they were down to like the skeleton crew by the end of it. And I think I don't think this"
47:12,520;47:19,160;"game should have been this close. Because I mean, it ended 23 17. The patients were still kind of"
47:19,160;47:26,840;"in it, but I think it was only because for some reason, the Bengals offensive play calling"
47:26,840;47:33,060;"decided to keep throwing the ball for no reason and making all sorts of weird, strange decisions."
47:33,060;47:39,120;"They didn't run a play action pass until two minutes left in the first half when they"
47:39,120;47:43,880;"were gashing the Patriots on the run game."
47:43,880;47:49,680;"like they just decided not to try a play action, which would have been the most obvious answer, I thought."
47:49,680;47:56,560;"But they also decided to punt from the Patriots 35, which is a star."
47:56,560;47:57,440;"Yeah."
47:57,440;47:58,720;"But hey, that was a hell of a punt."
47:58,720;48:02,360;"Hey, it better be because he's punted like 20 yards."
48:02,360;48:05,720;"I mean, you need to land."
48:05,720;48:09,440;"Yeah, I mean, I got it inside the 10, but I mean, it's not like they put it on the one."
48:10,480;48:13,840;"I think that set up the Patriots scoring drive, didn't it?"
48:13,840;48:17,320;"Because that was when they were pinned deep and then managed to drive the"
48:17,320;48:18,200;"length of the score."
48:18,200;48:20,480;"That's that to keep it because they were up to 13."
48:20,480;48:23,160;"And then the Patriots scored and kept it close."
48:23,160;48:29,120;"Right. Yeah. And I mean, if we're talking about how they were running things,"
48:29,120;48:33,080;"the, the maddening thing watching this game was that, you know, they're,"
48:33,080;48:36,880;"they're running a basically a four minute drill at the end of the half, the, the"
48:36,880;48:40,240;"paths are. And I mean, it basically looks like there's like a"
48:40,240;48:42,920;"minute and a half left on the clock. I mean, there is no"
48:42,920;48:47,360;"awareness. People are freaking out there. They're hurrying. So"
48:47,360;48:50,880;"it's it's so different from what's a Brady run, often run at"
48:50,880;48:56,240;"a time. And then it ends with a sack, but it takes a sack and"
48:56,240;48:58,920;"then the next place is the way of game. So they got pushed out a"
48:58,920;49:01,600;"field will range of enters a disaster. And then at the end of"
49:01,600;49:11,920;"game. The two minute drill again was a disaster. I mean, it ended horribly. And I think that"
49:11,920;49:16,800;"this is a pattern in sort of that era, the Blutso era of fortune."
49:16,800;49:23,600;"Yeah, you can kind of feel why when Bray took over, Bell check was so comfortable with it,"
49:23,600;49:29,200;"because it felt like a lot of these games, even in the 2000 season, the"
49:30,800;49:33,040;"Patrets kind of played to keep it close at the end."
49:33,040;49:37,840;"And then they kind of set the offense up to have that one last drive"
49:37,840;49:43,680;"to win it. And it just didn't ever really happen because it felt like Bledsoe couldn't"
49:43,680;49:50,080;"run that two-minute offense. It seemed like there was a lot of people"
49:50,080;49:57,040;"creating other reasons why it wasn't Bledsoe. But at the end of the day, he was kind of"
49:58,640;50:02,760;"the one that was always there in the middle of it, not working."
50:02,760;50:03,800;"Right."
50:03,800;50:09,200;"But and then as soon as Brady comes in, he wasn't playing out of his"
50:09,200;50:13,040;"minds the rest of the game, but he was just managing to find a way at"
50:13,040;50:16,080;"the end of these games to finish them and get the win."
50:16,080;50:18,360;"Yeah, I think composure."
50:18,360;50:21,360;"I mean, the, the announcements we're talking about how Blutso is always cool"
50:21,360;50:22,320;"one of those moments."
50:22,320;50:25,280;"And for me, I think that was a big difference."
50:25,320;50:33,580;"like you're alluding to is that it was just a different demeanor where I think you'd just panic to be honest."
50:33,580;50:40,560;"But yeah, it felt to me more like this might be too strong or whatever."
50:40,560;50:43,160;"It felt more like a defeatist attitude."
50:43,160;50:45,040;"We are again."
50:45,040;50:46,800;"We have to bring this team back."
50:46,800;50:47,840;"I put it on my shoulders."
50:47,840;50:49,560;"Let's give this a shot."
50:49,560;50:50,360;"See what happens."
50:50,360;50:55,040;"It wasn't like it didn't feel like the fire you would see, especially in Brady's early years."
50:55,040;50:57,760;"Oh, yeah, you're right."
50:57,760;51:00,920;"Telling out the play of the lie, like screaming at people to get in the right position sort"
51:00,920;51:03,160;"of thing, you know?"
51:03,160;51:05,760;"I quite gave a shit."
51:05,760;51:06,760;"Yeah."
51:06,760;51:07,760;"So I agree."
51:07,760;51:09,760;"Well, I mean, that's tough to say."
51:09,760;51:10,760;"It is."
51:10,760;51:11,760;"Yeah."
51:11,760;51:15,940;"And I think with blood so being where he was in his career too and how much punishment"
51:15,940;51:23,720;"he had taken, I don't really hold it against him in any way because I mean, I never played"
51:23,720;51:28,200;"any professional sports, but you know, playing men's open soccer on a Thursday night."
51:28,200;51:32,040;"If you're on a shitty team, you kind of, you know what you're getting yourself into."
51:32,040;51:37,520;"Even if you're the best player on that team, you kind of, it wears on you, just not being"
51:37,520;51:40,560;"on good teams for a while."
51:40,560;51:48,240;"So I can understand why he would feel that way, but it wasn't successful for any of them."
51:48,240;51:52,680;"I definitely played a lot of pickup flag football and I was consistently one of the better players"
51:52,680;51:56,500;"on the team. So we have a sort of similar."
51:56,500;52:00,820;"Quite, I guess he could say, but that's what I mean."
52:00,820;52:03,900;"Oh, okay. I was gonna say, because I like that you were you were"
52:03,900;52:05,980;"alluding to me actually being the better player on my soccer team."
52:05,980;52:07,380;"Cause I definitely was not."
52:07,380;52:09,780;"I don't know about that."
52:09,780;52:15,900;"Yeah. I mean, I always thought that you were going to take the MLS route, but"
52:15,900;52:17,420;"you know, you're proving me wrong."
52:17,420;52:19,980;"Yeah, we used to the podcast route instead."
52:19,980;52:21,780;"Much more lucrative."
52:21,780;52:25,380;"That's right. You want to do best moments here?"
52:25,380;52:33,860;"Yeah, before we do, I just wanted to touch on that last drive because I thought the replacement"
52:33,860;52:38,340;"refs kind of reared their head there because that last drive, even though I don't think"
52:38,340;52:43,940;"the pages would have won it, it was still some bullshit calls because it was the one early."
52:43,940;52:49,220;"I was saying it was like first to second down where a free Russia came in on blood,"
52:49,220;52:53,040;"And he kind of shrugged him off and made the throat of to Troy Brown"
52:53,040;52:59,840;"But they called him in the grasp like immediately. Yep. And so they gave him the sack and and brought away back"
52:59,840;53:04,200;"So it was instead of it being like second and five. It was second in like 18"
53:04,200;53:06,760;"Was it like kind of on the way down?"
53:06,760;53:10,240;"So it kind of looked like it but I mean he still got off"
53:10,240;53:13,300;"Yeah, but it like it's not something you would have blown dead"
53:13,300;53:18,380;"You were just waiting to see how the play ended sort of thing. There's like a real quick trigger finger on that whistle"
53:18,380;53:26,180;"And then the next player was probably a sack because this is Drew"
53:26,180;53:29,740;"blood. So in the two minute trail. But so it was a third and like real long"
53:29,740;53:34,880;"third and 18 or something like that. And blood. So actually made the the"
53:34,880;53:42,020;"past to I don't know why to see if it was I don't think it was Patton. I want to"
53:42,020;53:47,660;"say it was probably bird Emmanuel. But he went down to made it made a diving"
53:47,660;53:55,420;"catch. Yep. Like it didn't look like, like it may not have been a catch, but it wasn't"
53:55,420;53:58,900;"anything that you could overturn with replay and replay, I think was still pretty new in"
53:58,900;54:04,100;"these days. But they overturned that and called it and completed even those no like definitive"
54:04,100;54:10,180;"evidence. So now it's like fourth and 18 from your own 20 yard line. And they decide to"
54:10,180;54:14,620;"like going back to what you said, roll bloods out to his left as a right handed quarterback."
54:14,620;54:22,100;"then he, all the time, the purpose took a sack on the sideline throwing it, like, like,"
54:22,100;54:26,340;"just kind of shoveling it to whoever off in the line was in the vicinity."
54:26,340;54:27,780;"So it wasn't an official sack."
54:27,780;54:29,460;"Yeah."
54:29,460;54:34,820;"I mean, it's kind of sad because, you know, we didn't really get to see too much more of"
54:34,820;54:36,140;"him moving forward."
54:36,140;54:41,220;"So that's sort of one of his last big plays."
54:41,220;54:43,380;"And it is what it is."
54:43,420;54:48,020;"I mean, fortunately, I don't think anybody really remembers the specifics, but looking"
54:48,020;54:50,320;"back, it hurts a little bit."
54:50,320;54:51,280;"Yeah."
54:51,280;54:55,400;"Like I said, I didn't remember any of this game, but a lot of it kind of felt familiar"
54:55,400;55:03,580;"and that kind of the the abject failure at the end of these games."
55:03,580;55:05,820;"It's like, Oh, yeah, no, this, I remember this."
55:05,820;55:09,340;"I remember when this just used to be the norm where, you know, they'd be closed,"
55:09,340;55:12,940;"but they could never quite close the door because, you know, they get a penalty"
55:12,940;55:17,140;"that would go against them and then they would just kind of fall apart from there."
55:17,140;55:20,540;"Or you know, a play wouldn't go their way early in that last drive and they just like"
55:20,540;55:23,620;"couldn't, couldn't make up for it, you know."
55:23,620;55:24,620;"Yep."
55:24,620;55:25,620;"Right."
55:25,620;55:27,820;"Now, you know Brady gets sacked and it's third and 17 is like, oh well, he'll, he'll find"
55:27,820;55:34,620;"Amen Dolo over the middle against the, the Jaguars for 23 yards in a playoff game because"
55:34,620;55:38,820;"that, that's just like, they just rebound and you kind of expect it now most from these,"
55:38,820;55:40,140;"these Patriots teams these days."
55:40,140;55:43,200;"is back then, like, the expectation was exactly the opposite."
55:43,200;55:49,820;"Yeah, I mean, I think that's the epitome of the entire"
55:49,820;55:53,700;"Bledzo era minus the Super Bowl."
55:53,700;55:54,720;"Yeah."
55:54,720;55:59,340;"And I think the Super Bowl was kind of almost not wanting to believe that it was"
55:59,340;56:01,660;"happening because this never happens to us as well."
56:01,660;56:03,100;"Yeah."
56:03,100;56:04,700;"I mean, that was the perfect storm anyway."
56:04,700;56:08,180;"I mean, the team around them was something else, but"
56:08,700;56:09,700;"Yeah."
56:09,700;56:16,060;"Clearly putting it on his shoulders like we've mentioned at Nazin at this point and I feel"
56:16,060;56:24,780;"like we're not trying to bash a Dribledzo here but just watching some of his highlights"
56:24,780;56:26,580;"brings that some painful memory."
56:26,580;56:30,540;"Yeah, I think just especially because this was kind of later on in his career too."
56:30,540;56:35,220;"So late career Dribledzo, I think he'd just been beaten down at this point because I"
56:35,220;56:37,700;"I mean, he was setting records before that."
56:37,700;56:40,620;"Like in his prime, he was a top quarter."
56:40,620;56:44,220;"I had great fond memories of some of those games"
56:44,220;56:49,100;"when he's throwing 70 attempts to come back from 24 down"
56:49,100;56:51,420;"or whatever it was against the Vikings."
56:51,420;56:54,180;"Like games like that that I still stick out, but."
56:54,180;56:58,620;"2001, it wasn't for him."
56:58,620;57:03,340;"- Yeah, he had seen better days."
57:03,340;57:06,380;"I mean, he played a part in 2001, we get to that later, but."
57:06,380;57:07,380;"Yeah."
57:07,380;57:08,380;"Yeah."
57:08,380;57:09,380;"Very true."
57:09,380;57:11,380;"Yeah, almost in fairytale fashion."
57:11,380;57:14,500;"But yeah, like I said, we'll get to that when we get there."
57:14,500;57:16,420;"So yeah, let's do our best and worst."
57:16,420;57:17,420;"You want to go first?"
57:17,420;57:18,420;"Yeah."
57:18,420;57:23,180;"I mean, if we're doing, I don't know if we're doing the three best moments or the three"
57:23,180;57:24,180;"worst."
57:24,180;57:28,300;"I mean, I think we kind of talked about these ad nauseums."
57:28,300;57:30,220;"I just want to pick one of each, I think."
57:30,220;57:33,300;"That's all I have left in my list that we haven't talked about."
57:33,300;57:35,780;"All right, I mean, all right, fine."
57:35,780;57:39,420;"The best moment was in a fumble."
57:39,420;57:45,460;"It was probably one of the best fumbles I've seen outside"
57:45,460;57:47,660;"of the front fumble where, I mean,"
57:47,660;57:50,300;"he basically fumbled with nobody touching it."
57:50,300;57:53,180;"He just lost sight of the ball."
57:53,180;57:55,020;"I don't know what happened."
57:55,020;57:57,820;"- It looked like he was trying to find the laces"
57:57,820;57:59,460;"and then couldn't, so he decided to throw it anyway."
57:59,460;58:00,460;"And just like,"
58:00,460;58:02,180;"- Okay, yeah."
58:02,180;58:04,160;"He just like squeezed out of his hand."
58:04,160;58:06,320;"He just really needed the laces for that."
58:06,320;58:08,300;"- Yeah, and it goes flying backwards."
58:08,300;58:11,500;"And it's amazing because then like you see Bruce,"
58:11,500;58:13,480;"just like flying over people trying to get to him."
58:13,480;58:17,040;"So it was kind of a fun visual to kind of see the ball"
58:17,040;58:18,620;"just fly to this guy's hand and then Bruce"
58:18,620;58:20,300;"he comes into the screen."
58:20,300;58:23,420;"So that was probably..."
58:23,420;58:24,940;"- That was actually gonna be my best"
58:24,940;58:28,740;"was seeing Bruce, he doing his run full tilt"
58:28,740;58:30,260;"at the blocker and just jump over him,"
58:30,260;58:32,180;"that flip into the quarterback?"
58:32,180;58:34,060;"- Yep."
58:34,060;58:36,420;"- That was kind of like his signature thing,"
58:36,420;58:38,580;"was just running at the guy and just jumping over him"
58:38,580;58:40,260;"or trying to and always getting clipped on the legs"
58:40,260;58:43,540;"and always like ending up tackling the quarterback"
58:43,540;58:47,460;"with his ass cheeks or the back of his legs sort of thing."
58:47,460;58:48,900;"- Yep, yep."
58:48,900;58:53,380;"And then an honorable mention from me will be Bledto"
58:53,380;58:56,140;"scrambling to the right, diving for first down,"
58:56,140;58:57,940;"helicopters and-"
58:57,940;58:58,780;"- Yes."
58:58,780;59:04,780;"That was pretty awesome. I mean he scrambled all over the place like you mentioned, but that was that was an awesome play"
59:04,780;59:10,640;"Yeah, because he had that one and he also had he tried the the cue the quarterback sneak on fourth and two"
