Start Timestamp;End Timestamp;Transcript
01:00:04,880;01:00:06,040;"Like 500 pages."
01:00:06,040;01:00:07,400;"You should get that guy in the pod."
01:00:07,400;01:00:09,680;"Our own specter."
01:00:09,680;01:00:11,480;"Well, and who is the investigator?"
01:00:11,480;01:00:12,800;"I don't know."
01:00:12,800;01:00:13,680;"I don't know."
01:00:13,680;01:00:15,240;"We, we, we, we got him."
01:00:15,240;01:00:16,320;"I'm sure he's going to find out."
01:00:16,320;01:00:17,520;"We'll make some phone calls."
01:00:17,520;01:00:19,040;"Look, we're going to get to the bottom of this."
01:00:19,040;01:00:22,400;"Some day, parade is going to write his expose because his guilt is going to haunt him."
01:00:22,400;01:00:23,880;"He's a fucking cheater."
01:00:23,880;01:00:26,200;"He's, uh,"
01:00:26,200;01:00:31,120;"even if you do get him on the podcast, we're going to end up asking him if he can do"
01:00:31,120;01:00:31,200;"that."
01:00:31,200;01:00:32,400;"The helicopter dick thing."
01:00:32,400;01:00:34,120;"Oh shit."
01:00:34,120;01:00:37,440;"Asking if he'd fucking like everybody."
01:00:37,440;01:00:40,720;"Okay."
01:00:40,720;01:00:43,680;"So we're here to talk football and we haven't even got to the second half."
01:00:43,680;01:00:44,080;"Okay."
01:00:46,960;01:00:48,960;"Well, the third quarter didn't have much in."
01:00:48,960;01:00:50,960;"So let's just jump to the fourth quarter."
01:00:50,960;01:00:52,960;"Actually didn't watch the third quarter."
01:00:52,960;01:00:53,960;"All right, good."
01:00:53,960;01:00:54,960;"You know what?"
01:00:54,960;01:00:55,960;"The one above."
01:00:55,960;01:00:57,960;"You missed a couple turnovers now, is it?"
01:00:57,960;01:01:00,960;"Fourth quarter was where all the action happens."
01:01:00,960;01:01:04,960;"There's four touchdowns scored in the fourth quarter."
01:01:04,960;01:01:08,960;"Three of them by three, even by the Patriots did."
01:01:08,960;01:01:12,960;"I mean, well, one of them paint manning at a hand in."
01:01:12,960;01:01:16,360;"Because the cold scored at the touchdown"
01:01:16,360;01:01:20,040;"right at the end of the third quarter."
01:01:20,040;01:01:22,520;"To pull it a little bit closer, it was 23/7"
01:01:22,520;01:01:23,320;"the end of the third quarter."
01:01:23,320;01:01:25,880;"And the pages immediately went down and scored a touchdown,"
01:01:25,880;01:01:28,520;"which is very Patriot-esque."
01:01:28,520;01:01:33,360;"That was the screen pass to Antoine Smith,"
01:01:33,360;01:01:36,400;"where he rumbled for like 40, 50 yards."
01:01:36,400;01:01:38,560;"And then two players later kept him"
01:01:38,560;01:01:42,720;"fall-grained for touchdown, which you don't see very often."
01:01:42,720;01:01:46,640;"And then like two plays later, Colte of the ball, and that was the"
01:01:46,640;01:01:47,680;"title of pick six."
01:01:47,680;01:01:52,840;"And that was the game, even though Peyton would follow that up with a touchdown"
01:01:52,840;01:01:57,000;"drive of his own eventually through a touchdown on fourth down and went for two"
01:01:57,000;01:01:57,480;"missed it."
01:01:57,480;01:02:01,000;"It's now what 44 to 13 and the game was over."
01:02:01,000;01:02:03,320;"And I don't think Peyton Manning actually saw the field after that."
01:02:03,320;01:02:07,840;"They brought in, um, that was his name, Mark Rippon."
01:02:07,840;01:02:09,200;"Oh, hell yeah."
01:02:09,200;01:02:10,760;"Red Skins fame."
01:02:10,760;01:02:11,320;"Yes."
01:02:11,320;01:02:16,360;"exactly that when they said that. Yeah. Probably start on that team right now."
01:02:16,360;01:02:17,360;"Definitely could."
01:02:17,360;01:02:23,400;"Now, I'm thinking the next coach. May as well, right?"
01:02:23,400;01:02:29,400;"The London Redskins. Oh, feels nice. I feel like they probably change the"
01:02:29,400;01:02:32,400;"Redskins part. Maybe snide."
01:02:32,400;01:02:38,720;"I want to red coats. Oh, red coat. Not bad. Not bad."
01:02:38,720;01:02:47,360;"that I did find it interesting that there is video evidence out there of Bill Bellachek"
01:02:47,360;01:02:53,320;"celebrating touchdowns. I mean he's fist pumping, he's clapping. I don't know what year that"
01:02:53,320;01:02:57,960;"stopped. I mean there's rumors that he sold this soul, which I think we can all agree"
01:02:57,960;01:03:03,960;"on. But yeah, happened then. But there is evidence of him celebrating and smiling."
01:03:03,960;01:03:06,660;"Yeah, cuz I mean I remember this year"
01:03:06,660;01:03:09,680;"What's that this year?"
01:03:09,680;01:03:11,680;"2001 I"
01:03:11,680;01:03:18,120;"Don't know because he was still celebrating and right I think like I mean if we really want to like discuss when he sold this"
01:03:18,120;01:03:20,600;"So I feel like it was after 2002"
01:03:20,600;01:03:26,840;"I was gonna say after 2004 because that was when he was he was still celebrating cuz remember that was the end of the"
01:03:26,840;01:03:29,680;"Charlie Weiss"
01:03:30,000;01:03:33,840;"And Romeo Cornell like the three of them and they were like hugging at the end and like"
01:03:33,840;01:03:37,960;"Oh, right. Yeah, I was getting pissed because they poured the"
01:03:37,960;01:03:43,440;"The Kool-Aid on him and his dad like well, it's dad super old that could I kill? Yeah? Yep. I remember that"
01:03:43,440;01:03:48,600;"That's a good point actually. So I think it was after that what he didn't win for a couple of years"
01:03:48,600;01:03:50,920;"Yeah, and then sold the soul and that was 2007"
01:03:50,920;01:03:53,920;"You're right because then the culmination of that was probably oh seven"
01:03:53,920;01:03:57,760;"We saw little little signs of that and then here we are now"
01:03:58,640;01:04:00,940;"Yeah, you know, and that makes sense."
01:04:00,940;01:04:01,700;"Roger Godel."
01:04:01,700;01:04:04,380;"I never thought of it that way, but yeah, you're right."
01:04:04,380;01:04:06,440;"That was probably the last intimate moment he ever had."
01:04:06,440;01:04:09,940;"That's the devil trying to collect his spygate."
01:04:09,940;01:04:11,020;"Yeah."
01:04:11,020;01:04:15,320;"Now, if you were him, I mean, what you just say, hypothetically, the devil approaches you"
01:04:15,320;01:04:15,860;"whatever."
01:04:15,860;01:04:21,140;"And he's like, you know, giving you this deal where you're going to get, let's say eight"
01:04:21,140;01:04:24,720;"Super Bowls by the time you die, you coach until you're 85, right?"
01:04:24,720;01:04:25,640;"That's pretty good run."
01:04:25,640;01:04:26,340;"Amen."
01:04:26,340;01:04:29,540;"Um, you know, social media goes crazy."
01:04:29,540;01:04:34,100;"You're beloved, then you burn eternally, but like who cares?"
01:04:34,100;01:04:36,260;"Cause like there's no social media in hell who gives a shit."
01:04:36,260;01:04:38,100;"So would you do that?"
01:04:38,100;01:04:39,000;"Yes."
01:04:39,000;01:04:41,920;"You would 100% right."
01:04:41,920;01:04:43,340;"Depant what, what is hell?"
01:04:43,340;01:04:46,660;"Well, is hell watching?"
01:04:46,660;01:04:51,540;"Cause it, cause if hell was watching somebody else break all your records, that was suck."
01:04:51,540;01:04:53,280;"Oh fuck."
01:04:53,280;01:04:54,300;"I didn't even think about that."
01:04:54,660;01:04:56,220;"And I would eat them alive for it's"
01:04:56,220;01:04:57,060;"Yeah, man."
01:04:57,060;01:04:58,060;"Yeah."
01:04:58,060;01:04:59,940;"Man, you're bringing up great points today."
01:04:59,940;01:05:01,900;"I mean, I know this."
01:05:01,900;01:05:06,180;"You'll have to listen to our two of the podcast."
01:05:06,180;01:05:07,780;"And I started breaking and bring up good points."
01:05:07,780;01:05:08,700;"Yeah."
01:05:08,700;01:05:10,300;"Well, I mean, warmed up."
01:05:10,300;01:05:13,220;"You're definitely bringing a different perspective to the table."
01:05:13,220;01:05:15,780;"Absolutely."
01:05:15,780;01:05:16,300;"All right."
01:05:16,300;01:05:19,420;"I think that's that covers mostly games."
01:05:19,420;01:05:21,620;"Let's do some best and worse."
01:05:21,620;01:05:23,220;"And we want to go first."
01:05:23,220;01:05:24,760;"I know Steve already gave his best."
01:05:24,760;01:05:25,420;"Steve, you got to worry."
01:05:25,420;01:05:26,340;"It's what was your best again."
01:05:26,340;01:05:27,540;"I've already forgotten."
01:05:27,540;01:05:29,640;"It was like an hour ago, my variable sighting."
01:05:29,640;01:05:30,960;"Oh, that's right."
01:05:30,960;01:05:32,560;"The beginning of the Mike Bertle."
01:05:32,560;01:05:33,720;"My life at that point."
01:05:33,720;01:05:35,280;"I would think so."
01:05:35,280;01:05:36,360;"First, most people's lives."
01:05:36,360;01:05:37,980;"It's not like he played much on the Steelers."
01:05:37,980;01:05:38,840;"It's all like that."
01:05:38,840;01:05:39,600;"Do you have a worst?"
01:05:39,600;01:05:40,960;"I have another best."
01:05:40,960;01:05:41,680;"Does that count?"
01:05:41,680;01:05:42,400;"The fuck it?"
01:05:42,400;01:05:42,900;"Yeah, let's go."
01:05:42,900;01:05:44,200;"We're a patient podcast."
01:05:44,200;01:05:45,160;"As many best as you want."
01:05:45,160;01:05:49,020;"They cut to like John Bon Jovi and Robert"
01:05:49,020;01:05:49,960;"Crafts sitting together."
01:05:49,960;01:05:51,080;"Did they?"
01:05:51,080;01:05:51,680;"Yeah."
01:05:51,680;01:05:57,000;"that part. Well, that's super young. I wrote down the note that Robert craft"
01:05:57,000;01:06:03,080;"was like a man who didn't need to pay for hand jobs. I mean, you could say that"
01:06:03,080;01:06:07,320;"because his wife was sitting next to him. Okay, well, wait to make it real."
01:06:07,320;01:06:14,600;"Now, who's when you do that? Too soon. Rest in peace, my right. All right, Greg,"
01:06:14,600;01:06:20,400;"Give me your best and worst my best was man's favorite wide receiver tie-law"
01:06:20,400;01:06:26,280;"And okay my worst is drone pathans"
01:06:26,280;01:06:29,760;"Future"
01:06:29,760;01:06:32,200;"Oatmeal brain"
01:06:32,200;01:06:36,540;"And just general like you know unsteadiness and mood swings"
01:06:36,540;01:06:44,580;"You got lit up a bunch in this game like from the first play from the get I think that's a dog"
01:06:44,580;01:06:47,580;"darkest worst moment we've had."
01:06:47,580;01:06:48,580;"I don't think so."
01:06:48,580;01:06:50,580;"Last week we talked a lot about 9/11."
01:06:50,580;01:06:51,580;"Oh yeah."
01:06:51,580;01:06:52,580;"I forgot about that."
01:06:52,580;01:06:53,580;"Yeah."
01:06:53,580;01:06:55,580;"It was a twin tower joke in there somewhere."
01:06:55,580;01:06:58,580;"All right, Mike, your best or worst."
01:06:58,580;01:07:00,580;"All right, best."
01:07:00,580;01:07:04,580;"I mean, I have a few honorable mentions just quickly like the,"
01:07:04,580;01:07:05,580;"the, uh,"
01:07:05,580;01:07:06,580;"the, uh,"
01:07:06,580;01:07:08,580;"28 yard screen and the fourth."
01:07:08,580;01:07:10,580;"So Brady got like hammered."
01:07:10,580;01:07:12,580;"They kept this composure completed the pass."
01:07:12,580;01:07:18,940;"I was just picturing like Bledsoe running across the field, like closing his eyes, like throwing"
01:07:18,940;01:07:22,060;"like cross body, like tucking and rolling."
01:07:22,060;01:07:24,620;"So yeah Brady didn't do that."
01:07:24,620;01:07:25,940;"So that was pretty great."
01:07:25,940;01:07:33,540;"And even just the fact that like they sent Brady out to run a fourth and three like throwback"
01:07:33,540;01:07:39,380;"screen pass, the fourth quarter was showing the trust that they had in him even at that"
01:07:39,380;01:07:40,380;"point."
01:07:40,380;01:07:41,380;"It was pretty cool."
01:07:41,380;01:07:43,900;"And then another just quick aside,"
01:07:43,900;01:07:45,700;"I just, they threw up a graphic"
01:07:45,700;01:07:48,740;"of like what Foxborough Stadium was versus like,"
01:07:48,740;01:07:50,660;"you know, what ended up being Gillette Stadium."
01:07:50,660;01:07:54,140;"And I mean, they're like, it was a $6 million stadium."
01:07:54,140;01:07:57,180;"The new one was like 325 million."
01:07:57,180;01:08:00,820;"I mean, there's like 53,000 bench seats in Foxborough,"
01:08:00,820;01:08:02,460;"which were like cold and uncomfortable,"
01:08:02,460;01:08:06,940;"zero in Gillette, 68,000 chair backs."
01:08:06,940;01:08:09,140;"Apparently that was like the hot spot."
01:08:09,140;01:08:11,180;"- Actual chairs instead of benches."
01:08:11,180;01:08:21,680;"Yeah, yeah. So I thought that was pretty cool. And then the last honorable mention would be Brady just randomly talking on the sideline with like a line kid or whatever that was."
01:08:21,680;01:08:29,240;"He was just talking about this a random dude, not even other the Patriots team and just being a normal guy."
01:08:29,240;01:08:32,480;"He is the normal guy."
01:08:32,480;01:08:34,880;"He could have a handsome."
01:08:34,880;01:08:39,960;"Right. Well, after 2007, when he sold this hole, we could talk about that next week."
01:08:40,040;01:08:43,680;"But I think we'll have to save that."
01:08:43,680;01:08:46,000;"And then, yeah, so my best moment was actually"
01:08:46,000;01:08:50,280;"when they had a, oh man, there's too many like commentator"
01:08:50,280;01:08:53,880;"things, but I mean, the commentator, all right,"
01:08:53,880;01:08:55,000;"there's two great ones."
01:08:55,000;01:08:58,120;"One is the commentator debating through the commercial."
01:08:58,120;01:09:01,200;"Why didn't they go for two, right?"
01:09:01,200;01:09:03,520;"So they cold kick like, and they're like,"
01:09:03,520;01:09:04,360;"why don't they go for two?"
01:09:04,360;01:09:05,960;"And they're breaking down the math and they're going"
01:09:05,960;01:09:08,440;"with three touchdowns and three two-point conversions"
01:09:08,440;01:09:09,880;"they could take the lead."
01:09:09,880;01:09:12,340;"And they're legitimately talking about this."
01:09:12,340;01:09:13,500;"I thought that was fantastic."
01:09:13,500;01:09:15,740;"- Yeah, the cools are down 24 points."
01:09:15,740;01:09:17,580;"- Exactly, it was so funny."
01:09:17,580;01:09:22,020;"Another great moment that I liked was they had a poll"
01:09:22,020;01:09:24,740;"which O&2 team had the best chance of making the playoffs."
01:09:24,740;01:09:25,580;"- Yeah."
01:09:25,580;01:09:28,420;"- I agree it's a word listed in their own game."
01:09:28,420;01:09:30,660;"- That was gonna be my worst, yeah."
01:09:30,660;01:09:32,260;"- Oh, that was the best thing."
01:09:32,260;01:09:34,820;"- I have it, it was of the NFL team starting O&2,"
01:09:34,820;01:09:36,660;"which has a best shot at making the playoffs."
01:09:36,660;01:09:39,300;"Buffalo, Detroit, Kansas City, Minnesota,"
01:09:39,300;01:09:40,980;"Tennessee, or Washington."
01:09:40,980;01:09:43,180;"And then like eventually they realized,"
01:09:43,180;01:09:45,300;"wait, the Patriots aren't on this list."
01:09:45,300;01:09:46,140;"(laughs)"
01:09:46,140;01:09:46,980;"- Yeah, I remember coming through,"
01:09:46,980;01:09:48,860;"they were just like, maybe they could use it"
01:09:48,860;01:09:49,700;"and have a chip on their shoulder."
01:09:49,700;01:09:51,460;"And I could just picture like Bellachacks,"
01:09:51,460;01:09:53,620;"like, you know, after they're going out."
01:09:53,620;01:09:55,660;"Yeah, yeah, like did you guys see that CBS"
01:09:55,660;01:09:57,260;"like left us out of a pole?"
01:09:57,260;01:09:58,340;"- Oh yeah. - Right."
01:09:58,340;01:09:59,980;"So that was pretty funny."
01:09:59,980;01:10:00,820;"And then the worst moment."
01:10:00,820;01:10:03,620;"- I guess that was up on the bulletin board."
01:10:03,620;01:10:05,300;"- Oh hell yeah. - Super Bowl week."
01:10:05,300;01:10:09,060;"- Loder Malloy would be ranting and raving."
01:10:09,060;01:10:10,860;"- Oh, God yeah."
01:10:10,860;01:10:13,580;"- And then the worst moment for me was just seeing Pete"
01:10:13,580;01:10:15,740;"and run up the middle for 10 yards in a touchdown"
01:10:15,740;01:10:17,220;"'cause how does that even happen?"
01:10:17,220;01:10:18,580;"- Yeah, that was tough."
01:10:18,580;01:10:20,420;"But it's a pretty spry."
01:10:20,420;01:10:21,260;"- He was quick."
01:10:21,260;01:10:22,300;"If Peyton's running for touchdowns,"
01:10:22,300;01:10:24,620;"you know you're doing something right though."
01:10:24,620;01:10:26,420;"'Cause that ain't his thing."
01:10:26,420;01:10:27,420;"- That's right."
01:10:27,420;01:10:29,140;"- I like those."
01:10:29,140;01:10:30,700;"All right, my best."
01:10:32,580;01:10:37,620;"following a failed third down conversion where a paid manning thought they got it."
01:10:37,620;01:10:42,500;"Manning right over to the referee and was like trying to convince him that the spot was wrong."
01:10:42,500;01:10:46,580;"And Brian Cox is standing in the sideline waving at him, waving goodbye."
01:10:46,580;01:10:47,380;"That was awesome."
01:10:47,380;01:10:48,260;"Oh, you catch that?"
01:10:48,260;01:10:52,340;"He was so in Manning's head."
01:10:52,340;01:10:54,260;"Brian Cox had himself a fucking game."
01:10:54,260;01:10:56,340;"So that was definitely my best."
01:10:58,740;01:11:03,540;"honorable mentor be the fact that you saw the Patriots run Troy Brown on the jet sweep"
01:11:03,540;01:11:07,820;"That like as he's coming in motion. They just hike it real quick turn on a hand as well"
01:11:07,820;01:11:14,540;"And it wasn't as smooth as you see it nowadays, but like you know can bell check ahead of the game as always"
01:11:14,540;01:11:21,560;"My worst was gonna be the the oh and two graphic but"
01:11:21,560;01:11:24,580;"Instead I will say it's the"
01:11:26,100;01:11:32,420;"audio from this from the old Foxverse stadium where it sounded like we were listening to a high school football game."
01:11:32,420;01:11:39,140;"But you could hear the stadium announcer announcing the results of the play."
01:11:39,140;01:11:42,180;"Like Aaron Swan Smith up the middle for two yards."
01:11:42,180;01:11:45,780;"Like as you hear the announcer saying the same thing."
01:11:45,780;01:11:52,820;"And then you could actually get out of this on headphones and I could hear like a lot of fan chatter."
01:11:53,540;01:11:55,700;"And so I wrote down a few that I heard."
01:11:55,700;01:12:00,900;"One of the cheers was way to go. Oh, I'm looking good so far."
01:12:00,900;01:12:06,340;"This was that one. It was probably like three plays into the first drive."
01:12:06,340;01:12:09,940;"Yeah, which was great. I heard that too. It was like super."
01:12:09,940;01:12:19,220;"The all on. Yeah. Yeah. And then another one was it's okay, Peyton, which I don't know if it came"
01:12:19,220;01:12:25,460;"from a Colts fan. Um, and then there was another one. Don't walk away from me, you idiot."
01:12:25,460;01:12:34,500;"And then there was the guy repeating, I have as repeating five times, get me more cheeseburgers."
01:12:34,500;01:12:37,780;"You just kept repeating that as just like,"
01:12:37,780;01:12:43,540;"I'm painting going on. Yeah. And then like towards the end of the game,"
01:12:43,540;01:12:47,780;"like, I, uh, he must have been talking shit to a Colts fan. Cause he's like,"
01:12:47,780;01:12:51,700;"like, are you guys gonna lose in the first round again for the third year in a row?"
01:12:51,700;01:12:58,700;"Like that's, that's the, uh, the taunting of a guy who has never been there before."
01:12:58,700;01:12:59,500;"Yeah."
01:12:59,500;01:13:00,260;"Who just has the."
01:13:00,260;01:13:00,780;"Hey, thank you."
01:13:00,780;01:13:02,100;"So fucking time."
01:13:02,100;01:13:03,780;"Yeah, exactly."
01:13:03,780;01:13:05,900;"To a cult fan."
01:13:05,900;01:13:08,420;"It's like, well, you're going to get the playoffs and lose again."
01:13:08,420;01:13:10,100;"How that must suck, huh?"
01:13:10,100;01:13:12,100;"One of the playoffs feel like."
01:13:14,540;01:13:17,740;"Now that was a it was a"
01:13:17,740;01:13:25,440;"So I think my worst is probably the Gary glitter fact the fact they stopped playing that song because he's a kitty didler. I"
01:13:25,440;01:13:29,340;"Have worse. I just thought of it. What's that? I?"
01:13:29,340;01:13:36,180;"Had always thought Brady's first start was that game in Indianapolis that we're gonna watch later. Oh"
01:13:38,940;01:13:44,820;"game. Pat was pretty patent for Rose runs. Oh, yeah. Yeah."
01:13:44,820;01:13:49,100;"I was fully expecting to turn that game on and I was like, wait, it's in Fox"
01:13:49,100;01:13:50,100;"bro."
01:13:50,100;01:13:55,380;"I understood yourself a good game to watch though. It was he was pretty"
01:13:55,380;01:14:01,580;"steady. You know, no mistakes. Nothing flashy. Just solid Brady."
01:14:01,580;01:14:06,180;"I did. I was a little disappointed that his first touch and didn't go to Kevin"
01:14:06,180;01:14:07,840;"on that screen pass though."
01:14:07,840;01:14:11,620;"'Cause he was a shoestring tackle at like a three-yard line."
01:14:11,620;01:14:16,820;"And that was the fourth and three screenplay too."
01:14:16,820;01:14:17,660;"- Right."
01:14:17,660;01:14:19,260;"- So that would have been a hell of a first touch out throw,"
01:14:19,260;01:14:22,100;"but we're gonna have to wait for that for next week."
01:14:22,100;01:14:26,100;"So that's what in the game, that's what we call a teaser."
01:14:26,100;01:14:27,340;"We're gonna tease that."
01:14:27,340;01:14:28,180;"- That's a teaser."
01:14:28,180;01:14:29,020;"- We're at Teasing. - What are we teasing?"
01:14:29,020;01:14:30,340;"- That's a teaser."
01:14:30,340;01:14:32,700;"- We're teasing Tom Brady's first touch out pass."
01:14:32,700;01:14:35,380;"- Oh, and who are we teasing?"
01:14:35,380;01:14:40,540;"with that. Oh, yeah, we're teasing our mom. Oh, hi, Mrs."
01:14:40,540;01:14:44,540;"Brand. So as I shall tune in next week and listen to us talk"
01:14:44,540;01:14:49,000;"about the Patriots at the Chargers at the Chargers, home"
01:14:49,000;01:14:52,740;"versus Chargers. Find out the other. It's called a"
01:14:52,740;01:14:58,420;"teaser. We're real good at teasing. And the best part is"
01:14:58,420;01:15:03,260;"that's not next week next week is at the dolphins. Well, this"
01:15:03,260;01:15:05,820;"is just all right. I'm done."
01:15:05,820;01:15:12,340;"All right, on that note, we will see everybody next time on the"
01:15:12,340;01:15:13,820;"page as I as the podcast."