Start Timestamp;End Timestamp;Transcript
20:06,820;20:13,780;"Well, and then I also saw that I didn't realize this, but Pete Carroll had suspended"
20:13,780;20:17,780;"him before Belichick got there as well."
20:17,780;20:19,180;"So I didn't see that."
20:19,180;20:21,020;"Yeah, in '99."
20:21,020;20:23,820;"So there was already a little bit of a precedent there."
20:23,820;20:24,820;"Yeah, yeah."
20:24,820;20:25,820;"Yeah."
20:25,820;20:31,540;"Yeah, I remember him always having a tumultuous relationship, because even when Parcels was"
20:31,540;20:37,460;"run in the team and they had that press conference about Terry Glenn had an injury and Parcells"
20:37,460;20:41,860;"didn't believe that he was injured. He thought he was sitting out and so they asked him how Terry"
20:41,860;20:48,020;"Glenn was and he said, ""Yeah, she's fine."" Right. In true Parcells fashion. That's like the only"
20:48,020;20:54,100;"thing I remember about Terry Glenn. That sparked the whole, ""If you want me to be the cook,"
20:54,100;20:56,740;"you got to let me buy the groceries."" Exactly."
20:56,740;20:59,740;"Robert Kraft and Terry Glande pretty much hated him."
20:59,740;21:03,100;"Yeah, because Terry Glenn was Robert Kraft,"
21:03,100;21:05,660;"draft, make not Bill Bellaghex."
21:05,660;21:06,540;"Right."
21:06,540;21:08,060;"Bill Parcels, really."
21:08,060;21:08,540;"Right."
21:08,540;21:08,900;"Right."
21:08,900;21:14,340;"And then, you know, obviously Terry Gland passed in a accident,"
21:14,340;21:19,300;"but pretty much every interview that I heard after that incident was that,"
21:19,300;21:20,380;"you know, he was a good guy."
21:20,380;21:22,340;"He was just troubled, never really figured it out."
21:22,340;21:26,700;"So it's kind of a sad story in that sense, because he had the talent."
21:26,700;21:31,700;"but and the style by just didn't quite put it together."
21:31,700;21:33,580;"- Yeah, I felt like one of those guys"
21:33,580;21:36,900;"where it came easy to him before coming into the pros."
21:36,900;21:38,880;"So it never really seemed like he gave,"
21:38,880;21:41,780;"but like had to give much effort coming in"
21:41,780;21:43,820;"to know how to do that once he got there."
21:43,820;21:44,740;"- Yeah."
21:44,740;21:47,540;"- And so yeah, you just never really put it all together."
21:47,540;21:51,700;"Whereas the opposite side of that would probably be Troy Brown"
21:51,700;21:53,080;"who didn't quite have the talent,"
21:53,080;21:56,020;"but just worked his balls off"
21:56,020;21:57,460;"and I kept making the team."
21:57,460;21:59,980;"And from his biography that I read,"
21:59,980;22:04,060;"basically the only, like he kind of just hung around barely"
22:04,060;22:07,700;"by the skin of his teeth on the Parcels and Carols teams,"
22:07,700;22:11,740;"but Belichick kind of day one came to him says,"
22:11,740;22:16,300;"I remember you from when I was the defensive coach"
22:16,300;22:19,380;"when I was here last and I've watched a bunch of tape on you"
22:19,380;22:20,220;"and I know what you can do."
22:20,220;22:23,620;"So we're gonna basically feature you in this offense."
22:23,620;22:25,940;"- 1200 yards, five touchdowns is here."
22:25,940;22:30,420;"- Yeah, yeah, in 2001 was his best year as a receiver"
22:30,420;22:32,820;"'cause he was kind of the number one guy"
22:32,820;22:35,780;"because like I said, who else was it?"
22:35,780;22:37,060;"Especially the beginning."
22:37,060;22:42,180;"- Yeah, I mean, even in 2000, he almost got a thousand yards"
22:42,180;22:44,260;"and it was like nine, 50 or something like that."
22:44,260;22:48,100;"So given that team, 944 yards and four touchdowns"
22:48,100;22:53,100;"the year before 12.9 return average in 2000 as well."
22:53,660;22:57,660;"So he was on his way to be a part of the team in that fashion."
22:57,660;22:59,580;"The original West Walker."
22:59,580;23:00,780;"Exactly."
23:00,780;23:06,380;"I he was kind of the original gunner, Olshevsky, if you will."
23:06,380;23:07,620;"Oh boy."
23:07,620;23:09,620;"Oh, that's a hot take."
23:09,620;23:14,140;"Oh, you know it is."
23:14,140;23:16,500;"All right."
23:16,500;23:18,460;"So let's, uh, that's kind of the lead up."
23:18,460;23:22,140;"So let's, let's, because we're haven't actually talked about the game yet."
23:22,140;23:24,740;"We're at about a half hour in here."
23:24,740;23:26,700;"But is there anything else you want"
23:26,700;23:31,140;"to touch on real quick before we do get to the game?"
23:31,140;23:33,940;"I mean, Willie and the Unisynx Chris"
23:33,940;23:36,620;"Laid had a pretty nice bromance."
23:36,620;23:36,980;"Yeah."
23:36,980;23:38,060;"I missed that."
23:38,060;23:40,620;"And bought it from me."
23:40,620;23:42,740;"Couple notable draft picks for this year"
23:42,740;23:46,660;"was the first round pick was Richard Seymour."
23:46,660;23:49,180;"And they also drafted Matt Light in the second round."
23:49,180;23:50,180;"So two big names."
23:50,180;23:51,940;"That was kind of the only names I recognized"
23:51,940;23:58,680;"from this draft. There was a bunch of turnover from the 2000 season. The"
23:58,680;24:01,400;"announcer's in this game actually pointed out there was 38 new players"
24:01,400;24:07,120;"from a year ago and 18 of those were free agents. So Belichick basically just"
24:07,120;24:11,880;"gutted the team that he had before, brought in a bunch of veteran guys. And"
24:11,880;24:16,160;"I think that was his way of trying to set the tone for what this locker room"
24:16,160;24:19,800;"was going to be, which I think still holds today. He has, I mean, he's created"
24:19,800;24:24,660;"that core now that doesn't change as much, because he got braided it's there the whole"
24:24,660;24:30,040;"time. But that was his kind of method from the get go was to fill that culture of accountability"
24:30,040;24:35,480;"and bringing in the guys who knew what they were doing to help the young team kind of"
24:35,480;24:36,480;"gel a little bit."
24:36,480;24:42,840;"And if you didn't know that, just watch this first game because the commentators wouldn't"
24:42,840;24:48,200;"get off that topic for basically the whole third quarter when the pages stopped playing"
24:48,200;24:49,200;"football."
24:49,200;24:53,120;"Well, it's interesting too, because a lot of the guys are older guys."
24:53,120;24:57,520;"Like you said, veterans and their, you know, they had a little veterans."
24:57,520;24:58,520;"Right."
24:58,520;25:00,320;"They have a little bit of like a chip on their shoulder."
25:00,320;25:05,800;"They had an attitude, which is interesting because it fit with the Bella check type attitude."
25:05,800;25:10,000;"It wasn't like this arrogant type thing, but like Brian Cox, I remember he was like flipping"
25:10,000;25:12,760;"people off and then he became a patriot, you know?"
25:12,760;25:13,760;"Yeah."
25:13,760;25:14,760;"I was trying to bring up."
25:14,760;25:18,320;"have like an entire like neck roll on his shoulder."
25:18,320;25:19,320;"Oh my god."
25:19,320;25:21,480;"That went like almost above the back of his helmet."
25:21,480;25:23,400;"It was awesome."
25:23,400;25:27,960;"Looked like the headrest for your car seat."
25:27,960;25:29,760;"It was awesome."
25:29,760;25:30,400;"So all right."
25:30,400;25:33,520;"And oh, the one last thing that they kept harping on too"
25:33,520;25:36,160;"was that this season they had replacement referees, which"
25:36,160;25:37,760;"I did not remember."
25:37,760;25:39,080;"Yeah, I do remember that."
25:39,080;25:41,600;"And we lasted like I think three weeks or the first two"
25:41,600;25:42,760;"weeks."
25:42,760;25:43,260;"Yeah."
25:43,260;25:46,260;"I mean, that doesn't surprise me considering what happened after week one."
25:46,260;25:51,220;"But yeah, it was kind of when I was reading the papers leading up to it."
25:51,220;25:54,020;"And afterwards it like half the articles are about these replacement"
25:54,020;25:56,140;"refs and how they did and how they were going to do."
25:56,140;25:59,300;"And every time they made a call in the fields like, Oh, these"
25:59,300;26:01,380;"replacement refs look like real referees."
26:01,380;26:01,980;"Okay."
26:01,980;26:04,820;"Now, then that happened like a couple of years ago as well."
26:04,820;26:05,500;"Am I mistaken?"
26:05,500;26:05,860;"It did."
26:05,860;26:06,180;"Yeah."
26:06,180;26:09,500;"Because it doesn't age of social media."
26:09,500;26:11,020;"So it was way magnified."
26:11,020;26:11,540;"Yeah."
26:11,540;26:12,100;"Right."
26:12,100;26:12,460;"Right."
26:12,780;26:16,020;"blown up because they they miscalled a Hail Mary for"
26:16,020;26:19,920;"Seattle, the screen base packers game, right?"
26:19,920;26:23,260;"Yep. And one call is incomplete, one call to catch."
26:23,260;26:26,020;"And they have the picture of one guy waving it off and one guy with his hands up."
26:26,020;26:31,820;"So so the NFL still hasn't learned their lesson from 20 years ago, I guess."
26:31,820;26:35,300;"No, yeah, I'm sure we'll have that coming up soon again, whatever the next"
26:35,300;26:36,740;"NBA is for them."
26:36,740;26:41,180;"All right. So yeah, let's finally get to this game."
26:41,300;26:52,540;"Um, this was a week one of the 2001 season, like we said, again, it was in Cincinnati against the Bengals who the year before had not done well."
26:52,540;26:57,980;"They were, uh, I think that four and 12 or something like that."
26:57,980;26:59,060;"Something, something real bad."
26:59,060;27:06,660;"Yeah, they're four and 12 year before, but their only real contributor, especially on offense was Corey Dillon."
27:07,940;27:12,320;"Like the only two names I recognized from the Bengals roster other than John Kittner."
27:12,320;27:16,360;"And I didn't recognize that for a good reason was Corey Dillon and Ticchio"
27:16,360;27:16,880;"Spikes."
27:16,880;27:19,100;"Peter Walker."
27:19,100;27:21,060;"I remember him and he was pretty good in this game."
27:21,060;27:22,240;"Yeah, that's true."
27:22,240;27:24,080;"I I vaguely remember his name."
27:24,080;27:28,640;"I don't remember him being as good as he was being hyped up to be, but the man"
27:28,640;27:31,480;"made some quality catches in this game, the very least."
27:31,480;27:31,980;"Yeah."
27:31,980;27:33,160;"That one hand to grab a suite."
27:33,160;27:33,500;"Yeah."
27:33,500;27:34,600;"Oh, that was Darnay Scott."
27:34,600;27:34,940;"Sorry."
27:34,940;27:35,480;"That wasn't."
27:35,480;27:35,960;"Oh, yeah."
27:35,960;27:37,560;"Darnay Scott's legit."
27:37,560;27:42,560;"Yeah, yeah. For some reason, I always had Darnay Scott in my head as a quarterback."
27:42,560;27:46,160;"And I don't know why. I don't know who I'm confusing him with, but it was someone like"
27:46,160;27:47,160;"that."
27:47,160;27:50,760;"When Chad Johnson was on their team, but he didn't play at all."
27:50,760;27:55,220;"Yeah, because this was his rookie season. And so the right, the commentators made some"
27:55,220;27:58,360;"comment about how he looked good in preseason and they were excited to see what he could"
27:58,360;28:04,640;"do. I don't think they quite understood what they had on that. But yeah, speaking of the"
28:04,640;28:09,640;"commentators, I thought that was quite a quality crew for such a game that was"
28:09,640;28:14,200;"probably not touted to be a like one of the A list games."
28:14,200;28:19,040;"It was just Johnson back in the day who makes everything sound really exciting."
28:19,040;28:22,560;"I didn't think Brent Jones added much, but Sam Wiesch,"
28:22,560;28:27,480;"the old coach of the Cincinnati Bengals actually did a, I thought a really good job."
28:27,480;28:31,400;"Well, I thought that other guy sounded like Tony Romo a little bit."
28:31,400;28:33,560;"Which are like, I Brent Jones."
28:33,960;28:34,960;"Yeah."
28:34,960;28:35,960;"Really?"
28:35,960;28:37,320;"I was like, Tony Romo?"
28:37,320;28:37,760;"No."
28:37,760;28:41,040;"I didn't catch that."
28:41,040;28:45,040;"But yeah, I thought like Sam, why is he kind of had that like you could tell he"
28:45,040;28:51,800;"just came from coaching because he was all about like calling out the players"
28:51,800;28:53,560;"who were getting away with penalties and stuff like that."
28:53,560;28:59,400;"Like he caught some guy, some offensive lineman holding twice on one play."
28:59,400;29:00,880;"Like, I don't know how he got away with one."
29:00,880;29:01,280;"Never mind."
29:01,280;29:02,280;"Two of them."
29:02,280;29:02,960;"It was all up and on."
29:02,960;29:05,420;"Jeff, Jeff members Brent Jones from his playing days."
29:05,420;29:09,740;"Yeah, Brent Jones was a 49ers tight end, I believe."
29:09,740;29:12,040;"He was like Steve Young's goat to."
29:12,040;29:12,600;"Yeah."
29:12,600;29:12,800;"Yeah."
29:12,800;29:13,140;"Yeah."
29:13,140;29:18,820;"Because they had some, uh, they had some banter halfway through, uh, because"
29:18,820;29:23,320;"Brent Jones is 49ers actually beat Sam Wiesz's bangles in the Super Bowl."
29:23,320;29:27,540;"And so Sam Wiesz's comment was something along the lines of, yeah, they beat us"
29:27,540;29:29,140;"because we couldn't cover their tight ends."
29:30,180;29:33,340;"I don't know if that was actually true or not, or if he was just pandering to his audience."
29:33,340;29:40,860;"But to your point, after watching some of the 2000s and I mean, I didn't realize"
29:40,860;29:47,700;"that there is such a difference in sort of level of quality between teams, but the"
29:47,700;29:51,140;"announcing unit was pretty on point on this one."
29:51,140;29:52,020;"Yeah."
29:52,020;29:56,740;"I was surprised because usually, because yeah, I watched some of the 2000 games too."
29:56,740;30:01,860;"And you had some, I don't know, Dan Kricky and who was the other guy that did them with"
30:01,860;30:06,460;"them and they were just not, not the top crew."
30:06,460;30:12,340;"I don't think it's kind of like getting Dan Deodor if these days or someone like that."
30:12,340;30:17,540;"I don't even think he's doing it anymore, but just those."
30:17,540;30:20,700;"Oh, no, who did the last recent Patriots game?"
30:20,700;30:23,420;"It was a iron eagle and Dan Fouts."
30:23,420;30:24,220;"Yeah."
30:24,220;30:25,620;"It's like getting that crew."
30:25,620;30:25,980;"Yeah."
30:25,980;30:29,020;"because we're about all Scotty's old act. Do you like him?"
30:29,020;30:35,020;"I like to go though, but only because he's such a huge Homer. I kind of enjoy that,"
30:35,020;30:39,100;"especially because he's a local guy. I enjoy that same with like Gil and Gino back in the day."
30:39,100;30:43,980;"Was that a recap video just had just Gil and Gino? It was amazing."
30:43,980;30:50,300;"Yeah, all those are. Yeah, no, I love hearing those two call again because they were just kind of like"
30:52,620;30:56,180;"That was like the history for me is hearing their voices."
30:56,180;30:56,660;"Oh, yeah."
30:56,660;31:01,660;"Mom used to mute the TV and then put the radio underneath it and be on Jana."
31:01,660;31:06,300;"I'm pretty sure that's where we got our hatred of TV commentators, actually, was"
31:06,300;31:09,540;"from she would yell at the TV with the best of them."
31:09,540;31:15,900;"Some other general things about this game that I found interesting was"
31:15,900;31:17,540;"that extra points still from the one you had line."
31:17,540;31:21,300;"And yet there were people that still almost missed them."
31:21,300;31:27,900;"And the fans in Cincinnati in this game were like super hard."
31:27,900;31:30,620;"It was amazing."
31:30,620;31:34,100;"Yeah, those a whole bunch of mustaches."
31:34,100;31:41,540;"It's almost like the 80s hadn't left Cincinnati yet in 2001, but they had the hard hat, but"
31:41,540;31:42,940;"with the colors."
31:42,940;31:44,740;"It was beautiful."
31:44,740;31:45,740;"All right."
31:45,740;31:47,940;"Let's see what else we get here."
31:47,940;31:49,380;"Let's do like best and worst."
31:49,380;31:50,380;"I got a good worst."
31:50,380;31:51,380;"All right."
31:51,380;31:52,660;"Well, yeah."
31:52,660;31:58,100;"Is there anything else you want to touch on before we do that?"
31:58,100;32:01,380;"I mean, there is quite a bit on here."
32:01,380;32:05,060;"I mean, it was such a--"
32:05,060;32:06,780;"I mean, nothing really happened in this game."
32:06,780;32:09,740;"It was one of the more boring games I've ever watched."
32:09,740;32:13,700;"But there are--"
32:13,700;32:15,220;"you see certain signs of things."
32:15,220;32:19,660;"I mean, you saw the toughness of the team"
32:19,660;32:22,740;"in the first half, I mean, it kind of like gave up in the second half, but"
32:22,740;32:26,500;"Bletso was slinging it, taking the hits as usual."
32:26,500;32:32,620;"And he had just signed a contract that was supposed to basically be his career"
32:32,620;32:35,180;"contract where he was supposed to retire in New England."
32:35,180;32:37,420;"Um, and that he was just coming off of that."
32:37,420;32:41,900;"So he was sort of supposed to be the savior of the, uh, the franchise at that"
32:41,900;32:42,260;"point."
32:42,260;32:43,540;"Yeah."
32:43,540;32:46,860;"I actually wrote down the, the comment that the commentator said it said, uh,"
32:47,260;32:54,100;"Oh, here's Drew blood. So they signed a multi-million he signed a multi-year multi-million dollar contract that should keep him a patriot through the end of his career."
32:54,100;32:54,780;"Yep."
32:54,780;32:57,980;"Week one of the two years."
32:57,980;32:59,260;"Yeah."
32:59,260;33:05,180;"Well, it's crazy because they also said that he was the second second longest with the team."
33:05,180;33:07,780;"Probably have like active players and far was number one."
33:07,780;33:09,540;"He was out like nine years."
33:09,540;33:11,060;"So you look at Brady now."
33:11,060;33:12,620;"He's going on 20."
33:12,620;33:14,780;"I mean, that's just unheard of."
33:14,780;33:16,340;"It really is."
33:16,340;33:25,140;"Yeah, 20 years in the league is for a non kicker is out of control, but they have all"
33:25,140;33:27,860;"those with the same team is even more so."
33:27,860;33:36,900;"Because even Brett Farve, who's like the poster child of longevity, how many teams did he"
33:36,900;33:37,900;"end up playing for?"
33:37,900;33:38,900;"Three at the end of the day?"
33:38,900;33:42,060;"Because it was most of it with the Packers."
33:42,060;33:43,060;"And then the gym."
33:43,060;33:44,060;"Yeah, and the Vikings and my guests."
33:44,060;33:45,060;"Yeah."
33:45,060;33:46,060;"I think that was it, right?"
33:46,060;33:51,980;"you know well actually he was with the Falcons oh yeah originally he was"
33:51,980;33:57,820;"trapped yeah yeah yeah even just guys man crushes ended up going somewhere else"
33:57,820;34:05,620;"like Montana went to the Chiefs yeah Steve younger he started it with Tampa"
34:05,620;34:08,820;"I wanted to say he went to the hospital, but that would be"
34:08,820;34:16,660;"Yikes"
34:16,660;34:25,500;"Yeah, I think that just just touching on Drew blood so again he"
34:25,500;34:32,660;"I was surprised at how mobile he was because in the few couple of games that I watch of the 2000 season and then this game"
34:33,260;34:37,560;"He was not afraid to take off which was surprising because he was like six eight"
34:37,560;34:42,280;"180 pounds like it was not a massive dude. He just kind of tall gangly guy"
34:42,280;34:47,460;"But he was not afraid to like take off and try to lower the boom on people which you know"
34:47,460;34:51,820;"Let's see how that comes back to bite him. Well, that was the other thing though"
34:51,820;34:56,080;"It's like throughout the game and I think throughout the 2000 season from what I saw"
34:56,080;35:01,060;"Every announcer pointed out man. I don't know if the coach likes him doing this. Oh man"
35:01,060;35:07,200;"I don't know how long you gonna stay in there. So I mean obviously foreshadowing but it happened every game"
35:07,200;35:10,580;"which I mean you can say it's a lines fault but"
35:10,580;35:15,140;"Bletzel, I don't know man like he held the ball on"
35:15,140;35:22,420;"Hold on for a little too long. He I mean those rollouts didn't help the across the body across the field"
35:22,420;35:27,860;"I mean so I don't know if it's his fault or the old lines fault or they didn't have receivers or what but it was"
35:27,860;35:29,960;"awful to watch"
35:29,960;35:37,000;"Yeah, it felt like at least early in the 2000 season that I watched a lot of it was the O-lines fault"
35:37,000;35:38,760;"but I think"
35:38,760;35:41,600;"There's equal blame to go around because he would like"
35:41,600;35:48,440;"Double clutch or even triple clutched on some players if his first guy was no open it took him a while to go through his progressions and"
35:48,440;35:54,080;"Because the roll line wasn't stellar. I think led to a lot of sacks"
35:54,080;35:59,560;"But it wasn't just their fault either right he kind of"
35:59,560;36:05,780;"of, seem like there's always one of those plays where he's falling down and he's just"
36:05,780;36:10,380;"kind of hucking the ball up without looking at where it's going and you just kind of pray"
36:10,380;36:13,360;"that it's not an interception because everyone's in a while it would be."
36:13,360;36:16,600;"Wow. I hope you guys watch this game all the way through because right at the end there's"
36:16,600;36:22,560;"a guy wearing a gigantic furry bengals head like a cat head."
36:22,560;36:28,720;"I miss that one. I watched all that too but I don't remember seeing that. Oh yeah. I think"
36:28,720;36:31,720;"Towards the end of the fourth quarter I was kind of hoping this game would just end"
36:31,720;36:39,760;"Yeah, I kind of felt like that. I mean they made it competitive at the end somehow I have no idea how but"
36:39,760;36:42,960;"It was a pretty pretty rough one"
36:42,960;36:45,720;"I mean I'm looking at you know from the Bengals perspective"
36:45,720;36:49,320;"You have Corey Dylan who's just like a monster and it was like great to see that"
36:49,320;36:52,800;"I don't know why they didn't need more but that's a thing. Yeah"
36:52,800;36:57,000;"You look at like our running backs. I'm looking at it like"
36:57,920;37:03,240;"Redman Antoine Smith and Kevin Faulk and Kevin I think Antoine Smith or maybe Kevin five"
37:03,240;37:08,680;"I don't remember one of those was the top pressure with 33 yards. So I mean pretty awful all around"
37:08,680;37:15,600;"I'd say I I was surprised how much they were trying to get their full-back mark Edwards involved"
37:15,600;37:17,800;"Like yeah, like"
37:17,800;37:20,360;"Throwing screens to them"
37:20,360;37:22,440;"That's my worst"
37:22,440;37:27,120;"The second half first drive was three plays calling Mark Edwards number."
37:27,120;37:30,840;"First down and it's like, oh, well, that didn't work."
37:30,840;37:31,440;"Duh."
37:31,440;37:32,920;"That's shocking."
37:32,920;37:34,800;"I love that guy."
37:34,800;37:39,320;"You use, uh, I mean, yeah, he's basically Devlin now, I think."
37:39,320;37:41,840;"Maybe you touched them all a little bit more, but same guy."
37:41,840;37:42,040;"Yeah."
37:42,040;37:48,920;"I think he's Devlin, but without the, um, town around him on offense to, um,"
37:48,920;37:50,200;"to take away his touches."
37:50,200;37:51,920;"Oh, yeah."
37:51,960;37:52,460;"Okay."
37:52,460;37:53,460;"That makes sense."
37:53,460;37:55,560;"All right, guys, I got a roll soon."
37:55,560;37:56,360;"All right."
37:56,360;37:58,300;"Hey, wait, we still have so much to do."
37:58,300;37:59,060;"Hold on a second."
37:59,060;37:59,560;"Yeah."
37:59,560;38:02,960;"We asked him to stack two cells then."
38:02,960;38:04,580;"You guys can talk to yourselves because you guys"
38:04,580;38:06,000;"are doing a great job of that."
38:06,000;38:07,160;"That's why I just give me--"
38:07,160;38:09,040;"Steve, just give me your best and worst."
38:09,040;38:11,560;"And I'll cut it in where it needs to go."
38:11,560;38:15,520;"Well, you heard my worst of starting the second half"
38:15,520;38:16,920;"and just dishing the ball tomorrow."
38:16,920;38:19,080;"OK, where it's over and over again."
38:19,080;38:21,320;"Yeah, that was a surprising play call."
38:21,320;38:23,800;"But what are you going to do?"
38:23,800;38:24,360;"I guess."
38:24,360;38:25,840;"I'm liable."
38:25,840;38:26,400;"Yeah."
38:26,400;38:28,760;"What was your best?"
38:28,760;38:30,800;"Actually, honestly, watching Corey Dillon"
38:30,800;38:32,520;"and just getting a sneak preview of what he's going to do"
38:32,520;38:33,720;"in the Patriots."
38:33,720;38:34,240;"That's true."
38:34,240;38:34,680;"Yeah."
38:34,680;38:35,160;"Yeah."
38:35,160;38:39,280;"I mean, he looked apart that he could--"
38:39,280;38:41,120;"he was fast and he was strong."
38:41,120;38:41,640;"And he don't--"
38:41,640;38:43,080;"He's fast, or a big guy."
38:43,080;38:43,920;"Yeah."
38:43,920;38:45,880;"Yeah."
38:45,880;38:49,040;"All right, cool."
38:49,040;38:49,440;"All right."
38:49,440;38:50,680;"Come on, it means good night."
38:50,680;38:51,520;"All right."
38:51,520;38:52,340;"Take it."
38:52,340;38:53,000;"But yeah."
38:53,000;38:56,880;"All right."
38:56,880;38:59,240;"Well, now he's gone."
38:59,240;39:01,280;"No, real real podcast."
39:01,280;39:01,960;"Oh, boy."
39:01,960;39:04,400;"That was awkward."
39:04,400;39:06,040;"And I thought he was."
39:06,040;39:07,280;"I thought he was gone too."
39:07,280;39:09,560;"And I was going to see some nasty stuff."
39:09,560;39:10,640;"No, I didn't hear the beat."
39:10,640;39:11,160;"I got it."
39:11,160;39:12,640;"Didn't."
39:12,640;39:12,840;"All right."
39:12,840;39:13,340;"Now."
39:13,340;39:17,560;"All right."
39:17,560;39:19,680;"Now he's actually gone."
39:19,680;39:21,000;"Are you lying or?"
39:21,000;39:25,920;"No, I just saw his name drop off the participants list."
