Start Timestamp;End Timestamp;Transcript
41:40,080;41:44,240;"amazing. A 20 yard punt. It made it to like midfield."
41:44,240;41:48,800;"Yeah, that that bounce backwards like it hit the four like it hit like the 45 and bounce"
41:48,800;41:55,680;"backwards to the 40. Yeah. And it was that that would be topped by another punt from Brian"
41:55,680;42:01,680;"Mormon from his from the 50 yard line and made it to the 35. That's a 50 yard part."
42:01,680;42:13,200;"It was pretty awesome. He averaged his yards per punt. On the day he averaged 27.2 yards per"
42:14,800;42:20,200;"average that is amazing. I mean, what was wrong with them?"
42:20,200;42:29,440;"Most of the puns were into the way like it was a super windy game. And so it seemed like all of"
42:29,440;42:36,960;"his puns were towards the open end of the stadium. And like they were all really, really bad."
42:36,960;42:41,840;"Because because the first one he did, he did a line drive one. And it went 28 yards in Troy"
42:41,840;42:44,840;"Brown returned it for 32 or something like that."
42:44,840;42:48,840;"So we didn't try that again, but he kicked them straight up and they just hung."
42:48,840;42:50,840;"Oh, Brian."
42:50,840;42:51,840;"Yeah."
42:51,840;42:53,840;"Not great."
42:53,840;42:57,840;"Five puns, 136 yards average, 27.2."
42:57,840;43:00,840;"You know, that's what happens in six seasons, you know?"
43:00,840;43:02,840;"Yeah."
43:02,840;43:05,840;"I mean, they're hunting into the wind as they say."
43:05,840;43:06,840;"Yep."
43:06,840;43:09,840;"You think like that they would try some kind of different technique."
43:09,840;43:15,240;"something it was pretty rough every time but they just kept going for it."
43:15,240;43:23,920;"Yeah, it wasn't great. But I mean the kicking game in general was awful. They showed some"
43:23,920;43:30,840;"stat about Adam Minnitary kicking against the Bills and how bad he is. He was like a"
43:30,840;43:37,320;"70 or 80 percent kicker normally but in this game against the Bills he was like 50 something"
43:37,320;43:42,180;"percent field goal percentage, which is kind of strange."
43:42,180;43:43,800;"Oh, here it is."
43:43,800;43:47,800;"Vititary is 43 for 54 for 79.6%."
43:47,800;43:52,000;"So almost 80% on field goal attempts, which I love you is like a lot better at"
43:52,000;43:57,420;"this point than that, but yeah, that says his one week has been the bills against"
43:57,420;44:01,400;"whom he's managed only 58.3% field goal percentage."
44:01,400;44:03,000;"And he missed another one in this game."
44:03,000;44:04,120;"He missed two."
44:04,120;44:05,520;"He missed both of his field goals."
44:06,560;44:09,440;"So over to a field goals hit all three of his extra points."
44:09,440;44:11,720;"I think you just blame the wind in general."
44:11,720;44:15,940;"It looked like a bite like a couple of deep balls hung to and did some weird shit."
44:15,940;44:21,120;"So this was one of those old Foxboro games where the wind actually"
44:21,120;44:24,200;"mattered as opposed to here."
44:24,200;44:27,040;"Now where they say it matters, but you never really see it actually."
44:27,040;44:27,880;"Take it back."
44:27,880;44:29,240;"You're absolutely right though."
44:29,240;44:34,360;"That like most everyone had a crap game."
44:34,720;44:41,400;"I'm looking at Brady's numbers and he was 15 for 21, which isn't bad for a hundred seven yards. Yeah, to touch down interception."
44:41,400;44:45,160;"Kevin Falk was the leading receiver with 29 yards."
44:45,160;44:55,360;"He did good. Yeah, the run game was solid, you know, 24 102 touchdowns. That's what you want."
44:55,360;45:02,680;"It is. But I think that was also skewed by the run at the end. The big was it 40 something yard run."
45:03,040;45:04,040;"That's true."
45:04,040;45:05,040;"He's left."
45:05,040;45:06,040;"He's left."
45:06,040;45:08,040;"He was breaking tackles."
45:08,040;45:09,040;"Oh, yeah."
45:09,040;45:11,280;"Well, because that's the thing."
45:11,280;45:17,760;"Let's talk about Antoine Smith too, because he was a former Buffalo Bill and in '98, he'd"
45:17,760;45:23,320;"actually run for 1,100 yards and eight touchdowns."
45:23,320;45:27,360;"And then they got a new, I think offensive coordinator head coach or something like that"
45:27,360;45:29,040;"whole new system."
45:29,040;45:37,440;"And basically they said, like the common taste, we're saying that the new, yeah, he ran for"
45:37,440;45:42,560;"it. The new coach just basically didn't like him. So it just stopped playing him. So then"
45:42,560;45:48,040;"he ran for 600 yards in 99 and 300 yards in 2000."
45:48,040;45:55,480;"Who was Rob Johnson blowing in that front office? And we got in front of both studs."
45:55,480;45:58,600;"Yeah, is that a football question or not football question?"
45:58,600;46:01,000;"Both."
46:01,000;46:01,840;"Yeah."
46:01,840;46:08,040;"Yeah, I mean, he spent, I didn't want to spend it like the entire week before and"
46:08,040;46:12,120;"all the post games and how this wasn't like a revenge game."
46:12,120;46:15,800;"He's not angry at anybody because the people that gave up on him weren't even"
46:15,800;46:17,760;"there anymore, like coach wise and stuff."
46:17,760;46:22,040;"But he still was running like he was pissed off."
46:22,080;46:26,120;"Well, I think this is the hardest I've seen him run so far this season."
46:26,120;46:29,640;"And he's still got like clearly got a ton left in the tank too."
46:29,640;46:31,000;"I mean, oh, yeah."
46:31,000;46:35,080;"I can say we know that now, but why would you give up on a guy like that?"
46:35,080;46:37,920;"The same reason you give up on a guy like Doug Flute."
46:37,920;46:39,840;"Yeah."
46:39,840;46:40,280;"Yeah."
46:40,280;46:45,280;"I mean, I was in the soul and imagine like you're you're taking over a team."
46:45,280;46:47,160;"You kind of want you to put your stamp on it."
46:47,160;46:50,040;"Like I know a lot of guys want to distance themselves from like anybody"
46:50,040;46:52,360;"that the DM put in place beforehand."
46:52,360;46:55,160;"So it's probably a situation where you just want to do"
46:55,160;46:57,680;"his own guys and to prove a point, whatever."
46:57,680;46:59,800;"- Yeah, that's a good point."
46:59,800;47:01,280;"- Yeah."
47:01,280;47:02,640;"You gotta agree with that."
47:02,640;47:04,400;"- Bullshit though, you know?"
47:04,400;47:05,240;"- Yeah."
47:05,240;47:06,560;"- It is, I mean, yeah."
47:06,560;47:07,640;"- Yeah, I'll be,"
47:07,640;47:09,320;"play to the talent that you have."
47:09,320;47:12,640;"I mean, look at what they've done with the Ravens this year."
47:12,640;47:13,480;"It's like,"
47:13,480;47:14,640;"- Right."
47:14,640;47:16,400;"- You have a running quarterback that can do things"
47:16,400;47:18,640;"like that, build the system around them."
47:18,640;47:19,680;"- Right, yeah."
47:19,680;47:25,040;"much ego. Yeah. Like these numbers, like even riding the bench, like they weren't horrible."
47:25,040;47:31,840;"So I mean, to your point, they probably should have trusted them with the football a little"
47:31,840;47:39,880;"bit more. We should be coaches. I think so. I mean, I'm in line for the Belichick position"
47:39,880;47:41,960;"whenever he wants to give that up."
47:41,960;47:47,040;"Well, you know, positional coach type of guy might, you know, well, I don't know. I mean,"
47:47,040;47:51,280;"I'm low and they give it a shot, but I'm not freaking waiting around 20 more years to accept the job."
47:51,280;47:51,840;"Believe me."
47:51,840;47:53,840;"He's you strike me as a punters coach."
47:53,840;47:55,160;"Yeah, man."
47:55,160;47:58,200;"Joe judge special teams guy."
47:58,200;47:59,680;"Head coach of the giant."
47:59,680;48:02,480;"See, so there is an avenue there, guys."
48:02,480;48:05,960;"Mike, Mike, how are you going to be a coach when you don't even know what's football and not?"
48:05,960;48:09,760;"That's a damn it."
48:09,760;48:10,320;"You're right."
48:10,320;48:15,120;"Speaking of not knowing their football."
48:16,520;48:21,380;"Uh, I thought like we were talking about everybody not having a great game."
48:21,380;48:23,600;"Uh, Brady's play at the end."
48:23,600;48:26,440;"Well, we're talking about the end already."
48:26,440;48:31,760;"Cause man, I mean, there's just like a lot of shit football every quarter."
48:31,760;48:35,120;"I don't know if you've noticed, but we are all over the fucking place this week."
48:35,120;48:37,640;"So yeah, I'm going to jump to the end and we can jump back later."
48:37,640;48:38,000;"Don't worry."
48:38,000;48:38,440;"All right."
48:38,440;48:39,200;"Fair enough."
48:39,200;48:39,840;"Fair enough."
48:39,840;48:44,860;"Cause I wanted to point out Brady's, uh, kind of very unbrady, like rookie"
48:44,860;48:46,460;"mistake at the end there."
48:46,460;48:52,220;"Pats up by two scores and they're running the ball with"
48:52,220;48:53,220;"relative ease."
48:53,220;48:56,180;"And for some reason the paths start calling like play action"
48:56,180;48:58,340;"passes when they have no reason to."
48:58,340;49:03,620;"And so Brady fixed play action rolls to his right."
49:03,620;49:06,300;"And there's a defender like in his face."
49:06,300;49:11,300;"He tries to like I want to say he was trying to juke."
49:12,940;49:16,020;"But if you've seen Tom Brady run, you can kind of imagine what that looks like."
49:16,020;49:17,860;"And so he does it."
49:17,860;49:23,140;"And the, the, the defensive end just kind of slaps the ball out of his hand and then"
49:23,140;49:29,280;"kicks it 20 yards backwards and the bills end up recovering it and scoring a"
49:29,280;49:33,820;"touchdown like two plays later to make the game uncomfortably close."
49:33,820;49:34,740;"Yeah."
49:34,740;49:38,820;"Let's say it was a learning experience for Brady this game because it was pretty"
49:38,820;49:39,820;"awful throughout."
49:40,780;49:44,520;"But I don't know if it's entirely his fault because"
49:44,520;49:50,860;"they there was I think six sacks on them by the time the fourth quarter started."
49:50,860;49:51,520;"Yep."
49:51,520;49:57,260;"So and I think in the by half he was sacked like four or five times."
49:57,260;50:01,100;"So I don't think he's been pressured like that this season."
50:01,100;50:01,540;"Yeah."
50:01,540;50:04,500;"He was well other than the Miami Dolphins game."
50:04,500;50:05,180;"Oh, sure."
50:05,180;50:05,700;"Yeah."
50:05,700;50:09,500;"Had that almost exact play where Brady Fumble the snap."
50:09,500;50:15,460;"And then the, the, was a, the right guard did a beautiful back heel to kick it back 20"
50:15,460;50:17,860;"yards at the, the dolphins are covered for a touchdown."
50:17,860;50:18,260;"Yeah."
50:18,260;50:20,060;"He was sacked seven times in this game."
50:20,060;50:21,100;"Seven man."
50:21,100;50:22,500;"And yeah, he fumbled twice."
50:22,500;50:23,500;"He had the pick."
50:23,500;50:25,340;"Yeah."
50:25,340;50:28,940;"And the bills, the bill for the backs were sacked five times."
50:28,940;50:34,060;"So this was not an offensive display by any stretch of the imagination."
50:34,060;50:35,100;"Well, right."
50:35,100;50:39,180;"And I believe, I believe every year in sack to drop back ratio."
50:39,300;50:42,140;"I guess who did Rob Johnson."
50:42,140;50:43,500;"Yeah, I can see it."
50:43,500;50:44,000;"Yeah."
50:44,000;50:47,540;"I don't know the Brady's decisions at the end, though,"
50:47,540;50:52,140;"like you were saying, I wouldn't say that this game was a blowout"
50:52,140;50:54,220;"because they were up by it."
50:54,220;50:58,220;"Whoa, was it like 14, whatever it was like less than two touchdowns?"
50:58,220;50:59,340;"Fourteen three."
50:59,340;51:00,660;"Fourteen three."
51:00,660;51:05,740;"And then after that play, yeah, Pulitzer's price got the touchdown."
51:05,740;51:08,580;"So it's 14 11 after a two point conversion."
51:08,580;51:13,480;"And so yeah, that one decision made it a close game, even though it shouldn't have been to"
51:13,480;51:16,720;"your point, they should they could have just run the timeout and I don't know why they"
51:16,720;51:21,240;"were getting all cute and fancy, but yeah, that's what I was wondering is like, I mean,"
51:21,240;51:25,160;"you still on a rookie quarterback who's been sacked seven times."
51:25,160;51:31,200;"Well, probably six times, I suppose that probably counted as a sack, the fumble."
51:31,200;51:34,760;"Why are you having him roll out on a bootleg?"
51:34,760;51:39,760;"And the bills, they went for an on-side kicking, almost got it."
51:39,760;51:45,320;"It was recovered by our very own, unlike Vrayble."
51:45,320;51:46,160;"- Yes."
51:46,160;51:50,640;"- You know, sore spot right there, but yeah,"
51:50,640;51:51,720;"they almost got the on-side kick."
51:51,720;51:53,280;"So if they got it, this would have been"
51:53,280;51:55,000;"potentially a different game."
51:55,000;51:58,600;"And yeah, we're not, even at this point,"
51:58,600;52:01,920;"I don't think we were used to seeing Brady make,"
52:01,920;52:04,040;"you know, these decisions."
52:04,040;52:09,040;"So it was interesting to, I'm sure you saw some of this,"
52:09,040;52:11,200;"but in reading some of the articles,"
52:11,200;52:14,880;"'cause now there's about 50,000 articles written every game"
52:14,880;52:17,480;"that we have to sift through during this time."
52:17,480;52:20,760;"But they were talking to him about it."
52:20,760;52:22,360;"And he did say that it was a learning experience."
52:22,360;52:25,200;"And it was, I think the first time where he was coming off"
52:25,200;52:27,400;"a little bit more humble than like confident,"
52:27,400;52:32,640;"which was, I think probably good for this moment in the season."
52:32,640;52:34,880;"- Yeah, the quote that I wrote down was,"
52:34,880;52:37,120;"you'd like to play great every,"
52:37,120;52:38,120;"this is Tom Bray talking,"
52:38,120;52:39,440;"you'd like to play great every week,"
52:39,440;52:42,800;"but I'm finding out that's not always the case in this league."
52:42,800;52:44,160;"- Yeah, so that was a little different"
52:44,160;52:45,840;"than what we've heard before."
52:45,840;52:48,080;"- Yeah, oh yeah."
52:48,080;52:50,360;"And then in that same article was the quote,"
52:50,360;52:52,120;"yesterday certainly was an education"
52:52,120;52:54,400;"in adversity for the second year novice."
52:54,400;52:57,040;"He learned he could overcome a rash of misadventures."
52:57,040;52:58,760;"He completed 15 of 21 passes,"
52:58,760;53:01,120;"but they travel only 107 yards."
53:01,120;53:05,760;"as long as connection was a 38 yard to Anne Juan Winfield of Buffalo."
53:05,760;53:08,160;"Yeah, that's pretty rough."
53:08,160;53:16,040;"And again, it's pretty amazing though that Dollar Check stuck with him because I don't know."
53:16,040;53:19,960;"I mean, we saw what stid him, you know, he throws one pick six and, you know, he, you know,"
53:19,960;53:20,760;"replays again."
53:20,760;53:26,720;"So, you know, and this is right around the time that Bledso was starting to come back."
53:26,720;53:30,560;"Um, I think we were expecting him to be ready the next week."
53:30,560;53:35,560;"So the fact that Brady won that amazes me looking back on it."
53:35,560;53:37,760;"Yeah, I'm a little sub..."
53:37,760;53:40,960;"It almost makes you feel like the situation is different."
53:40,960;53:46,160;"I mean, I don't know if things would have been different"
53:46,160;53:50,080;"if say Jimmy Garoppolo had stayed healthy"
53:50,080;53:53,600;"for those first four games a few years ago."
53:53,600;53:55,600;"And if he had won all four of those games,"
53:55,600;53:57,680;"if you would have seen something similar."
53:58,720;54:00,720;"I don't know."
54:00,720;54:01,720;"Wow."
54:01,720;54:06,720;"Because it feels like a similar situation where you knew that the start is coming back."
54:06,720;54:12,720;"But if the guy that plays those first four games gets you to this point, I mean, obviously,"
54:12,720;54:14,720;"these are more than four games."
54:14,720;54:18,720;"But if he gets you to this point, and I think at that point,"
54:18,720;54:24,720;"Garoppolo was playing better than before he got hurt than Brady was playing here."
54:24,720;54:29,720;"playing here. So I'm not quite sure how that would work out. But yeah, you're right."
54:29,720;54:39,040;"Blood. So it was announced that he was cleared by the medical staff to play this the following"
54:39,040;54:44,240;"week here against the Rams coming up. So yeah, I'm assuming that's gonna be the whole next"
54:44,240;54:45,240;"week of."
54:45,240;54:46,240;"Bloods articles."
54:46,240;54:48,240;"articles"
54:48,240;54:50,400;"Terrible year. Yeah"
54:50,400;54:54,600;"Yeah, that's true. I mean and it was it wasn't it was a guy. I"
54:54,600;54:57,600;"Mean he had a lot of pics as usual"
54:57,600;55:02,560;"You know, I think I think the whole thing was that"
55:02,560;55:08,520;"Like the only thing that team had offensive would you bled so and he dragged them to five and eleven"
55:08,520;55:11,840;"Right I"
55:11,840;55:14,880;"Mean Belichick though. He's a decision-making"
55:15,360;55:23,300;"You know guy right so Brady Brady makes sound decisions for the most part great game manager at this point didn't make a lot of mistakes"
55:23,300;55:29,000;"but I mean obviously, you know he references Brady now is iconic in in"
55:29,000;55:34,160;"Boston and for the Patriots well Bledo was pretty iconic as well at the time"
55:34,160;55:37,520;"Oh, yes, so I don't know if it was the easiest decision"
55:37,520;55:42,400;"I mean again, it obviously helps because it was Parcel's guy not his own right"
55:43,320;55:48,120;"But yeah, it's your point. I mean, I wonder what would have happened with the Garoppolo thing"
55:48,120;55:53,400;"I mean obviously luckily it happened the way that it happened. They made another three Super Bowls, but"
55:53,400;55:56,480;"That's a good point. I don't know how it would have played out if"
55:56,480;55:58,640;"Bursett didn't"
55:58,640;56:05,280;"Jump in there. Mmm. All right. So anything anybody else have anything they want to touch on in this game"
56:05,280;56:12,400;"Other than that it was absolute crap. Yeah, it was a bit of a slog to get through"
56:12,400;56:14,560;"Oh, good thing I didn't watch it then."
56:14,560;56:18,760;"Way to break the fourth wall, Steve."
56:18,760;56:19,360;"I know."
56:19,360;56:20,120;"Thanks a lot."
56:20,120;56:20,120;"All right."
56:20,120;56:21,560;"And that case, that's the worst."
56:21,560;56:22,480;"Steve, did you?"
56:22,480;56:24,240;"Wait, wait, wait, wait, wait."
56:24,240;56:26,840;"Did you end up watching the highlights at least?"
56:26,840;56:28,560;"No, nothing."
56:28,560;56:29,240;"Not even did."
56:29,240;56:29,560;"All right."
56:29,560;56:30,520;"Good for you."
56:30,520;56:31,480;"OK, you know what?"
56:31,480;56:35,800;"The I actually found highlights because, well, I assume Greg wouldn't watch a game."
56:35,800;56:38,600;"So he proved me wrong."
56:38,600;56:39,240;"So thanks, Greg."
56:39,240;56:41,200;"I watched the first half."
56:41,200;56:42,200;"There you go."
56:42,200;56:46,760;"But the highlights I found were actually NFL prime time highlights."
56:46,760;56:48,280;"Yeah, I watch those too."
56:48,280;56:50,040;"Yeah, just in case."
56:50,040;56:51,160;"I love those."
56:51,160;56:59,360;"Dude, I will say on top of the bad play, obviously, there were so many flags on the"
56:59,360;57:01,680;"bills and Patriots."
57:01,680;57:04,160;"It was almost painful to sit through."
57:04,160;57:10,480;"I think the announcers were getting a little antsy too, but obviously not the Belichick"
57:10,480;57:17,480;"type of team and whatnot that we're used to, but so many on both sides."
57:17,480;57:20,920;"Like, so I obviously the the referees were shit or something."
57:20,920;57:22,480;"Yeah, they weren't great."
57:22,480;57:24,480;"I don't know, that was rough."
57:24,480;57:29,280;"I think like it'd be interesting to touch on some of the stuff that was going on around"
57:29,280;57:30,440;"this game as well."
57:30,440;57:35,480;"Some of the notes that he had Andy on Terry Glenn, I thought were pretty interesting."
57:35,480;57:36,480;"Yeah."
57:36,480;57:39,480;"Yeah, we're here we go."
57:39,480;57:47,160;"So this is still kind of in the peak Terry Glenn saga of will he ever play for the Patriots"
57:47,160;57:49,160;"again?"
57:49,160;57:57,960;"And the story that came out in kind of the aftermath of last week's game on Tuesday in"
57:57,960;58:03,120;"the Boston Globe was that Terry Glenn has depression."
58:03,120;58:08,500;"And it was, as a quote, ""is Glenn confirmed that chronic depression is the physical disability"
58:08,500;58:13,380;"cited as the reason the receiver was unable to take his mandated drug test at the appointed"
58:13,380;58:17,300;"time during the off season that tardiness earned glenna four game suspension at the"
58:17,300;58:21,580;"start of the season. That is not to be confused with the season long banishment bellow trek"
58:21,580;58:25,820;"jai twin pose when glam bolted from training camp because he felt the team wasn't being"
58:25,820;58:29,700;"supportive enough in his protest of the league sentence."
58:29,700;58:30,700;"Right."
58:30,700;58:35,140;"So now we get into like the whole like housewives of Orange County."
58:35,140;58:38,140;"Hey, I don't necessarily agree with that."
58:38,140;58:39,140;"You said it a bit."
58:39,140;58:41,140;"I could tell it in your voice."
58:41,140;58:43,140;"All right, give it to me then."
58:43,140;58:44,140;"Give me your side of this."
58:44,140;58:45,140;"Well, I don't know."
58:45,140;58:57,140;"It's tough because I feel like for them to be talking about depression, that was like almost like ahead of its time because you I didn't really hear this kind of stuff being talked about a sort of taboo back then."
58:57,140;59:03,140;"And for us to hear this, I mean, obviously he's putting it out there at the time, but"
59:03,140;59:08,580;"for us to hear this without like social media, there's definitely a stigma attached to it."
59:08,580;59:12,500;"Now, does he advance that, you know, lessening of the stigma?"
59:12,500;59:19,420;"I don't know because I don't know if he was using it to justify his, you know, his actions"
59:19,420;59:22,060;"to provide an excuse or if he was actually dealing with this."
59:22,060;59:25,820;"But we do know that he had, you know, substance issues."
59:25,820;59:29,060;"We see a little bit of that with Josh Gordon."
59:29,060;59:31,900;"And he hasn't necessarily described depression,"
59:31,900;59:35,260;"but I know that there's a lot of things"
59:35,260;59:39,380;"that go into addiction, depression, anxiety."
59:39,380;59:42,300;"And we're finding out a little bit more about that now."
59:42,300;59:45,340;"Even guys like Antonio Brown, where we're not quite"
59:45,340;59:47,540;"sure what's going on, he seems like he's just kind of show"
59:47,540;59:48,260;"boating."
59:48,260;59:50,340;"There could be something a little bit deeper,"
59:50,340;59:51,420;"a little bit of depression."
59:51,420;59:53,300;"Who knows?"
59:53,300;59:57,500;"But we do know that with Terry Glenn, it manifested in substance abuse."
59:57,500;01:00:02,380;"So maybe the way that he went about doing it wasn't the right way,"
01:00:02,380;01:00:08,340;"but I feel like the infrastructure wasn't in place for sure back then to help a"
01:00:08,340;01:00:10,060;"guy who's dealing with like problems."
01:00:10,060;01:00:15,220;"And like maybe I'm off base and maybe he was sort of like using that as a"
01:00:15,220;01:00:20,140;"crutch or like a reason to get because there was also a dispute where the"
01:00:20,140;01:00:22,580;"Patriots had paid them, I think $11 million,"
01:00:22,580;01:00:25,500;"and they were holding $8 million of a signing bonus"
01:00:25,500;01:00:27,060;"because of all this."
01:00:27,060;01:00:29,980;"And that was sort of his reasoning"
01:00:29,980;01:00:31,060;"for trying to combat that."
01:00:31,060;01:00:34,860;"So again, is it the Antonio Brown thing where it's like,"
01:00:34,860;01:00:36,100;"hey, I'm gonna blame everybody else."
01:00:36,100;01:00:38,300;"I'm gonna put my blames on this or that."
01:00:38,300;01:00:39,620;"I'm gonna want my money back."
01:00:39,620;01:00:41,980;"Or is it that he was actually dealing with that?"
01:00:41,980;01:00:44,620;"And it just seems like an excuse"
01:00:44,620;01:00:46,460;"because we didn't really like hear"
01:00:46,460;01:00:47,860;"that kind of stuff back then."
01:00:47,860;01:00:49,300;"- Right. And I think that's a criticism."
01:00:49,300;01:00:55,620;"not that whether or not he has chronic depression or anything like that, which I mean looking"
01:00:55,620;01:01:02,620;"back on it now and kind of the tragic way that he ended, it's probably pretty obvious"
01:01:02,620;01:01:06,680;"that yeah, he had at least something, whether it was chronic depression or something even"
01:01:06,680;01:01:07,680;"more than that."
01:01:07,680;01:01:13,660;"I think it was pretty obvious that there was something going on with him."
01:01:13,660;01:01:21,020;"But yeah, the criticism was that this came out however many months after the fact."
01:01:21,020;01:01:25,660;"And now why is this coming out all of a sudden when there's this protracted legal battle?"
01:01:25,660;01:01:26,660;"Right."
01:01:26,660;01:01:29,660;"Like at the time, like why didn't it come out at the time?"
01:01:29,660;01:01:34,980;"And I think like my whole the reason for my comment about like, you know, housewives of"
01:01:34,980;01:01:39,980;"of Orange County was just the whole reason why of Glenn,"
01:01:39,980;01:01:43,020;"like basically leaving training camp"
01:01:43,020;01:01:45,100;"because the team wasn't being supported"
01:01:45,100;01:01:46,660;"enough of him sort of thing."
