Start Timestamp;End Timestamp;Transcript
01:02:19,460;01:02:23,020;"Where he had none in two years?"
01:02:23,020;01:02:28,120;"Yeah, the real question is how did Wayne Krabette not plan the Patriots?"
01:02:28,120;01:02:30,300;"Right"
01:02:30,300;01:02:32,300;"It was a killer - a"
01:02:32,300;01:02:38,900;"510 white receiver that was undrafted out of a division one double a school like that"
01:02:38,900;01:02:39,740;"- Yeah."
01:02:39,740;01:02:41,500;"(laughing)"
01:02:41,500;01:02:42,700;"- I'll check that all over."
01:02:42,700;01:02:46,100;"That played in the AOC, he's basically Welker."
01:02:46,100;01:02:48,180;"- He plays without gloves too."
01:02:48,180;01:02:49,700;"Think about the glove game."
01:02:49,700;01:02:52,300;"- Why are you not wearing gloves and him not wearing gloves?"
01:02:52,300;01:02:54,740;"Many of you are wearing gloves and Tom Brady does it."
01:02:54,740;01:02:57,100;"(laughing)"
01:02:57,100;01:03:00,780;"- And his name is Wayne John Cravette"
01:03:00,780;01:03:03,700;"instead of John Wayne Cravette, which is just,"
01:03:03,700;01:03:05,580;"it's just Chezkiss."
01:03:05,580;01:03:06,580;"(laughing)"
01:03:06,580;01:03:07,580;"- Oh my God."
01:03:07,580;01:03:09,020;"I didn't know that."
01:03:09,020;01:03:12,180;"So, all right, here's a conspiracy theory for you."
01:03:12,180;01:03:13,020;"Okay."
01:03:13,020;01:03:14,300;"Belichick played against Wayne Kerbat"
01:03:14,300;01:03:15,700;"and wanted him the entire time,"
01:03:15,700;01:03:17,660;"but Kerbat wouldn't come."
01:03:17,660;01:03:21,380;"So as soon as Belichick saw another shifty white receiver"
01:03:21,380;01:03:25,500;"playing in the AFC East that would play really well against him,"
01:03:25,500;01:03:26,860;"he's like, I have to have him."
01:03:26,860;01:03:28,340;"And he signed, he spent,"
01:03:28,340;01:03:30,780;"was like a second round draft pick on Buzz Welker?"
01:03:30,780;01:03:32,340;"Yeah, second."
01:03:32,340;01:03:33,460;"That's caught legs."
01:03:33,460;01:03:34,540;"That makes sense."
01:03:34,540;01:03:36,620;"a long waiting game though."
01:03:36,620;01:03:41,340;"Well, I think you just had his eyes open for that that shift"
01:03:41,340;01:03:42,020;"for that long."
01:03:42,020;01:03:43,740;"That's if you're white receiver."
01:03:43,740;01:03:46,340;"All of those ears, but I can't think of anybody else."
01:03:46,340;01:03:48,660;"Yeah, I mean,"
01:03:48,660;01:03:52,660;"I mean, Troy Brown was kind of fit that role."
01:03:52,660;01:03:56,940;"Oh, but like the undrafted one double A white wide receiver with"
01:03:56,940;01:03:57,900;"that shift. Yeah."
01:03:57,900;01:04:01,180;"You've talked about what round Troy was picking."
01:04:01,180;01:04:03,940;"He was like the closest thing you can come to"
01:04:03,940;01:04:06,660;"- That's true, yeah. - Yeah, it's round, I think."
01:04:06,660;01:04:08,620;"- Yeah, it's round. - It doesn't exist anymore."
01:04:08,620;01:04:12,640;"- I'm so late. (both laughing)"
01:04:12,640;01:04:15,160;"- But out of, where did he play?"
01:04:15,160;01:04:17,020;"- Marshall? - Uh, where did you play the game?"
01:04:17,020;01:04:18,640;"- With Pennington."
01:04:18,640;01:04:20,540;"- Yeah, uh, well. - Awesome."
01:04:20,540;01:04:22,280;"- I don't know about before, Pennington."
01:04:22,280;01:04:24,080;"- No, I think he's been in the league too long."
01:04:24,080;01:04:25,640;"- Definitely, I think it would have been sick."
01:04:25,640;01:04:28,100;"- I think it would have been sick of those college highlights."
01:04:28,100;01:04:30,400;"Troy Brown, Randy Moss, and Chad Pennington."
01:04:30,400;01:04:32,620;"- Steve, didn't we look at up at Troy Brown"
01:04:32,620;01:04:36,260;"And Randy Moss where they overlapped."
01:04:36,260;01:04:37,180;"- At the end of the year. - At the one year."
01:04:37,180;01:04:38,020;"- At the one year. - At the one year."
01:04:38,020;01:04:40,540;"- Troy Brown was there in 2007, Randy Moss was there."
01:04:40,540;01:04:44,260;"- Oh, I thought they overlapped in college."
01:04:44,260;01:04:45,300;"- Oh, in college."
01:04:45,300;01:04:47,860;"- Not the other way around. - They overlapped in"
01:04:47,860;01:04:51,060;"New England at the very end of '07,"
01:04:51,060;01:04:52,860;"at the very tailtail of Troy"
01:04:52,860;01:04:54,180;"in the very beginning of Randy."
01:04:54,180;01:04:56,180;"- Yes, yes, that's what it was."
01:04:56,180;01:04:59,700;"- It went 70. - Yeah, because Randy Moss,"
01:04:59,700;01:05:01,800;"when he played for Vikings this year,"
01:05:01,800;01:05:08,280;"Uh, the first like, as soon as the game ended, the Patriots won pretty handily and Rainy"
01:05:08,280;01:05:09,960;"Moss gave up on the last play."
01:05:09,960;01:05:15,880;"Um, you know, as he does, but the, like, you know, how they, they show everybody like"
01:05:15,880;01:05:18,400;"talking after the game."
01:05:18,400;01:05:22,120;"And Rainy Moss was like buddy, buddy with Troy Brown."
01:05:22,120;01:05:25,800;"So we floated the conspiracy theory that Troy Brown's a reason Rainy Moss ended up in New"
01:05:25,800;01:05:28,440;"England because of the Marshall connection."
01:05:28,440;01:05:30,120;"I'm not saying it's not true."
01:05:30,120;01:05:32,320;"Yeah, that one's a little bit more of a stretch."
01:05:32,320;01:05:33,120;"I feel it's not."
01:05:33,120;01:05:36,320;"I mean, Randy's like, ""Hey, Troy, we went to the same alma mater."
01:05:36,320;01:05:37,120;"We're buddies."
01:05:37,120;01:05:37,920;"What do you think of El check?"
01:05:37,920;01:05:38,420;"What do you like?"
01:05:38,420;01:05:39,220;"Do you like working with them?"""
01:05:39,220;01:05:40,920;"And Troy's like, ""Yeah, of course, this is the best."""
01:05:40,920;01:05:44,120;"If they traded for him, he didn't like sign here as a free agent."
01:05:44,120;01:05:46,320;"Yeah, that's why they go out for him in the first place."
01:05:46,320;01:05:48,720;"Because he's the best receiver in the NFL."
01:05:48,720;01:05:49,720;"I don't know, Andy."
01:05:49,720;01:05:51,720;"But he hadn't had good seasons, though."
01:05:51,720;01:05:53,320;"They were still taking a chance."
01:05:53,320;01:05:57,420;"Hey, remember Randy's lost contract was outrageous then."
01:05:57,420;01:05:59,320;"He took a huge pay cut to come here."
01:05:59,320;01:06:01,320;"That's right. Why did he do that?"
01:06:01,320;01:06:02,320;"As soon as he got trained."
01:06:02,320;01:06:04,600;"Yeah, why did Randy accept the deal?"
01:06:04,600;01:06:05,920;"Yeah. All right."
01:06:05,920;01:06:07,400;"All right. You're right."
01:06:07,400;01:06:08,200;"Can we move on?"
01:06:08,200;01:06:11,120;"Nope."
01:06:11,120;01:06:16,640;"Remember Chris Berman's Troy Brown."
01:06:16,640;01:06:17,920;"He's he saw his goal."
01:06:17,920;01:06:19,360;"Troy Brown from."
01:06:19,360;01:06:21,200;"Yep."
01:06:21,200;01:06:22,440;"You know what it is?"
01:06:22,440;01:06:24,280;"Middle and renowned."
01:06:24,280;01:06:27,040;"Oh, that's right."
01:06:27,040;01:06:27,880;"Oh, yeah."
01:06:27,880;01:06:34,040;"What does that mean? Yeah, I never do that either. Lester Raymond Brown and his band of renown"
01:06:34,040;01:06:42,520;"From like 1938 jazz musician apparently the Chris Berman always has the deepest cuts"
01:06:42,520;01:06:49,000;"Less Brown and his band of renown. Yeah"
01:06:49,000;01:06:53,520;"Well Brown I think is a white dude"
01:06:54,440;01:07:00,280;"Not that I'm at it, but okay in 1930s jazz - that's crazy - 19. Yeah"
01:07:00,280;01:07:03,200;"1947"
01:07:03,200;01:07:05,200;"Wow"
01:07:05,200;01:07:09,400;"Yeah, it led the band for nearly seven decades from 1938 to 2000"
01:07:09,400;01:07:12,080;"Maybe not that deep of a cut shit"
01:07:12,080;01:07:15,440;"It's not my kind of music. That's a hell of a"
01:07:15,440;01:07:19,360;"Yeah"
01:07:19,360;01:07:21,360;"Do you have any"
01:07:21,360;01:07:26,800;"Bermanisms for this one Greg I think we already did the Jets doing I don't know it's been so long"
01:07:26,800;01:07:30,720;"Maybe not but"
01:07:30,720;01:07:33,040;"Do not what I did not do any now"
01:07:33,040;01:07:41,040;"You don't have anything for John Hall that feels like yeah Matt Turk. There's definitely a name you can do there"
01:07:45,720;01:07:50,640;"So here's a question. Who do you think was the best who who had the most yards out of"
01:07:50,640;01:07:53,760;"Laverneas cold Santa moss and wanker bet"
01:07:53,760;01:08:02,000;"There is Stephen Corro was pretty stacked. That's yeah. Yeah, yeah solid one day three right there. Are you talking about in this game or"
01:08:02,000;01:08:04,760;"just career wise"
01:08:04,760;01:08:08,480;"Let's do the game first. I'd say"
01:08:08,480;01:08:14,100;"Santana Moss probably just because he played forever on the Redskins. That was a deep threat"
01:08:14,100;01:08:15,840;"Yeah, especially you use it."
01:08:15,840;01:08:16,680;"That's what I would say."
01:08:16,680;01:08:18,440;"It returns and all that to use a sick return or even in the"
01:08:18,440;01:08:18,940;"store."
01:08:18,940;01:08:19,440;"All right."
01:08:19,440;01:08:20,440;"Yeah."
01:08:20,440;01:08:21,440;"You are correct."
01:08:21,440;01:08:23,240;"It goes, ""Moss calls Cribette."""
01:08:23,240;01:08:26,680;"Yeah, Cribette was the possession receiver."
01:08:26,680;01:08:29,200;"I would have put him last."
01:08:29,200;01:08:31,200;"In this game, though?"
01:08:31,200;01:08:32,200;"Mmm."
01:08:32,200;01:08:35,400;"It's got to be Santana, especially with that factor."
01:08:35,400;01:08:36,400;"Yeah."
01:08:36,400;01:08:37,400;"All per person."
01:08:37,400;01:08:38,400;"That's it."
01:08:38,400;01:08:41,400;"It could be calls because calls had that big deep touchdown pass that should have been"
01:08:41,400;01:08:43,880;"picked off by whoever the hell it was."
01:08:43,880;01:08:45,480;"Was that the double coverage?"
01:08:45,480;01:08:50,520;"Yeah, Victor Green, like literally had his hands just didn't back up far enough"
01:08:50,520;01:08:53,080;"before he jumped and it just sailed over his head."
01:08:53,080;01:08:54,600;"Dropped right in the basket."
01:08:54,600;01:08:56,080;"Just stressing."
01:08:56,080;01:08:57,160;"It was tired."
01:08:57,160;01:08:58,520;"I think he was on Cole's all night."
01:08:58,520;01:09:00,960;"So I'm saying my Moss had the most."
01:09:00,960;01:09:04,200;"Stat check it."
01:09:04,200;01:09:06,000;"It was Cole's was 78."
01:09:06,000;01:09:06,960;"This is receiving out."
01:09:06,960;01:09:09,320;"78 Moss was 77."
01:09:09,320;01:09:11,040;"Progen 61."
01:09:11,040;01:09:13,440;"They're all right about the same."
01:09:13,440;01:09:19,720;"Patriots, I would say Kevin Falk had the most receiving yards."
01:09:19,720;01:09:21,640;"Yeah."
01:09:21,640;01:09:24,040;"Seems like the only one that had any."
01:09:24,040;01:09:24,720;"Yeah."
01:09:24,720;01:09:26,960;"Him and David Patton, both at 38."
01:09:26,960;01:09:32,520;"Troy Brown, tough day, seven targets, two catches, eight yards and a fumble punt."
01:09:32,520;01:09:34,920;"He had one catch rate that hurt too."
01:09:35,400;01:09:38,240;"Yeah, like he landed on a football and lower back."
01:09:38,240;01:09:40,080;"Yeah, he was hurt."
01:09:40,080;01:09:42,360;"He landed on like tailbone or something."
01:09:42,360;01:09:45,360;"The way he was holding himself."
01:09:45,360;01:09:51,800;"I do have from the Pat Chaneyton or Chadwick."
01:09:51,800;01:09:52,200;"Sorry."
01:09:52,200;01:09:53,120;"It's a"
01:09:53,120;01:09:53,960;"at Chaneyton."
01:09:53,960;01:09:58,200;"The commentators are like fumbling over each other to like a great"
01:09:58,200;01:10:01,120;"math about like, oh, this is what he does in one quarter."
01:10:01,120;01:10:03,480;"What if you extrapolate that to the whole game?"
01:10:03,840;01:10:11,160;"692 yards. Did you just do that in your head? Oh my God. You're so smart."
01:10:11,160;01:10:12,760;"It's just like, dude, the fuck."
01:10:12,760;01:10:16,520;"Well, they were they were having a rough night because apparently this was the"
01:10:16,520;01:10:22,680;"Monday night game, right? Yeah. And they had done the Sunday night game in Dallas"
01:10:22,680;01:10:27,160;"the night before. And they were acting like it was the biggest fucking deal that"
01:10:27,160;01:10:29,040;"they were in Dallas 24 hours ago."
01:10:29,040;01:10:31,520;"Yeah, they would not shut the fuck up about that."
01:10:31,800;01:10:34,560;"Yeah. Like, so we're all running on no sleep."
01:10:34,560;01:10:35,760;"Okay."
01:10:35,760;01:10:37,640;"All right. Let's show the camera guys again."
01:10:37,640;01:10:43,880;"Because they were running. Oh, look, they're Santa Claus holding the microphone."
01:10:43,880;01:10:49,840;"Yeah, it wasn't their best game, but December 22nd."
01:10:49,840;01:10:52,440;"Yeah, it was also three days before Christmas."
01:10:52,440;01:10:55,520;"And they kept showing like shots of, you know,"
01:10:55,520;01:10:58,560;"moving Christmas and like, oh, they do it different up here."
01:10:58,560;01:11:00,640;"There's like one house that has some reason on the windows."
01:11:00,640;01:11:02,980;"And like that is beautiful."
01:11:02,980;01:11:04,580;"It's amazing."
01:11:04,580;01:11:08,180;"Like I think that's my neighbor."
01:11:08,180;01:11:10,340;"And like I think they leave that up all year round."
01:11:10,340;01:11:11,500;"Yeah, but I live in Virginia."
01:11:11,500;01:11:12,900;"It just looks like a goddamn house."
01:11:12,900;01:11:14,260;"Now I can do it."
01:11:14,260;01:11:16,900;"It's like, oh yes, only people in New England"
01:11:16,900;01:11:18,420;"put a briefs in their windows."
01:11:18,420;01:11:19,420;"Exactly."
01:11:19,420;01:11:21,260;"And then they had some like."
01:11:21,260;01:11:22,180;"Okay."
01:11:22,180;01:11:23,620;"Oh, I have this cactus."
01:11:23,620;01:11:24,780;"Yeah, that's true."
01:11:24,780;01:11:28,980;"If they just came from Dallas, I suppose that makes more sense."
01:11:28,980;01:11:29,500;"Yeah."
01:11:29,740;01:11:30,920;"We had snow as well."
01:11:30,920;01:11:31,840;"So all right."
01:11:31,840;01:11:32,960;"Do we want to do best and worse?"
01:11:32,960;01:11:34,880;"I don't think there's much else to talk about in this."
01:11:34,880;01:11:35,740;"Yeah."
01:11:35,740;01:11:36,800;"All right."
01:11:36,800;01:11:38,380;"Greg, you want to go first?"
01:11:38,380;01:11:39,200;"No."
01:11:39,200;01:11:41,600;"Steve."
01:11:41,600;01:11:46,540;"Uh, yeah, I'll take the best best so Greg doesn't have it."
01:11:46,540;01:11:47,620;"Okay."
01:11:47,620;01:11:48,520;"Definitely."
01:11:48,520;01:11:48,920;"They kept him."
01:11:48,920;01:11:50,880;"Falk touchdown return."
01:11:50,880;01:11:52,120;"Where are you?"
01:11:52,120;01:11:52,640;"Herd."
01:11:52,640;01:11:56,060;"What two guys touchdown and they went up like what seven or."
01:11:56,060;01:11:56,880;"Yeah."
01:11:56,880;01:11:58,280;"Something like that."
01:11:58,560;01:12:00,360;"Now seven, nothing was the first issue."
01:12:00,360;01:12:02,960;"And he just took it right back to the house."
01:12:02,960;01:12:07,720;"Yeah. And in it, he like kind of cuts left and then cuts back right and just sees"
01:12:07,720;01:12:10,560;"a little gap in the blocking and jumps."
01:12:10,560;01:12:11,600;"A dude."
01:12:11,600;01:12:12,920;"That's like kind of falling over."
01:12:12,920;01:12:16,680;"And if you watch it from the opposite, from the end zone, you see him jump and you"
01:12:16,680;01:12:18,800;"see three jets, just missed a bit."
01:12:18,800;01:12:20,800;"Like they can't get over the guy on the ground."
01:12:20,800;01:12:24,800;"And then it's just him on the kicker and it's like, you better outrun that kicker, Kevin."
01:12:26,040;01:12:30,040;"If you don't know, run that kick, you know, Bella checks going to play that highlight on the loop."
01:12:30,040;01:12:30,840;"Are you getting caught?"
01:12:30,840;01:12:31,640;"Oh, my God. Yeah."
01:12:31,640;01:12:33,640;"No, I don't subscribe to that theory."
01:12:33,640;01:12:38,440;"Getting like getting tackled by the kicker is like losing in a Super Bowl."
01:12:38,440;01:12:41,640;"Like you have to get to the point of getting to the kicker."
01:12:41,640;01:12:43,160;"I don't know. But he had to get a great."
01:12:43,160;01:12:45,840;"He really had like no chance."
01:12:45,840;01:12:48,760;"It's one of those. If you get caught by the kicker, it's your fault for not."
01:12:48,760;01:12:51,440;"If you get like caught, like he chases you down."
01:12:51,440;01:12:53,440;"Like we saw a mandatory chase that guy down."
01:12:53,440;01:12:53,640;"Yeah."
01:12:53,640;01:12:54,640;"That's different."
01:12:55,040;01:12:56,380;"That guy, Herschel Walker."
01:12:56,380;01:12:59,120;"Yeah, it was Herschel Walker was it was."
01:12:59,120;01:13:01,000;"So yeah, I think it depends on the kicker."
01:13:01,000;01:13:02,260;"I'm kind of in the middle of you too."
01:13:02,260;01:13:04,760;"If you get tackled by Adam Venatorian, he runs you down."
01:13:04,760;01:13:05,920;"Fair enough."
01:13:05,920;01:13:11,040;"If you get tackled by Sebastian Janikowski, like that should be on loop the next day."
01:13:11,040;01:13:15,320;"Because I don't think Sebastian Janikowski has ever made a tackle in his career."
01:13:15,320;01:13:18,240;"Because he does the Olay every time."
01:13:18,240;01:13:20,040;"I love Sebastian."
01:13:20,040;01:13:21,040;"I know."
01:13:21,040;01:13:22,160;"I just love him."
01:13:22,160;01:13:23,000;"- Let's see the ass."
01:13:23,000;01:13:25,640;"(laughing)"
01:13:25,640;01:13:30,640;"- And then my worst is the 2007 spread against the Eagles."
01:13:30,640;01:13:37,880;"We were at no negative 24 and a half points."
01:13:37,880;01:13:38,720;"And if you remember,"
01:13:38,720;01:13:41,440;"that was that Chip Kelly game, we were super close."
01:13:41,440;01:13:42,920;"- Oh yeah."
01:13:42,920;01:13:45,680;"- I would fuck with you to make a fucking"
01:13:45,680;01:13:48,840;"spread negative 24 and a half."
01:13:48,840;01:13:50,640;"- So the page was 24 and a half point favorites."
01:13:50,640;01:13:51,920;"- I remember all, it tells the game,"
01:13:51,920;01:13:53,840;"I remember a super close me barely won."
01:13:53,840;01:13:57,120;"- Do you know why they were 24 and a half point favorites?"
01:13:57,120;01:13:59,120;"Because every game before,"
01:13:59,120;01:14:01,360;"they were like at least two touchdown favorites"
01:14:01,360;01:14:02,880;"and they kept blowing it away."
01:14:02,880;01:14:06,080;"Like they covered by like two touchdowns"
01:14:06,080;01:14:07,880;"on top of whatever the spread was."
01:14:07,880;01:14:09,600;"So finally got up to 24 and a half"
01:14:09,600;01:14:11,840;"and then they won by like seven."
01:14:11,840;01:14:13,360;"- Now there was like three I felt like,"
01:14:13,360;01:14:15,400;"I feel like it was pretty close, but whatever."
01:14:15,400;01:14:17,160;"- There were a couple of close games are you?"
01:14:17,160;01:14:18,320;"- I have to play in Vegas."
01:14:18,320;01:14:19,160;"- So."
01:14:20,040;01:14:22,480;"Do you know the biggest spread and the other way"
01:14:22,480;01:14:23,640;"for the Patriots was?"
01:14:23,640;01:14:25,680;"- Were there biggest on dogs?"
01:14:25,680;01:14:26,680;"- Awesome."
01:14:26,680;01:14:27,520;"- Huh?"
01:14:27,520;01:14:30,780;"- Was it the Super Bowl?"
01:14:30,780;01:14:31,840;"- Nope."
01:14:31,840;01:14:33,720;"- Wait, the biggest favorites they were?"
01:14:33,720;01:14:35,640;"- No, the biggest underdogs."
01:14:35,640;01:14:36,480;"- Dogs, underdogs."
01:14:36,480;01:14:37,460;"- Dogs."
01:14:37,460;01:14:39,480;"- 11 and a half points."
01:14:39,480;01:14:41,720;"- They're 14 point dogs to the Rams"
01:14:41,720;01:14:42,920;"in Super Bowl, weren't they?"
01:14:42,920;01:14:47,160;"- Not according to Patriots dynasty that info."
01:14:47,160;01:14:48,440;"- Oh, Andy."
01:14:48,440;01:14:49,760;"- They may have shifted."
01:14:49,760;01:14:52,200;"I got a mission from Pro Football reference."
01:14:52,200;01:14:54,760;"So I'm going to be around this time frame, right?"
01:14:54,760;01:14:55,360;"Yeah."
01:14:55,360;01:14:57,040;"Steelers Steelers, they have to change."
01:14:57,040;01:14:58,720;"Oh, no."
01:14:58,720;01:15:00,320;"No, steal it."
01:15:00,320;01:15:02,320;"Steelers opening week."
01:15:02,320;01:15:04,400;"No, they weren't that big of it."
01:15:04,400;01:15:06,160;"I don't know. Tell us."
01:15:06,160;01:15:10,400;"The Colts game where Patton runs and catches."
01:15:10,400;01:15:13,320;"Oh, not Brady's first star."
01:15:13,320;01:15:15,880;"That was surprisingly not."
01:15:15,880;01:15:17,280;"Second."
01:15:17,280;01:15:19,480;"That's surprising."
01:15:19,640;01:15:23,240;"Wow, shit. Okay. Who knew? All right, Greg, you got your best"
01:15:23,240;01:15:23,840;"and worst ready?"
01:15:23,840;01:15:26,120;"Yeah, something up."
01:15:26,120;01:15:29,480;"Yes, I have something to add here."
01:15:29,480;01:15:30,880;"Okay."
01:15:30,880;01:15:35,600;"For cyber everything called best and worse, whatever."
01:15:35,600;01:15:40,480;"Looking at scores around the league for the same week, because I was like,"
01:15:40,480;01:15:43,960;"Oh, I wonder how the bills did because they were, you know, we played them last"
01:15:43,960;01:15:45,080;"week, right? Yeah."
01:15:45,920;01:15:52,920;"So they went to Lambo and lost 10 to nothing to Green Bay."
01:15:52,920;01:15:54,020;"Oh, shit."
01:15:54,020;01:15:57,560;"And between Brett Favre and Drew Bledself,"
01:15:57,560;01:16:04,040;"they had less than 300 yards passing combined,"
01:16:04,040;01:16:06,560;"one touchdown and four picks."
01:16:06,560;01:16:07,400;"Nice."
01:16:07,400;01:16:10,840;"And they were sacked eight times."
01:16:10,840;01:16:13,600;"Merry fucking Christmas."
01:16:13,600;01:16:14,840;"Waffy game."
01:16:14,840;01:16:19,000;"I'm a little surprised the the picks weren't more than four combined."
01:16:19,000;01:16:19,740;"I know."
01:16:19,740;01:16:20,240;"I know."
01:16:20,240;01:16:21,540;"Watch the finish three each."
01:16:21,540;01:16:23,040;"Yeah."
01:16:23,040;01:16:25,340;"That's 27 degrees."
01:16:25,340;01:16:26,640;"Wind chill 13."
01:16:26,640;01:16:27,440;"Yeah."
01:16:27,440;01:16:28,040;"Lamb of."
01:16:28,040;01:16:33,040;"Oh, would you rather watch that game in person or this game on TV?"
01:16:33,040;01:16:34,440;"Back game in person."
01:16:34,440;01:16:35,840;"Probably."
01:16:35,840;01:16:38,840;"Man, we're blood."
01:16:38,840;01:16:39,240;"So."
01:16:39,240;01:16:44,140;"All right, Lisa, we kind of sprung this on you, but do you have any best and worse?"
01:16:44,640;01:16:49,100;"How is is am I talking about this game or what's the format?"
01:16:49,100;01:16:52,440;"Some of us talk about this game"
01:16:52,440;01:16:58,360;"It doesn't watch the game doesn't offer you like best of experience"
01:16:58,360;01:17:02,100;"That's a worse of brothers feel free to rank us"
01:17:02,100;01:17:07,920;"You're all equally great, that's my mom answer"
01:17:07,920;01:17:14,560;"Yeah, well our mom doesn't answer it like that though, yeah"
01:17:14,560;01:17:16,560;"- Yeah, she hates you."
01:17:16,560;01:17:17,560;"- No, she doesn't."
01:17:17,560;01:17:18,400;"(laughing)"
01:17:18,400;01:17:19,940;"- She loves me all the time."
01:17:19,940;01:17:20,860;"(laughing)"
01:17:20,860;01:17:21,700;"- Oh man."
01:17:21,700;01:17:23,940;"- But it's not, she says to me, dude."
01:17:23,940;01:17:25,540;"- She's here, she says about you."
01:17:25,540;01:17:29,180;"- How far apart are you guys in age?"
01:17:29,180;01:17:32,500;"- 18 months."
01:17:32,500;01:17:34,340;"- Yeah, I'm 37."
01:17:34,340;01:17:35,340;"- And I'm 38 months."
01:17:35,340;01:17:36,180;"- 38 months."
01:17:36,180;01:17:38,020;"- 38 months. - 38 months."
01:17:38,020;01:17:39,860;"- Yeah."
01:17:39,860;01:17:41,340;"- I always forget how old I am now."
01:17:41,340;01:17:42,420;"I think I'm 32."
01:17:42,420;01:17:43,420;"- Yeah."
01:17:43,420;01:17:46,420;"- Yeah, we have a sister as well who's between me and Steve."
01:17:46,420;01:17:48,860;"- Yeah, so it made our 18 months apart."
01:17:48,860;01:17:51,060;"- Me and Greg are 18 months and then me and Ellie"
01:17:51,060;01:17:55,140;"are two and a half years apart."
01:17:55,140;01:17:57,100;"- Why isn't she on the fuck?"
01:17:57,100;01:17:58,980;"- She hates us."
01:17:58,980;01:18:00,340;"- She's smarter than us."
01:18:00,340;01:18:01,780;"(laughing)"
01:18:01,780;01:18:03,500;"She knows better."
01:18:03,500;01:18:05,820;"- She also has three children and doesn't have time"
01:18:05,820;01:18:08,420;"to watch football games from 2000 and so on."
01:18:08,420;01:18:09,780;"(laughing)"
01:18:09,780;01:18:10,620;"- I feel that."
01:18:10,620;01:18:11,460;"Yeah."
01:18:11,460;01:18:12,300;"I was like, oh, I'm having stuff."
01:18:12,300;01:18:13,140;"You're great."
01:18:13,140;01:18:14,140;"You're great."
01:18:14,140;01:18:16,780;"[LAUGHTER]"
01:18:16,780;01:18:19,940;"But about this game, no."
01:18:19,940;01:18:23,820;"I mean, it's very little best and all worst."
01:18:23,820;01:18:25,940;"There was one play that I kind of liked"
01:18:25,940;01:18:28,580;"where Tom fell over."
01:18:28,580;01:18:30,980;"It was like right after that goal line stand"
01:18:30,980;01:18:33,340;"where the Jets had to settle for a field goal."
01:18:33,340;01:18:35,640;"And then on that subsequent drive,"
01:18:35,640;01:18:38,620;"Tom fell over and he just looked so mad."
01:18:38,620;01:18:41,020;"And I don't know, brought me joy."
01:18:41,020;01:18:44,780;"- I like sassy, Tom."
01:18:44,780;01:18:47,140;"It's my favorite to all of us when he starts getting mad"
01:18:47,140;01:18:48,220;"and pissy."
01:18:48,220;01:18:51,700;"- Was that the one where John Abrams"
01:18:51,700;01:18:55,020;"pushed Matt Light back so far that he stepped on Brady's foot?"
01:18:55,020;01:18:55,860;"- Yes."
01:18:55,860;01:18:58,060;"(laughs)"
