Start Timestamp;End Timestamp;Transcript
00:00,000;00:06,780;"This is Christine Brown, and while I have to listen to this podcast as my motherly duty,"
00:06,780;00:08,200;"you have the choice not to."
00:08,200;00:12,480;"My sons sometimes say some naughty things when they're trying to be funny, but really,"
00:12,480;00:13,920;"they're just being stupid."
00:13,920;00:15,480;"You still want to listen?"
00:15,480;00:16,480;"Go right ahead."
00:16,480;00:18,400;"I am not your mother."
00:18,400;00:26,520;"Welcome back to the Page of Stimesy Podcast."
00:26,520;00:31,520;"We are mercifully almost finished with the 2002 season."
00:31,520;00:36,920;"But before we actually finished,"
00:36,920;00:39,520;"we actually have to watch some of these games"
00:39,520;00:41,520;"at the end of the season."
00:41,520;00:43,880;"We've had a lot of help so far throughout this season"
00:43,880;00:46,420;"because it has been a rough one."
00:46,420;00:49,720;"We've had some friends on, we've had Connor on,"
00:49,720;00:51,240;"we've had some experts on."
00:52,680;00:54,400;"And this time we have both."
00:54,400;00:58,960;"We have a friend of mine who is also,"
00:58,960;01:01,440;"maybe experts a strong word, but a legend."
01:01,440;01:02,520;"- I know, not an expert now."
01:02,520;01:04,440;"- Reddit famous, maybe?"
01:04,440;01:05,280;"(laughing)"
01:05,280;01:07,680;"- Just an archivist, an archivist."
01:07,680;01:09,260;"- All right."
01:09,260;01:10,100;"I like that."
01:10,100;01:14,440;"Yeah, we know her as Lisa,"
01:14,440;01:16,400;"but you probably know her as Timnog"
01:16,400;01:19,640;"if you're ever on the Patriot subreddit"
01:19,640;01:24,640;"because she is probably the most famous user"
01:24,640;01:27,600;"on that Patriot subreddit?"
01:27,600;01:30,280;"- Yeah, for sure."
01:30,280;01:33,540;"- Maybe other than random times,"
01:33,540;01:34,840;"Julian posts on there."
01:34,840;01:37,040;"- Yeah, he doesn't count."
01:37,040;01:37,860;"- Yeah."
01:37,860;01:39,280;"- He's not a real Redditor, is he?"
01:39,280;01:42,560;"Not a nerd like the rest of us."
01:42,560;01:44,200;"- Yeah, that's a hassle."
01:44,200;01:47,800;"- I'm happy to be here."
01:47,800;01:50,620;"- Yeah, thanks for joining us."
01:50,620;01:54,420;"Apologies in advance, one for making you watch this game"
01:54,420;01:56,900;"and two for my brothers."
01:56,900;01:57,880;"So I'm sure they'll say something"
01:57,880;01:59,500;"- Why? - I'm inappropriate."
01:59,500;02:00,340;"- What is that supposed to mean?"
02:00,340;02:01,700;"- You know why. - You know why."
02:01,700;02:03,200;"- Three brothers, just Greg."
02:03,200;02:04,680;"(laughing)"
02:04,680;02:06,100;"- Fair enough. - So good."
02:06,100;02:07,100;"I'm excited."
02:07,100;02:07,940;"- Yeah."
02:07,940;02:11,340;"But we've been internet friends for a while"
02:11,340;02:14,300;"and I realize I actually don't know"
02:14,300;02:17,340;"how you got into being a Patsvang"
02:17,340;02:19,660;"'cause you're not from around here."
02:19,660;02:23,020;"- I am not, but I will be soon, which I'm stoked about."
02:23,020;02:24,820;"- Cool, oh, that's right, yeah, here."
02:24,820;02:26,780;"Who gets the area at some point?"
02:26,780;02:29,820;"- Yeah, I'm looking forward to getting out of Arizona"
02:29,820;02:33,820;"'cause it's 101 today and I'm over it."
02:33,820;02:36,980;"- Isn't it 101 every day though?"
02:36,980;02:39,540;"- Let's see."
02:39,540;02:40,380;"- Pretty much."
02:40,380;02:45,660;"- Yeah, it, no, it's gonna get down to 98 on Saturday."
02:45,660;02:48,540;"So there's things to look forward to."
02:48,540;02:49,860;"- I stand corrected."
02:49,860;02:56,420;"- My husband is a Pads fan and he,"
02:56,420;02:58,580;"I don't wanna use the word indoctrinated me,"
02:58,580;03:01,940;"but he strongly suggested that they would be the best team"
03:01,940;03:03,540;"in the NFL to follow."
03:03,540;03:04,940;"And it's been a great ride."
03:04,940;03:06,860;"So I mean, I'm really excited."
03:06,860;03:08,260;"- How long ago was this?"
03:08,260;03:14,060;"- Oh geez, we've been together 15, 16 years, so."
03:14,660;03:15,920;"- I'm done."
03:15,920;03:19,220;"- So you're an Arizona born and raised?"
03:19,220;03:21,460;"- No, I'm from California."
03:21,460;03:24,560;"- Okay, just slowly making her way."
03:24,560;03:28,500;"So did you have a sports team before the Patriots?"
03:28,500;03:32,420;"- No, because growing up in LA, the age that I am,"
03:32,420;03:36,460;"I'm 36, no one was really a Rams fan"
03:36,460;03:40,940;"and no one where I lived was a Raiders fan."
03:40,940;03:45,340;"So LA did not really have a strong football affiliation"
03:45,340;03:46,580;"at all at that time."
03:46,580;03:49,980;"If I grew up in LA now,"
03:49,980;03:52,580;"I'd probably be super stoked about the Rams."
03:52,580;03:55,380;"I don't think anybody stoked about the Chargers ever."
03:55,380;03:57,620;"- Nope."
03:57,620;04:00,460;"Not even the doctors."
04:00,460;04:02,540;"- No, oh man, that's all."
04:02,540;04:07,100;"But yeah, we've seen some good games along the way"
04:07,100;04:08,940;"and it's been a really cool journey."
04:08,940;04:11,460;"This, this offseason was hard."
04:11,460;04:14,940;"I'm, I'm sure you guys have talked about that on the podcast."
04:14,940;04:16,100;"Yeah."
04:16,100;04:17,340;"Yeah."
04:17,340;04:23,220;"That, that one month between our like MVP quarterbacks, it was a difficult"
04:23,220;04:23,620;"month."
04:23,620;04:25,180;"Yeah."
04:25,180;04:26,620;"I know we publish a podcast."
04:26,620;04:28,140;"I don't remember recording much of it."
04:28,140;04:30,020;"When Tom Brady left."
04:30,020;04:34,500;"Uh, so my thoughts are out there somewhere, but."
04:34,500;04:35,980;"Yeah."
04:36,300;04:40,500;"Yeah, it's been tough to watch him play for a different team."
04:40,500;04:47,220;"Yeah, I was very like petty in game one and then I ate all my words in game two."
04:47,220;04:48,420;"Yeah."
04:48,420;04:50,500;"So yeah, that's where I'm at."
04:50,500;04:55,940;"Well, I was, I was all supportive until Brady ran for that first touchdown."
04:55,940;04:56,540;"I'm like, fuck it."
04:56,540;04:57,900;"Now he's doing it for somebody else."
04:57,900;04:58,740;"Yep."
04:58,740;05:01,100;"And then I got like super salty about it."
05:01,100;05:05,220;"Uh, and then yeah, then he lost and threw a pick six."
05:05,220;05:08,500;"I'm like, oh well, I still love them though."
05:08,500;05:11,260;"- I thought it was good to get our gut reactions"
05:11,260;05:12,100;"as soon as it happened,"
05:12,100;05:13,540;"'cause I think I feel different now."
05:13,540;05:14,700;"I'm fine with it."
05:14,700;05:16,660;"- You've made your piece?"
05:16,660;05:17,500;"- Yep."
05:17,500;05:18,340;"- I'm about to know."
05:18,340;05:20,180;"- There's Cam Newton, a reason that you're fine with it."
05:20,180;05:22,460;"- I think you're good, and the bucks to not do good."
05:22,460;05:24,540;"That way."
05:24,540;05:25,660;"- You want the bucks to lose, Steve?"
05:25,660;05:26,660;"That's what you're gonna say?"
05:26,660;05:27,900;"- Yeah, I can river concrete."
05:27,900;05:28,740;"I'm not gonna river the box."
05:28,740;05:29,900;"- I'm believable."
05:29,900;05:31,140;"- Unbelievable."
05:31,140;05:31,980;"- I get it."
05:33,100;05:34,820;"I might be a bigger bucks fan now."
05:34,820;05:36,580;"Whoa."
05:36,580;05:38,140;"Has them."
05:38,140;05:42,700;"Well, you can go start your own fucking podcast."
05:42,700;05:44,260;"I'm gonna get me some pewter pants."
05:44,260;05:48,580;"Having having cam really helps."
05:48,580;05:52,220;"If we didn't have cam, that would be brutal."
05:52,220;05:53,140;"I agree."
05:53,140;05:53,980;"Yeah."
05:53,980;05:57,620;"Yeah. I think just seeing a completely different"
05:57,620;05:58,620;"offense out there."
05:58,620;06:00,380;"Yeah, it's been fun."
06:00,380;06:00,860;"Yeah."
06:00,860;06:01,260;"Exactly."
06:01,260;06:02,820;"You've just been a nice change of pace."
06:02,820;06:05,220;"'cause some of you've seen from all these other teams"
06:05,220;06:08,220;"that get the young Adjaw quarterbacks,"
06:08,220;06:10,180;"they're like, oh, well, that looks fun,"
06:10,180;06:13,300;"but we have Tom Brady, so we'll be okay without it."
06:13,300;06:14,140;"- Right."
06:14,140;06:18,980;"- And now we actually get to enjoy it for ourselves for once."
06:18,980;06:22,820;"- And like, I still worry about Cam when he runs,"
06:22,820;06:25,180;"but it's not like a same kind of worry you have"
06:25,180;06:27,480;"for like your grandfather, you know,"
06:27,480;06:30,140;"following and breaking a hip that I didn't expect."
06:30,140;06:31,660;"- Or Tom Brady running."
06:31,660;06:32,660;"Yeah. Yeah."
06:32,660;06:35,460;"It's so true."
06:35,460;06:37,580;"You was running a lot in 2002."
06:37,580;06:40,260;"I was going to say speaking of Tom Brady running."
06:40,260;06:44,740;"I think we may have seen his longest run of his career"
06:44,740;06:46,500;"to this point in this game."
06:46,500;06:51,180;"Remember the whopping 15 yards on third down, right?"
06:51,180;06:52,020;"Yeah."
06:52,020;06:56,740;"And that may be the only highlight."
06:56,740;07:01,100;"One of three highlights that I can think of from this game off the top of my"
07:01,100;07:05,020;"head. Are there? Go ahead."
07:05,020;07:06,380;"Any fun."
07:06,380;07:09,300;"I think it's on Peach's Dynasty or no. Or do you just leave this this one off?"
07:09,300;07:14,540;"I cut that. I'll have them on the website when this comes out. But I think there"
07:14,540;07:20,220;"will be three. One of them is Tom Rees scramble. One of them is basically Kevin"
07:20,220;07:25,140;"Falk, who is the only player who produced in this game. And Brady's touchdown"
07:25,140;07:26,900;"pass, which is probably already in there."
07:27,380;07:28,820;"So we're done with the game."
07:28,820;07:29,320;"Good."
07:29,320;07:32,180;"I'm done talking about this week."
07:32,180;07:36,100;"Well, this is a big game, though."
07:36,100;07:40,660;"I mean, as far as like this is like the culmination of the season up to this point, right?"
07:40,660;07:41,420;"Right."
07:41,420;07:47,420;"I mean, both teams are what the Pats are eight and six coming in and the Jets were seven and seven."
07:47,420;07:48,300;"Yep."
07:48,300;07:50,900;"So you got two divisional games to finish the season."
07:50,900;07:53,420;"That's really going to decide if you're making playoffs or not."
07:53,420;07:54,140;"Yeah."
07:54,140;07:56,100;"I won't spoil it for you, but."
07:56,540;07:59,580;"Yeah, if you win both of these, you're in the playoffs."
07:59,580;08:00,460;"Yeah."
08:00,460;08:02,860;"If you were one of them, you need help."
08:02,860;08:03,980;"Refresh my memory."
08:03,980;08:08,300;"What happened to Testa Verdi that Chad Pennington started this game?"
08:08,300;08:09,900;"He sucked."
08:09,900;08:10,420;"Yeah."
08:10,420;08:12,420;"So he was just..."
08:12,420;08:13,660;"I think, yeah."
08:13,660;08:14,140;"Yeah."
08:14,140;08:17,980;"So they started out the season one and three with Testa Verdi."
08:17,980;08:21,180;"And then as soon as Pennington came in, they said..."
08:21,180;08:24,340;"So actually, I read into Pennington a little bit."
08:24,340;08:30,580;"And it's it's it's kind of interesting how that all played out because he was a first round"
08:30,580;08:38,500;"draft pick in 2000. So he's one of the Brady six. Yeah, he was the first first of the Brady six"
08:38,500;08:46,020;"in that draft. Oh, by the Jets. By the Jets. Yep. He played as a high pick, then, obviously."
08:46,020;08:50,500;"Do you know who who he was throwing to at in college? Yeah, I do."
08:51,700;08:54,940;"- Randy Moss. - Wow."
08:54,940;08:57,340;"- At the thundering herd of marshmallows."
08:57,340;09:00,180;"- 'Cause I just remember there's one particular"
09:00,180;09:02,980;"Randy Moss highlight from college."
09:02,980;09:04,820;"- I know exactly which one you found."
09:04,820;09:05,820;"- I know what you're showing."
09:05,820;09:09,020;"Chad Peddington throws a wide receiver screen to him"
09:09,020;09:12,740;"and there's two defenders, 10 yards downfield"
09:12,740;09:15,620;"and Randy Moss splits them and outruns them,"
09:15,620;09:17,220;"giving them a 10 yard headstock."
09:17,220;09:21,340;"- He like skips them too, like he like skips over them."
09:21,340;09:23,940;"It's the most ridiculous thing I've ever seen."
09:23,940;09:24,700;"All right."
09:24,700;09:27,140;"Let's add that highlight to the game."
09:27,140;09:29,020;"Yeah."
09:29,020;09:32,540;"Well, you know what's funny is if you were doing highlights,"
09:32,540;09:35,180;"Chad Pennington had a great game."
09:35,180;09:38,900;"I mean, you get way more Jets highlights out of this game"
09:38,900;09:40,180;"than Pat's highlight."
09:40,180;09:42,020;"Lisa, I think you know better than I do,"
09:42,020;09:43,660;"that we don't do Jets highlights."
09:43,660;09:45,580;"I know, I know."
09:45,580;09:47,700;"I agree, that was Pennington played pretty decently."
09:47,700;09:50,660;"And honestly, I never really truly hated Pennington."
09:50,660;09:52,700;"like I should since for being a chef."
09:52,700;09:53,980;"- Is he a good player?"
09:53,980;09:54,820;"- Yeah."
09:54,820;09:56,060;"- He's not surrounded a bunch too,"
09:56,060;09:58,300;"so that lessened it for me."
09:58,300;09:59,420;"- Yeah."
09:59,420;10:02,660;"Well, do you wanna, so I went through his career"
10:02,660;10:05,420;"and there was some interesting stuff in there."
10:05,420;10:07,420;"Usually I go to like the off the field stuff,"
10:07,420;10:10,820;"but he is, I think he's like playing yogurt off the field."
10:10,820;10:11,900;"- Yeah, he's too clean."
10:11,900;10:14,660;"- He's absolutely nothing of interest, I think, fine."
10:14,660;10:18,220;"But so he was drafted in 2000,"
10:18,220;10:22,020;"same time as Brady, he spent two years behind"
10:22,020;10:24,060;"the best of the birdie."
10:24,060;10:26,060;"And test the birdie really didn't even play that well either."
10:26,060;10:32,260;"Like last year, I mean, they went 10 and six last year, but he had like 15 touchdowns, 14 pigs."
10:32,260;10:34,780;"So it might just be a sign of the times."
10:34,780;10:39,820;"I know they used to like let quarterbacks work their way into a bit more."
10:39,820;10:42,700;"So they will start the rookie, did you?"
10:42,700;10:43,300;"Right."
10:43,300;10:43,540;"Right."
10:43,540;10:47,260;"So this year is when he makes his real first appearances."
10:47,340;10:50,260;"And he like completely turns a team around."
10:50,260;10:52,900;"So no in Jets fans."
10:52,900;10:56,100;"I'm assuming the hype train was like in full steam."
10:56,100;10:57,100;"Yeah."
10:57,100;11:00,420;"Cause they make, they make the playoffs."
11:00,420;11:00,980;"Well there."
11:00,980;11:04,740;"And then he beats Manning in the first round 41 to nothing."
11:04,740;11:05,900;"Wow."
11:05,900;11:11,420;"So yeah, they were, they were pretty, they had a pretty good season and they were"
11:11,420;11:12,340;"really hyped on them."
11:13,180;11:18,460;"So you'll like this, Steve, then next year in the fourth pre-season game,"
11:18,460;11:20,620;"he dislocates his hand."
11:20,620;11:24,340;"I'm sorry. What? Yeah."
11:24,340;11:27,060;"I don't know why he was playing in the fourth game."
11:27,060;11:29,940;"Also, how do you dislocate your hand?"
11:29,940;11:31,700;"No, I do. It's not like it's one boat."
11:31,700;11:34,620;"We jet spans, dislocated their hands, jerking off to the thought."
11:34,620;11:38,260;"He's the new Tom Brady."
11:38,260;11:42,060;"Then it heals enough in time for Sanchez to come along and they break it again."
11:42,060;11:50,220;"Yeah, so we missed the first five games of the year because that they finished six and"
11:50,220;11:56,180;"10. And then the next year, they give them a seven year, 64 million dollar contract."
11:56,180;11:57,700;"Oh my God."
11:57,700;11:58,700;"Oops."
11:58,700;12:05,700;"That turned out it didn't go well."
12:05,700;12:10,620;"The quote I took took out of here was he was he was beefing with the media in New York"
12:10,620;12:18,020;"too. Pennington scolded the assembled media telling them it was not their right but a"
12:18,020;12:22,660;"privilege of theirs to cover the jets to be around a bunch of professional athletes"
12:22,660;12:37,220;"every day and do your job. I love that. I like America. As a journalist, I am very offended."
12:37,220;12:44,820;"is also a strong word. Yeah, it is. So that he has also the injuries. I mean, it makes a playoffs,"
12:44,820;12:52,100;"you know, for, but he's got he has that shoulder injuries. Oh, six, he wins. Come back player of"
12:52,100;13:00,020;"the year. More years of injuries. And then he gets traded to Miami and wins come back player of"
13:00,020;13:03,740;"of the year again in Miami in 2008."
13:03,740;13:05,180;"- Oh yeah."
13:05,180;13:08,660;"- And he was actually second in MVP voting set here."
13:08,660;13:09,740;"- Nah, he should."
13:09,740;13:12,700;"- That's wild."
13:12,700;13:13,540;"- Yeah, and then-"
13:13,540;13:15,700;"- I wonder if there's any other player"
13:15,700;13:19,020;"that's one comeback player of the year twice."
13:19,020;13:20,100;"- He's the only one."
13:20,100;13:21,980;"Yeah, they mentioned that."
13:21,980;13:22,980;"- That is interesting."
13:22,980;13:24,460;"(laughing)"
13:24,460;13:26,300;"- But one of the years he won it was,"
13:29,300;13:31,220;"Yeah, he beat out Drew Brees."
13:31,220;13:34,660;"That was the road to shop here."
13:34,660;13:36,560;"I think so. Yeah."
13:36,560;13:38,060;"When he moved to the Saints."
13:38,060;13:39,860;"Yeah. Holy shit."
13:39,860;13:46,180;"Yeah. So he had one good year of Miami that year and then nothing after that."
13:46,180;13:55,100;"But he was the starting quarterback on both teams that won the AFCs, the only two teams."
13:55,100;13:56,620;"Yeah."
13:56,620;14:00,820;"Yeah, I'll wait dolphins in the this year. Yeah, so"
14:00,820;14:11,220;"the second best, right? Yep. I think he has to. For sure. Because, yeah, he is him and Brett Farr are both"
14:11,220;14:16,220;"the reason the Patriots missed the playoffs the two times that they missed them."
14:16,220;14:22,460;"Wow. Because in '08, we've talked about that where"
14:23,980;14:25,980;"Because wasn't um"
14:25,980;14:29,540;"Pennington was"
14:29,540;14:34,800;"Released or traded to Miami to make room for Brett Favre, right Greg? Yeah. Yeah, it sounds right"
14:34,800;14:38,220;"I think I think we talked about that and so then at the end of the season"
14:38,220;14:43,820;"Pennington beats Brett Favre, which keeps the Patriots out of the playoffs"
14:43,820;14:47,860;"Yes, I don't think Miami needed the win to get in the"
14:47,860;14:50,860;"Plan and they were in anyway, but that kept the Patriots out"
14:52,020;14:54,540;"How far they get that year I can't remember in"
14:54,540;14:57,540;"2008 yeah, no wait"
14:57,540;15:00,060;"They lost the wildcard"
15:00,060;15:02,900;"At least seven to nine to the Ravens cool"
15:02,900;15:07,460;"What are the Patriots were coming on strong and like heaven lesson to show it up?"
15:07,460;15:12,860;"Yeah, and then no 2001 it's a little bit more convoluted"
15:12,860;15:15,820;"but pennington I"
15:15,820;15:18,660;"Think they were already in the playoffs"
15:19,420;15:27,360;"Because the Patriots beat the dolphins which means the Jets were already in the playoffs and they were playing Brett Favre's Packers"
15:27,360;15:30,740;"Brett Favre was in the running for MVP"
15:30,740;15:34,520;"and I think the game mattered to"
15:34,520;15:43,980;"Matter to the Packers for seating reasons I believe yep because we talked about this when the Patriots played the Packers and"
15:48,100;15:50,740;"Basically, Packers got their doors blown off."
15:50,740;15:56,660;"Breath and people say that's why Brett Favre didn't win the MVP that year because he lost so badly in the last week of the season."
15:56,660;16:00,340;"And that loss kept the page side of playoffs again."
16:00,340;16:03,420;"So those two guys playing against each other."
16:03,420;16:07,420;"Jet panning is in beating Brett Favre twice."
16:07,420;16:09,860;"They're all really sad, which is weird."
16:09,860;16:13,300;"And that's probably why I don't really hate Chad Pennington, but I hate Brett Favre."
16:13,300;16:15,620;"I wonder if Brett Favre would won both those games."
16:15,620;16:17,660;"Maybe I like Brett Favre and hate Chad Pennington."
16:17,660;16:19,760;"Who would you?"
16:19,760;16:22,300;"I don't think you would."
16:22,300;16:23,100;"I don't know."
16:23,100;16:25,960;"I hate Mark Sanchez a whole lot more than Chad Pennington."
16:25,960;16:27,860;"But why don't you hate Chad Penning?"
16:27,860;16:30,620;"Because he's the reason he's the one that kept you out of the playoffs."
16:30,620;16:34,340;"Well, to be fair, I didn't know that until rewatching this game."
16:34,340;16:36,900;"You know, sometimes hate isn't logical."
16:36,900;16:39,780;"You know, if you feel you feel."
16:39,780;16:44,740;"And it hates a lot easier when you don't know."
16:45,180;16:52,020;"Well, maybe they didn't know that not only were they playing for the Patriots to get in the players are not they're playing for who I get to hate the most for the rest of my being."
16:52,020;16:55,280;"Yeah, they know that Brett far may have tried harder."
16:55,280;16:55,860;"Yeah."
16:55,860;16:57,620;"But I doubt it."
16:57,620;17:00,780;"You're about to make a little kid hate you, Brett."
17:00,780;17:01,620;"Come on."
17:01,620;17:12,380;"Also, Pennington's parents are both British and his real name is James Chadwick Pennington, the most British name ever."
17:14,380;17:15,100;"Wait, was he born?"
17:15,100;17:15,820;"Yes."
17:15,820;17:17,940;"James Chadwick Pennington."
17:17,940;17:19,220;"Was he born here, Greg?"
17:19,220;17:21,340;"Uh, yes."
17:21,340;17:23,380;"Yeah, he was born in Knoxville."
17:23,380;17:26,500;"So the same thing as our parents, except move to"
17:26,500;17:27,500;"Knox."
17:27,500;17:28,660;"He had a ham, sure."
17:28,660;17:30,060;"He had a seven draw."
17:30,060;17:31,780;"Chadwick."
17:31,780;17:33,940;"Is that what most most chads are?"
17:33,940;17:35,020;"Are they Chadwick's?"
17:35,020;17:36,420;"Oh, sorry."
17:36,420;17:36,940;"Question."
17:36,940;17:40,740;"Um, is not sure for Chad, right?"
17:40,740;17:42,540;"No."
17:43,780;17:45,480;"I don't think so."
17:45,480;17:46,620;"I thought I'm just."
17:46,620;17:51,380;"Unless they're just Chad because I have friends who are like just Jill and"
17:51,380;17:53,740;"not short for anything or just Kate."
17:53,740;17:57,700;"Well, what is Chad short for?"
17:57,700;17:59,500;"Yeah, my brother is just Matt."
17:59,500;18:00,420;"He's not a Matthew."
18:00,420;18:02,100;"Oh, wow."
18:02,100;18:03,700;"Oh, I guess."
18:03,700;18:05,060;"Do you call him Matthew?"
18:05,060;18:07,220;"No, because that's what I do."
18:07,220;18:09,940;"My friends, I just call them their names, even though it's not just"
18:09,940;18:13,120;"just watched a seven minute Randy Moss college highlight"
18:13,120;18:14,460;"(laughing)"
18:14,460;18:18,340;"and it's auto playing a in 12 minute one."
18:18,340;18:20,740;"I thought we were talking about that, that shit was awesome."
18:20,740;18:21,580;"- Yeah, right?"
18:21,580;18:22,700;"- That doesn't sound bad."
18:22,700;18:25,100;"- There's a bomb hurdle one too, it was ridiculous."
18:25,100;18:28,940;"- Oh, don't worry, there'll be like a 15 minute one after that."
18:28,940;18:30,020;"There's plenty."
18:30,020;18:33,940;"- No, it's the Vikings 12 minutes."
18:33,940;18:37,340;"- Oh yeah, the Vikings won't be even more ridiculous."
18:37,340;18:38,940;"- Least he never did that."
18:38,940;18:44,620;"Yeah, thank God. Who else played for these? Well, this is a her medwards team."
18:44,620;18:48,700;"Hmm. Nobody wants to do the her medwards. Okay."
18:48,700;18:55,580;"You do it, Andy. Yeah. I mean, what do you play to do?"
18:55,580;18:58,740;"You play to win the game. Oh, okay."
18:58,740;19:05,580;"And while he would win this game, this was the last time he would be the"
19:05,580;19:08,140;"Patriots as a head coach in the NFL."
19:08,140;19:12,220;"Yeah, after this, he is two and two."
19:12,220;19:16,380;"He would finish his record against the page to be two and nine."
19:16,380;19:17,980;"When was the final score of this game?"
19:17,980;19:19,980;"30 or 17."
19:19,980;19:21,100;"Yeah."
19:21,100;19:22,820;"And it wasn't even that close."
19:22,820;19:23,580;"It was close."
19:23,580;19:24,620;"It shouldn't have been."
19:24,620;19:25,740;"And it wasn't."
19:25,740;19:28,260;"According to the box score that I looked at."
19:28,260;19:30,780;"Oh, yeah."
19:30,780;19:33,180;"We forgot to give this a watchability score."
19:33,380;19:39,860;"Yeah, yes. So Lisa, what we do is, because we have to watch all these, the listeners don't,"
19:39,860;19:43,140;"but we like to give a watchability score out of six on parties."
19:43,140;19:49,060;"How good the game is to watch, and if it's worth rewatching. And we always start with Greg."
19:49,060;19:53,700;"Because he has yet to watch at one of these games."
19:53,700;19:56,740;"That's not true. I watch the ones that are worth watching."
19:56,740;20:02,340;"Week 16 and the Jets is not worth watching."
20:02,340;20:09,260;"Well, according to the stats, this one doesn't look like there's many."
20:09,260;20:14,940;"I mean, the score was closer than it and then the stats seemed to lead it to be."
20:14,940;20:19,700;"I mean, they got out yardaged 393 to 216."
20:19,700;20:20,700;"Yeah."
20:20,700;20:22,940;"So they didn't see."
20:22,940;20:27,540;"I mean, it was the kickoff return by fall because that was probably pretty sweet."
20:27,540;20:28,540;"I'm assuming."
20:28,540;20:29,540;"It was."
