Start Timestamp;End Timestamp;Transcript
41:08,680;41:10,400;"like full game highlights to YouTube"
41:10,400;41:12,640;"and making you go to YouTube to watch it."
41:12,640;41:13,140;"Yeah."
41:13,140;41:16,440;"I guess I still don't quite understand why that is."
41:16,440;41:20,960;"But that might be more to control where the video shows up."
41:24,120;41:29,120;"- Oh yeah, just for like 15, 20 second clips of one play,"
41:29,120;41:35,480;"it seems like allowing people to easily share that"
41:35,480;41:39,800;"would actually build more interest in the brand"
41:39,800;41:43,640;"and have more people come to find more of those"
41:43,640;41:45,520;"and actually like visit your website more"
41:45,520;41:46,560;"and then you can serve the meds"
41:46,560;41:49,440;"and do whatever you need to to make your money."
41:49,440;41:50,360;"- Sure, excited."
41:50,360;41:51,200;"- Yeah."
41:51,200;41:53,160;"- I can't have a highlight request."
41:53,160;41:54,000;"Okay."
41:54,000;42:02,520;"And this goes back to the commentators, which, Andy, I can't believe you haven't talked on."
42:02,520;42:08,280;"I have a, I have a lot of hate on them, but they were talking about this Miami Denver game"
42:08,280;42:11,440;"where they were just laying each other out and ended field goal, field goal, field goal."
42:11,440;42:17,400;"So I tried to Google it and I couldn't find it, but it sounded like it was like a super duper slug"
42:17,400;42:21,080;"fast where people just absolutely crushing each other."
42:21,080;42:22,200;"Oh."
42:22,200;42:31,200;"Huh. So 2001 week 16. Well, it's had to be 2002. Right. Oh, week 15."
42:31,200;42:40,700;"Because I had to rewind it because he said he said something so dumb. I listened to this twice because right before he says, I've seen more third and 20s made than I have seen third and ones."
42:40,700;42:43,200;"That's fucking stupid."
42:43,200;42:43,700;"Yeah."
42:43,700;42:51,700;"And the other commentator called him out. I mean, which commentary said this dumb shit, but he's like, oh, really, you've been around for a long time, which doesn't make any sense either because the longer you're going to be."
42:51,700;42:55,300;"the longer you're around, they're starting to say you're going to see wait if you watch"
42:55,300;43:04,580;"one third downplay maybe. It's so dumb. So they start talking about this slugfest between"
43:04,580;43:12,980;"Miami and Denver however many years ago. Oh, so it wasn't even this season? No, no, it's like"
43:12,980;43:17,940;"they're talking about old, they're reminiscing about some slugfest between the two teams."
43:19,140;43:24,420;"We've honestly, it feels like from like the 70s or 80s, probably worst with good highlight guests in there too."
43:24,420;43:31,380;"Yeah, that's probably my guess. And you probably won't find highlights from games from the 70s because do they even have TV back then?"
43:31,380;43:33,400;"Yeah."
43:33,400;43:35,540;"Last mom."
43:35,540;43:37,380;"I guess some other choice."
43:37,380;43:42,100;"Just go through our the old VHS ones. Remember those videos we used to have as kids."
43:42,100;43:43,300;"Oh,"
43:43,300;43:45,380;"- Oh, I like films with Steve Sable."
43:45,380;43:46,660;"- Oh, yeah."
43:46,660;43:48,060;"- Steve Sable's videos."
43:48,060;43:52,520;"- Dude, he's Morgan Freeman before Morgan Freeman."
43:52,520;43:53,600;"- Yeah. - Yeah."
43:53,600;43:55,520;"- And the music too was always great."
43:55,520;44:01,160;"Speaking of which, I forgot about the ESPN chime"
44:01,160;44:03,160;"that was in this whenever they'd show the thing"
44:03,160;44:05,920;"at the bottom, the Dunno-Nah."
44:05,920;44:07,580;"- The Mayonnaise chime."
44:07,580;44:11,380;"- I feel like I've told you this before."
44:11,380;44:15,380;"Every time I say the word mayonnaise in my head, I say it to that team."
44:15,380;44:16,380;"Mayonnaise."
44:16,380;44:17,380;"Mayonnaise."
44:17,380;44:19,380;"That's where I got it from."
44:19,380;44:20,380;"Yeah."
44:20,380;44:21,380;"Finetically."
44:21,380;44:22,380;"God damn it."
44:22,380;44:25,900;"Because they had a commercial they do with the straws too, right?"
44:25,900;44:27,380;"There's like two guys at the wedding."
44:27,380;44:28,380;"Oh yeah, I remember that."
44:28,380;44:31,380;"I was used to doing it every time I go to get fast food."
44:31,380;44:36,380;"You're like, ""Hey kid, ever since we did the Brett Favre game, I've been saying real,"
44:36,380;44:38,380;"comfortable, jeans."
44:38,380;44:43,520;"time I pick up jeans like the footage. I can't stop thinking it."
44:43,520;44:45,680;"This podcast is gonna ruin us."
44:45,680;44:48,600;"Ready to pretty fucked up, so"
44:48,600;44:53,520;"I do every time I hear his name though, and I'm a real"
44:53,520;44:55,840;"comfortable pine killers."
44:55,840;45:01,680;"It'll bread. I have some other choice comparisons from the"
45:01,680;45:07,800;"commentators. Okay. You talked for a little bit about how Brad"
45:07,800;45:10,880;"Johnson was better than Mike Vick and should have gone to the Pro Bowl over him."
45:10,880;45:14,720;"It's a high was not paying attention to family."
45:14,720;45:15,400;"I missed that."
45:15,400;45:23,160;"And then they were talking about saying Randy Moss and for some reason,"
45:23,160;45:24,320;"because he's not even in this game."
45:24,320;45:28,800;"This one I know they said like Santana Moss is better."
45:28,800;45:30,280;"Oh no."
45:30,280;45:33,400;"No, they said he was faster."
45:33,400;45:36,640;"Like, you know, it was like, which moss is faster than the guys?"
45:36,640;45:38,840;"Just like dead pans like Randy."
45:38,840;45:41,360;"I don't know which team is worse."
45:41,360;45:44,200;"They have their own moss and he's faster."
45:44,200;45:49,120;"It was because Chad Pennington had thrown to Randy Moss in college."
45:49,120;45:52,240;"And now he's throwing to Santana Moss and he's so fast."
45:52,240;45:54,640;"He's like, Oh, which guy is faster?"
45:54,640;45:57,200;"And the other guy just dead pans like Randy."
45:57,200;45:59,160;"Obviously. Yeah."
45:59,160;46:00,000;"Like what you mean?"
46:00,000;46:02,280;"That's not a player that's ever played in the league."
46:02,280;46:03,920;"Exactly what he said."
46:03,920;46:05,640;"Well, back to the victim."
46:05,640;46:11,080;"I think this is this is the year Vic like makes his name known right where he goes into"
46:11,080;46:19,800;"Lambo because we're talking about the packers by losing to the dolphins would have to play"
46:19,800;46:26,200;"Vic and the Falcons right and then Vic goes into Lambo and beats him."
46:26,200;46:29,560;"Is this not Brad Johnson's Super Bowl appearance though?"
46:29,560;46:30,560;"It is."
46:30,560;46:31,560;"Yes it is."
46:31,560;46:38,700;"Considered the worst quarterback to win a Super Bowl, right? Yeah, is he because they didn't win it because of him"
46:38,700;46:41,320;"They want it because of that spider witness"
46:41,320;46:48,020;"Yeah, yeah to win actually see that I mean Grossman made one he was really bad. Oh, yeah"
46:48,020;46:50,760;"He didn't win it though"
46:50,760;46:54,240;"Yeah, yeah, who else"
46:54,240;46:56,240;"I mean flacko would be on that list"
46:56,600;47:00,880;"But I mean he had really good playoffs that year"
47:00,880;47:04,320;"So he was kind of the reason they want the Ravens won that Super Bowl"
47:04,320;47:09,720;"Peyton man was pretty bad that last year, but yeah, that's what I was also paid manning. Yeah"
47:09,720;47:13,200;"But that individual game performance was so bad"
47:13,200;47:15,160;"Yeah"
47:15,160;47:17,160;"Which one"
47:17,160;47:21,480;"Hey man, I had a couple of stinkers in the Super Bowl"
47:23,600;47:25,600;"Speaking of stinkers Ken Walter"
47:25,600;47:32,520;"He is probably the worst punter I've seen on the Patriots"
47:32,520;47:35,560;"Did I can I can remember"
47:35,560;47:38,080;"Like I wrote down"
47:38,080;47:41,720;"The one good thing that he's done this season"
47:41,720;47:49,560;"Was tackling Santana Moss on a part return after out kicking his coverage by like 20 yards and setting up a huge return"
47:51,040;47:53,480;"Okay, you're blaming it for out kicking the coverage"
47:53,480;47:55,680;"Yeah"
47:55,680;47:58,880;"Your that's your just fucking job as a punter and when he wasn't"
47:58,880;48:03,880;"When he wasn't doing that he was he was kicking it too far again into the fucking end zone for touchbacks"
48:03,880;48:09,580;"Well, maybe the coverage should have sped up and got down there quicker. It landed five yards in the end zone"
48:09,580;48:13,560;"Not much you can do about that like it pounds five yards"
48:13,560;48:20,520;"I retract my previous statement. So that pun was a net of 20 yards. So it wasn't even like"
48:20,520;48:26,040;"like, uh, and so I had one that I thought was like, oh, it finally hit a good punt."
48:26,040;48:32,760;"It was a whopping 44 yard punt, which you followed up with a 27 yard punt like late"
48:32,760;48:33,160;"in the game."
48:33,160;48:39,480;"There's a, there's a really fascinating news article about Ken Walter and like"
48:39,480;48:43,680;"just how much the anxiety of being so bad got to him."
48:43,680;48:48,000;"I, I think it was written around 2001 or 2002."
48:48,000;48:49,360;"Oh, I have to dig it up."
48:49,640;48:51,560;"That sounds like a must read right."
48:51,560;48:52,080;"Yeah."
48:52,080;48:53,320;"It was good."
48:53,320;48:54,760;"Oh my god."
48:54,760;48:55,420;"All right."
48:55,420;48:55,520;"Yeah."
48:55,520;48:57,240;"We'll have to dig right after."
48:57,240;49:01,960;"Because you think of punting as like the least stressful position in football, really, you"
49:01,960;49:02,960;"know?"
49:02,960;49:03,960;"Yeah."
49:03,960;49:04,460;"Yeah."
49:04,460;49:07,240;"If you fuck it up, it's not like you lost the game."
49:07,240;49:09,440;"Like if you fuck up as a kicker, you could lose the game, you know?"
49:09,440;49:09,940;"Yeah."
49:09,940;49:10,440;"Yeah."
49:10,440;49:10,440;"Yeah."
49:10,440;49:10,940;"Yeah."
49:10,940;49:12,440;"High leopardy."
49:12,440;49:15,960;"And you're already there performing because they fucked up."
49:15,960;49:16,480;"So I--"
49:16,480;49:17,000;"Exactly."
49:17,000;49:17,500;"Yeah."
49:17,500;49:18,520;"You're already given the ballway."
49:18,520;49:20,000;"So it's like whatever."
49:20,000;49:24,160;"And then people feel, I feel like you only remember bad punts"
49:24,160;49:26,400;"like the next day when someone else brings it up"
49:26,400;49:28,720;"and you're like, oh yeah, he was terrible."
49:28,720;49:30,240;"You know, you don't ever like think of it on you."
49:30,240;49:31,600;"Like he lost the game for us."
49:31,600;49:33,120;"It was always just."
49:33,120;49:34,600;"- Yeah, it's never lost on a pun."
49:34,600;49:35,440;"Yeah. - Right."
49:35,440;49:37,840;"- You don't say Ryan Allen probably won that Super Bowl"
49:37,840;49:38,680;"with us."
49:38,680;49:39,820;"He punted awesome in that Ram Super Bowl."
49:39,820;49:40,680;"- That's true."
49:40,680;49:43,360;"Yeah, him and Matt Slater."
49:43,360;49:45,160;"I think he could have given them co-nppies."
49:45,160;49:46,760;"- That would have been awesome."
49:46,760;49:47,600;"Just the fact that it's so--"
49:47,600;49:52,000;"So Bella Checchi and if the punter went super on the fee,"
49:52,000;49:53,360;"I would have been so happy."
49:53,360;49:54,520;"I remember like half time."
49:54,520;49:58,120;"I was like, I, I really was hoping for a three nothing win."
49:58,120;50:02,400;"You know, just have that like all signature to the game."
50:02,400;50:05,200;"Yeah, it was so good."
50:05,200;50:11,320;"Cause that that Rams offense, I think was top 10 all time."
50:11,320;50:12,680;"Yeah, I think it was like,"
50:12,680;50:16,320;"leaving higher because the Chiefs was as well."
50:16,360;50:18,280;"the two softens, I think was fourth all time."
50:18,280;50:20,800;"And I think I want to say I thought they like both."
50:20,800;50:24,560;"I think there was seventh all time there, but they were both like"
50:24,560;50:30,680;"all the time offenses and the Patriots held that Rams team to three points,"
50:30,680;50:34,080;"which is outrageous. But yeah. And also the fact that"
50:34,080;50:41,360;"Matthew Seder would occasionally actually catch Ryan Allen's punts,"
50:41,360;50:45,000;"like before they hit the ground, like you would get down there fast enough"
50:45,000;50:48,300;"and to be able to turn around and field the punt as if he was the punter."
50:48,300;50:52,520;"Is he still playing or did we like cut him and he's gone?"
50:52,520;50:56,000;"Are you still playing? Yeah. Who?"
50:56,000;51:01,000;"Matthew Slater Slater. No. Alan. Oh."
51:01,000;51:04,020;"Oh, I see."
51:04,020;51:06,020;"He's talking."
51:06,020;51:10,720;"That's actually this is what I'm saying. Like no, we don't even know."
51:10,720;51:15,840;"Is it it's week three? Oh, no, it is not yeah. Yeah. Yeah"
51:15,840;51:22,720;"Yeah, it's not that they're here. He's not playing. No, I thought he played for Falcons last year. He was a good part"
51:22,720;51:24,720;"I don't understand"
51:24,720;51:29,000;"Yeah, the fact they moved on from him and"
51:29,000;51:34,520;"He couldn't land anywhere else because he wasn't yeah"
51:34,520;51:38,000;"Yeah, oh man"
51:39,680;51:43,400;"You want to hear some other another interesting staff from this game?"
51:43,400;51:48,640;"Let's do it. I depressing but the Jets the Jets said"
51:48,640;51:52,720;"186 yards in the first quarter alone after only"
51:52,720;51:57,280;"Getting 200 yards in their previous meeting this year"
51:57,280;52:00,440;"Yeah, that's right"
52:00,440;52:05,320;"Patriots shall act them. Mm-hmm. That was a victory week - yeah"
52:05,320;52:08,880;"Yeah, I had a pick sick like a 90 something yard pick six. Yeah"
52:08,880;52:11,960;"Yeah, this is all team makes you long for Vinny test of Verity"
52:11,960;52:17,200;"Sure does all the Vinny green head"
52:17,200;52:25,540;"Is that what that means yeah, we looked it up. I mean I don't that's what the translation"
52:25,540;52:28,500;"I believe we call that loosened translated"
52:28,500;52:35,140;"The Vinny green head I know we're like wait the Jets this all makes sense"
52:37,960;52:39,960;"Really does oh"
52:39,960;52:42,480;"man"
52:42,480;52:44,480;"I"
52:44,480;52:46,480;"Had a stat that I thought was"
52:46,480;52:49,320;"I don't know interesting, but strange"
52:49,320;52:54,480;"Because another player who I think has struggled down the stretch here is Anton Smith"
52:54,480;53:00,580;"How many eyes do you have in this game rec? He's had a few disappointing games down this"
53:00,580;53:06,160;"See here I'd say less than 50"
53:07,480;53:10,080;"14 carries for 46 yards."
53:10,080;53:11,080;"Right."
53:11,080;53:13,960;"On the season, they showed a stat."
53:13,960;53:15,760;"He was averaging four yards per carry."
53:15,760;53:16,660;"Really?"
53:16,660;53:18,220;"That does not sound right."
53:18,220;53:18,960;"Yeah."
53:18,960;53:21,460;"This has been the least impressive four yards per carry."
53:21,460;53:23,320;"I've seen from a running deck."
53:23,320;53:25,960;"I mean, to be fair, they're trying to throw it a ton."
53:25,960;53:27,540;"They did."
53:27,540;53:27,700;"Yeah."
53:27,700;53:31,100;"This was kind of like a microcosm of the season, really."
53:31,100;53:32,180;"Couldn't stop the run."
53:32,180;53:35,080;"I'm sure Curtis Martin went over a hundred yards."
53:35,080;53:35,840;"Yeah."
53:35,840;53:37,600;"And a thousand yards again on the season."
53:37,600;53:39,520;"Um,"
53:39,520;53:43,320;"couldn't stop a pass rush."
53:43,320;53:46,200;"Brady was getting shellacked the entire time and just"
53:46,200;53:49,800;"like couldn't run the ball early and just got away from like, just didn't even"
53:49,800;53:50,480;"try anymore."
53:50,480;53:55,520;"And Brady was just trucking around and didn't have the time, wasn't accurate."
53:55,520;54:00,880;"Just wasn't able to put the team on his back, which again, it's surprising"
54:00,880;54:02,640;"considering what we've seen for the last."
54:03,640;54:14,440;"And I was since probably 2004-ish, like when he just decided, yeah, no, I am going to put the team on my back and the offense is going to run through me now instead of him being more of a game manager."
54:14,440;54:15,880;"Like these last couple of years."
54:15,880;54:16,240;"Yeah."
54:16,240;54:22,320;"Yeah, he was 19 of 37 for 133, one touchdown, one pick."
54:22,320;54:25,760;"So really not that impressive."
54:25,760;54:26,240;"No."
54:26,240;54:31,040;"And the and the pick was his kind of patented getting really frustrated."
54:31,040;54:33,640;"the office and do anything and chuck it deep in a double coverage."
54:33,640;54:34,520;"Yeah."
54:34,520;54:35,760;"You know, he still does that."
54:35,760;54:36,320;"Yeah."
54:36,320;54:36,960;"That's what I'm saying."
54:36,960;54:39,160;"That hasn't gone anywhere."
54:39,160;54:39,600;"Yeah."
54:39,600;54:41,720;"But you were seeing it in 2002."
54:41,720;54:44,480;"Frustration with the offense."
54:44,480;54:50,280;"There was such a weird lack of urgency in this game given how important it really"
54:50,280;54:54,080;"was like, yeah, didn't seem like a game with any implication at all."
54:54,080;54:56,000;"And it was actually very important."
54:56,000;54:56,720;"Right."
54:56,720;54:59,200;"It was played at home and everything and the crowds behind him and they still"
54:59,200;55:05,920;"just like didn't seem to get up for it. Yeah. Because yeah, I mean, the defense, which had been,"
55:05,920;55:10,960;"uh, I guess the strength of this team or what you would expect to be in the early years, like this"
55:10,960;55:15,360;"year wasn't like they were getting absolutely no pass rush. Even when they brought the blitz,"
55:15,360;55:20,560;"they easily got picked up and Pennington just had all day to throw. Was he an attack? Uh,"
55:20,560;55:26,800;"they have one play where I think he was not it was close. Anybody still like picked up a yard"
55:27,440;55:31,280;"Yeah, it's because it can't stop the run. I mean, right"
55:31,280;55:37,040;"And all that slows down your pass rush and now that's more I think the secondary is to every"
55:37,040;55:41,280;"Yeah, yeah, but they just had to cover for too long"
55:41,280;55:48,160;"And the defense was biting on every play action the chat pending was doing they had that it was uh to be fair"
55:48,160;55:49,920;"It was a good play action. I'll give them that"
55:49,920;55:54,320;"I'm interested in the palm lachete turnover into 2003"
55:55,840;55:58,880;"How much what how much of the defense they turn over after this?"
55:58,880;56:04,720;"Um, well, what was game one of 2003?"
56:04,720;56:12,880;"That I remember did fine. I bet you do. Yeah, you do. We'll see if that talk for that week."
56:12,880;56:15,920;"So you said that you said he had a good uh"
56:15,920;56:25,440;"Play action pennington. Yeah. Yeah, so they said the whole dislocating the hand thing. Yeah"
56:25,440;56:30,780;"So they said that so he dislocated in the preseason game. They rushed him back"
56:30,780;56:33,960;"It said due to the severity of the injury in a rush rehab process"
56:33,960;56:41,060;"Pennington's wrist would never be the same and his once outstanding play fake became thoroughly ordinary. Wow"
56:41,060;56:47,780;"So just think about how good that play fake could have been Andy"
56:53,840;56:58,880;"Must have been known for his play face. He's like it was really good read option"
56:58,880;57:02,240;"We leave it as belly for like an extra second good old Chadwick"
57:02,240;57:08,740;"What's his name Chadwick to you James Chadwick Pennington the third"
57:08,740;57:16,360;"Lord Chadwick"
57:16,360;57:22,680;"What else can we pile on since this is shit on the Patriots week? Oh well this shit on Chadwick he"
57:23,360;57:30,960;"Apparently when he got traded to the Dolphins, it was like, like a rush job for the preseason."
57:30,960;57:34,960;"And he just got married and they said he brought his playbook on his honeymoon."
57:34,960;57:36,640;"Oh my God."
57:36,640;57:38,680;"What a loser."
57:38,680;57:39,960;"Is he still married?"
57:39,960;57:42,600;"Probably doubt it."
57:42,600;57:47,960;"Oh, he just seems like a a dork, you know, what woman kind of guy."
57:47,960;57:51,240;"Yeah, he got three point three eight three GPA."
57:51,240;57:52,000;"Yeah."
57:52,000;57:52,640;"What is going on?"
57:52,640;57:55,140;"Like no a yogurt plain yogurt"
57:55,140;57:58,400;"What do you think is wonder like was"
57:58,400;58:02,240;"What was Brady 32? Yeah"
58:02,240;58:10,160;"Probably right I don't think 50 50. Yeah, give me a 41"
58:10,160;58:14,400;"It was a road scholar. He's finally oh"
58:14,400;58:18,160;"Look at this dummy 25"
58:21,520;58:26,360;"How do you get how was the road scholar finalists and then it's a 25 and a wonder right?"
58:26,360;58:28,720;"Wait, you're serious about the road scholar"
58:28,720;58:33,120;"Yeah, it's what according to Wikipedia Wikipedia calm"
58:33,120;58:38,880;"Yeah renowned source of unbiased"
58:38,880;58:42,000;"factual information"
58:42,000;58:44,560;"boy"
58:44,560;58:51,300;"That's surprising it was a it was an interesting look from Belichick read with a headband"
58:51,300;58:53,700;"I love that fan looking."
58:53,700;58:54,700;"Rocking the headband."
58:54,700;58:55,700;"I like that."
58:55,700;58:56,700;"Yeah."
58:56,700;58:57,700;"That was pretty slick."
58:57,700;59:01,940;"No holes in a sweater, which no none taking care of himself."
59:01,940;59:02,940;"Yeah."
59:02,940;59:05,180;"Well, shit for him."
59:05,180;59:06,940;"Yeah."
59:06,940;59:08,580;"Fighting scale."
59:08,580;59:10,780;"I love bill of checks."
59:10,780;59:16,380;"Like I tire because it's like, you know, you see like hipsters are like, oh, I don't"
59:16,380;59:20,940;"care what I look like, but his just so authentically not giving a shit."
59:20,940;59:23,780;"You know, you just have to respect it."
59:23,780;59:24,660;"You do."
59:24,660;59:27,380;"So completely unflattering all the time."
59:27,380;59:28,020;"Yeah."
59:28,020;59:29,700;"It doesn't give a shit."
59:29,700;59:32,660;"He's the least photogenic man ever."
59:32,660;59:37,860;"Even though it's like, man, you had half a beard at one point."
59:37,860;59:38,980;"Yeah, right."
59:38,980;59:40,980;"Rich covers a new drag."
59:40,980;59:44,140;"I'm not I'm not trying to imply that I'm photogenic."
59:44,140;59:48,220;"I'm just saying, at least he's setting the bar low."
59:49,220;59:53,780;"Well, what was it like trash and a dumpster and like, you know, you can"
59:53,780;59:58,460;"you just yeah, to go back to what Lisa was saying earlier, of once you set a"
59:58,460;01:00:02,660;"standard, a high bar, people start to accept, expect that from you."
01:00:02,660;01:00:04,940;"So always set a low standard."
01:00:04,940;01:00:07,940;"Just like,"
01:00:07,940;01:00:08,540;"live by."
01:00:08,540;01:00:15,740;"Holy shit."
01:00:15,740;01:00:18,940;"So I got some names for you guys."
01:00:18,940;01:00:23,140;"here. Alright. Uh, starting on this defense."
01:00:23,140;01:00:26,500;"And you tell me if you've ever heard of them. Okay."
01:00:26,500;01:00:30,300;"I'm just gonna go through the list and you tell me if you heard them."
01:00:30,300;01:00:34,900;"Bobby Hamilton left to find. Yes. Richard Seymour left offensive tackle."
01:00:34,900;01:00:38,340;"Yes. Yeah. Rick Lyle right defensive tackle."
01:00:38,340;01:00:41,700;"I had that note. Who the fuck is Lyle? Yep. So did I."
01:00:41,700;01:00:45,220;"Anthony Pleasant, Roman Fyfer, Mike Rayville, Ted Johnson."
01:00:45,220;01:00:46,820;"So the linebackers. Okay."
01:00:46,820;01:00:49,700;"Yes. Cornerbacks, tie law."
01:00:49,700;01:00:50,880;"I'm assuming you've heard of him."
01:00:50,880;01:00:54,020;"All Leonard Leonard Myers."
01:00:54,020;01:00:55,740;"I remember Leonard Myers."
01:00:55,740;01:00:56,220;"Little bit."
01:00:56,220;01:00:56,740;"Literally."
01:00:56,740;01:00:58,220;"Sure."
01:00:58,220;01:00:59,980;"I do not remember him at all."
01:00:59,980;01:01:06,940;"I do not like him, which is strange because he actually apparently he played"
01:01:06,940;01:01:08,500;"in seven games in 2001."
01:01:08,500;01:01:15,180;"I remember that he did something that like made me an eight games this season."
01:01:15,620;01:01:17,620;"And this was his one and only start."
01:01:17,620;01:01:21,500;"I and he was the one that panning to was picking on in this game."
01:01:21,500;01:01:27,940;"And then your safeties are lower below in to Bucky Jones, but I have not heard"
01:01:27,940;01:01:31,700;"two of these starting players on the defense."
01:01:31,700;01:01:34,100;"Lyle must have been new."
01:01:34,100;01:01:35,940;"I didn't see him on the list of like."
01:01:35,940;01:01:40,540;"Jets players currently playing on the Patriots, which was pretty long as we all"
01:01:40,540;01:01:42,580;"know, and I saw his name on the top."
01:01:42,580;01:01:43,220;"I was like, who the fuck?"
01:01:43,220;01:01:45,500;"I mean, I saw one that the game tells like, who is Lyle?"
01:01:45,500;01:01:48,700;"So he must have like was that Steve Martin was so shit"
01:01:48,700;01:01:52,120;"Right now check probably cut him this this in this week"
01:01:52,120;01:01:55,300;"I would think and just signs some guy he knew from the Jets"
01:01:55,300;01:01:59,480;"Yeah, it must have been because band didn't work"
01:01:59,480;01:02:02,200;"because as a defensive end"
01:02:02,200;01:02:05,900;"He spent five six seven eight nine years in the league"
01:02:05,900;01:02:09,800;"and had 11 sacks ever"
01:02:10,500;01:02:12,500;"Never all with the Jets or"
01:02:12,500;01:02:19,460;"No, but in 2001 he hit his high where he had three and a half sacks with the Jets before coming to New England"
