Start Timestamp;End Timestamp;Transcript
01:00:38,660;01:00:42,260;"- And he does that little like his end zone celebration"
01:00:42,260;01:00:44,500;"as he's going into the prop back memories."
01:00:44,500;01:00:46,260;"- Yeah, for sure."
01:00:46,260;01:00:48,700;"- Kind of reminded you of the tie law a little bit."
01:00:48,700;01:00:51,100;"Yeah. So that's a very Asian of that."
01:00:51,100;01:00:53,300;"I love a little bit of showmanship."
01:00:53,300;01:00:54,300;"Yeah."
01:00:54,300;01:00:56,300;"Of course, Dick Endberg on that last touchdown"
01:00:56,300;01:00:59,740;"says, ""Preach home scores and we're going to extra time."""
01:00:59,740;01:01:01,220;"And then Dan Deereau for a while,"
01:01:01,220;01:01:02,300;"people had to remind them that no,"
01:01:02,300;01:01:04,740;"they still had to keep the extra point."
01:01:04,740;01:01:07,220;"Back then it was pretty automatic, you know, whatever."
01:01:07,220;01:01:08,100;"Yeah."
01:01:08,100;01:01:09,340;"That's true."
01:01:09,340;01:01:13,300;"Especially with Morton Anderson and his 1970s face."
01:01:13,300;01:01:17,100;"I want you to commentate a game, Andy."
01:01:17,100;01:01:17,940;"All right."
01:01:17,940;01:01:24,660;"And then and then I'm referee another game and then I'm gonna sit through and watch the whole film"
01:01:24,660;01:01:27,660;"I've done"
01:01:27,660;01:01:31,140;"Hard football college fucking hard dude. Oh"
01:01:31,140;01:01:34,900;"Yeah, I have no problem referees except these ones"
01:01:34,900;01:01:40,260;"Except all of them"
01:01:40,260;01:01:44,560;"No, they're a blip. So you know how you always share the Patriots always get all the calls everything"
01:01:45,140;01:01:47,440;"Yeah, you can point him to this game because"
01:01:47,440;01:01:54,140;"There were 13 penalties called in this game and 12 more on the Patriots. Oh, maybe I made it more"
01:01:54,140;01:01:56,140;"One penalty for five yards. Maybe they did"
01:01:56,140;01:02:04,060;"But the Patriots did they bitch about it. Did they get off their game? No, they just went one the game anyway"
01:02:04,060;01:02:09,760;"Well, I mean think about that locker room bell check at halftime. They had nine in the first half"
01:02:09,760;01:02:13,780;"Game you know, so I had three more"
01:02:13,980;01:02:18,940;"He must have been so fucking mad about penalties because this wouldn't even a game if they were"
01:02:18,940;01:02:23,540;"saying selves in the foot in the first half. I don't know. I think I mean, I didn't watch the game"
01:02:23,540;01:02:27,080;"so I didn't see the penalties, but were they were they like they're driving me?"
01:02:27,080;01:02:29,260;"There's well, there's two kinds of penalties, right?"
01:02:29,260;01:02:31,700;"There's like aggression type penalties and then there's like"
01:02:31,700;01:02:33,540;"like"
01:02:33,540;01:02:41,660;"Off sides or like mental bone. Hey, holding I'm fine with passing appearances. I'm fine with that's just playing aggressive"
01:02:41,660;01:02:45,960;"You know, he was a perfect example Greg the end of the first half"
01:02:45,960;01:02:52,160;"The they pin him deep the cheese deep and they force the three and out and they punt it and it's like a crappy pond or whatever"
01:02:52,160;01:02:56,660;"And they get the ball at like the 45 on the offense and yeah"
01:02:56,660;01:02:59,860;"And the cheese 45 and then immediately fall start"
01:02:59,860;01:03:04,820;"Yeah, I was 50 and like they only have like one time no time out so never in like"
01:03:04,820;01:03:08,520;"Less than a minute in time to try and get a field goal through"
01:03:09,540;01:03:17,180;"So the ones that make those five yards are so key in that situation like all right offense get out there and boom"
01:03:17,180;01:03:19,180;"Fall start that's your ninth penalty of the half"
01:03:19,180;01:03:27,460;"It was not great now came in in opportune moments too like things to to keep drives live or you had like a really great"
01:03:27,460;01:03:28,700;"punts"
01:03:28,700;01:03:32,740;"To Dante Hall and you like you pinned them and then you had I"
01:03:32,740;01:03:38,860;"Think it was a legal man downfield on his oh and so they got their repunting kick it back to Dante Hall and"
01:03:39,180;01:03:43,660;"And he ended up with like an extra 20 yards of field position. Yeah, just stupid shit like that"
01:03:43,660;01:03:47,740;"And some of them were ticket tag. I think most of the calls were correct"
01:03:47,740;01:03:49,900;"I think in this game"
01:03:49,900;01:03:51,900;"They had two that were called"
01:03:51,900;01:03:57,340;"Where the gunners were or the like the punt team was blocking the gunners out of bounds"
01:03:57,340;01:03:59,340;"Like they pushed them out of bounds, but kept blocking them out of bounds"
01:03:59,340;01:04:05,340;"They caught two different guys. They're calling for that twice. Tyla was one of them. I think no, that's a terrible call"
01:04:06,460;01:04:09,060;"No, it's a legit college is the time to play."
01:04:09,060;01:04:10,660;"I'm sorry."
01:04:10,660;01:04:12,180;"Yeah, I think that's those sorts of"
01:04:12,180;01:04:15,020;"penalties you just never really see called, but there's two in this game."
01:04:15,020;01:04:16,140;"It's like, what are you guys doing?"
01:04:16,140;01:04:18,580;"Yes, assholes."
01:04:18,580;01:04:22,300;"Terrible referees in this one."
01:04:22,300;01:04:23,300;"All right, let's get to"
01:04:23,300;01:04:23,820;"all the time."
01:04:23,820;01:04:25,340;"I'm glad that we're time law."
01:04:25,340;01:04:27,420;"Thoughts."
01:04:27,420;01:04:29,420;"I strongly disagree."
01:04:29,420;01:04:34,700;"The rate the commentators disagreed about the original overtime rules for no one"
01:04:34,700;01:04:35,900;"gets a possession."
01:04:35,900;01:04:39,020;"Because that's won the toss."
01:04:39,020;01:04:40,820;"They take it down."
01:04:40,820;01:04:42,900;"There's a sick move by David Patton."
01:04:42,900;01:04:44,420;"Like they thought he was going out of bounds"
01:04:44,420;01:04:45,620;"and he cut it back inside."
01:04:45,620;01:04:47,820;"It got another like 15 yards."
01:04:47,820;01:04:48,780;"- Yeah, I think it was one of those plays"
01:04:48,780;01:04:50,580;"where it was supposed to be a run play."
01:04:50,580;01:04:52,220;"But Brady saw the Pat was uncovered."
01:04:52,220;01:04:54,540;"So he just like pulled the ball and chucked it to him quick."
01:04:54,540;01:04:56,780;"And Pat and took it for like 20 yards."
01:04:56,780;01:04:58,100;"- Yeah, that was a great play."
01:04:58,100;01:04:59,700;"- Yeah, it was fantastic."
01:04:59,700;01:05:04,460;"- And he gave him the old, hey, how are you too to that DB?"
01:05:04,460;01:05:05,300;"- Yeah, he did."
01:05:05,300;01:05:07,620;"look like he's gonna step out of bounds and cut it back in front of his face."
01:05:07,620;01:05:11,140;"Uh-huh. And he's like, ""Hey, you dropped, you dropped, you dropped strap, buddy."""
01:05:11,140;01:05:14,980;"Yeah. I'm sure he said that."
01:05:14,980;01:05:21,300;"Day in Doodor did have some thoughts about, um, about one more time."
01:05:21,300;01:05:24,500;"And we actually talked about this, uh, in the..."
01:05:24,500;01:05:26,340;"We got an audio. We got an audio."
01:05:26,340;01:05:27,700;"...it was called, ""Last Week."" Yeah."
01:05:27,700;01:05:29,700;"But this is, this is what he had to say in this game too."
01:05:29,700;01:05:31,460;"Six."
01:05:32,260;01:05:38,260;"Well this is a situation where maybe some people think well maybe we go ahead and try to kick the field goal on third down."
01:05:38,260;01:05:40,260;"I think you try to keep going."
01:05:40,260;01:05:43,260;"Even Adam Vennitary, it's not a certainty."
01:05:43,260;01:05:45,260;"I know that he hasn't missed this year."
01:05:45,260;01:05:47,260;"The guy is money in the bank."
01:05:47,260;01:05:51,260;"But a touchdown is better."
01:05:51,260;01:05:54,260;"A touchdown leaves no doubt."
01:05:54,260;01:06:00,260;"I actually get his point."
01:06:00,260;01:06:04,700;"So yeah, like the 25."
01:06:04,700;01:06:09,180;"He's talking about like avoiding a missed field goal or like a botched snap, right?"
01:06:09,180;01:06:11,780;"Cause that's why something would say go for kicking on third."
01:06:11,780;01:06:13,340;"But it's third and seven."
01:06:13,340;01:06:15,620;"Like I understand that aspect of it."
01:06:15,620;01:06:20,260;"It's third and seven from the chief's 20 odd line without a military."
01:06:20,260;01:06:21,620;"Oh, yeah."
01:06:21,620;01:06:24,940;"I mean, I don't agree with this statement, but I see what he's trying to say."
01:06:24,940;01:06:28,180;"Like when I first started, I thought he was just like, didn't understand that a"
01:06:28,180;01:06:29,060;"field goal wins it."
01:06:29,420;01:06:30,420;"You might not."
01:06:30,420;01:06:36,080;"I'm still not sure because as as they as he's talking, they're showing the stat on the screen"
01:06:36,080;01:06:40,360;"that says like they're showing at him in the terraces has 12 game winning field goals,"
01:06:40,360;01:06:42,320;"six of them in overtime."
01:06:42,320;01:06:45,760;"Like this is more automatic than scoring a touchdown."
01:06:45,760;01:06:47,160;"Yeah, but I touched down."
01:06:47,160;01:06:48,160;"There's no doubt."
01:06:48,160;01:06:51,200;"I'm like a field goal to have."
01:06:51,200;01:06:56,880;"Which have you considered that Andy?"
01:06:56,880;01:07:02,380;"the doubt factor failed to think of the doubt."
01:07:02,380;01:07:05,860;"Well, that's like is in the hall."
01:07:05,860;01:07:09,120;"Fuck you."
01:07:09,120;01:07:14,920;"Adam's field goal is a no doubt her."
01:07:14,920;01:07:16,520;"Oh, yeah."
01:07:16,520;01:07:17,500;"That was true."
01:07:17,500;01:07:19,780;"It would have been good in arena football."
01:07:19,780;01:07:20,820;"You split it right."
01:07:20,820;01:07:21,940;"Right down Broadway."
01:07:21,940;01:07:23,340;"Yeah."
01:07:23,340;01:07:24,980;"And that was all she wrote."
01:07:25,900;01:07:30,740;"Another big win and like you got to think that spirit is sore and high right now in New England."
01:07:30,740;01:07:38,100;"Yeah, it's when a Super Bowl you come back next year and your quarterback is even better and you're just shit stomping teams like."
01:07:38,100;01:07:38,260;"Yeah."
01:07:38,260;01:07:44,380;"And you're undefeated on the season three and again, it's like some pretty good teams too."
01:07:44,380;01:07:45,540;"Yeah, right."
01:07:45,540;01:07:46,540;"Right."
01:07:46,540;01:07:52,020;"So I think it's a good stop time to do some best and worst."
01:07:52,020;01:07:54,340;"Greg."
01:07:54,340;01:07:55,340;"Oh, yeah."
01:07:55,340;01:07:57,140;"- Can you start with Steven?"
01:07:57,140;01:07:59,540;"- What did he got?"
01:07:59,540;01:08:02,440;"- Grog's supposed to go."
01:08:02,440;01:08:05,940;"- Starts watching the highlights now."
01:08:05,940;01:08:12,620;"The worst is like more commentating,"
01:08:12,620;01:08:14,500;"a pile on Andy."
01:08:14,500;01:08:16,620;"The only good part was their golf thing"
01:08:16,620;01:08:19,260;"where the announcements always get super stoked"
01:08:19,260;01:08:21,300;"when punters help kick their coverage."
01:08:21,300;01:08:23,620;"Like they, they like,"
01:08:23,620;01:08:25,620;"with a Casey Punter like Dick Enberg."
01:08:25,620;01:08:29,420;"Yeah, hit the fuck out of the ball, but like he did like kind of a low line"
01:08:29,420;01:08:32,020;"driver or not. You know, he's put it out."
01:08:32,020;01:08:34,540;"Yeah. He out kicked his coverage by like 20 yards."
01:08:34,540;01:08:37,780;"Yeah. And so Troy got like a sick return out of it."
01:08:37,780;01:08:40,380;"And just like just by running straight up the middle."
01:08:40,380;01:08:42,900;"Oh, it's a huge booby bun."
01:08:42,900;01:08:44,300;"Oh, so what a great leg."
01:08:44,300;01:08:48,260;"And it's like, that's what he's trying to do."
01:08:48,260;01:08:52,700;"Oops. And then my best is definitely that Troy Brown drive."
01:08:52,700;01:08:55,300;"I mean, I think I snap chatted it to like a billion people."
01:08:55,300;01:08:56,540;"Oh my God."
01:08:56,540;01:08:56,900;"Yeah."
01:08:56,900;01:09:01,420;"I, I, I, I, like, they had like a sweet highlight montage after it too,"
01:09:01,420;01:09:03,380;"of all of his catches and like, oh my God."
01:09:03,380;01:09:03,500;"Yeah."
01:09:03,500;01:09:04,580;"Nothing was easy."
01:09:04,580;01:09:08,220;"I think it's where like everybody learned to can't play zone against"
01:09:08,220;01:09:08,780;"Brady too."
01:09:08,780;01:09:11,540;"Cause like Troy was just too good against that zone."
01:09:11,540;01:09:15,540;"Bray is just going to go over and over and over and Troy is just making the"
01:09:15,540;01:09:18,500;"gutty, gritty plays and like just being awesome."
01:09:18,500;01:09:20,460;"And then that touchdown to cap it was just wow."
01:09:20,460;01:09:21,180;"Yeah."
01:09:21,180;01:09:22,580;"Brady wasn't even looking."
01:09:22,580;01:09:24,900;"He wasn't even pretending to look anywhere else."
01:09:24,900;01:09:27,660;"He's just staring Troy ran down until he got open"
01:09:27,660;01:09:28,500;"and just threw it at him."
01:09:28,500;01:09:29,340;"- I could do that."
01:09:29,340;01:09:30,180;"- He was even open to you."
01:09:30,180;01:09:31,260;"You just throw it in anyway."
01:09:31,260;01:09:32,100;"You still catch it."
01:09:32,100;01:09:32,940;"- All right, great."
01:09:32,940;01:09:34,180;"- I got mine now."
01:09:34,180;01:09:35,020;"- Okay, good."
01:09:35,020;01:09:38,980;"- My best, Shadow Daniel Graham,"
01:09:38,980;01:09:40,660;"first career touchdown reception."
01:09:40,660;01:09:42,300;"- Yeah, okay, good one."
01:09:42,300;01:09:44,220;"- I don't think we've talked about that."
01:09:44,220;01:09:46,020;"- Sure."
01:09:46,020;01:09:50,260;"- My worst was the commentators, you know?"
01:09:50,260;01:09:54,540;"like even that play where they got the name wrong on who caught the pass."
01:09:54,540;01:09:56,540;"Like, come on."
01:09:56,540;01:10:02,700;"Which time are we talking about the one where they are talking about how Troy Brown"
01:10:02,700;01:10:04,660;"is back from his injury when he, he, well, yeah."
01:10:04,660;01:10:08,060;"Well, we're talking about the one we got the name wrong three times."
01:10:08,060;01:10:09,180;"Oh, well, yeah."
01:10:09,180;01:10:10,500;"I mean, we can be confused."
01:10:10,500;01:10:13,860;"Our leading wide receiver, where we talk about when they talk about tickling for"
01:10:13,860;01:10:14,900;"five fucking minutes."
01:10:14,900;01:10:15,620;"Yeah."
01:10:15,620;01:10:17,420;"You guys know you got, you get it."
01:10:17,420;01:10:17,980;"You get it."
01:10:19,580;01:10:21,740;"Well, when they they call the script kick the onsides kick."
01:10:21,740;01:10:24,140;"Oh, that dude that one."
01:10:24,140;01:10:29,780;"Oh, when Dick Emberg says, uh, he says a six yard game."
01:10:29,780;01:10:31,300;"Oh, he gains maybe a yard."
01:10:31,300;01:10:33,060;"Actually, wait, no, make that six yards."
01:10:33,060;01:10:35,580;"Oh, dude, he was five yards off."
01:10:35,580;01:10:36,540;"Yeah."
01:10:36,540;01:10:37,980;"What in it?"
01:10:37,980;01:10:39,180;"What an 88."
01:10:39,180;01:10:42,500;"Pretty good."
01:10:42,500;01:10:43,260;"It's pretty."
01:10:43,260;01:10:43,980;"It's pretty brown."
01:10:43,980;01:10:47,140;"That's a hard negative for not watching the game there, Greg."
01:10:47,140;01:10:48,620;"That's true."
01:10:48,620;01:10:51,900;"I did it. That's the thing when I just watched the highlights."
01:10:51,900;01:10:53,620;"I don't get any of the commentator stuff."
01:10:53,620;01:10:55,140;"My negative is Greg."
01:10:55,140;01:10:56,740;"And I watch in the fucking football game."
01:10:56,740;01:11:00,100;"Well, my positive is you because you're such a good brother, Andy."
01:11:00,100;01:11:01,660;"And I love you so very much."
01:11:01,660;01:11:04,340;"So you know what I'm going to do?"
01:11:04,340;01:11:05,860;"Like I'm going to mix this up on you."
01:11:05,860;01:11:06,500;"Ready? You ready?"
01:11:06,500;01:11:07,580;"Do you do what do you do?"
01:11:07,580;01:11:11,500;"My best is the following Dick Enberg line."
01:11:11,500;01:11:13,420;"You go."
01:11:13,420;01:11:16,060;"Third and third and goal."
01:11:16,060;01:11:18,060;"At the end of the game here."
01:11:18,060;01:11:23,480;"And the Patriots know that the Chiefs are gonna run it and so you can see there's something in there"
01:11:23,480;01:11:30,720;"Beef cakes, you know, they're having package and Dick Ember goes they've just sent in a whole truckload of beef"
01:11:30,720;01:11:37,340;"See that's what I'm talking about. Yeah, that that's a redeeming one right there. Yeah a"
01:11:37,340;01:11:41,320;"Truckload of beef truckload of beef. Yeah"
01:11:41,320;01:11:44,060;"my"
01:11:45,000;01:11:52,200;"Let's see what else I have like visualizing that you know just a bunch of like fat dudes wedged wedged into like a Ford F-150"
01:11:52,200;01:12:03,400;"Back of a you all like they're like a set of pigs here. They're all grunting. Yeah"
01:12:03,400;01:12:08,960;"My worst is"
01:12:09,400;01:12:15,680;"One of the referees getting in the way in this game because they were taking as many shots as Troy Brown and"
01:12:15,680;01:12:20,880;"Tom Brady were in fact rad guys one of the rest"
01:12:20,880;01:12:28,920;"Managed to run into the the Chiefs fullback as he was running onto the field to go to the huddle and"
01:12:28,920;01:12:33,040;"It literally looked like it knocked him out cold. Yeah"
01:12:34,040;01:12:40,040;"Massive like like black eyes sort of like you know in boxing where like the bottom like just under their eyes swells up"
01:12:40,040;01:12:42,740;"And it all like they cut it to make it the swelling go down"
01:12:42,740;01:12:46,100;"It was that and that's what they did had to give him like eye drops and shit"
01:12:46,100;01:12:48,700;"They stopped the game for like ten minutes. Just"
01:12:48,700;01:12:54,440;"Oh, yeah, he stayed in the game. He stayed in. Yeah, good for him. Yeah"
01:12:54,440;01:13:00,520;"But there's a few plays where like the referees just they were in the middle player. It's got clobbered"
01:13:00,520;01:13:04,520;"Just got ragdolled. Yep. So Molly Wopte. Oh"
01:13:04,520;01:13:08,680;"I"
01:13:08,680;01:13:09,400;"Let's"
01:13:09,400;01:13:11,400;"All right the source"
01:13:11,400;01:13:13,400;"Oh dear"
01:13:13,400;01:13:19,040;"There I mean this is an ideal. I let's give a game ball out. All right, Craig"
01:13:19,040;01:13:23,240;"Urban to sources Molly whopping mine"
01:13:23,240;01:13:28,440;"I'm not gonna steal your Steve mine goes to Tom Brady 400 passing yards"
01:13:29,840;01:13:31,840;"Four touchdowns. He's really"
01:13:31,840;01:13:36,640;"Save it"
01:13:36,640;01:13:38,320;"Frank save it late. Oh"
01:13:38,320;01:13:43,760;"Okay, go ahead"
01:13:43,760;01:13:51,400;"Obviously obviously mines Troy Brown Patriots record and catches"
01:13:51,400;01:13:55,880;"In all three quarters mine is dick and Berg"
01:13:57,400;01:13:59,500;"For watching a different game than we were"
01:13:59,500;01:14:06,960;"You know what no I take it back mine is the Patriots offensive coordinator"
01:14:06,960;01:14:10,280;"Who was Charlie Weiss at this point?"
01:14:10,280;01:14:13,120;"Because he has decided"
01:14:13,120;01:14:16,040;"One that he wanted to play this game like I play Madden"
01:14:16,040;01:14:20,540;"Which was really just throw at every fucking play Brady had like what 50 something times?"
01:14:20,540;01:14:26,480;"52 times something stupid like that and they just came out doing that he came out five wide and said you know what fucking we're just"
01:14:26,480;01:14:31,440;"not gonna run the ball and then no huddle too that's their first drive no huddle five wide just"
01:14:31,440;01:14:37,600;"like all right let's go yeah back in 2002 that was crazy yeah and then just the the amount of"
01:14:37,600;01:14:43,680;"trickery they had on this day on their first touchdown they tried to go for two on the extra"
01:14:43,680;01:14:50,640;"point by having the holder yeah and Walter tried to do a dive off of left tackle and he didn't make it"
01:14:51,440;01:14:54,500;"And then they did another one where they pitched a fall,"
01:14:54,500;01:14:58,240;"who threw back to Brady, who fumbled it and hadn't throw it away."
01:14:58,240;01:15:01,740;"And then they had another one where they pitched a fall and fall,"
01:15:01,740;01:15:04,820;"fall through deep to Troy Brown, who missed it."
01:15:04,820;01:15:09,320;"And our old friend Dick Enberg missed the fact that Brady had pitched a fall."
01:15:09,320;01:15:10,440;"Yes."
01:15:10,440;01:15:14,420;"And commentated it that it was Brady going deep and he was deriding,"
01:15:14,420;01:15:16,460;"Brady from missing fault for missing Troy Brown."
01:15:16,460;01:15:18,460;"So badly."
01:15:18,460;01:15:20,700;"Until two, I think it was like the next play."
01:15:20,700;01:15:25,400;"They somebody like told him in his ear that actually that and he correct himself eventually"
01:15:25,400;01:15:32,660;"So the offensive play calling I thought was it was it felt very"
01:15:32,660;01:15:37,740;"We're execution shit. I felt like Chip Kelly ask, you know"
01:15:37,740;01:15:42,720;"Yeah, just put on all the stops and just having a good time with it. The UNH is finest. That's right"
01:15:42,720;01:15:45,900;"All right, Greg less less on the Molly Wapping"
01:15:46,500;01:15:50,240;"Well, so I put in ragdolled into urban"
01:15:50,240;01:15:57,620;"And it sounds like I'm getting two separate like paths here. I'm getting what what looks like a"
01:15:57,620;01:16:00,660;"semen rag"
01:16:00,660;01:16:07,360;"Synonyms and I'm also getting a lot of like when women are on their period sentiment. So I'll just read a couple of you guys"
01:16:07,360;01:16:09,360;"make the call"
01:16:09,360;01:16:12,340;"Cotton pony"
01:16:12,340;01:16:14,980;"Cock rag"
01:16:15,420;01:16:22,440;"Butchers apron west of these are a synonym for ragdoll. I'm still I'm still stuck on cotton pony"
01:16:22,440;01:16:24,440;"I don't know which side that goes on"
01:16:24,440;01:16:27,200;"West Virginia tiki torch"
01:16:27,200;01:16:37,040;"Rusty work boot"
01:16:41,040;01:16:43,040;"Ragging a bag"
01:16:43,040;01:16:48,000;"See semen farm. I think you can get what that one is that one I got yep"
01:16:48,000;01:16:55,600;"Dude there's like literally like 700 options here"
01:16:55,600;01:17:00,640;"This is awesome. Sorry mom"
01:17:00,640;01:17:08,200;"This is making it into this episode. Oh sphincter slap. That's a good for you Andy"
01:17:08,920;01:17:13,760;"Is slapping in you endo in this case I'm gonna say probably"
01:17:13,760;01:17:19,320;"All right, well on that note"
01:17:19,320;01:17:24,960;"If we have any listeners left, what are we looking at next week boy? I have no idea"
01:17:24,960;01:17:30,120;"No, no page traveling to Qualcomm Stadium"
01:17:30,120;01:17:34,040;"The party the San Diego"
01:17:34,040;01:17:37,160;"Supercharges San Diego"
01:17:37,880;01:17:42,740;"charges. That's the one. So we'll see you next week if we"
01:17:42,740;01:17:47,960;"haven't been canceled by then. On the next. Yeah, we can't"
01:17:47,960;01:17:51,560;"what? This is going to cancel us. You are the reason we'd be"
01:17:51,560;01:17:58,400;"canceled. Can I cancel like us? All you. I'm what I came in"
01:17:58,400;01:18:02,360;"mom. My old pencils. When I came when I came into this"
01:18:02,360;01:18:05,240;"recording, I was like, I'm intentionally gonna make this"
01:18:05,240;01:18:08,700;"go off the rails. I set out to do that."
01:18:08,700;01:18:11,740;"It doesn't feel intentional. Oh, it was."
01:18:11,740;01:18:14,140;"It feels just naturally who you are."
01:18:14,140;01:18:16,660;"You did an okay job at it, but like, I don't know."
01:18:16,660;01:18:19,380;"We did. I got us. I got us to some weird places. No."
01:18:19,380;01:18:21,980;"Sure. Yeah, we did. We just kind of dip our toes."
01:18:21,980;01:18:23,860;"We kind of tickled the line. Yeah."
01:18:23,860;01:18:27,220;"We did. I mean, we were on"
01:18:27,220;01:18:31,020;"wicked diff between talking about"
01:18:31,020;01:18:33,460;"bank and smacking smacking. Yeah."
01:18:33,460;01:18:40,460;"Yeah. And I think you're wrong there, Andy. And I think we proved that unequivocally."
01:18:40,460;01:18:48,460;"I disagree. I think you unproved it with your list. I don't even remember what it's called."
01:18:48,460;01:18:50,460;"The something smack."
01:18:50,460;01:18:55,460;"We can save this for a later episode, but I have, you know, like the,"
01:18:55,460;01:19:00,460;"Um, when you have sex and then you leave."
01:19:00,460;01:19:07,360;"And like, there's like, there's a term for that, you know, like the way I'm"
01:19:07,360;01:19:07,560;"damn."
01:19:07,560;01:19:08,220;"Thank you, ma'am."
01:19:08,220;01:19:09,160;"Yes, exactly."
01:19:09,160;01:19:15,640;"So the synonyms of that I've got like 15 that are so fucking funny."
01:19:15,640;01:19:20,680;"Oh, I had a note that I should have brought up on what's Tom Brady's"
01:19:20,680;01:19:21,560;"completion streak."
01:19:21,560;01:19:21,980;"I don't know."
01:19:21,980;01:19:22,900;"What do you mean?"
01:19:23,120;01:19:25,380;"He had like 11 or 12 in a row in this game."
01:19:25,380;01:19:28,500;"Yeah, it was in that range."
01:19:28,500;01:19:30,560;"I'm not going to stat check that."
01:19:30,560;01:19:32,240;"Well, stat check."
01:19:32,240;01:19:33,380;"Cause I'm going to ask it later."
01:19:33,380;01:19:34,380;"Okay."
01:19:34,380;01:19:35,540;"I'll stack it."
01:19:35,540;01:19:37,180;"Check it before the next episode."
01:19:37,180;01:19:41,960;"All right."
01:19:41,960;01:19:45,400;"And on that note, we will see you next week in San Diego."
01:19:45,400;01:19:48,260;"I guess we're still recording."
