Start Timestamp;End Timestamp;Transcript
20:29,540;20:30,540;"It was good."
20:30,540;20:31,540;"That's okay."
20:31,540;20:32,540;"Not too much."
20:32,540;20:39,660;"I mean, it was like a minute 15 and they had the ball on the Jets 10 yard down to touchdown."
20:39,660;20:42,900;"So it wasn't like completely out of hand the whole game."
20:42,900;20:44,700;"Yeah, scored there."
20:44,700;20:47,860;"Like there was still a chance that they could go on."
20:47,860;20:50,660;"Kick it and recover something like that."
20:50,660;20:55,700;"So it wasn't like complete blow out like they scored 30 points in the first half and"
20:55,700;20:56,700;"then right."
20:56,700;20:58,700;"Right. But it's close to zero."
20:58,700;21:04,220;"Zero. I was wondering about you, Steve, because I know you're hatred for the jets."
21:04,220;21:07,580;"Yeah. I think this is nobody needs to watch this game."
21:07,580;21:11,340;"Yeah. Highlights and that's about as that's the maximum."
21:11,340;21:19,100;"All three. Have you guys talked about like the composition of the offensive line this season?"
21:19,100;21:25,500;"Because like Tom had a terrible game and part of it was he was under pressure so much this game."
21:26,540;21:28,340;"And he was."
21:28,340;21:29,140;"We talked about that."
21:29,140;21:30,740;"Matt Light sucks."
21:30,740;21:34,620;"Yeah, we've touched on Matt Light not being as good as"
21:34,620;21:36,500;"at least I remember."
21:36,500;21:37,700;"I remember him being great."
21:37,700;21:40,380;"But like what you're going to leave with me later."
21:40,380;21:41,020;"He was not good."
21:41,020;21:42,420;"Yeah."
21:42,420;21:47,100;"Yeah, I want to say, oh, one was his rookie year."
21:47,100;21:49,420;"And he didn't even know that was his year."
21:49,420;21:49,860;"I feel."
21:49,860;21:51,020;"Oh, there you go."
21:51,020;21:52,820;"That check."
21:52,820;21:53,260;"Yeah."
21:53,260;21:54,580;"Come on, Stat Check."
21:54,580;21:58,860;"And I loved it. Like the first, the first good throw I saw Tom"
21:58,860;22:01,860;"make was four minutes into the second quarter and then he"
22:01,860;22:04,420;"immediately got sacked. And I'm like, Oh, it's going to be this"
22:04,420;22:05,300;"kind of game. Okay."
22:05,300;22:10,780;"Yeah, even for his life, you ran for that 15 yard longest run of"
22:10,780;22:12,660;"his career for imagine that."
22:12,660;22:14,860;"And Tom Brady runs for 15."
22:14,860;22:16,940;"After dodging all three"
22:16,940;22:18,260;"rushes with the Jets sent."
22:18,260;22:23,580;"Yeah. So did he play as poorly as his as his stats luck? Or was"
22:23,580;22:29,500;"it in the first half he did. Yeah. Yeah. And he played so badly that the commentator"
22:29,500;22:34,780;"started again talking about him wearing his gloves. Because this was the, uh, this was"
22:34,780;22:40,380;"the ESPN crew. And the last time we saw them, the Patriots had played the Raiders in the"
22:40,380;22:47,340;"snowball rematch. Yeah. And they made a huge deal about Brady wearing his glove. And, uh,"
22:47,340;22:51,980;"and he lost that game. So as soon as he started like, you know, one hopping balls into receivers"
22:51,980;22:56,700;"like, oh, he's got the glove on again. Maybe he's got too much grip on the football."
22:56,700;23:01,580;"I didn't watch this that closely. Thank God. I just kind of had it on."
23:01,580;23:07,100;"Yeah, drop by my boy, David Givens. Oh, that would have changed."
23:07,100;23:11,020;"Already stat line. Yeah."
23:11,020;23:20,860;"So, but I think was in the first after the first quarter, I wrote it. Brady had five yards"
23:20,860;23:22,860;"passing and"
23:22,860;23:25,580;"Pettington had a hundred and seventy three in two touchdowns"
23:25,580;23:31,460;"Yeah, Pennington completed his first eleven passes and the Jets out gained them"
23:31,460;23:35,220;"261 to 78 at halftime, but it was still 17 10"
23:35,220;23:38,420;"just because"
23:38,420;23:41,780;"Kevin Falk took the kickoff back for touchdown"
23:41,780;23:44,860;"And he was also the only one"
23:44,860;23:49,820;"Like this is just a bag game all right. We had I hate to bring this up. Oh"
23:49,820;23:52,900;"Oh, I was hoping you'd bring this up"
23:52,900;23:55,780;"So"
23:55,780;23:59,580;"There was a point in this game third quarter like first drive of the half"
23:59,580;24:02,820;"the second half"
24:02,820;24:06,520;"Patriots basically drive down convert a fourth and one like in midfield"
24:06,520;24:12,620;"Brady has his 15 yard third down run and then he throws a touchdown a 4a to tie the game up at 17"
24:12,620;24:15,300;"Jets go three and out"
24:16,220;24:25,540;"For you. Yeah, didn't he like doing thing and getting trouble. Oh, yeah, but he's still employed. It was the Don ye thing. Brady's"
24:25,540;24:34,060;"He was mocking with the Asian accent. Yeah, I think there might have been some other stuff in there, too. Yeah, but he's still"
24:34,060;24:39,800;"Doing his shitty thing on one of the sports talk radios. Yeah, I probably"
24:39,800;24:44,860;"Say I was sad to see 48 doing well"
24:44,860;24:48,020;"just because we know how far he's fallen now."
24:48,020;24:52,860;"Yeah, at least you got that to look forward to Boston Sports Talk radio when you move there."
24:52,860;24:55,460;"It's you're in for a treat. I'll tell you that."
24:55,460;25:03,740;"Yeah. I've never heard anybody hate the New England sports teams as much as Boston Sports Talk radio."
25:03,740;25:05,700;"They were some Greg."
25:05,700;25:09,940;"Well, Greg, the Bucks fan."
25:09,940;25:13,380;"And while just to give Lisa some context here,"
25:13,380;25:16,740;"we have a constant battle between these two homers."
25:16,740;25:20,860;"That just so they have these blinders on."
25:20,860;25:24,420;"They're like, oh, the Patriots can never do anything wrong."
25:24,420;25:26,660;"And anything, anybody else does good sucks"
25:26,660;25:29,060;"because it's not the Patriots, but not me."
25:29,060;25:32,180;"I'm a fan of football first, and then I'm a Patriots fan."
25:32,180;25:35,260;"- You're a Belichick Hater, that's what you are."
25:35,260;25:36,100;"- You are."
25:36,100;25:37,180;"Give me no credit."
25:37,180;25:38,020;"- Yeah."
25:38,020;25:39,020;"All right."
25:39,020;25:40,220;"Let's do one."
25:40,220;25:44,460;"And do you want to give a hot take about the sweatshirt he was wearing?"
25:44,460;25:46,940;"I'm sure you got some things to say about that."
25:46,940;25:50,420;"Well, I think is did his mom pass away?"
25:50,420;25:51,420;"Yeah."
25:51,420;25:52,420;"Yeah."
25:52,420;25:55,420;"I tried not to make any jokes about that with."
25:55,420;25:56,420;"Yeah."
25:56,420;25:59,060;"You know, he was old."
25:59,060;26:02,060;"Yeah, he's 90 something right?"
26:02,060;26:03,060;"98."
26:03,060;26:04,060;"Yeah."
26:04,060;26:05,060;"Yeah."
26:05,060;26:07,900;"I'd love to meet his mom just to see what her personality is like."
26:07,900;26:15,260;"Oh, man. Yeah, I bet she was a firecracker. Yeah. I mean, just look at our mom. What happened to us?"
26:15,260;26:26,140;"I don't know. That's so ominous. Sorry, mom. Maybe we'll have a surprise guest next week."
26:26,140;26:28,620;"We're going to tease that. You see that, boys? That's called teasing."
26:28,620;26:33,180;"You're supposed to see my cast as I'm so good."
26:35,980;26:39,380;"But yeah, so back to the thing that none of us actually want to talk about"
26:39,380;26:44,520;"So the pages are tied it up. They get the Jets to go three and out momentum has shifted"
26:44,520;26:48,780;"The Jets punt. I don't even know if I can say it say"
26:48,780;26:51,540;"It hurt Troy Brown"
26:51,540;26:58,800;"Fumbles the punt. Oh, I missed that play the test recover at like the Patriots 20"
26:58,800;27:03,180;"Minish to drive all the way to the five-yard line before these out of four field goal"
27:03,940;27:05,940;"But then like that was the momentum"
27:05,940;27:13,300;"Brady gets like the next drive they go with patrons go three and out they punt and like that's it. Oh she wrote"
27:13,300;27:15,100;"Yeah"
27:15,100;27:17,100;"What your thoughts Andy?"
27:17,100;27:20,700;"This is when I say they think the Patriots can do no wrong"
27:20,700;27:26,380;"Just Troy Brown is even like further down that road of like"
27:26,380;27:33,860;"Troy Brown don't get me wrong, but you two are like"
27:33,860;27:37,020;"like weird fanboys about it."
27:37,020;27:40,540;"- All right, give me your unbiased fucking opinion then."
27:40,540;27:41,820;"- A little fence sitter."
27:41,820;27:45,060;"- You're the coolest."
27:45,060;27:47,380;"- Want to hear a quote from the man himself?"
27:47,380;27:48,380;"- I do."
27:48,380;27:50,460;"- He said, ""It just kills you."
27:50,460;27:52,580;"It takes a lot of momentum from your team."
27:52,580;27:55,380;"It's one of the worst plays I've ever had in my career."
27:55,380;27:58,660;"It was just a bad decision not to call for a fair catch."""
27:58,660;28:02,460;"- So how is this any anti-troy Brown?"
28:02,460;28:03,940;"- It's not, I just--"
28:03,940;28:07,500;"- Everyone makes mistake and then he owns up to it."
28:07,500;28:09,980;"- That's possible way, plus the Troy Brown."
28:09,980;28:11,540;"- What humility."
28:11,540;28:13,640;"- And they showed him on the sideline,"
28:13,640;28:15,820;"like when the Jets were still driving the ball,"
28:15,820;28:17,980;"and he looked like he was gonna cry."
28:17,980;28:19,300;"Like he was--"
28:19,300;28:23,300;"- I watched, well I bet it's gotta be weird for him"
28:23,300;28:25,740;"because he's always been the guy that like"
28:25,740;28:27,980;"does the little things right, you know?"
28:27,980;28:28,820;"- Yeah."
28:28,820;28:31,500;"- So it's gotta be weird for him to like make a mental mistake"
28:31,500;28:36,500;"like that. And like that. I mean, in a huge part in a game that's deciding your season,"
28:36,500;28:40,220;"whether you go to play offs or not, I bet that I bet that weighed on him a lot. I bet"
28:40,220;28:46,260;"it did. Yeah. But we still love them. Right, Steve? Of course. I love it. You were now"
28:46,260;28:51,060;"everyone. Exactly. Because because you knew it was going to go up to it. You knew it was"
28:51,060;28:59,540;"going to go play for the Buccaneers. No one's perfect. You still perfect in my eyes. So"
28:59,540;29:02,980;"I got super bored when I was watching this game,"
29:02,980;29:05,740;"'cause I just didn't really watch it, honestly."
29:05,740;29:07,060;"And I swear, I watched most of it"
29:07,060;29:08,260;"except those like two minutes."
29:08,260;29:10,500;"I took something outside to my yard,"
29:10,500;29:11,420;"like some trash and stuff,"
29:11,420;29:13,260;"so I just left it playing in my room"
29:13,260;29:14,460;"and came back and saw they had the ball"
29:14,460;29:17,500;"and I wasn't gonna rewind it to find out."
29:17,500;29:18,340;"- Good job."
29:18,340;29:20,660;"- I looked up on your website,"
29:20,660;29:21,940;"- That sounds suspicious."
29:21,940;29:24,660;"- All of like the biggest spreads,"
29:24,660;29:26,820;"highest over under, lowest over under."
29:26,820;29:28,340;"- Yeah, yeah, yeah."
29:28,340;29:31,560;"I thought that's kind of cool to kind of get in there and be like, I remember that game."
29:31,560;29:32,600;"I don't remember that game at all."
29:32,600;29:35,540;"Yeah, I didn't remember this game at all."
29:35,540;29:41,300;"I think the whole, I think I just kind of blacked out the whole 2002 season as if it didn't happen"
29:41,300;29:43,620;"because it's that one down year."
29:43,620;29:48,500;"They don't make the playoffs in between three Super Bowl winning seasons."
29:48,500;29:49,080;"Yeah."
29:49,080;29:50,420;"I just don't remember it."
29:50,420;29:50,980;"It's fine."
29:50,980;29:55,220;"I sort of feel that way about the Matt Castle year too."
29:55,220;29:56,540;"That's a good point."
29:56,540;29:56,900;"I don't."
29:58,300;30:01,980;"Like I can't think of specific things that happen that year."
30:01,980;30:07,220;"I remember being impressed with how well it went for what it was."
30:07,220;30:13,180;"But I remember not having the same investment in it because the"
30:13,180;30:14,900;"expectation was lower, I guess."
30:14,900;30:15,700;"Yeah."
30:15,700;30:19,660;"Well, because the expectation was so high at the beginning of the year,"
30:19,660;30:23,100;"yeah, just shattered 10 minutes in to the season."
30:23,100;30:23,340;"Yeah."
30:23,340;30:24,180;"Yeah."
30:24,180;30:25,660;"I think we're also grieving that year."
30:25,660;30:26,380;"Yeah."
30:26,380;30:32,800;"I mean, we went to the game against the Cardinals, all of us, the Brown family in the snow."
30:32,800;30:34,240;"That's my first game."
30:34,240;30:37,600;"And that was the Cardinals team that actually went to the Super Bowl that year."
30:37,600;30:39,780;"And the Patriots like walked them."
30:39,780;30:42,140;"It was like 40 to seven or something ridiculous."
30:42,140;30:49,760;"So I was living in Phoenix during that Super Bowl year."
30:49,760;30:55,600;"And I worked, um, I used to be a librarian and I was working at the Phoenix"
30:55,600;31:04,160;"public library and this kid came in the day after that Super Bowl head to toe. Oh no, it wasn't"
31:04,160;31:13,760;"'08, it was '07, oh my god. And he had to print some homework, but he was just the saddest kid I've"
31:13,760;31:15,120;"ever seen in my life."
31:15,120;31:21,840;"That's awesome. I know that I know that kid. You are that kid."
31:23,600;31:30,960;"Yeah, I when the second giant Super Bowl, I was in college at the time."
31:30,960;31:35,800;"And I had a Monday class at like 8 a.m."
31:35,800;31:39,640;"And I couldn't skip those classes."
31:39,640;31:44,800;"And I like, I used to like write down the date on my notes every time."
31:44,800;31:49,000;"And I was like studying like a month later, I was going through and I get to one"
31:49,000;31:50,520;"section. It's like gibberish."
31:51,880;31:52,720;"I like looked at the day."
31:52,720;31:53,860;"It was the Monday after the seat ball."
31:53,860;31:54,680;"I was like, oh, okay."
31:54,680;31:56,760;"That makes sense."
31:56,760;31:58,640;"Oh, man."
31:58,640;31:59,720;"Not your best work."
31:59,720;32:02,720;"Yikes."
32:02,720;32:06,240;"Well, let's talk about Reddit."
32:06,240;32:08,280;"Okay."
32:08,280;32:11,480;"I mean, I don't think I have any else from this game."
32:11,480;32:12,920;"Yeah."
32:12,920;32:17,800;"You being a librarian, librarian is like the least surprising update ever."
32:17,800;32:19,480;"Right."
32:20,880;32:26,680;"So like just explain what your role is in Reddit and the Patriots Reddit for those that like don't know."
32:26,680;32:32,760;"Like I just post highlights. I don't really ever even comment."
32:32,760;32:38,240;"You know, I don't I don't check that subreddit on daily basis, but during the game."
32:38,240;32:39,880;"I'll do."
32:39,880;32:46,000;"I've kind of pared it down to just do like scoring plays or Zach or anything like that."
32:46,000;32:49,920;"Because after what is this five years, maybe."
32:50,800;32:54,280;"It's my husband's like, would you just sit down and watch a football game with me?"
32:54,280;32:57,520;"So that's why I scaled it back a little bit."
32:57,520;33:01,760;"Um, and then I'll do an upload after the game that has them all, like"
33:01,760;33:05,720;"bing, bing, bing, bing, in a row and people can request whatever I missed."
33:05,720;33:13,000;"And I put it up and, you know, several years ago, the, I would say the"
33:13,000;33:15,880;"Patriots subreddit was less saturated with highlights."
33:15,880;33:16,840;"Like it's come a long way."
33:16,840;33:20,120;"And there's other people doing, like, you know, I don't."
33:20,560;33:22,040;"Andy, when did you join Reddit?"
33:22,040;33:24,700;"I couldn't tell you."
33:24,700;33:26,240;"I'm broke."
33:26,240;33:32,880;"But but yeah, people used to ask me for really old gifts."
33:32,880;33:36,160;"Like, Oh, do you have anything from the intentional safety game or, you"
33:36,160;33:38,120;"know, I went to this game."
33:38,120;33:39,480;"Do you have any highlights from it?"
33:39,480;33:43,960;"And there are so there was at that time."
33:43,960;33:48,280;"So few old highlights that I have a lot of games recorded."
33:48,280;33:49,280;"And so I said, sure."
33:49,280;33:49,880;"I'll share."
33:49,880;33:53,520;"And that's really how it came about."
33:53,520;33:55,160;"So where did you have them recorded?"
33:55,160;33:58,400;"Did you just have them like on a DVR or something?"
33:58,400;34:02,960;"Some of them, yeah, some of them prove like TV capture software and then, you know, some"
34:02,960;34:07,600;"of them, I don't want to like the FBI to come knock on my door, like tape takers and things"
34:07,600;34:08,600;"like that."
34:08,600;34:11,440;"Yeah, just trading them with other people, yeah."
34:11,440;34:12,440;"Yeah, exactly."
34:12,440;34:19,600;"You know, you don't, it really chaps my hide the way that this content is protected."
34:19,600;34:21,600;"Everybody should be able to watch it."
34:21,600;34:27,760;"And it's one thing, you know, not to besmirch the crafts, I guess, but it's one thing that"
34:27,760;34:32,040;"they're really like, persnickety about."
34:32,040;34:37,200;"And so I don't think that it will ever change, but I honestly really love watching the old"
34:37,200;34:39,680;"games just as they're presented."
34:39,680;34:44,360;"And I think even the old games, when they will re-ear them on NFL Network, you're not"
34:44,360;34:45,560;"getting that telecast."
34:45,560;34:47,880;"You're getting like a condensed version."
34:47,880;34:56,200;"I love seeing like the long fan shots of how bad people looked and you know stuff like that"
34:56,200;35:03,960;"That's true though. It is a different experience like watching"
35:03,960;35:10,280;"Like the long-form like TV version of a game after the fact like with the Super Bowls"
35:10,280;35:14,840;"I remember like trying to try to some of the earlier ones trying to find like the full"
35:15,320;35:20,380;"Games because all you could find was just like the highlights and like that doesn't really put you in that"
35:20,380;35:24,000;"Just yeah the feelings that you had while you're watching plays, you know"
35:24,000;35:27,520;"Like the building of tension and that kind of stuff, you know, yeah"
35:27,520;35:34,760;"Miss the commercials in it and sort of don't if like this whole game at commercials in it"
35:34,760;35:36,760;"I would be like fuck that"
35:36,760;35:37,960;"but"
35:37,960;35:43,800;"Sometimes you catch like a little bit of a commercial on these someone like just didn't stop the tape in time or started too early and"
35:44,040;35:47,040;"Yeah, some of the old commercials are hilarious."
35:47,040;35:48,040;"Yeah."
35:48,040;35:53,280;"Yeah, and I was thinking, you know, as you guys are going through, you know, this is one year"
35:53,280;36:00,520;"post 9/11, and that was such a moment in time, especially that first game, the Malus"
36:00,520;36:03,200;"game."
36:03,200;36:07,480;"I was thinking, we're about what, 19 years out from that?"
36:07,480;36:13,280;"I wonder what people watching these games, 19 years from now, are going to think seeing"
36:13,280;36:18,280;"Bill wear his mask so stupidly like he did on Sunday night."
36:18,280;36:22,720;"Like these guys with their face shields, like, are we going to think, wow,"
36:22,720;36:25,440;"remember COVID or are we all still going to be wearing masks?"
36:25,440;36:28,760;"It's true. Yeah. Yeah."
36:28,760;36:31,040;"They're going to look at a game some last year and be like, why aren't they wearing"
36:31,040;36:32,360;"masks? This is weird."
36:32,360;36:37,720;"But it's true. Yeah. Like 20 years from now when we're still doing this"
36:37,720;36:39,680;"podcast. Exactly."
36:39,680;36:41,560;"Because the dynasty just doesn't end."
36:42,320;36:48,120;"Yeah, check still wearing his mask wrong. Yeah, probably on purpose, I'm sure."
36:48,120;36:52,320;"Cam Newton just won his tent Super Bowl."
36:52,320;36:53,880;"I like it."
36:53,880;36:56,920;"As a pocket passer, though, he's all done running. Yeah."
36:56,920;37:03,840;"So all these games that we've been watching are those from you"
37:03,840;37:08,080;"from that right inside at least in some"
37:09,760;37:11,760;"I mean, I know you've done a little..."
37:11,760;37:12,760;"You've got..."
37:12,760;37:13,760;"Yeah."
37:13,760;37:14,760;"Um..."
37:14,760;37:15,760;"Yeah."
37:15,760;37:16,760;"So..."
37:16,760;37:20,760;"I was going to say, I have every Brady game."
37:20,760;37:24,760;"I think like between you and I, we've now gotten the whole shebang."
37:24,760;37:25,760;"We have, yeah."
37:25,760;37:30,760;"Yeah, we've been sharing what each other didn't have."
37:30,760;37:33,760;"And I think at this point, I think we do have them all."
37:33,760;37:34,760;"Yeah."
37:34,760;37:37,760;"When you get back into blood, so it just becomes impossible."
37:37,760;37:38,760;"Yeah."
37:38,760;37:40,960;"Yeah. Yeah. That's true."
37:40,960;37:43,160;"So do you feel like the pressure?"
37:43,160;37:44,760;"Because I know like, you know,"
37:44,760;37:49,560;"you have a certain like name notoriety and the Reddit now and people like expect"
37:49,560;37:52,360;"like the clips and the post game and stuff."
37:52,360;37:55,160;"Do you feel like the pressure of, you know,"
37:55,160;37:58,760;"I got to like get these things up there because people are like waiting for it."
37:58,760;38:02,160;"Or do you just not give a shit about strangers on the internet?"
38:02,160;38:04,160;"I did a couple of years ago."
38:04,160;38:07,760;"Yeah. And I would like sit here through the whole telecast"
38:07,760;38:10,520;"and then sit and see what people wanted."
38:10,520;38:12,760;"And it was too much, especially when it's like"
38:12,760;38:14,400;"a Sunday night game."
38:14,400;38:18,840;"Like I don't stay up late, I can't."
38:18,840;38:21,080;"That's gonna be really hard for me next year"
38:21,080;38:24,640;"'cause like right now I'm taking advantage of my time zone."
38:24,640;38:28,280;"But people ask me for the weirdest stuff,"
38:28,280;38:29,840;"they'll be like, hey, do you have that clip"
38:29,840;38:31,920;"of that guy picking his nose or,"
38:31,920;38:34,680;"hey, do you have like, can you get that"
38:34,680;38:36,080;"where Tom can't find his hat?"
38:36,080;38:39,920;"Like that's probably one of the most requested gifts I ever had."
38:39,920;38:42,160;"Um, so."
38:42,160;38:42,920;"You find it?"
38:42,920;38:44,000;"Yeah."
38:44,000;38:45,240;"Well, yeah, it was during the game."
38:45,240;38:46,640;"So, you know, just rewind."
38:46,640;38:52,160;"But yeah, people, people are funny, but I haven't noticed that."
38:52,160;38:57,040;"Yeah, the, the requests lately have been more and more obscure."
38:57,040;38:58,240;"Yeah."
38:58,240;38:59,920;"A little bit ridiculous."
38:59,920;39:00,880;"Yeah."
39:00,880;39:02,400;"But you know what?"
39:02,720;39:07,720;"I like football and I'm happy to share this weird hobby."
39:07,720;39:11,720;"So it's really, I'm a Celtics fan too."
39:11,720;39:16,000;"I don't know if you guys are like all four,"
39:16,000;39:18,400;"you're not into it."
39:18,400;39:22,040;"It always cracks me up that the Celtics highlights"
39:22,040;39:24,600;"capture is also named Tim,"
39:24,600;39:28,320;"but he's like a Polish guy, yeah."
39:28,320;39:29,200;"- Polish guy."
39:29,200;39:31,360;"- But didn't he learn from you?"
39:31,360;39:35,120;"No, we've actually never interacted, but he's really."
39:35,120;39:40,640;"Well, it is interesting that they are like protective about their highlights and stuff."
39:40,640;39:44,880;"Cause I mean, I think like from a fan point of view, it's almost like universally"
39:44,880;39:48,880;"accepted that like we want to see highlights and people always shit on like the"
39:48,880;39:51,920;"MLB because they're like super protective about it."
39:51,920;39:52,600;"That's the worst."
39:52,600;39:52,840;"Yeah."
39:52,840;39:57,240;"Like you can't even get like highlight packages on YouTube, you know, it's, and"
39:57,240;40:01,840;"It seems like all the customers feel the same way."
40:01,840;40:05,520;"So I don't know, I mean, there has to be"
40:05,520;40:07,440;"in their side of the argument is,"
40:07,440;40:10,440;"do you know what that is, what their argument would be?"
40:10,440;40:15,160;"- I want to go ahead."
40:15,160;40:17,360;"- They want the viewers on their website"
40:17,360;40:20,080;"to look at the highlights on their content platform"
40:20,080;40:23,120;"so they can serve them as a big money often."
40:23,120;40:26,640;"But what they fail to realize is like,"
40:26,640;40:28,440;"That's not a like sustainable solution."
40:28,440;40:30,000;"You can just go find it anywhere."
40:30,000;40:30,840;"- Yeah."
40:30,840;40:32,560;"- And like you're hurting the brand"
40:32,560;40:35,040;"by not being accessible for everybody"
40:35,040;40:36,800;"in the modern internet day, right?"
40:36,800;40:37,640;"- Yep."
40:37,640;40:38,480;"- Yep."
40:38,480;40:40,240;"- You're not gonna stop people from finding it"
40:40,240;40:45,200;"and since you're stopping more people from finding it,"
40:45,200;40:47,840;"thus decreasing what you'd make at a ballpark"
40:47,840;40:49,640;"or getting new fans, whatever it might be."
40:49,640;40:50,680;"- Yeah."
40:50,680;40:52,040;"- Yeah."
40:52,040;40:54,840;"- Yeah, and if the way that they're sharing it"
40:54,840;40:56,360;"doesn't have a social aspect to it,"
40:56,360;40:59,480;"And it's pointless because you look at a highlight"
40:59,480;41:01,360;"and you want to talk about it with somebody."
41:01,360;41:01,880;"So."
41:01,880;41:02,880;"Yeah, exactly."
41:02,880;41:04,880;"Yeah, especially just the short clips too."
41:04,880;41:08,680;"Like I understand the NFL posting there,"
