Start Timestamp;End Timestamp;Transcript
40:27,300;40:32,040;"So this is where, like to me, Brady, like anybody can be a Joe"
40:32,040;40:34,560;"Flacko won a Super Bowl, right?"
40:34,560;40:35,060;"Yeah."
40:35,060;40:38,360;"Eli Manning's done it twice where he goes on a hot streak"
40:38,360;40:38,960;"and rides it."
40:38,960;40:41,800;"But who is he a Baltimore?"
40:41,800;40:42,880;"Joe Flacko."
40:42,880;40:45,120;"No, the other one."
40:45,120;40:46,040;"What do you mean?"
40:46,040;40:47,840;"What is that?"
40:47,840;40:49,600;"Isn't it shots fired?"
40:49,600;40:52,640;"It's kind of bolder Trento for you."
40:52,640;40:53,840;"Yeah, Trento for a moment."
40:53,840;40:54,640;"He went with."
40:54,640;40:56,680;"Rich Ganon's got one, right?"
40:56,680;40:59,240;"Rich Ganon is good, though."
40:59,240;41:01,600;"Rex Grossman went to a Super Bowl with the Bears."
41:01,600;41:02,440;"Yeah, exactly."
41:02,440;41:03,440;"Yeah."
41:03,440;41:06,840;"But yeah, this is this is Brady come out showing that it wasn't just."
41:06,840;41:08,000;"Yeah."
41:08,000;41:13,440;"And that's the difference Brady Brady wins the Super Bowl, and then he puts in more work in the off season."
41:13,440;41:15,040;"Oh, I think which I have."
41:15,040;41:16,440;"I have a clip for that."
41:17,080;41:19,780;"Look at me. I've learned a new trick."
41:19,780;41:21,480;"Can you tell? Yeah, I like it."
41:21,480;41:25,080;"So this is actually I hate it again."
41:25,080;41:26,080;"This is a lot."
41:26,080;41:28,780;"I thought the lot I'm in."
41:28,780;41:36,480;"This is our girl Bonnie talking about Brady work on us because remember last week we didn't know about Brady's play action."
41:36,480;41:37,780;"Ooga."
41:37,780;41:42,580;"All right. Well, Dick, play action has become so much a part of the Patriots offense."
41:42,580;41:45,680;"And Tom Brady's really worked on the fakes in the off season."
41:45,680;41:47,360;"and he watched a lot of film of the great ones."
41:47,360;41:49,660;"Brett Farr, Peyton Manning, he mentioned Elvis Gruback,"
41:49,660;41:51,520;"and he said, ""The key is really consistency."
41:51,520;41:54,240;"If you watch quarterbacks, a lot of times they'll rush"
41:54,240;41:55,800;"to their hand-off point and then slow down"
41:55,800;41:57,760;"and do just the opposite when they fake."""
41:57,760;41:59,800;"Said defenses will definitely pick up on that."
41:59,800;42:01,440;"So you always have to keep what you're doing"
42:01,440;42:02,640;"exactly the same."
42:02,640;42:07,040;"- And Elvis Gruback does not fit."
42:07,040;42:08,760;"- Yeah, did she say Gruback in there?"
42:08,760;42:09,680;"- Yeah, yeah."
42:09,680;42:12,680;"She's just like, ""Oh, here's some two very highly-read"
42:12,680;42:14,080;"Hall of Fame writers."""
42:14,080;42:15,340;"I thought I misheard that."
42:15,340;42:17,200;"Like Gerbach."
42:17,200;42:20,260;"That name forever."
42:20,260;42:22,620;"And maybe he's really good play action."
42:22,620;42:24,340;"It's a great name."
42:24,340;42:26,580;"Here's, I think the real thing that makes pretty great."
42:26,580;42:28,060;"Like, I don't know."
42:28,060;42:30,060;"I don't remember this season at all."
42:30,060;42:32,280;"And, um, but I know the end result."
42:32,280;42:34,940;"Of that missing the plan."
42:34,940;42:40,140;"So he's got to fall off, but then in 2002 or 2003, he comes back even more"
42:40,140;42:40,980;"with a vengeance."
42:42,180;42:45,900;"Like to have that peak of Super Bowl start this year, the way this has."
42:45,900;42:49,700;"I don't remember this year being so awesome where three games or three and"
42:49,700;42:51,780;"oh, they're absolutely lighting people up."
42:51,780;42:53,380;"Their offense looks unstoppable."
42:53,380;42:57,460;"Their defense looks just as good as last year and then to have it all fall apart."
42:57,460;43:01,780;"And then to come back the next year and rattle off two more Super Bowl wins."
43:01,780;43:03,660;"That's what really makes pretty great."
43:03,660;43:04,780;"Yeah."
43:04,780;43:12,060;"And I think that even this year, I think, yeah, Brady led this, the, the NFL"
43:12,060;43:17,980;"touchdown. He did indeed with 28. So it's not like it was like, but I mean, back then,"
43:17,980;43:23,020;"I think that was like a reasonable amount of touchdowns to leave the league with."
43:23,020;43:31,180;"Yeah. And I mean, Stephen's saying the defense is as good as last year, but I think you're starting"
43:31,180;43:38,060;"to see cracks here. Like, look at Priest Holmes at an absolutely monster game. So I mean, yeah,"
43:38,060;43:43,340;"So let's talk about Priest on because I remember him being good, but I don't remember why."
43:43,340;43:46,340;"But apparently he led the league in a year before."
43:46,340;43:47,060;"Yeah."
43:47,060;43:49,940;"And and he was like the they were talking about it."
43:49,940;43:50,980;"The commentator talking about it."
43:50,980;43:57,420;"It was the first guy in like 20 years to lead the league in rushing when he was a free"
43:57,420;43:58,420;"agent the year before."
43:58,420;44:04,900;"So the chiefs actually had signed him prior to the 2001 season."
44:05,980;44:10,460;"And actually the Patriots were looking at him as well, but they they went on to one Smith because he was cheaper. I think"
44:10,460;44:20,700;"No, he couldn't have been cheaper doesn't sound right does it pretty songs as a nobody before he got to he's undrafted out of taxes"
44:20,700;44:27,580;"Didn't he he played for the the Ravens right before yeah for for two years, but he didn't put up really any numbers"
44:27,580;44:31,180;"I think he's still pretty highly touted though because"
44:32,140;44:35,900;"Who else was there? It wasn't Jamal Anderson at the time who was just like light and"
44:35,900;44:37,820;"league on fire and Priest Holmes is backing him up."
44:37,820;44:44,140;"I mean, maybe. I mean, he's got a decent average per carry, but I mean,"
44:44,140;44:48,540;"yeah, I think it was one of those like backup running backs that everybody fell in love with,"
44:48,540;44:51,020;"you know, and so there was a bit of a bidding market for him."
44:51,020;44:52,620;"Who's the equivalent right now?"
44:52,620;44:58,060;"It's probably a billy of, because everybody has like three running backs."
44:58,060;44:59,260;"Yeah, well, they don't."
44:59,260;45:09,420;"who was the running back for the the Ravens backup that everybody loved. I don't remember who it was."
45:09,420;45:19,340;"Yeah, he put up a three year span here in Kansas City where he's like the best running back in"
45:19,340;45:24,940;"the league. Yeah, and this was right in the midst of that. I think how many yards he's run for this"
45:24,940;45:33,660;"season was like 1600 or something ridiculous. Yeah, 1615 with another like almost 700 receiving"
45:33,660;45:38,540;"yards. Yeah, he basically was the offense of this team. And the coaches knew that going"
45:38,540;45:41,500;"in, they knew what they're getting themselves into and they still couldn't fucking stop it."
45:41,500;45:47,100;"Cause yeah, 24 touchdowns. He would, and then the next year he would set an NFL record with"
45:47,100;45:52,780;"27 touchdowns, which has, has been, has been broken like four times since then, but still,"
45:53,340;46:01,500;"But at the right. Yeah. Yeah. I always confused LT and pre-somes, but I really don't know why."
46:01,500;46:07,420;"Maybe because they both like didn't LT break that not long after. Yeah, I was like the next year."
46:07,420;46:12,460;"And then some who broke it the year after, I think. Yeah. But I always I used to always get him"
46:12,460;46:20,140;"in Jamal Lewis mixed up. I used to get him and didn't the Chiefs have another Larry Johnson"
46:20,140;46:24,460;"course maybe. Yeah, sorry. Yeah, yeah, it was very"
46:24,460;46:27,820;"gentle. That's right. From Penn State. Yeah. Yeah. And they"
46:27,820;46:30,700;"were like kind of similar running running back styles and"
46:30,700;46:33,060;"they're the workhorse of the team and everything ran through"
46:33,060;46:37,060;"them. Yeah. Kind of like that era of of chief football"
46:37,060;46:41,700;"felt like his songs went undrafted, right? He did. Yeah. I"
46:41,700;46:44,700;"think it's because he was back in up Ricky Williams, right? Is"
46:44,700;46:47,060;"that what you're saying, Steve? Yeah, they were playing at"
46:47,060;46:50,760;"Texas together, but it was like their times weren't that crossed."
46:50,760;46:55,440;"And there's like a one year gap in priest homes, like stats at Texas."
46:55,440;46:56,800;"I have no idea what happened there, but."
46:56,800;47:03,120;"Oh, you know, well, his name is, he's priests."
47:03,120;47:07,440;"So it's definitely not like, you know, touching kids or anything."
47:07,440;47:07,600;"Yeah."
47:07,600;47:13,040;"And I'm saying, you didn't go to Penn State."
47:13,040;47:13,840;"So we're good."
47:13,840;47:15,580;"- Hey, hi, hi."
47:15,580;47:17,840;"(laughing)"
47:17,840;47:23,720;"There was stuff, I don't know, maybe you gotta hurt."
47:23,720;47:25,320;"- What a backfield."
47:25,320;47:27,240;"- Right, Jesus."
47:27,240;47:30,280;"- And when you think about it, like Ricky Williams,"
47:30,280;47:33,120;"like there's that trade where the Saints traded"
47:33,120;47:35,200;"like their entire draft."
47:35,200;47:36,040;"- Oh, right, yeah."
47:36,040;47:37,400;"- For the take to get 'em."
47:37,400;47:42,400;"And then the pre-sombs goes undrafted and career-wise,"
47:42,440;47:45,280;"got to say Priest Holmes has a better career than Ricky Williams."
47:45,280;47:48,440;"Yeah, is that true?"
47:48,440;47:51,800;"He said the touchdown record."
47:51,800;47:54,000;"Like Ricky Williams never even sniffed it."
47:54,000;47:57,360;"I mean, Ricky was a stud for a few years."
47:57,360;47:59,240;"Yeah. He was, I don't know about a stud."
47:59,240;48:00,040;"He was good."
48:00,040;48:01,640;"And then he was like just crazy."
48:01,640;48:03,920;"I hadn't like traveled the world."
48:03,920;48:05,600;"Smoked, I loved him too."
48:05,600;48:07,840;"But yeah, like the songs."
48:07,840;48:11,880;"Have you ever heard about him negotiating his own contract?"
48:11,880;48:14,100;"- No."
48:14,100;48:18,740;"Or this actually goes in hand in hand with my deep dive,"
48:18,740;48:20,760;"but when you got drafted,"
48:20,760;48:25,600;"there was like the whole hip-hop and sports"
48:25,600;48:28,800;"were becoming like intermingled to a high degree."
48:28,800;48:31,240;"So all the rappers were wearing the jerseys backwards."
48:31,240;48:32,080;"Remember that?"
48:32,080;48:33,120;"- Oh, yeah."
48:33,120;48:34,800;"- And apparently like when you got drafted,"
48:34,800;48:38,800;"he like signed on with, I don't know,"
48:38,800;48:41,680;"one of the Southern rappers had like set up"
48:41,680;48:44,040;"their own agency, sports agency."
48:44,040;48:46,320;"And they were getting some pretty big names."
48:46,320;48:50,400;"And like the contract that they drafted for him was like,"
48:50,400;48:53,000;"like 98% incentive laden."
48:53,000;48:53,920;"(laughs)"
48:53,920;48:55,320;"And like the incentives were like,"
48:55,320;48:58,080;"he had to set like NFL records"
48:58,080;49:01,680;"for like four straight seasons to get to that benchmark."
49:01,680;49:04,480;"And he's like, ""Oh, betting on myself."""
49:04,480;49:06,440;"And I like lost millions and millions of dollars"
49:06,440;49:08,840;"in the process. (laughs)"
49:08,840;49:09,680;"- Where'd that go?"
49:09,680;49:10,520;"- Yeah."
49:10,520;49:11,720;"- Who are Ricky Williams?"
49:11,720;49:16,040;"- So you wanna hear my deep dive here?"
49:16,040;49:17,120;"- Yeah."
49:17,120;49:20,040;"- So whenever I hear the name Dante Hall,"
49:20,040;49:25,040;"I think of the little Wayne song from the drought three."
49:25,040;49:28,480;"I'm gonna read you the lyric right now."
49:28,480;49:29,320;"Remember he does the X--"
49:29,320;49:31,200;"- Can you rap us the lyric, please?"
49:31,200;49:35,200;"- I'm just gonna speak it."
49:35,200;49:37,480;"(laughing)"
49:37,480;49:38,680;"Come on."
49:38,680;49:44,340;"I'm just gonna speak of a member they called me X factor and he used to do the X thing"
49:44,340;49:48,080;"Yeah, yeah, yeah, so this is the line from little Wayne. I"
49:48,080;49:51,280;"Got a great idea. We should have sex"
49:51,280;49:55,440;"Pitch I'm like Dante Hall. I just throw up the X"
49:55,440;50:00,400;"Poetry"
50:00,400;50:04,440;"Took me a second realize that was the like like the truck"
50:05,400;50:13,080;"Like the socket X like X to see yes, who used to do the socket X in the rest?"
50:13,080;50:18,440;"I know you're talking about they they ban that from the kickball field in my elementary school because everybody"
50:18,440;50:22,520;"Cross the play kickball to do the X"
50:22,520;50:30,400;"Those things like triple H or something like that. Yeah, you want to hear a couple other"
50:30,400;50:33,360;"lines from this song"
50:33,760;50:39,320;"Yeah, I mean, yeah, don't drink Kristall no more just poured on white bitches heads"
50:39,320;50:44,700;"Which actually has more context than you think apparently"
50:44,700;50:50,200;"The like the CEO of Kristall in an interview with the economist"
50:50,200;50:58,080;"They were asking about how rap culture had kind of adopted Kristall as like a sign of affluence and he basically said"
50:58,080;51:00,640;"Hey, you can't pick who drinks your beverage is you know"
51:00,640;51:04,200;"And they all took it as racist. So like Jay Z started"
51:04,200;51:10,400;"Like boycotting it. So this is Lil Wayne acknowledging that you know fuck you"
51:10,400;51:13,880;"I just pour it on white bitch's heads now. It's just kind of awesome"
51:13,880;51:20,280;"Which I never knew when I listen to the song. I just thought it was kind of funny, but it's pretty badass too"
51:20,280;51:22,280;"I thought you're pretty good. Yeah"
51:22,280;51:26,880;"Is another line if you don't like it"
51:28,360;51:30,680;"Ninja fuck you with an AIDS dick"
51:30,680;51:36,120;"It's like come on"
51:36,120;51:39,160;"Mr. Wayne is there a back sort of that one?"
51:39,160;51:43,800;"I like the self-censoring too by the way. Yeah, I'm not that yes"
51:43,800;51:48,440;"Yeah, uh, which also reminded me of my favorite rap quote ever"
51:48,440;51:53,880;"from uh dr. Dre forgot about Dre if y'all don't like me blow me"
51:55,880;51:59,760;"Which is which is just the best and I say it to Kelly all the time"
51:59,760;52:03,320;"Y'all don't like me blow me"
52:03,320;52:10,280;"So then from there I started thinking for Christmas the gift of the curse"
52:10,280;52:15,520;"So I started looking into like hey when it is like did"
52:15,520;52:21,200;"How much did Tom Brady enter like the hip-hop culture right?"
52:21,360;52:25,340;"So if they're grabbing on Dante Hall and like Tom Brady is like"
52:25,340;52:27,820;"perennial MVP"
52:27,820;52:34,700;"Like he's got to be in there at some point right and apparently the first time little Wayne mentioned mentions him is in 2011"
52:34,700;52:40,240;"For a while long time. Yeah, the song Gucci Gucci my life. It's like a movie"
52:40,240;52:44,420;"I got a leading lady my rooftop drop back like Tom Brady"
52:44,420;52:48,440;"Which is a pretty sweet line. Yeah, so that's 2011"
52:49,360;52:53,700;"11 yeah, that seems way late. It's the first time little Wayne mentions him"
52:53,700;52:58,200;"Yeah, so I know I thought so too"
52:58,200;53:04,360;"My favorite was a Rick Ross song. It's actually Walle who says it"
53:04,360;53:07,800;"He and this quote is"
53:07,800;53:15,660;"Out of this third rock ninja air it out. I'm on my Tom Brady. Y'all ninjas is Eric Crouch"
53:15,660;53:17,660;"- That's a great approach."
53:17,660;53:20,100;"(laughing)"
53:20,100;53:21,460;"- Eric Crouch, dude."
53:21,460;53:22,300;"- That's brilliant."
53:22,300;53:23,300;"- Yeah, yeah."
53:23,300;53:25,500;"- Is Eric Crouch the widest quarterback"
53:25,500;53:27,140;"to ever be mentioned in a rap song?"
53:27,140;53:29,180;"- He's gotta be up there."
53:29,180;53:30,100;"- Yeah, yeah."
53:30,100;53:32,700;"- I don't know, is there a brand in a weed in one?"
53:32,700;53:34,420;"(laughing)"
53:34,420;53:37,300;"- I mean, I feel like weed would actually be a good word"
53:37,300;53:38,660;"to fit into a rap song."
53:38,660;53:40,180;"- Definitely."
53:40,180;53:43,420;"- There's a little Kim one too, but it's just so bad."
53:43,420;53:44,260;"- We can't say that."
53:44,260;53:45,080;"- The not- - I'm not."
53:45,080;53:45,920;"- I'm not gonna ever crack."
53:45,920;53:46,760;"- I'm a writer."
53:46,760;53:48,420;"All right, this is from 2019,"
53:48,420;53:50,580;"Little Kim's song, Too Bad."
53:50,580;53:51,420;"- Oh dear."
53:51,420;53:54,100;"- I'm gonna shake it on him,"
53:54,100;53:56,540;"shake it all around like a hula hoop,"
53:56,540;53:59,380;"and now he wanna take me to Hawaii,"
53:59,380;54:02,180;"and you know I'ma go, go and get it."
54:02,180;54:05,040;"Tom Brady, I'ma throw it, throw it back."
54:05,040;54:07,060;"- What?"
54:07,060;54:08,860;"- Poetry."
54:08,860;54:10,780;"(laughing)"
54:10,780;54:12,580;"From Little Kim."
54:12,580;54:17,540;"I believe she's talking about her hips during quite a."
54:17,540;54:19,260;"Okay."
54:19,260;54:22,700;"Well, we'd explain the whole, you know, certain position."
54:22,700;54:23,260;"Yeah."
54:23,260;54:25,060;"Yeah, throwing it back."
54:25,060;54:25,740;"Yeah."
54:25,740;54:28,180;"But this Tom Brady even throw it back."
54:28,180;54:29,180;"He throws it forward."
54:29,180;54:31,060;"Yeah."
54:31,060;54:33,780;"But what is Hawaii have to do with anything?"
54:33,780;54:35,180;"The pro-ball idiot."
54:35,180;54:39,060;"It's not in Hawaii anymore."
54:39,060;54:40,900;"In Orlando."
54:41,260;54:43,060;"He want to take me to Orlando."
54:43,060;54:45,820;"That's the best."
54:45,820;54:47,020;"That's the best."
54:47,020;54:50,940;"But he but he made the but he made the Super Bowl."
54:50,940;54:52,260;"So he canceled on me."
54:52,260;54:54,300;"Here it is."
54:54,300;54:56,260;"All right."
54:56,260;54:57,060;"That's all I had."
54:57,060;55:04,180;"I thought that steep dive was going to be about Dante Hall, but it took a real strange turn."
55:04,180;55:04,780;"Yeah."
55:04,780;55:05,140;"Yeah."
55:05,140;55:07,060;"It was sick, but like."
55:07,060;55:09,980;"He wasn't like a great receiver."
55:10,180;55:15,240;"Yeah, it's first catch behind beyond the line of scrimmage in like the fourth quarter or the very end when"
55:15,240;55:22,540;"Chiefs are making it a game. Yep. And that Tony Gonzalez snag was also"
55:22,540;55:30,180;"One of the game. Yeah, but it was on tile law. He was not open and he just pulled it out"
55:30,180;55:38,140;"Yeah, the bad wrist or something like you had a yeah, they kept talking and talking about it. Yeah too too much whacking right Andy"
55:38,140;55:47,260;"right. Yeah. Smell me. I would say Dante Hall, Steven, to your point, reminding me a"
55:47,260;55:52,540;"lot of Devin Hester. I think he's shiftier than Devin Hester. Well, just in terms of"
55:52,540;55:58,980;"like Devin Hester was an incredible kick returner. Yeah, the role I'm trying so hard to make"
55:58,980;56:05,660;"him wide receiver. He just couldn't just couldn't. And it felt like Dante Hall is that similar"
56:05,660;56:09,700;"guy like they did a couple of endarounds or reverses with him just to get the ball"
56:09,700;56:15,420;"in his hands. And one of them he was electric but he is he had like a couple of punt returns"
56:15,420;56:20,660;"or kick returns that were pretty damn good in this game. But having said that in this"
56:20,660;56:25,700;"game specifically I thought Dion branch almost matched him kick return for kick return because"
56:25,700;56:29,620;"there was a lot of them this game. The damn branch is a sick kick returner. I didn't even"
56:29,620;56:34,460;"remember him returning kicks. Yeah I mean he's averaging like 30 yards a kick return in this"
56:34,460;56:39,380;"game. They were fantastic. His first two were 34 and 53 yards."
56:39,380;56:44,180;"This is what I'm starting from. Yeah. Yeah. He was great. I just"
56:44,180;56:46,740;"don't remember. And this is like his rookie season. And they"
56:46,740;56:50,220;"keep talking about how polite he is. This is, I think two games"
56:50,220;56:52,980;"in a row. They've talked about it where he starts, he starts"
56:52,980;56:55,300;"every sentence with yes, sir. Or yes, ma'am."
56:55,300;56:58,020;"Yeah, that's a that's a white commentator thing to say."
56:58,020;57:03,780;"Like, I'll tell you what, you have to call mam and ages."
57:03,860;57:04,860;"Yeah."
57:04,860;57:08,420;"It wears a belt and he doesn't even sack his parents."
57:08,420;57:12,100;"It's so polite."
57:12,100;57:15,780;"That idea."
57:15,780;57:17,020;"Go on, Greg."
57:17,020;57:18,460;"I was going to say, can you?"
57:18,460;57:24,060;"I think Dante Hall might be the shiftiest player that I can think of just off the top of my head."
57:24,060;57:25,180;"I mean, Reggie Bush."
57:25,180;57:32,340;"And what when he was at USC was like impossible to put a hand on, but beyond that."
57:32,340;57:33,540;"One name."
57:33,540;57:43,700;"All right, let me hear Barry Sanders. Hmm. Okay. Yeah. Yeah. Yeah, that's the very sounds I can think that would be that's a good point. Yeah. But yeah, no, he's he's in that"
57:43,700;57:50,420;"in that yeah, I mean, he's not obviously not as good as a football player and like not as productive as some of those other guys but"
57:50,420;57:56,900;"Just from a pure like get the ball in his hands and that one that you watched the highlight video of Mandy"
57:57,460;58:00,340;"The one entitled Human Joystick absolutely."
58:00,340;58:03,900;"Yeah, where he runs like back like 16 yards and then like, yeah."
58:03,900;58:07,140;"Oh, well, he like gets a, a project."
58:07,140;58:11,500;"He catches the punter like the four yard line and goes backwards a couple yards"
58:11,500;58:14,020;"to the end zone and then still managed to return it for touchdowns somehow."
58:14,020;58:14,860;"Yeah."
58:14,860;58:15,900;"Why are you even catching that?"
58:15,900;58:16,500;"He's like, yeah, fuck it."
58:16,500;58:17,380;"Yeah."
58:17,380;58:18,900;"He was pretty good."
58:18,900;58:20,660;"Human highlight reel."
58:20,660;58:21,460;"It's like that."
58:21,460;58:23,980;"I see that running back to the paths picked up."
58:23,980;58:26,260;"I'm drafted guy."
58:26,500;58:29,740;"in the super short dude. Yeah. Oh, yeah. Yeah."
58:29,740;58:33,980;"He's high like packages. He looks like he's going to be something fun to watch."
58:33,980;58:38,580;"Oh, really? I feel like I thought that about Dion Lewis when he first came here,"
58:38,580;58:40,820;"too. Yeah, and he was. He was electric."
58:40,820;58:42,700;"It was sick. Yeah."
58:42,700;58:45,820;"Lewis, break ankle like nobody. I loved it. Yeah."
58:45,820;58:48,580;"I loved Dion Lewis. I loved him. We'll get to it."
58:48,580;58:53,100;"I didn't obviously when I watched these games, I have no idea what's going to happen"
58:53,100;58:59,020;"because I don't remember the season and the Chiefs get to the one inch line."
58:59,020;58:59,900;"Right."
58:59,900;59:04,780;"There's like the receiver runs a curl, whatever, and stops one in short, like an idiot."
59:04,780;59:06,820;"And uh, and lower below."
59:06,820;59:07,740;"Yeah."
59:07,740;59:09,620;"Make sure he does not get it."
59:09,620;59:10,820;"I have a note here."
59:10,820;59:12,900;"Tell me they throw a slant and throw a pick."
59:12,900;59:16,260;"Like you have pre-somes in the backfield."
59:16,260;59:19,100;"Like he's like carried you drink green, like barely."
59:19,100;59:22,220;"You know, like he just broke a hundred yards on that fucking throw."
59:22,820;59:26,380;"to tell me and I was like, please tell me they're trying to throw it with green."
59:26,380;59:27,740;"But they don't."
59:27,740;59:29,820;"They just run it in like smart people do."
59:29,820;59:32,620;"Yeah, so it's not a Pete Carroll moment."
59:32,620;59:33,220;"This is a."
59:33,220;59:33,740;"No."
59:33,740;59:34,900;"Yeah."
59:34,900;59:36,100;"So the team and the OT."
59:36,100;59:41,420;"Yeah, the game really went down to third inches, three seconds left, one"
59:41,420;59:43,260;"play left and down by seven."
59:43,260;59:46,140;"And the Chiefs ran a priest's homes."
59:46,140;59:49,820;"Really write them into dove over the pile and almost didn't make it, but"
59:49,820;59:51,500;"managed to get there because."
59:52,500;59:58,020;"I think there was both Bruce Key and Fife were out for this game."
59:58,020;59:59,660;"So they were starting."
59:59,660;01:00:01,980;"No, sorry, starting."
01:00:01,980;01:00:04,980;"I think they're heavy packaged, what had Larry is."
01:00:04,980;01:00:08,020;"Yeah, I saw him in there."
01:00:08,020;01:00:09,020;"Way more."
01:00:09,020;01:00:13,380;"That's where they were for their lieback and core and they got gas for like a buck 80"
01:00:13,380;01:00:14,660;"by pre-somes in this game."
01:00:14,660;01:00:15,300;"Yeah."
01:00:15,300;01:00:19,300;"Yeah, the game was doing whatever he wanted on the ground."
01:00:19,300;01:00:19,820;"Yeah."
01:00:19,820;01:00:23,260;"I felt like he was averaging a first down every carry."
01:00:23,260;01:00:24,100;"- Yeah."
01:00:24,100;01:00:26,260;"- I don't think I saw a single negative play from him."
01:00:26,260;01:00:27,580;"When they thought they had him,"
01:00:27,580;01:00:29,500;"he would still get a couple yards."
01:00:29,500;01:00:31,140;"- Yeah, or at least get very crazy."
01:00:31,140;01:00:33,420;"- He was better than our member."
01:00:33,420;01:00:35,180;"I thought he was kind of like a powerback guy,"
01:00:35,180;01:00:37,660;"but he had some shiftiness to him too."
01:00:37,660;01:00:38,660;"- Yeah, yeah."
