Start Timestamp;End Timestamp;Transcript
58:13,380;58:19,420;"So can you go to if you can line up when the way Malay hits Brady."
58:19,420;58:21,460;"I just want to hear like Dick."
58:21,460;58:27,380;"Because I'm not crazy in that he didn't go."
58:27,380;58:28,940;"Yeah, someone fell on his leg."
58:28,940;58:30,460;"Dick said like Dick."
58:30,460;58:33,860;"I'm not like debating that though."
58:33,860;58:35,820;"I think we all agree that Dan Dudor."
58:35,820;58:37,300;"So is a dumb show of all time."
58:37,300;58:38,300;"Old leg dick."
58:38,300;58:39,300;"Do you know."
58:39,300;58:42,300;"I mean, do you know the creepy comments?"
58:42,300;58:45,300;"Like like, like, dude, or dude."
58:45,300;58:49,300;"Oh, that's almost as good as WD 33 Andy."
58:49,300;58:51,300;"Oh, right. What was that for?"
58:51,300;58:53,300;"That's a fog."
58:53,300;58:54,300;"Well, that's right."
58:54,300;58:57,300;"Cause he just keeps the, he's the grease monkey."
58:57,300;58:59,300;"Yeah. The human lubricant."
58:59,300;59:03,300;"Do we know when about that?"
59:03,300;59:05,300;"The time that was?"
59:05,300;59:10,300;"This is going to be bad radio, but second quarter."
59:10,300;59:11,700;"47 minutes."
59:11,700;59:14,700;"So it'll be just like, I don't know, maybe a couple of minutes before 47."
59:14,700;59:19,580;"Well, while he looks for it, Steve, do you think that was a dirty play?"
59:19,580;59:24,540;"No, I didn't look at kind of blocking the back and like shoved down more."
59:24,540;59:26,180;"Whereas we're not a pilot."
59:26,180;59:31,020;"He was already on the ground and then made like an extra lunch or lawyer was sort of like pushed down."
59:31,020;59:34,980;"If it was the player other than lawyer, Maloy."
59:34,980;59:37,580;"I have the feeling you would say it's dirty."
59:37,580;59:42,020;"I don't think so because the ball was like, he's already down and then he made the lunge"
59:42,020;59:43,020;"for lawyers."
59:43,020;59:46,940;"It's like a dude getting rolled up blocking or like, you know, you're blocking and someone"
59:46,940;59:47,940;"gets rolled up behind you."
59:47,940;59:52,100;"It was a similar sort of play where it wasn't like where it was going for his knee."
59:52,100;59:56,580;"I just feel like in the NFL, all those plays are kind of like that."
59:56,580;59:59,340;"They were not probably able to."
59:59,340;01:00:02,940;"It was different because he definitely made like an effort to use already on the ground"
01:00:02,940;01:00:04,700;"and then like then lunge at him."
01:00:04,700;01:00:05,700;"I agree with that."
01:00:05,700;01:00:10,620;"I think you guys are just you're viewing these through rose colored glasses and that you like"
01:00:10,620;01:00:15,700;"lawyer and the line you don't want you don't want him to hate the Patriots."
01:00:15,700;01:00:17,340;"But he does."
01:00:17,340;01:00:20,660;"Well, dude, there's clear evidence that he was really good."
01:00:20,660;01:00:24,140;"But yeah, yeah, he sold Tom Brady his house."
01:00:24,140;01:00:24,780;"Yeah."
01:00:24,780;01:00:28,420;"Oh, well, in that case, you could never do a dirty hit Andy."
01:00:28,420;01:00:31,700;"It was not even going out there and trying to fucking tear Tom Brady's knee off."
01:00:31,700;01:00:34,780;"And that's also not who he was where Bernard Pollard has a dinner."
01:00:34,780;01:00:36,500;"We know what he's gonna."
01:00:36,500;01:00:39,580;"Bernard Pollard has a track reputation."
01:00:39,580;01:00:41,540;"What if Harris would have Harrison did that?"
01:00:41,540;01:00:43,820;"Oh, that would probably do."
01:00:43,820;01:00:47,860;"Yeah, for sure."
01:00:47,860;01:00:48,940;"We just say it was spirited."
01:00:48,940;01:00:50,540;"All right, I think I found it here."
01:00:50,540;01:00:52,660;"So fairly into the second quarter."
01:00:52,660;01:00:55,660;"Talk about his arms going to fall off before this thing's over."
01:00:55,660;01:00:56,580;"Going to do it again."
01:00:56,580;01:00:57,660;"And down he goes."
01:00:57,660;01:00:58,100;"I know."
01:00:58,100;01:00:59,260;"Pressure from the hell about."
01:00:59,260;01:01:00,180;"So there's a sack."
01:01:00,180;01:01:01,180;"That's a buffalo."
01:01:01,180;01:01:07,180;"Well, they're hoping that the play action here, honey, but his arm really has fallen."
01:01:07,180;01:01:08,180;"That's Sam."
01:01:08,180;01:01:10,180;"And you're in such a mess."
01:01:10,180;01:01:12,180;"A field position."
01:01:12,180;01:01:15,180;"Brady going for Gibbons."
01:01:15,180;01:01:16,180;"Incomplete."
01:01:16,180;01:01:20,180;"And Boyd at Tom Brady has somebody fall on his leg dick and he is hurt."
01:01:20,180;01:01:21,180;"He is hurt."
01:01:21,180;01:01:26,180;"And Boyd at Tom Brady has somebody fall on his leg dick and he's incomplete."
01:01:26,180;01:01:31,700;"and boy did Tom Brady have somebody fall on his leg dick and he is hurt he is"
01:01:31,700;01:01:37,940;"and boy did Tom Brady have somebody fall on his leg dick and he is hurt"
01:01:37,940;01:01:41,380;"I don't feel fine you're like dick"
01:01:46,180;01:01:48,180;"Sounds like dick Brady"
01:01:48,180;01:01:57,280;"I tell you it's terrible you triple your leg dick"
01:01:57,280;01:02:02,460;"I'm a trippin on his leg"
01:02:02,460;01:02:12,900;"Oh God I was right though. Yeah, I'm like big Brady"
01:02:12,900;01:02:17,840;"All right, but I also think you're right like this is where he says talks about the ligaments - yeah"
01:02:17,840;01:02:21,980;"Oh, yeah, yeah, it's a great show that replay over and over again. It was like oh, yeah"
01:02:21,980;01:02:27,440;"This was like they don't do it so much anymore, but they show the wide right replay"
01:02:27,440;01:02:32,240;"They showed drew blood so getting his lung cave didn't replay. They're just like hey, let's hit all the low lights"
01:02:32,240;01:02:38,220;"Let's see if he talks about the ligaments real quick. Oh"
01:02:38,220;01:02:42,220;"This is really awkward coming from the far side"
01:02:42,220;01:02:44,220;"side might have been Malloy is"
01:02:44,220;01:02:46,420;"good friend. It is lawyer"
01:02:46,420;01:02:48,620;"Malloy. Oh look at the last knee"
01:02:48,620;01:02:54,060;"and ankle of Tom Brady. Oh boy."
01:02:54,060;01:02:57,000;"That is when a quarterback is at"
01:02:57,000;01:02:59,160;"his most vulnerable standing"
01:02:59,160;01:03:00,460;"there with your legs straight"
01:03:00,460;01:03:02,400;"out and that hurt. You could"
01:03:02,400;01:03:03,900;"almost see the band. It's"
01:03:03,900;01:03:05,700;"remarkable that the only thing I"
01:03:05,700;01:03:07,200;"can say is I hope Tom Brady has"
01:03:07,200;01:03:10,540;"loose ligaments. I love"
01:03:10,540;01:03:12,540;"I don't care what anyone says."
01:03:12,540;01:03:14,540;"- I hope he's got loose link."
01:03:14,540;01:03:16,180;"- He's such an idiot."
01:03:16,180;01:03:18,140;"- I'm on AD, he's so bad."
01:03:18,140;01:03:20,020;"- Dan Deardorff, MD."
01:03:20,020;01:03:23,580;"But he's like, it's, you know when movies get so bad,"
01:03:23,580;01:03:24,420;"they're good?"
01:03:24,420;01:03:28,500;"You know, the thing I hate are movies that are like"
01:03:28,500;01:03:29,540;"somewhere in between."
01:03:29,540;01:03:32,220;"Like, you either be so bad you're entertaining."
01:03:32,220;01:03:34,860;"- Yeah, but like, watch like a ton of movies"
01:03:34,860;01:03:36,300;"that are so bad they're good, you know?"
01:03:36,300;01:03:37,540;"Like those are good ones in a while."
01:03:37,540;01:03:38,380;"- That's a good point."
01:03:38,380;01:03:39,660;"- You don't have to get too much of them."
01:03:39,660;01:03:43,740;"That's true. Yeah, I think that's that's my issue with him. He's so corny all the goddamn time"
01:03:43,740;01:03:47,180;"Yeah, any Bruce he plays the sex and he has some sex"
01:03:47,180;01:03:53,020;"This is gonna fall off. He's throwing it so much like that's his dumb"
01:03:53,020;01:03:57,580;"Right and also how many times of Tom Ray throw it like 25 times in the first half. Yeah"
01:03:57,580;01:04:03,500;"You're through 21 to 32 times this game. I'm just gonna fall off. Hey"
01:04:03,500;01:04:05,340;"Jesus"
01:04:05,340;01:04:07,340;"All right, you want to do best and worse?"
01:04:08,860;01:04:11,340;"Yeah, I guess I'm best of the worst. All right."
01:04:11,340;01:04:13,100;"Given to me, Steven."
01:04:13,100;01:04:21,900;"There was a stat where someone had thrown five touchdowns in a game when Brady was on fire in"
01:04:21,900;01:04:25,740;"the first half and was like, ""Oh, he was going to throw five touchdowns in the game and tie the"
01:04:25,740;01:04:31,660;"record."" And then doesn't he then later throw five touchdowns in a half? He does."
01:04:35,020;01:04:36,180;"- No, he'll get there."
01:04:36,180;01:04:38,660;"- Yeah, do you remember who it was that,"
01:04:38,660;01:04:39,860;"whose record it was?"
01:04:39,860;01:04:42,300;"The five touchdowns in a game?"
01:04:42,300;01:04:45,540;"Steve Grogan in 1979, versus Jess."
01:04:45,540;01:04:48,380;"And they were like, Tom Brady was two years old."
01:04:48,380;01:04:50,660;"Oh my God, can you imagine?"
01:04:50,660;01:04:53,260;"Yeah, that's how time works, bro."
01:04:53,260;01:04:54,100;"What did you expect?"
01:04:54,100;01:04:55,780;"They've just come out of the womb,"
01:04:55,780;01:04:56,580;"hucking footballs?"
01:04:56,580;01:05:00,500;"Like, I don't understand what you're getting at there."
01:05:00,500;01:05:01,340;"- Well, they're getting at,"
01:05:01,340;01:05:03,660;"that's an old record, Andy, do you not agree?"
01:05:04,860;01:05:06,580;"I don't think that's where they were going with it."
01:05:06,580;01:05:09,060;"I'm standing Dandy at all."
01:05:09,060;01:05:10,060;"I can see that."
01:05:10,060;01:05:12,060;"I'm going to."
01:05:12,060;01:05:14,820;"I'm fighting a good fight for my boy Dan."
01:05:14,820;01:05:17,380;"So all right, if you had to pick one"
01:05:17,380;01:05:24,140;"to spend an eternity on an island, just the two of you,"
01:05:24,140;01:05:29,140;"would it be your choices are Dan Deodor or Bill Belichick?"
01:05:29,140;01:05:30,140;"Oh, oh."
01:05:30,140;01:05:31,620;"[LAUGHTER]"
01:05:31,620;01:05:33,540;"We're brothers."
01:05:33,540;01:05:37,820;"I mean, you guys are Steve first Steve for sure"
01:05:37,820;01:05:42,340;"Yeah, we have all the time. Yeah, he gives great foot rubs"
01:05:42,340;01:05:49,240;"I know that's a good question Bill said Bellachacks probably wicked boring dude. I mean I mean"
01:05:49,240;01:05:56,280;"It's like would you rather be bored or like wicked annoyed? Yeah, it's a really good one"
01:05:58,900;01:06:04,920;"I guess board maybe if you like broke Belichick down enough you could get him to open up. I bet he would yeah"
01:06:04,920;01:06:08,460;"I know you know he's like boring on on purpose. I feel like yeah"
01:06:08,460;01:06:11,420;"And every time you hear like when he's miked up and stuff"
01:06:11,420;01:06:15,880;"He's always like telling jokes and shit, but they're like not great the jokes"
01:06:15,880;01:06:19,100;"Like all right. I tell you about that one round coach of the rounds back in the 80s"
01:06:19,100;01:06:24,260;"Yeah, all the players like yeah about this guy like yeah, it's not funny. Yeah coach"
01:06:24,580;01:06:30,660;"Yeah, when all you care about is football you're just not gonna be like a well-rounded like good fun person to hang out with"
01:06:30,660;01:06:38,340;"Can I do my other best yeah sure can"
01:06:38,340;01:06:43,700;"One I look at the radio announcers"
01:06:43,700;01:06:52,100;"From remember they had the bills guy on yeah, yeah, they said he was the longest serving radio announcer in NFL history"
01:06:53,500;01:06:58,560;"The bills guy who have been doing it since the bills were created as a franchise. Yeah, but didn't they say he missed?"
01:06:58,560;01:07:03,080;"He missed it for seven years because like the radio station went under or something"
01:07:03,080;01:07:09,160;"He was in second place was Gil Santos. Oh no shit"
01:07:09,160;01:07:13,940;"Hell yeah, I looked up who had a longer career like who who who yeah"
01:07:13,940;01:07:21,500;"Gil fucking crushes him really. Oh, yeah, so it was Gil in first place in 2012"
01:07:23,140;01:07:25,140;"That shmo was like"
01:07:25,140;01:07:29,940;"1957 to 2002. Oh whatever"
01:07:29,940;01:07:32,780;"Who's the longest?"
01:07:32,780;01:07:34,780;"Oh, I didn't look that up"
01:07:34,780;01:07:38,300;"Probably yeah, the guy from the Cubs, right? He was there forever"
01:07:38,300;01:07:45,660;"Well, I think it was just football. Yes like I started when the bill started. Yeah, and still must not have been too far behind either"
01:07:45,660;01:07:47,660;"Right, even the Patriots started"
01:07:47,660;01:07:52,740;"You would play for the Patriots when the Patriots are oh, J. You know"
01:07:52,740;01:07:53,740;"No."
01:07:53,740;01:07:57,740;"What do you just know for football and not for?"
01:07:57,740;01:07:58,740;"Yeah."
01:07:58,740;01:07:59,740;"Yeah."
01:07:59,740;01:08:01,740;"And then my best best fitting gloves is this next gift."
01:08:01,740;01:08:03,740;"I'm going to share screen again."
01:08:03,740;01:08:04,740;"Oh, good."
01:08:04,740;01:08:05,740;"Audio."
01:08:05,740;01:08:06,740;"Yep."
01:08:06,740;01:08:07,740;"Okay."
01:08:07,740;01:08:09,740;"Can you, can you give us a this?"
01:08:09,740;01:08:10,740;"This is such a throwback."
01:08:10,740;01:08:11,740;"Play by play."
01:08:11,740;01:08:14,740;"You should be able to share your audio too."
01:08:14,740;01:08:15,740;"There's no audio."
01:08:15,740;01:08:16,740;"It's just my fable."
01:08:16,740;01:08:17,740;"Okay."
01:08:17,740;01:08:24,020;"Is Mike Raywell in his he must have had a baller game wearing the shark tooth hat, which you're wearing right now Greg"
01:08:24,020;01:08:26,500;"Uh-huh just looking super young"
01:08:26,500;01:08:31,700;"And then it pulls up his little stat line of how long he's been in the year"
01:08:31,700;01:08:34,260;"Seven years Ohio State"
01:08:34,260;01:08:36,460;"28"
01:08:36,460;01:08:39,220;"And you're sitting here chilling on the sideline as a patron"
01:08:39,220;01:08:46,220;"Little do we know he would guarantee he would cut off his penis if the tenants he tight is would win a Super Bowl"
01:08:46,420;01:08:48,420;"How far we've come oh"
01:08:48,420;01:08:53,860;"Man football's different these days I came for my thumb on it"
01:08:53,860;01:08:58,660;"But oh, man"
01:08:58,660;01:09:06,660;"All right, Gregory you want to do your best and worse yes, I do okay"
01:09:06,660;01:09:09,300;"so my best"
01:09:09,300;01:09:15,020;"Was a sand gas sighting yes best name for a full-back"
01:09:15,580;01:09:17,580;"Yeah"
01:09:17,580;01:09:19,500;"No, I"
01:09:19,500;01:09:23,720;"He's got a cousin named Thad Gash"
01:09:23,720;01:09:27,220;"Thad Alvin Gash Jr. Which is"
01:09:27,220;01:09:33,400;"Kick ass name to be honest like I usually shit on the juniors like naming your kid after self"
01:09:33,400;01:09:38,400;"But if your name is Thad Gash you goddamn right your name you can't say anything. Yeah, that's"
01:09:38,400;01:09:44,860;"Play in the NFL - apparently oh damn pull back had to be I have no idea"
01:09:44,860;01:09:46,060;"- Yeah."
01:09:46,060;01:09:49,020;"Another interesting note about Sam Gash."
01:09:49,020;01:09:51,660;"I mean, obviously, you know, old school Pats fans"
01:09:51,660;01:09:53,620;"don't know what he played for the past for years."
01:09:53,620;01:09:57,660;"He made a Pro Bowl."
01:09:57,660;01:09:58,940;"He didn't make a Pro Bowl with the Pats,"
01:09:58,940;01:09:59,980;"but he did make a Pro Bowl,"
01:09:59,980;01:10:04,620;"and he was the first ever back in NFL history"
01:10:04,620;01:10:07,980;"to make the Pro Bowl without a single rushing attempt"
01:10:07,980;01:10:09,380;"in the regular season."
01:10:09,380;01:10:10,500;"- Holy shit."
01:10:10,500;01:10:11,340;"- Yeah."
01:10:11,340;01:10:12,160;"- No way."
01:10:12,160;01:10:12,980;"- That's impressive."
01:10:14,020;01:10:15,700;"just that could have a road greater, huh?"
01:10:15,700;01:10:17,980;"Yeah, I guess I might have caught."
01:10:17,980;01:10:19,500;"I think he was more like a"
01:10:19,500;01:10:22,780;"passing option at that because he caught a pass in this game."
01:10:22,780;01:10:24,860;"He did. I mean, it didn't."
01:10:24,860;01:10:26,860;"It didn't look particularly natural."
01:10:26,860;01:10:29,700;"Yeah, because no Mark Edwards, if you will."
01:10:29,700;01:10:33,220;"But I asked what a great fucking name, huh?"
01:10:33,220;01:10:33,460;"Right."
01:10:33,460;01:10:36,340;"Yeah, for somebody who's supposed to open up holes."
01:10:36,340;01:10:37,700;"Like that's perfect. Yeah."
01:10:37,700;01:10:38,700;"No."
01:10:38,700;01:10:41,540;"My worst is going to be"
01:10:42,700;01:10:47,500;"probably lawyer maloised mood directly after this game. Like I"
01:10:47,500;01:10:50,740;"can't imagine what was going through his head where they turn"
01:10:50,740;01:10:54,220;"around from week one where he thinks he's going on to like a"
01:10:54,220;01:10:58,580;"Super Bowl contender. Yeah, they beat the past 31 nothing. The"
01:10:58,580;01:11:01,260;"whole city's behind them. They got the lead. So they got"
01:11:01,260;01:11:05,340;"stacked as team. They're tuning all they're like, dude, this"
01:11:05,340;01:11:09,420;"was such a good decision to go to Buffalo. I'm gonna I'm gonna"
01:11:09,420;01:11:12,420;"fucking st-- I'm going to shove this down Bell check throat too."
01:11:12,420;01:11:14,320;"And the wrong fucking sense."
01:11:14,320;01:11:16,520;"They're out of the playoffs."
01:11:16,520;01:11:19,980;"He just fucking hurt his buddy Tom Brady."
01:11:19,980;01:11:20,520;"Yeah."
01:11:20,520;01:11:22,620;"And they fucking are trash."
01:11:22,620;01:11:28,320;"Also, on the Patriots first drive, it was Loy Malloy, who was called for defensive"
01:11:28,320;01:11:30,920;"pass interference in the end zone, which set up the first touchdown."
01:11:30,920;01:11:36,020;"And like he was the closest player to Givens when Givens scored his touchdown too."
01:11:36,020;01:11:37,920;"So not even a great game from Loyer."
01:11:38,520;01:11:43,560;"God damn shoes. Yeah, so not great. Yeah. I mean, I still love lawyer"
01:11:43,560;01:11:46,840;"Malay. And I'll always love lawyer Malay. Absolutely. Part of the law"
01:11:46,840;01:11:54,040;"firm. But just you got to feel for him for his dreams being shattered at this"
01:11:54,040;01:12:00,040;"point. Yeah, that's brutal. Mm hmm. Yeah, because I mean, and he, I guess he kind"
01:12:00,040;01:12:04,920;"of had a say in the decision at the beginning of the season. But like he was"
01:12:04,920;01:12:08,400;"also being asked to like take a cuz oven. Yeah. So I"
01:12:08,400;01:12:10,740;"understand that I got no problem with decision he made,"
01:12:10,740;01:12:14,400;"you know, no, he's a he's a pro. He's look out for his family. I"
01:12:14,400;01:12:18,640;"get that. Oh, yeah, absolutely. So it sucks. It does suck."
01:12:18,640;01:12:24,840;"That's what I'm saying. It's all about setting expectations in"
01:12:24,840;01:12:27,960;"life where if you expect to be bad, you'll never be"
01:12:27,960;01:12:34,240;"disappointed. But if you set that bar too high, you know, you're"
01:12:34,240;01:12:41,240;"asking for the hurt. There's something with a dumpster and a trash can or something like that, Greg, you have an analogy for this."
01:12:41,240;01:12:48,240;"What? And it's like you expect a dumpster and you get a trash can, you'd be like, Oh, all right."
01:12:48,240;01:12:55,240;"I think we talked about it in the pot before. Yeah, I haven't heard that."
01:12:56,240;01:12:57,300;"- I don't know."
01:12:57,300;01:12:59,420;"- Yeah, I like the setting expectations, that's good."
01:12:59,420;01:13:01,580;"- That's Greg's approach with his wife, with Kelly."
01:13:01,580;01:13:02,620;"- Yeah, right, right, yeah."
01:13:02,620;01:13:05,220;"- She expects I'm a dumpster fire"
01:13:05,220;01:13:07,180;"and then she just gets a trash can fire."
01:13:07,180;01:13:10,140;"- Yeah, yeah, that's, yeah, exactly."
01:13:10,140;01:13:13,180;"Setting expectations is, it's a real part of life"
01:13:13,180;01:13:15,460;"that we need to get better at, you know?"
01:13:15,460;01:13:16,580;"- I agree, yeah."
01:13:16,580;01:13:20,100;"Both at work and then your personal life."
01:13:20,100;01:13:21,100;"- Mm-hmm."
01:13:21,100;01:13:22,860;"- And you want to set them as low as possible as the key,"
01:13:22,860;01:13:23,700;"I think."
01:13:23,700;01:13:26,100;"- Yeah, we're all, we're all mediocre."
01:13:26,100;01:13:30,060;"The three of us are like definition of mediocre."
01:13:30,060;01:13:30,900;"Oh yeah."
01:13:30,900;01:13:31,740;"And the sooner we--"
01:13:31,740;01:13:33,660;"When we wake up at the podcast, like that's--"
01:13:33,660;01:13:34,100;"Yeah."
01:13:34,100;01:13:37,220;"If you look up mediocre in the dictionary,"
01:13:37,220;01:13:39,980;"it's three white men with a podcast."
01:13:39,980;01:13:40,740;"Yeah."
01:13:40,740;01:13:42,300;"We're actually a cliche."
01:13:42,300;01:13:43,420;"We're a meme."
01:13:43,420;01:13:43,900;"Yeah."
01:13:43,900;01:13:44,420;"Yeah."
01:13:44,420;01:13:46,420;"It's podcasts that we're doing now."
01:13:46,420;01:13:50,180;"What do you call a group of white males?"
01:13:50,180;01:13:52,860;"You call them a podcast."
01:13:52,860;01:13:54,860;"Yelling into the abyss."
01:13:54,860;01:13:55,340;"Exactly."
01:13:55,340;01:13:57,100;"yelling into the universe."
01:13:57,100;01:14:02,300;"- Well, all right, that took a turn."
01:14:02,300;01:14:03,140;"I wasn't expecting anything."
01:14:03,140;01:14:04,540;"- You know we're all gonna die one day."
01:14:04,540;01:14:05,540;"You gotta get back."
01:14:05,540;01:14:07,060;"(laughing)"
01:14:07,060;01:14:08,780;"- Yeah, but you know what'll live on forever?"
01:14:08,780;01:14:10,340;"- Just fucking podcast."
01:14:10,340;01:14:11,380;"- You fucking right."
01:14:11,380;01:14:12,620;"- You're gonna run this thing."
01:14:12,620;01:14:13,460;"- Yep."
01:14:13,460;01:14:14,420;"- Ugh."
01:14:14,420;01:14:15,780;"Dude, that leg dick."
01:14:15,780;01:14:19,700;"Fucking comment, that, that's in the annals of time."
01:14:19,700;01:14:20,700;"- It'll never die."
01:14:20,700;01:14:21,540;"- Yeah."
01:14:21,540;01:14:22,380;"- Oh God."
01:14:22,380;01:14:25,420;"There's somebody in like 20, 60 when the paths are terrible."
01:14:25,420;01:14:27,900;"They're going to be like, I wonder how it was when Brady was flying."
01:14:27,900;01:14:31,580;"And they're like, damn, this Dan Deegar sounds like a dickhead."
01:14:31,580;01:14:36,300;"I wonder where he's buried."
01:14:36,300;01:14:36,780;"Good."
01:14:36,780;01:14:40,980;"Ah, too far too far."
01:14:40,980;01:14:41,500;"Yeah."
01:14:41,500;01:14:42,580;"I'll take that back."
01:14:42,580;01:14:45,020;"All right."
01:14:45,020;01:14:47,260;"I'll do my best and worst to recover from that."
01:14:47,260;01:14:48,180;"My best."
01:14:48,180;01:14:48,820;"I got a couple."
01:14:48,820;01:14:52,020;"Um, first one is totally Ben DeCain's first sack."
01:14:52,020;01:14:57,260;"his career. Yeah. Oh, where he just kind of wrapped up through blood. So and then like"
01:14:57,260;01:15:01,860;"didn't tackle him because blood so had like a flung. Like who else can we send on a blitz"
01:15:01,860;01:15:04,180;"just sit down the roster, get everybody some experience."
01:15:04,180;01:15:09,580;"Fuck, telly band decay and also, um, Gerard Cherry had a nice blitz off the edge and he"
01:15:09,580;01:15:14,420;"caught, what was the name Travis Brown? Completely unaware. And I think may have concussed him"
01:15:14,420;01:15:20,660;"too. That was the brutal it. Yeah. Um, so telly, uh, who hopefully we'll have on to discuss"
01:15:20,660;01:15:29,300;"credit cards would be good. Also Tom Brady did not throw an interception at home in this"
01:15:29,300;01:15:33,660;"season. All 12 of his interceptions came on the road and the Patriots now have home field"
01:15:33,660;01:15:40,460;"advantage all the way through the playoffs. So that might work out. And then my last best."
01:15:40,460;01:15:47,780;"Oh, yeah, they talked about David Gibbons. And did you boys realize that he was a running"
01:15:47,780;01:15:52,460;"back at Notre Dame who converted to wide receiver. I had no idea."
01:15:52,460;01:15:54,380;"I've heard that as well."
01:15:54,380;01:15:59,900;"His stats were like, yeah, like 20 catches his senior year, something crazy."
01:15:59,900;01:16:03,140;"Yeah, I could see the wide receiver before they had dropped it and tried to convert him."
01:16:03,140;01:16:08,740;"I don't know. That's what the commentator said that he was running back at Notre Dame and then he"
01:16:08,740;01:16:14,660;"converted to wide receiver and the page is drafted as a wide out. He looks at the case. He is. Yeah,"
01:16:14,660;01:16:19,220;"He's a natural wider series like but he's also like built like a big wide series you like that's not"
01:16:19,220;01:16:26,580;"Running back built. I wrote this down watching this game. He is what we all wish Nick Hill Harry could be"
01:16:26,580;01:16:29,060;"or"
01:16:29,060;01:16:30,420;"Malcolm Mitchell"
01:16:30,420;01:16:35,380;"Well, Machel Mitchell like he was but like that's that prototype"
01:16:35,380;01:16:40,980;"I think Belichick was looking for was that David Givens and then the Malcolm Mitchell and probably even Aaron Dobson"
01:16:42,020;01:16:44,580;"the big bodied wide receiver Aaron dropson."
01:16:44,580;01:16:48,580;"Call what you will. Ken Braille dropkins."
01:16:48,580;01:16:54,260;"That one doesn't quite work really like it. But speaking of misses."
01:16:54,260;01:17:04,100;"They're bullsh*t Andy. In 2000 he had 24 rushing attempts, 25 catches, and then a senior"
