Start Timestamp;End Timestamp;Transcript
19:31,540;19:34,740;"Understandably, a lot of long faces on the bill."
19:34,740;19:38,940;"Sideline Greg, how top of the task is it as a coach to go into the locker room now"
19:38,940;19:41,740;"and tell your guys how important it is to try to go out on a positive note."
19:41,740;19:42,540;"Well, they're pros."
19:42,540;19:45,460;"You know, we've got to go out and try to get off the field better on deep fan."
19:45,460;19:46,620;"They spread us out a little bit."
19:46,620;19:48,220;"Didn't make any plays."
19:48,220;19:50,940;"We didn't capitalize on the one turnover we did get."
19:50,940;19:52,020;"Our guys have come out."
19:52,020;19:53,980;"We'll be a little bit more wide open here in the second half,"
19:53,980;19:55,500;"and we've got to finish it strong."
19:55,500;19:57,100;"Thank you."
19:57,100;19:59,580;"Quality man, Greg Williams, you've got to empathize."
19:59,580;20:05,980;"I'm sorry."
20:05,980;20:07,580;"What was that, Dan Deodorf?"
20:07,580;20:08,580;"quality man."
20:08,580;20:13,820;"Understandably, a lot of quality man Greg Williams is God empathize quality man Greg"
20:13,820;20:17,100;"quality man Greg Williams is God empathize."
20:17,100;20:18,100;"Do you though?"
20:18,100;20:22,300;"I will I refuse to empathize with Greg Williams."
20:22,300;20:25,740;"Yeah, the worst, the worst."
20:25,740;20:30,460;"And they kept talking him up about how like all the players like, Oh, I can't believe"
20:30,460;20:34,260;"how great he's like stuck with us through this whole season, even though we suck."
20:34,260;20:35,940;"What the fuck choices you have?"
20:35,940;20:37,260;"Like it's, he sucks."
20:37,260;20:38,620;"You like you suck because of him."
20:38,620;20:39,660;"Like he's the coach."
20:39,660;20:43,540;"This is got two Gs in his name."
20:43,540;20:44,980;"He's selling the Greg."
20:44,980;20:45,820;"Oh my God."
20:45,820;20:46,820;"I guess three Gs."
20:46,820;20:49,940;"Yeah, he's awful."
20:49,940;20:52,500;"So do we want to just talk about the,"
20:52,500;20:56,260;"the potential complications of this game?"
20:56,260;20:57,100;"Yes."
20:57,100;20:58,020;"What the Patriots are playing for?"
20:58,020;21:00,180;"Cause this is week 17."
21:00,180;21:02,540;"Yeah, this is the last week."
21:02,540;21:04,300;"There's a bunch of stuff on the line."
21:05,300;21:10,300;"It took a screenshot of the graphic that they had up"
21:10,300;21:15,340;"because two teams in the AFC were undefeated"
21:15,340;21:17,020;"at home this season."
21:17,020;21:20,860;"The Chiefs 12 and three who have,"
21:20,860;21:21,980;"they start off undefeated."
21:21,980;21:23,720;"They went like nine and O,"
21:23,720;21:25,780;"but have struggled down the stretch here."
21:25,780;21:29,000;"And I believe this game was on a Saturday."
21:29,000;21:35,260;"And so the Chiefs are hosting the Bears the day after."
21:35,260;21:36,740;"who are seven and eight."
21:36,740;21:40,140;"And the Patriots again are a game up,"
21:40,140;21:43,900;"but if the Patriots lost this game,"
21:43,900;21:48,460;"and the Chiefs won, there would be tie for a record,"
21:48,460;21:51,020;"but I think the Chiefs would have a tiebreaker"
21:51,020;21:52,740;"somewhere down the road on..."
21:52,740;21:55,660;"- I don't know. - I'm an opponent."
21:55,660;21:57,020;"- Yeah, something like that, yeah."
21:57,020;21:59,660;"Or like conference, whatever."
21:59,660;22:04,860;"- So yeah, and the Chiefs do end up winning that game."
22:04,860;22:07,580;"So this is basically the battle for the one seed."
22:07,580;22:08,080;"Yeah."
22:08,080;22:08,580;"Yeah."
22:08,580;22:11,780;"And that's probably part of the reason Brady was in there"
22:11,780;22:13,100;"for as long as he was."
22:13,100;22:13,380;"Right."
22:13,380;22:16,780;"Just to make sure which is what Belichick said at halftime,"
22:16,780;22:18,060;"too, is what they said."
22:18,060;22:22,020;"And also both teams really good at home."
22:22,020;22:24,020;"But the Chiefs-- like the Patriots, obviously,"
22:24,020;22:25,420;"both teams undefeated."
22:25,420;22:31,060;"The Patriots were averaging 20 to 10 wins,"
22:31,060;22:34,140;"like 20 points for 10 points against the Chiefs"
22:34,140;22:38,380;"On the other hand, averaging 34, almost 35 points a game at home."
22:38,380;22:42,300;"Um, well, when allowing only 17, so that, I mean, that's."
22:42,300;22:47,340;"Like for the chiefs, it's kind of a big deal to want to win at home."
22:47,340;22:49,220;"Or want to play at home."
22:49,220;22:49,580;"So."
22:49,580;22:55,460;"You're also denying the chiefs that, um,"
22:55,460;22:58,700;"I don't know what I'm looking for."
22:58,700;22:59,820;"Advantage."
22:59,820;23:00,180;"Yeah."
23:00,180;23:01,700;"Home field advantage."
23:01,820;23:03,000;"Arrowhead's no joke either."
23:03,000;23:04,460;"That's true."
23:04,460;23:04,980;"Yeah."
23:04,980;23:05,760;"Yeah, especially at this point."
23:05,760;23:06,480;"Yeah."
23:06,480;23:07,480;"And priest homes."
23:07,480;23:08,040;"Peace."
23:08,040;23:08,780;"Yeah."
23:08,780;23:10,920;"So were there any other, um,"
23:10,920;23:16,640;"was there anything else on the line Greg, like around the league for this week?"
23:16,640;23:18,200;"Yeah, do you want?"
23:18,200;23:19,040;"I mean, I have."
23:19,040;23:20,660;"So this is obviously week 17."
23:20,660;23:26,560;"So there's a lot of maybe we get, we, we touch on it after we talk about the game."
23:26,560;23:27,720;"All right."
23:27,720;23:27,960;"Yeah."
23:27,960;23:28,400;"Yeah."
23:28,400;23:30,400;"Cause it's a lot of like results based stuff."
23:30,400;23:31,300;"That's what I figured."
23:31,300;23:31,500;"Yeah."
23:31,500;23:32,000;"Okay."
23:32,000;23:34,800;"All right."
23:34,800;23:39,560;"So in terms of if you want to watch this game, I would say,"
23:39,560;23:41,040;"watch the first half."
23:41,040;23:41,540;"Yeah."
23:41,540;23:41,800;"Yeah."
23:41,800;23:42,240;"First half."
23:42,240;23:45,720;"And watch kind of like the end of the, hey, you can watch the fourth quarter to"
23:45,720;23:47,140;"watch the first, not even fourth quarter."
23:47,140;23:48,040;"Watch your first half."
23:48,040;23:50,040;"And then the last couple minutes to watch that."
23:50,040;23:52,240;"I and T that we all know the game ceiling one."
23:52,240;23:52,780;"Yeah."
23:52,780;23:57,880;"Um, that I think is you could, that could be your thumbnail, Greg."
23:57,880;23:58,480;"There you go."
23:58,480;24:00,080;"I don't know."
24:00,080;24:00,920;"- That's not the number."
24:00,920;24:01,760;"- Yeah."
24:01,760;24:02,580;"- Yeah."
24:02,580;24:04,640;"- I didn't remember it was an interception until."
24:04,640;24:05,480;"- Oh really?"
24:05,480;24:06,320;"- I remember the interception."
24:06,320;24:07,360;"I thought it was Teddy Bruski."
24:07,360;24:08,920;"- I thought it was a fourth down play."
24:08,920;24:12,360;"I remember like a goal line stop at the end of the game."
24:12,360;24:13,200;"- No, yeah."
24:13,200;24:15,320;"I thought they put their starters back in."
24:15,320;24:17,400;"- I thought they put their starters back in too Andy."
24:17,400;24:18,240;"- Yeah."
24:18,240;24:19,080;"- But they didn't."
24:19,080;24:19,920;"- No."
24:19,920;24:21,720;"- Which was even better when,"
24:21,720;24:23,960;"'cause it was Larry Izzo with the Unisoyant to end it."
24:23,960;24:24,800;"- He does, it was Izzo."
24:24,800;24:26,200;"- To keep the 31 nothing."
24:26,200;24:29,400;"- He was playing two, he was one guy versus two."
24:29,400;24:32,960;"He had the guy in the fly and the guy deep and he like bumps the guy in the flat goes deep,"
24:32,960;24:33,960;"makes interception."
24:33,960;24:34,540;"Yeah."
24:34,540;24:41,360;"And then I thought it was Teddy because like Teddy flips the fuck out and is like on the field"
24:41,360;24:44,240;"and they had like this crazy hugging party in the midfield."
24:44,240;24:44,960;"It was awesome."
24:44,960;24:46,000;"Yeah."
24:46,000;24:47,720;"With the entire defense and Troy Brown there."
24:47,720;24:49,840;"They are so fucking stoked."
24:49,840;24:53,360;"So yeah, it was a fucking hell of a party at the end of it."
24:53,360;24:57,960;"Um, yeah, I think the first quarter is basically the Patriots offense."
24:58,720;25:00,320;"did whatever the hell they wanted."
25:00,320;25:05,760;"The defense against the number two ranked defense"
25:05,760;25:07,280;"in the NFL."
25:07,280;25:08,200;"- Where are they?"
25:08,200;25:09,040;"- I missed that."
25:09,040;25:10,160;"- So Buffalo had a tough year."
25:10,160;25:11,760;"Yeah, they had a tough year."
25:11,760;25:12,760;"- Oh, they were, that's right."
25:12,760;25:14,560;"- In terms of yardage,"
25:14,560;25:17,040;"they were the number two defense in the NFL."
25:17,040;25:18,720;"And they were number five for a pricing,"
25:18,720;25:21,160;"which is for points against as well."
25:21,160;25:22,000;"- Yeah."
25:22,000;25:22,840;"- So another defense is sick."
25:22,840;25:24,080;"They had playmakers everywhere."
25:24,080;25:25,400;"- Yeah. - They're off top five defense."
25:25,400;25:26,920;"- They're off top five defense though."
25:26,920;25:27,760;"- Yo, yeah."
25:27,760;25:29,100;"They're running faster."
25:29,100;25:29,620;"Good drew blood."
25:29,620;25:30,220;"So it was good."
25:30,220;25:32,520;"It also felt like the whole line."
25:32,520;25:33,600;"And I don't know."
25:33,600;25:35,020;"It may have been day and year or two."
25:35,020;25:39,940;"The point that's out that it seemed like the defense wasn't trying."
25:39,940;25:44,740;"The Bill Zefans wasn't running at 100% effort either on the Bethel"
25:44,740;25:47,540;"Johnson touchdown where I don't remember."
25:47,540;25:48,840;"I miss my boy."
25:48,840;25:49,820;"Yeah."
25:49,820;25:50,880;"You have his jersey, right?"
25:50,880;25:54,780;"Kind of half asked it and got stiff armed in the chest and just like didn't"
25:54,780;25:56,320;"even really try to make the tackle."
25:56,580;26:02,480;"Your Bethel is is this is like peak battle because he's been playing awesome these last couple weeks to he's had a kickass year"
26:02,480;26:08,460;"I'm I'm hyped on Bethel right now. Yeah, there's a look so much better. I don't know how he didn't"
26:08,460;26:16,820;"Stick because yeah, he's been playing great. He and not just I mean, okay, so yeah, oh I gotta I gotta get comparison"
26:16,820;26:20,980;"Cordero Patterson"
26:21,460;26:26,580;"Mmm. No, that's like shift here. No, I just mean from like a game impact, right?"
26:26,580;26:28,460;"He's not like he's not you're not giving him like"
26:28,460;26:34,680;"10 10 targets a game or anything, but like every time he gets the ball. He seems to do something that's like, okay"
26:34,680;26:39,220;"That's okay. That's a big and and his his biggest contribution is on kickoffs"
26:39,220;26:46,660;"And even in this game, I think Bethel Johnson's biggest contribution was kickoff coverage. Yes because"
26:47,660;26:53,820;"Antonio Brown the other Antonio Brown the bills Antonio Brown was a kick off one. I looked it up"
26:53,820;26:58,820;"I was like what no well. Yes. No, it's not the same way. We were over we went over this week one. I think"
26:58,820;27:06,700;"It's the Antonio Brown that you draft by accident and fantasy and kick yourself"
27:06,700;27:15,500;"But yeah, so he was a bit of a burner in this and Bethel Johnson rained him down on kickoffs"
27:15,500;27:17,700;"that probably would have been touchdowns otherwise."
27:17,700;27:20,900;"Like, ran this guy down from behind"
27:20,900;27:22,700;"when nobody else could catch him,"
27:22,700;27:24,460;"like from the other side of the field on one of them."
27:24,460;27:26,020;"So Bethel Johnson, yeah."
27:26,020;27:27,420;"I'm big on him in this."
27:27,420;27:30,180;"And like, that's the kind of players you like"
27:30,180;27:32,180;"that make the most of their opportunities."
27:32,180;27:36,740;"Yeah. And so I'm kind of, but I think it was a couple of weeks ago,"
27:36,740;27:38,100;"maybe in the Jags game,"
27:38,100;27:40,900;"they said that he didn't play because"
27:40,900;27:44,620;"something to do with his preparation for the game wasn't up to snuff."
27:44,620;27:47,260;"like it wasn't the pages weren't happy with it."
27:47,260;27:48,540;"So they'd like bench him for a game."
27:48,540;27:52,220;"So there may have been something else going on there, but every time he's on"
27:52,220;27:53,220;"the field, he does something."
27:53,220;27:54,820;"He makes a, he makes a difference."
27:54,820;27:56,420;"He like wasn't prepared."
27:56,420;27:58,060;"So he didn't even dress."
27:58,060;27:59,140;"Yeah."
27:59,140;28:01,660;"I'm so prepared well enough for the week or some, some show you that."
28:01,660;28:02,220;"Yeah."
28:02,220;28:07,980;"Uh, similar to Ruben Brown in this game, it gave me old fucking, uh, Malcolm"
28:07,980;28:08,900;"Butler treatment."
28:08,900;28:09,060;"Yeah."
28:09,060;28:10,340;"I'm not going to give you a real reason."
28:10,340;28:13,380;"We're just going to sit one of our players."
28:13,620;28:17,860;"Yeah, and in a super ball for no reason."
28:17,860;28:22,540;"Bill Belichick, your hero, your God."
28:22,540;28:23,820;"Yes."
28:23,820;28:25,020;"I mean, there's got to be something there."
28:25,020;28:26,180;"It can't believe that never came up."
28:26,180;28:28,420;"I know."
28:28,420;28:31,540;"Well, when we have either of them on the podcast, we will talk about it."
28:31,540;28:34,260;"Butler, you free agent."
28:34,260;28:34,700;"Yeah."
28:34,700;28:35,140;"He is."
28:35,140;28:36,980;"Yeah, he's got release."
28:36,980;28:38,940;"So we shall see."
28:38,940;28:43,060;"Yeah, but there was something about in this game,"
28:43,060;28:47,980;"Reuben Brown didn't travel with the team the bills like"
28:47,980;28:50,500;"Pro Bowl"
28:50,500;28:52,500;"Line, oh is left tackle maybe"
28:52,500;28:56,500;"So he's a guard. Yeah, there's a guard"
28:56,500;29:00,660;"But yeah, he"
29:00,660;29:08,020;"I guess he had some altercations on the field and on the sidelines in the game before this"
29:08,020;29:10,700;"against the"
29:10,700;29:14,140;"Dolphins in a game where Drew Bledso was sacked six times"
29:14,140;29:19,780;"And I guess they said he was frustrated with the way the offense was was performing"
29:19,780;29:26,380;"And so he didn't practice all week and didn't travel with the team and this was another thing that that"
29:26,380;29:30,020;"Your boy Dan Deidorf was like"
29:30,020;29:35,260;"Meleagering. Yeah, he was he was upset about this"
29:35,260;29:40,380;"But the fact that Ruben gets to stay home and still gets a paycheck, but all his teammates are"
29:40,380;29:46,700;"are here battling it out, which I think if you look at the scores probably a"
29:46,700;29:56,380;"questionable statement, but yeah he was on that train for probably most of the"
29:56,380;30:02,340;"second quarter I would say about how this offensive line looked."
30:02,340;30:07,860;"I hear nipples hard underneath your gear door if Jersey or Rock solid."
30:07,860;30:12,860;"- Ruben Brown, four time second team all pro."
30:12,860;30:15,820;"- Yeah."
30:15,820;30:16,860;"- What was the brides made?"
30:16,860;30:18,500;"Never the bride."
30:18,500;30:20,380;"- Well, that's cause he's gonna show up for his team."
30:20,380;30:23,260;"- Is that the most bills stat ever?"
30:23,260;30:26,120;"Four time second team all pro."
30:26,120;30:28,620;"(laughing)"
30:28,620;30:30,820;"- Well, they have been four times second place"
30:30,820;30:31,660;"that I've had."
30:31,660;30:32,500;"- Yeah."
30:32,500;30:33,340;"- Just fits."
30:33,340;30:37,500;"- Oh."
30:37,500;30:41,060;"Yeah, I'm more of a Cuban guy myself, you know a cubano"
30:41,060;30:48,160;"Yeah, I did find it strange that patrons go 14 and 2 set a franchise record for wins"
30:48,160;30:52,520;"Going to win Super Bowl and have two pro bowlers"
30:52,520;30:57,280;"Mmm. Yeah, that's what well. I mean I'm wearing one of them's Jersey"
30:57,280;31:02,780;"Tyler baby is that from me is that the Jersey from this year? Yeah?"
31:02,780;31:06,300;"Why war today"
31:06,300;31:09,380;"Oh, yeah. So who is the other one?"
31:09,380;31:11,380;"Three, Tyler, Pearl, Bull Jersey."
31:11,380;31:14,620;"The other one is Seamore, right? Yeah."
31:14,620;31:16,420;"Yeah. So no offense."
31:16,420;31:19,940;"Oh, yeah, that makes sense. This offense has been Harrison."
31:19,940;31:21,740;"I think you could have made a case for Harrison."
31:21,740;31:22,140;"I agree."
31:22,140;31:23,460;"He stuck out as like Bruce,"
31:23,460;31:24,900;"the hominist. Bruce, he"
31:24,900;31:26,220;"should have made it. He had it."
31:26,220;31:29,380;"Because I should have had more than two being how dominant they were because they"
31:29,380;31:32,380;"were absolute crushing teams."
31:32,380;31:33,580;"Yeah. Yeah."
31:33,940;31:40,740;"And Wikipedia.com is saying that William McGinnis is a pro baller to maybe he got in as a alternate"
31:40,740;31:41,540;"could be"
31:41,540;31:47,940;"It doesn't matter if it's not like I didn't even play it right. Yeah, actually now this was this was when the pro bowl was after"
31:47,940;31:53,540;"the school was that's right. Now a title I did play in this game. Yeah, I bet he did. Yeah."
31:53,540;32:03,860;"But yeah, the Teddy, no, Teddy, Mike Vable had an interception early in the first quarter."
32:03,860;32:10,660;"better. Bill's first drive, I think. And that was, that was this defense 28th interception"
32:10,660;32:16,700;"on the season with 28 interceptions a lot. It was actually, it moved them into first"
32:16,700;32:21,740;"in the NFL. I don't know if that stuck, but it was also the most by pages defense since"
32:21,740;32:29,060;"1964. It's a long fucking time. Also, in 1964, I'm surprised you could get 28 interceptions"
32:29,060;32:33,620;"because I don't think teams threw more than like three times a game back then. But yeah,"
32:33,620;32:35,620;"Well, that's why because I kept throwing somebody got in there."
32:35,620;32:37,120;"Except because it's so bad at it."
32:37,120;32:41,860;"But this team was also only allowing nine points per game at home."
32:41,860;32:43,980;"Pretty good."
32:43,980;32:47,380;"And I mean, this first half was making crazy domination."
32:47,380;32:52,100;"Like they get the kickoff, go down nine plays, 60 yards touchdown."
32:52,100;32:57,820;"Next drive, blood so throws an interception, touch down again, 14, nothing before you"
32:57,820;33:01,380;"can even like before the finish sat down."
33:01,380;33:01,820;"Yeah."
33:01,820;33:02,620;"Exactly."
33:02,620;33:07,180;"Yeah, but like they've been waiting for this all is the best the offense looked in forever"
33:07,180;33:11,260;"In many games and they were just against the number two defense"
33:11,260;33:16,380;"Yeah, because they came out just saying, you know what fuck it five wide no huddle"
33:16,380;33:21,600;"We're just gonna just hammer right down your throat and it worked for two drives and then they just"
33:21,600;33:24,820;"Got up"
33:24,820;33:27,220;"Nothing like 20 nothing at half time"
33:27,220;33:32,100;"Yeah, it was 21 nothing after like right at the right at the beginning of the second quarter because they"
33:32,100;33:36,560;"Their last drive the first quarter finished in the second like right at the beginning"
33:36,560;33:39,180;"Brady through touch on a Troy Brown"
33:39,180;33:46,020;"And so some blood so like still hasn't thrown a complete a pass at this point. Yeah, he had the bills lit"
33:46,020;33:51,820;"horrendous. Yeah, they couldn't block anybody on that offensive line like Siva say"
33:51,820;33:53,540;"- Here's a question for you guys."
33:53,540;33:56,460;"Did you guys feel bad for Brady watching this?"
33:56,460;33:57,900;"- Bad for Brady?"
33:57,900;33:58,780;"- Blood, so sorry."
33:58,780;34:00,380;"- Yes, yes I did."
34:00,380;34:01,340;"- Because of the good of no time,"
34:01,340;34:03,260;"he was just throwing hot every time."
34:03,260;34:05,260;"- There was a free rusher every single time."
34:05,260;34:07,500;"- He was throwing down straight up flashbacks dude."
34:07,500;34:09,580;"- Yeah, he was like, no, just like, oh God,"
34:09,580;34:10,900;"he's not really his fault,"
34:10,900;34:13,100;"but he's not making it any better."
34:13,100;34:14,420;"- No."
34:14,420;34:17,540;"- Because, yeah, there was one drive where I think"
34:17,540;34:20,580;"the bills dropped back to pass three times"
34:20,580;34:23,060;"And every single time, bloodsoil got hit"
34:23,060;34:24,620;"because there was a free rusher."
34:24,620;34:26,940;"But he was also like, there was no hot routes."
34:26,940;34:28,460;"There was no like quick dump outs"
34:28,460;34:30,340;"to the running back and then like that."
34:30,340;34:32,300;"And then they punted and Brady got the ball."
34:32,300;34:34,220;"And literally the first place of free rusher"
34:34,220;34:36,820;"and Brady just dumps it off to like the tight end and the flat."
34:36,820;34:38,740;"And they get like four or five yards out of it."
34:38,740;34:41,460;"Like that right there is why they kept Brady"
34:41,460;34:43,260;"and not bloodsoil."
34:43,260;34:44,700;"But yeah, bloodsoil."
34:44,700;34:49,420;"I'd say he had maybe a second and a half"
34:49,420;34:51,540;"to make a decision in this."
34:51,540;34:53,780;"Those are free Russia almost every single day."
34:53,780;34:56,020;"They just blessed, the blitz percentage"
34:56,020;34:58,540;"I spent through the roof because they just blessed every play."
34:58,540;34:59,820;"It felt like it. Yeah."
34:59,820;35:00,900;"Well, I don't even think they did."
35:00,900;35:03,620;"I think they just brought rushes from different places."
35:03,620;35:05,820;"It's usually like a four man rush, but it was like--"
35:05,820;35:07,980;"They're putting safeties and corners and linebackers"
35:07,980;35:09,820;"on every--"
35:09,820;35:14,540;"Even into garbage time when the bills brought in--"
35:14,540;35:16,780;"the fuck was his name?"
35:16,780;35:17,940;"Travis Brown."
35:17,940;35:19,140;"Travis Brown, yeah."
35:19,140;35:23,380;"one of the Brown brothers from Northern, Northern Arizona,"
35:23,380;35:25,100;"lumberjacks represent."
35:25,100;35:26,940;"Northern Arizona, huh?"
35:26,940;35:28,340;"The lumberjacks, baby."
35:28,340;35:29,460;"Chop that wood."
35:29,460;35:31,220;"Oh, he's a Phoenix boy."
35:31,220;35:32,020;"Yeah, that's a guy."
35:32,020;35:34,460;"Yo."
35:34,460;35:35,940;"I can put on it at the moon."
35:35,940;35:42,940;"He was kind of like your very like Madden"
35:42,940;35:45,900;"created backup quarterback because he came in"
35:45,900;35:49,500;"And he like looked like a dollar store version of Drew"
35:49,500;35:51,980;"blood, so similar builds."
35:51,980;35:53,520;"But like his helmet didn't quite fit right."
35:53,520;35:56,020;"And his face mask was too big because it looked like they"
35:56,020;35:59,600;"give him him, you know, the like the old school tight ends"
35:59,600;36:01,420;"helmets from these days."
36:01,420;36:03,700;"There's like a little bit bigger and the face mask is huge."
36:03,700;36:05,500;"And it goes like down to their chest."
36:05,500;36:08,540;"You know those ones like the ones that Christian fory wears."
36:08,540;36:11,140;"Yeah, this guy was wearing that."
36:11,140;36:13,740;"And he just like."
36:13,740;36:15,180;"They just like hung him out to dry."
36:15,180;36:16,820;"you got lit up in this game too."
36:16,820;36:21,300;"That was the Harrison definitely can custom."
36:21,300;36:23,740;"Well, oh, yes."
36:23,740;36:24,740;"So what yes, yeah."
36:24,740;36:26,340;"He's walking up the head."
36:26,340;36:27,540;"We had to come out and he was clear to"
36:27,540;36:28,740;"him custom came back."
36:28,740;36:30,340;"Well, wasn't that the tight end?"
36:30,340;36:31,740;"Yeah. Yeah."
36:31,740;36:32,660;"Yeah, it was a tight end."
36:32,660;36:33,500;"Who'd be killed as?"
36:33,500;36:36,220;"But you you mistook them because they look"
36:36,220;36:37,700;"exactly the same because they were in the same"
36:37,700;36:38,700;"fucking helmet."
36:38,700;36:39,220;"Yeah."
36:39,220;36:40,220;"The helmet was just like that."
36:40,220;36:41,220;"It was like a beer."
36:41,220;36:41,740;"Yeah."
36:41,740;36:42,900;"That's one of those ridiculous ones."
36:43,620;36:44,620;"I just couldn't stop."
36:44,620;36:47,380;"A lot of Browns in this game, huh?"
36:47,380;36:48,460;"Fuck yeah."
36:48,460;36:52,460;"Travis Brown, Antonio Brown, Reuben Brown, Troy Brown."
36:52,460;36:53,660;"Yeah."
36:53,660;36:57,660;"Craig Brown, Annie Brown, Steve Brown."
36:57,660;36:59,420;"Dan Deardo."
36:59,420;37:01,500;"No."
37:01,500;37:02,540;"Yeah."
37:02,540;37:04,460;"Who else?"
37:04,460;37:06,060;"Well, there's a couple of Travises."
37:06,060;37:07,540;"We're going Travis Brown."
37:07,540;37:11,100;"We got Travis Henry, who was literally the only bright spot"
37:11,100;37:12,980;"in this game for the Bills."
37:12,980;37:14,980;"Who bared is none of the burden."
37:14,980;37:16,180;"Ooh, let's play this game."
37:16,180;37:18,820;"What game are you playing?"
37:18,820;37:21,860;"You know where that could go from like last names to first names."
37:21,860;37:22,500;"All right."
37:22,500;37:23,460;"So Travis Henry."
37:23,460;37:27,540;"Henry Ruggs III."
37:27,540;37:28,540;"Henry Winkler."
37:28,540;37:34,980;"Ruggs and bugs."
37:34,980;37:40,140;"Yeah, Travis Henry actually ended this game with over 100 yards, didn't he?"
37:40,140;37:41,140;"Rushing."
37:41,780;37:42,780;"I believe he did."
37:42,780;37:43,780;"Stat Trek?"
37:43,780;37:44,780;"I don't know."
37:44,780;37:45,780;"I didn't watch the second half."
37:45,780;37:46,780;"I'm just after you."
37:46,780;37:47,780;"Travis Henry, before you."
37:47,780;37:48,780;"I was 62."
