Start Timestamp;End Timestamp;Transcript
37:48,780;37:55,060;"I was confusing him with Travis Brown who threw for 100 yards."
37:55,060;37:57,280;"Which is more than Bledso other before."
37:57,280;38:02,940;"Bledso 12 of 29 83 yards, 1 interception, 3 sacks."
38:02,940;38:05,940;"She's not great."
38:05,940;38:07,180;"Not great."
38:07,180;38:12,180;"Yeah, in a rating of 34.7."
38:12,180;38:14,360;"Damon Heward had a higher rating than that."
38:14,360;38:16,600;"Damon Heward was 0 for 1."
38:16,600;38:17,600;"[laughs]"
38:17,600;38:21,440;"And it had a better rating."
38:21,440;38:22,800;"And negative 1 rushing arts."
38:22,800;38:23,800;"Yeah."
38:23,800;38:24,800;"Pretty good."
38:24,800;38:25,800;"Yeah."
38:25,800;38:27,720;"So, well that's because he had a kneel down."
38:27,720;38:31,600;"Was that tight end on the bills?"
38:31,600;38:35,840;"The same one that Brady ruined with at Michigan and was like super close with?"
38:35,840;38:36,840;"Yes."
38:36,840;38:38,600;"- Is it Reimersma?"
38:38,600;38:39,440;"No."
38:39,440;38:42,040;"- Mark Campbell."
38:42,040;38:44,640;"- That's, is that the same dude?"
38:44,640;38:46,400;"- Yes, yeah, 'cause they mentioned it."
38:46,400;38:47,240;"- That's the first one that they would,"
38:47,240;38:49,320;"when you ever read like a Brady bio or whatever."
38:49,320;38:51,440;"- Yeah, that was the same one."
38:51,440;38:52,520;"'Cause I think, and he was the one"
38:52,520;38:54,080;"that got kind of concussed in this too."
38:54,080;38:55,780;"- He was super concussed."
38:55,780;38:58,360;"- Yeah, he was taking shots because they kept like"
38:58,360;39:00,560;"this Travis Brown character kept like"
39:00,560;39:04,480;"floating the ball down the middle to that tight end seam route."
39:04,480;39:07,940;"which brought me Harrison just feasted on every time he caught the ball."
39:07,940;39:11,180;"He got lit up and he went back a couple times."
39:11,180;39:12,700;"Not great."
39:12,700;39:16,180;"So yeah, Travis Henry was like the only person still trying at the end of the"
39:16,180;39:16,660;"game too."
39:16,660;39:17,940;"It's like the third quarter."
39:17,940;39:20,860;"They're just like handing it off to him and not blocking for him."
39:20,860;39:25,060;"So he's breaking like four or five tackles and getting like a loss of two"
39:25,060;39:27,620;"yards soon to be replaced by the bills."
39:27,620;39:30,900;"First round picked this year who redshirted the entire year."
39:33,340;39:37,620;"Yeah, that's because he had that crazy leg injury in college, right?"
39:37,620;39:45,180;"Title he has it right before he gets drafted. Yeah, he's in like the I don't know if it's a national championship"
39:45,180;39:49,040;"But it was in the ball game right in the Rose Bowl against Texas"
39:49,040;39:52,740;"Ever"
39:52,740;39:54,780;"Where did they draft him?"
39:54,780;39:58,020;"Jesus music for something"
39:58,820;40:04,540;"That's so like in the at a high pick they weren't like awesome last year either. They didn't know either. No, they did not"
40:04,540;40:10,300;"Running backs were like way more value back then. I mean this is true"
40:10,300;40:15,620;"But still the dude had like a cross-ass knee injury in this last game at college"
40:15,620;40:18,460;"Speaking of which you want to"
40:18,460;40:21,660;"You want to talk about the"
40:21,660;40:26,180;"Around the league or yeah, yeah, yeah, that's a good spot for it. All right"
40:26,980;40:32,660;"So this is the first edition of the newest segment that I will probably forget about next time"
40:32,660;40:41,140;"We're calling it around the league with Greg Brown, okay"
40:41,140;40:51,300;"That's the one yeah"
40:51,300;40:56,380;"So"
40:56,380;41:02,280;"Let's take a little gander. Let's take a walk around the NFC, the AFC, see what else is going on."
41:02,280;41:05,280;"Oh, she had the playoffs. The realm of the Patriots. Yeah."
41:05,280;41:11,280;"First they're made. Not only that, but some records reset this year. So."
41:11,280;41:21,480;"Yeah. Um, Jamal Lewis would complete his 2000 yard season this week."
41:21,480;41:22,480;"Oh yeah."
41:22,480;41:26,240;"Finishing the year with 2066 yards,"
41:26,240;41:31,240;"which at the time was second all time."
41:31,240;41:33,640;"To Barry Sanders maybe?"
41:33,640;41:36,520;"No, Andrew, do you have a guess?"
41:36,520;41:37,600;"Eric Dickerson?"
41:37,600;41:38,800;"Eric Dickerson."
41:38,800;41:40,240;"Ha! Look at me."
41:40,240;41:42,600;"Still holds the record."
41:42,600;41:43,760;"Dickerson."
41:43,760;41:45,800;"Lewis has been, there's a new second."
41:45,800;41:47,080;"Can you name that?"
41:47,080;41:49,760;"Adrian Peterson?"
41:49,760;42:00,060;"in Peterson 2012. So yeah, he had a fucking monster year. He had like, he absolutely feasted"
42:00,060;42:04,620;"on Cleveland. He had like 295 yards in like one week and then 180."
42:04,620;42:10,140;"I have a, I have a, I think we may have touched it on his back when we played the Browns,"
42:10,140;42:16,560;"but the fun fact that we had for the Browns game that one was in week two, Browns linebacker"
42:16,560;42:21,200;"Andre Davis, telephone Ravens running back to Mal Lewis before the game and say that he wanted"
42:21,200;42:26,240;"Lewis to carry the ball at least 30 times in their upcoming matchup. Quote, if that happens,"
42:26,240;42:32,320;"it's going to be a career day. Lewis replied, Lewis then erupted to 295 rushing yards, breaking"
42:32,320;42:37,200;"the record previous held by Corey Dillon in 2000 as a brand spell 33 to 13."
42:37,200;42:43,040;"The browser Feders literally called up Javalu is like, I fucking dare you to run 30 times."
42:43,040;42:44,040;"I was like, ""Okay."""
42:44,040;42:45,040;"And runs for 300."
42:45,040;42:46,040;"Yeah."
42:46,040;42:47,480;"And then did it again in week six."
42:47,480;42:48,480;"Yeah."
42:48,480;42:51,760;"Like, yeah, like a fuck 80."
42:51,760;42:56,680;"So I mean, like Steve was saying, the running backs are way more valued."
42:56,680;43:03,240;"So also in this year, Priest Holmes said what was at the time the record for most touchdowns"
43:03,240;43:04,240;"in a season."
43:04,240;43:05,240;"Oh, yes."
43:05,240;43:06,240;"27 touchdowns."
43:06,240;43:07,840;"Which was broken by LTV."
43:07,840;43:08,840;"Yeah."
43:08,840;43:09,840;"Eventually."
43:09,840;43:10,840;"Like 30 something."
43:10,840;43:11,840;"She was ridiculous."
43:11,840;43:16,840;"Interestingly, it was 2005, Sean Alexander broke it,"
43:16,840;43:19,600;"and then 2006, that's right, broke that."
43:19,600;43:22,320;"So I remember that, like, we had a four years,"
43:22,320;43:24,800;"the record was set. - Sean Alexander, yeah."
43:24,800;43:27,000;"- So LT at 31 touchdowns, that's the record"
43:27,000;43:29,320;"as it stands now in 2006."
43:29,320;43:30,160;"- Yeah."
43:30,160;43:36,640;"- So, a little around the league playoff updates."
43:36,640;43:39,240;"- Give me the playoff picture."
43:39,240;43:51,240;"the playoff picture. So the, the AFC is the Pats and first, the chiefs in second. Yep."
43:51,240;43:59,240;"Colton third, they win the AFC South with like the same record as the Titans. Right. But"
43:59,240;44:02,640;"they wanted head to head I think. And they're both wicked good too. Right. They're both like"
44:02,640;44:08,080;"three or four lost teams. I think they're four lost teams. Yep. Yeah. So that bolts"
44:08,080;44:16,000;"more wins based on defense in Jamal Lewis. They win their division, the SC North. So they"
44:16,000;44:24,280;"actually have a worse record than the Titans, but say we'll get Baltimore and Tennessee,"
44:24,280;44:31,000;"wild car game and then the chiefs or the Colts will play Denver. Okay. So those are the two"
44:31,000;44:33,580;"And then Chiefs, Pats have buys."
44:33,580;44:36,640;"So"
44:36,640;44:39,220;"the Colts Denver game."
44:39,220;44:40,720;"I remember that either."
44:40,720;44:42,120;"I think I do."
44:42,120;44:44,920;"It's a pretty yeah."
44:44,920;44:48,120;"Well, guess that maybe once we once that game, like"
44:48,120;44:48,960;"that's what we're going to do."
44:48,960;44:51,760;"The pages could because obviously we know that we play the"
44:51,760;44:53,120;"Titans and the Colts this year."
44:53,120;44:57,480;"So the Chiefs after having this amazing year are basically one and done."
44:57,480;45:00,040;"Yeah, fall apart with the which is interesting."
45:00,040;45:00,560;"Yeah."
45:00,560;45:09,800;"The NFC. So the NFC finishes with Philadelphia as the one seed."
45:09,800;45:12,320;"St. Louis says the two seed."
45:12,320;45:13,440;"That makes sense."
45:13,440;45:15,200;"Panthers as the three seed."
45:15,200;45:19,160;"Green Bay as the four seed, which I'll get to in a minute."
45:19,160;45:22,000;"Seattle and Dallas as wildcards."
45:22,000;45:30,000;"OK, so I don't know if you remember how the Packers got into the playoffs this year."
45:30,160;45:31,760;"But we're not division."
45:31,760;45:35,960;"So it was between them and Minnesota going into the last week of the year."
45:35,960;45:36,960;"Okay."
45:36,960;45:42,160;"So Minnesota, this is the uh, Culpepper Randy Moss theme."
45:42,160;45:47,360;"So it was fucking sick team with um, who's our other wide resource card?"
45:47,360;45:49,360;"Only does all he does catch touchdowns."
45:49,360;45:50,360;"Yeah."
45:50,360;45:50,360;"Yeah."
45:50,360;45:53,860;"So it is like 1000s catch or something on a highlight the other day."
45:53,860;45:56,560;"And it was catching a touchdown on 1000s."
45:56,560;45:57,360;"Of course."
45:57,360;45:58,360;"All he does is catch touchdowns."
45:58,360;46:04,360;"So last week, Minnesota had like blown the doors off Kansas City."
46:04,360;46:06,360;"It was like 45. Oh, yes."
46:06,360;46:08,360;"When he or something like that. So that was a big win."
46:08,360;46:10,360;"That was actually a big game for the past."
46:10,360;46:14,360;"Moss is like in peak Moss form."
46:14,360;46:17,360;"He had like seven catches, there's a buck 11, two touchdowns in that game."
46:17,360;46:20,360;"So now into week 17, all they need is like,"
46:20,360;46:26,360;"it's one of those situations where like they either need to win or Seattle wins or tie."
46:26,360;46:29,960;"or tie, you know, it's like one of those things where like four things have to go against them"
46:29,960;46:31,280;"for them to not make the playoffs."
46:31,280;46:32,280;"Yeah."
46:32,280;46:39,800;"And they're playing the three and 12 Cardinals after just these Cardinals, those Cardinals"
46:39,800;46:43,200;"after just beating the 12 ditch thieves."
46:43,200;46:46,920;"So there they go into Arizona."
46:46,920;46:48,520;"They're fucking kicking their ass."
46:48,520;46:50,920;"17 to six with less than two minutes left."
46:50,920;46:52,880;"It's 17 to six."
46:52,880;46:53,880;"What?"
46:53,880;46:56,200;"And then some deodorant magic happens."
46:56,200;46:57,840;"Josh McCown magic."
46:57,840;47:02,440;"This is the Josh McCown led card notes."
47:02,440;47:03,740;"What?"
47:03,740;47:05,520;"It was like his rookie year too."
47:05,520;47:09,080;"It's actually like second or third year in the league, but he played."
47:09,080;47:11,560;"So 2019, which is fucking crazy."
47:11,560;47:12,040;"Yeah."
47:12,040;47:12,640;"Yeah."
47:12,640;47:13,160;"So."
47:13,160;47:13,800;"Holy shit."
47:13,800;47:16,600;"McCown leads them down."
47:16,600;47:17,960;"They score a touchdown."
47:17,960;47:20,840;"I think they convert like a fourth and 10 on that drive."
47:20,840;47:24,320;"They get an onside kick."
47:24,320;47:25,560;"Nice."
47:25,560;47:27,880;"recover that they start driving."
47:27,880;47:32,040;"They're like down within like the 10 yard line of Minnesota."
47:32,040;47:34,840;"They it's second down."
47:34,840;47:36,360;"They have did one time out."
47:36,360;47:39,080;"They get sacked, call the time out."
47:39,080;47:40,840;"The next play."
47:40,840;47:43,440;"They get sacked a sack fumble."
47:43,440;47:44,840;"Oh my God."
47:44,840;47:49,080;"So it's now fourth in goal from the 24."
47:49,080;47:53,000;"With like an expired."
47:53,000;47:54,620;"It's the last play of the game."
47:54,620;47:56,120;"If they can't clock it, then nothing."
47:56,120;48:02,560;"And some fucking way how Josh McCown pulls this bullshit out of his ass."
48:02,560;48:05,240;"And it's like it was very similar to the."
48:05,240;48:10,960;"The Super Bowl with the Steelers with the touchdown in the corner against Cardinals."
48:10,960;48:11,600;"Yeah. Yeah."
48:11,600;48:12,160;"Oh, yeah."
48:12,160;48:15,600;"Same idea of play where he's just like launches it into the back corner."
48:15,600;48:17,520;"The end on this guy like tol of tasks."
48:17,520;48:20,640;"And that's the last play of the game."
48:20,640;48:26,280;"the Cardinals win 18 to 17. The Vikings are out of the playoffs. The Packers are in season"
48:26,280;48:33,360;"done. Wow. It's one of the most ridiculous games ever seen to fit to lose your season"
48:33,360;48:40,320;"against a fucking three and 12 team like that. Oh, Josh McCallen and a three and 12 team"
48:40,320;48:45,520;"wasting a cold pepper Randy Moss team. Like there's just so many layers of heartbreak"
48:45,520;48:47,880;"for Vikings fans there like I can't even imagine."
48:47,880;48:50,320;"Yeah. Oh my God, this catch."
48:50,320;48:52,320;"How did you get?"
48:52,320;48:56,280;"And this was actually before they had the rule of push out."
48:56,280;49:00,360;"So he only he gets one foot down and then the defendant gets pushed out."
49:00,360;49:02,840;"But they say, yeah, so it's non reviewable."
49:02,840;49:07,640;"Yeah. Or no, it's reviewed, but they the review is that he had like"
49:07,640;49:08,800;"maintained. Yeah."
49:08,800;49:11,320;"For all he would have come down in bounds if"
49:12,320;49:17,140;"God damn. All right. Yeah. We'll post that in the show notes. So if anybody wants to watch it, they can"
49:17,140;49:21,040;"I didn't see it. But I think this is another one where if you find the right"
49:21,040;49:23,480;"commentator, it's hilarious."
49:23,480;49:37,320;"Oh, no. Right. Because we talked about the other day, the ending to the the"
49:37,320;49:42,880;"the Saints game. Yeah. How could they do that? Where they scored the lateral touchdown and"
49:42,880;49:48,440;"then missed the extra point to tie it to go to overtime. And I think that kept the Saints"
49:48,440;49:53,160;"out of the playoffs, didn't it? I guess the Saints did not make the playoffs."
49:53,160;49:58,960;"Yeah, they did not. They finished, but they finished eight and eight. So they had a chance"
49:58,960;50:05,120;"if they had won that. But yeah, sounds like they would have brutal fourth and 24. And"
50:05,120;50:08,760;"Of course, your guys are going to hate this, but like Brett"
50:08,760;50:12,440;"Farm is watching from, I think it was Chicago after beating the"
50:12,440;50:17,960;"bears being like, Oh, shock skies. We did it. Yeah, you guys"
50:17,960;50:25,920;"would have hated it. What if I am hitting it? All right. So we"
50:25,920;50:29,160;"got some some excitement having the NFC, which didn't really"
50:29,160;50:33,020;"happen. The AFC, he's not that last day. Then it was kind of"
50:33,020;50:35,940;"like it was just the seating more than anything. Right."
50:35,940;50:39,140;"Cause the Ravens were two games up on the Bengals."
50:39,140;50:42,540;"Patriots were four games up on the dolphins who finished 10 and six,"
50:42,540;50:43,340;"but missed the playoffs."
50:43,340;50:47,340;"Yeah, they missed him on a tiebreaker with Broncos. Yeah."
50:47,340;50:50,580;"So if they had beaten the Patriots once this season,"
50:50,580;50:52,100;"they wouldn't be the playoffs."
50:52,100;50:58,180;"ASE, man, it's tough when you got the Patriots in there."
50:58,180;51:01,700;"It's true. Damn. All right."
51:02,980;51:05,060;"So we got the Panthers at the three seed"
51:05,060;51:06,460;"and the Patriots at the one seed."
51:06,460;51:08,060;"And the commentators in this role"
51:08,060;51:11,340;"are also talking about how hard it was for the one seed"
51:11,340;51:14,780;"to win or to even get to the Super Bowl"
51:14,780;51:17,500;"because I think it took a screenshot."
51:17,500;51:21,660;"Only three of the top seeded AFC playoff teams"
51:21,660;51:24,380;"have made to the Super Bowl in the last 10 seasons."
51:24,380;51:27,020;"The only team to win was the 1998 Broncos."
51:27,020;51:29,220;"Only one seed to win from the AFC."
51:30,460;51:33,900;"So the one seat isn't really known for."
51:33,900;51:35,820;"- Well, that's 'cause it's always fucking Peyton Manning"
51:35,820;51:37,320;"and he blows in the playoffs."
51:37,320;51:40,560;"(laughing)"
51:40,560;51:42,660;"- Well, this is still early Peyton, so maybe not."
51:42,660;51:43,940;"- Yeah, I think, I think,"
51:43,940;51:45,260;"better early for that, but."
51:45,260;51:46,100;"- This is a point to happen."
51:46,100;51:46,940;"- This is a point to happen."
51:46,940;51:49,580;"- If that number is skewed,"
51:49,580;51:52,340;"it's 'cause of Peyton Manning, god damn it."
51:52,340;51:55,500;"- It's skewed because of Tom Brady or Will Bann."
51:57,540;52:02,060;"- Yeah, some other numbers in the pages favor though"
52:02,060;52:06,340;"for this is that single season since 1970,"
52:06,340;52:09,700;"only three teams of one 12 consecutive regular season games"
52:09,700;52:13,460;"before the pages did it just in this game here."
52:13,460;52:17,080;"All three of them won the Super Bowl."
52:17,080;52:20,240;"They were obviously the 1972 Dolphins,"
52:20,240;52:25,180;"the 1985 Bears and the 1998 Broncos."
52:25,180;52:28,260;"So good company to have to win those games."
52:28,260;52:29,440;"But two of those teams,"
52:29,440;52:31,940;"let's see, the 85 bear,"
52:31,940;52:33,740;"well, 72 dolphins obviously undefeated."
52:33,740;52:36,660;"85 bears, I think went 15 and one"
52:36,660;52:37,940;"and beat the shit out of everybody,"
52:37,940;52:40,620;"except the one team they lost you that year, do you know?"
52:40,620;52:44,700;"The Miami Dolphins."
52:44,700;52:45,780;"The Miami Dolphins."
52:45,780;52:48,020;"The only team to beat the 85 bears"
52:48,020;52:50,620;"keeping the time coming up every season."
52:50,620;52:51,740;"And I think the 98 Broncos"
52:51,740;52:54,180;"were a bit of a shit storm or two, aren't they?"
52:54,180;52:58,540;"wagon. Yeah, because that was L. way like end of his career."
52:58,540;53:02,460;"And then they had 12 Davis. Yeah. That's Pete."
53:02,460;53:05,740;"Torel Davis for those four years where he was just like on"
53:05,740;53:10,740;"another planet. Yeah, exactly. And and this was the time when the"
53:10,740;53:16,900;"the Broncos were like kind of skirting the salary cap by paying"
53:16,900;53:21,060;"money outside of it. Wasn't that this era? So they had that"
53:21,060;53:23,300;"story. They had some stack teams. Oh, yeah."
53:23,300;53:25,660;"Um, how are they doing that?"
53:25,660;53:29,660;"Not to get too into the weeds here, but you can actually find it on your team"
53:29,660;53:30,580;"and this dot com."
53:30,580;53:34,100;"I was going to say, are there other teams of the NFL cheating or"
53:34,100;53:38,620;"possibly bending the rules because I will throw a hissy fit on national"
53:38,620;53:39,260;"television."
53:39,260;53:43,980;"If that's the goddamn truth, I want you to cry like, yeah."
53:43,980;53:45,820;"We can do it about this."
53:45,820;53:46,100;"Yeah."
53:46,100;53:48,020;"Where's the inspector?"
53:48,020;53:48,900;"God damn it."
53:48,900;53:49,500;"There you go."
53:49,500;53:50,940;"It's called salary cap gate."
53:50,940;53:52,660;"According to your team cheats.com."
53:52,780;53:54,420;"- Same cap, Kate."
53:54,420;53:56,980;"That's the most boring gate ever."
53:56,980;54:00,460;"- Yeah, well, I think they name everything something gate"
54:00,460;54:02,860;"because as is tradition."
54:02,860;54:04,420;"But the summary is according to his website,"
54:04,420;54:06,700;"on September 17, 2004, the league announced that"
54:06,700;54:08,020;"for the second time in three years,"
54:08,020;54:10,860;"the Denver Broncos were fined nearly a million dollars"
54:10,860;54:13,700;"and would once again lose their third round draft pick"
54:13,700;54:17,140;"because of salary cap violations between 96 and 98."
54:17,140;54:19,100;"- Luxury tax, essentially."
54:19,100;54:21,180;"- Oakland Raiders owner Al Davis,"
54:21,180;54:23,580;"content at the Broncos circumvention of the salary cap"
54:23,580;54:27,380;"helped them win the Super Bowl in the '97 and '98 seasons."
54:27,380;54:29,780;"In the years where they didn't follow the cap rules,"
54:29,780;54:31,620;"the Broncos top player quarterback John Ella"
54:31,620;54:35,060;"was paid around 5.4% of the legal cap space, which"
54:35,060;54:38,140;"was 1.2% less than the next closest team."
54:38,140;54:40,060;"Even more telling, always cap charges"
54:40,060;54:44,980;"in the Broncos' '98 Super Bowl seasons were just 2.1 and 2.6"
54:44,980;54:47,740;"million respectively, which is pretty fucking small."
54:47,740;54:49,940;"By comparison, Miami Dolphins quarterback Dan Marino--"
54:49,940;54:56,300;"Who would be the most logical comparison had cap triders of 4.3 and 7.6 million."
54:56,300;55:01,220;"So like a fraction of that implications that Ellie took a relatively low cap hit,"
55:01,220;55:03,940;"but received outside the cap funds to compensate for that."
55:03,940;55:06,660;"God damn see that's what I'm saying."
55:06,660;55:12,260;"Like it's you can only rile up the public if it's not boring."
55:12,260;55:12,780;"Yeah."
55:12,780;55:13,740;"Well, here you go."
55:13,740;55:17,420;"Here's like 4.6 2 million percent over the cap."
55:17,420;55:18,180;"And so here you go."
55:18,180;55:19,920;"Here's the pages tuned out."
55:19,920;55:21,180;"Here's the panel."
55:21,180;55:22,660;"You the fuck out."
55:22,660;55:27,000;"Tell me they were videotaping practice and I'll get hype."
55:27,000;55:27,540;"Okay."
55:27,540;55:32,340;"The Broncos explanation for the infraction goes something like this."
55:32,340;55:35,900;"Owner Pat Bolin was trying to build a new stadium for the Broncos and we're short on cash."
55:35,900;55:40,420;"So he asked Elway and running back to rel Davis to forfeit some of their paycheck now."
55:40,420;55:43,260;"And in return, he would pay them back plus interest after the season."
55:43,260;55:45,540;"Cash."
55:45,540;55:46,660;"She's giving them checks."
55:46,660;55:47,020;"Yeah."
55:47,020;55:47,900;"Fucking outside."
55:47,900;55:51,500;"You know, just give them just give them a cut and be like, yeah, I'll say it."
55:51,500;55:51,860;"I asked."
55:51,860;55:55,100;"So as soon as you retire, we'll give you a crispy fucking job as GM and let you"
55:55,100;55:59,340;"draft a bunch of shitty quarterbacks that will never replace you in the ring of"
55:59,340;56:00,820;"honor in Denver."
56:00,820;56:02,660;"All the calls for the franchise."
56:02,660;56:03,260;"It'll be fine."
56:03,260;56:03,660;"Yeah."
56:03,660;56:05,500;"So."
56:05,500;56:07,220;"Awesome."
56:07,220;56:11,860;"Steve, can we designate you are a salary cap guy?"
56:11,860;56:15,460;"Like this is your, I feel you'd be good at that."
56:15,460;56:15,940;"Yeah."
56:15,940;56:16,700;"You're a numbers guy."
56:16,700;56:21,100;"Your numbers cruncher. Can you be our like salary cap question answer?"
56:21,100;56:23,660;"Can you get some Excel spreadsheets going please?"
56:23,660;56:26,940;"No, I can be a"
56:26,940;56:30,100;"gift-sejester guy though."
56:30,100;56:32,780;"If suggested, give or gift."
56:32,780;56:35,660;"You can show me how to rip gifts like you do for your website."
56:35,660;56:36,940;"I have some gifts."
56:36,940;56:38,940;"Okay, what are they?"
56:38,940;56:41,740;"What are your suggestions?"
56:41,740;56:43,740;"Yeah."
56:43,980;56:49,260;"By all means I'll be like dick guy Tom Brady right after he like"
56:49,260;56:54,260;"Nearly tears is like a mint talking to Damien Heward. Yeah"
56:54,260;56:56,680;"No"
56:56,680;57:02,060;"So this is sort of like how it started right because that I mean get some audio here"
57:02,060;57:04,780;"There's no audio needed"
57:04,780;57:08,140;"Well, I mean this is an audio is a podcast"
57:08,140;57:10,420;"Yes"
57:10,420;57:13,460;"Greg you you play Tom Brady. I'll play Damon Heward"
57:13,460;57:16,460;"It was the kind of like, Hey, John."
57:16,460;57:18,460;"Y'all dude, did you see that shit?"
57:18,460;57:21,460;"Yo, that motherfucker."
57:21,460;57:24,460;"Yo, he was so close to my knee, dude."
57:24,460;57:25,460;"How's your playability?"
57:25,460;57:27,460;"Just like I'm fucking laser focused."
57:27,460;57:30,460;"He's just fucking, he's not even talking to Damon."
57:30,460;57:31,460;"Get fucked."
57:31,460;57:33,460;"Top, do you like my face mask?"
57:33,460;57:34,460;"I gotta get on my fucking face."
57:34,460;57:36,460;"I got it from the tight ends."
57:36,460;57:37,460;"They really liked it."
57:37,460;57:39,460;"What kind of name is he word anyway?"
57:39,460;57:40,460;"Speak highly of it."
57:40,460;57:42,460;"What kind of name is Damon?"
57:42,460;57:46,460;"And then does the name of the devil."
57:46,460;57:48,460;"Can we get some audio in one of these?"
57:48,460;57:49,460;"Maybe."
57:49,460;57:50,460;"I don't need these guests."
57:50,460;57:53,460;"I have some audio, but they're."
57:53,460;57:57,460;"Yeah, the highlights on the website don't have audio, but I have one audio."
57:57,460;57:59,460;"Yeah."
57:59,460;58:02,460;"Tom Brady is a Steve, you know, this is a podcast."
58:02,460;58:03,460;"Yes."
58:03,460;58:07,460;"So the people that are listening cannot see what you see."
58:07,460;58:08,460;"All right."
58:08,460;58:10,460;"I've got one that's."
58:10,460;58:13,380;"That's pretty great."
