Start Timestamp;End Timestamp;Transcript
00:00,000;00:06,720;"This is Christine Brown, and while I have to listen to this podcast as my motherly duty,"
00:06,720;00:08,160;"you have the choice not to."
00:08,160;00:12,360;"My sons sometimes say some naughty things when they're trying to be funny, but really,"
00:12,360;00:14,200;"they're just being stupid."
00:14,200;00:15,440;"You still want to listen?"
00:15,440;00:16,440;"Go right ahead."
00:16,440;00:18,400;"I am not your mother."
00:18,400;00:26,680;"All right, welcome back to the Patriots Dynasty Podcast."
00:26,680;00:29,120;"I'm your host Andy Brown."
00:29,120;00:35,860;"with me today is middle brother Steve Brown. He of who gets no respect. Have you gotten"
00:35,860;00:41,900;"any respect lately, Steve? I get more respect than the goddamn jets do, but they don't deserve"
00:41,900;00:49,780;"it. This is true. They don't deserve it. We are for those who are new listeners, if they're"
00:49,780;00:55,640;"aren't any. We are the Brown brothers. Oh, which game should I start with? About"
00:55,640;00:58,760;"Hey, you know, maybe they just discovered us."
00:58,760;01:02,440;"Maybe, maybe someone, I don't know, found us tweet."
01:02,440;01:06,560;"They're listening to that first fucking Bengals game, which is just a disaster."
01:06,560;01:08,080;"Yeah, that was a rough one."
01:08,080;01:09,560;"I mean, I shouldn't read that."
01:09,560;01:15,400;"But if you're smart enough and you started at this one, I don't know how smart that is either."
01:15,400;01:18,040;"I would go back and listen to the playoff ones because it was a game."
01:18,040;01:20,640;"It was."
01:20,640;01:24,480;"It's a typical AFCE's battle."
01:24,480;01:30,640;"below we do is we rewatch. We're rewatching every game of the Dynasty era. We started in 2001."
01:30,640;01:35,760;"And we're halfway through 2004 at this point. This is 2004 week seven."
01:35,760;01:40,000;"Patriots playing at home versus the Jets. This is their third home game in a row, I believe."
01:40,000;01:47,600;"Weirdly. Yeah, it's one of those like strange streaks where they had three home games in a row."
01:47,600;01:53,440;"Speaking of streaks. Speaking of streaks, absolutely."
01:54,320;01:56,420;"What is the wind streak up to at this point, Steve?"
01:56,420;01:57,620;"I don't know."
01:57,620;02:00,680;"Twenty one coming into this game is 20."
02:00,680;02:05,120;"So they will leave spoiler alert with 21 wins most ever."
02:05,120;02:11,520;"And it also breaks the regular season wind streak at."
02:11,520;02:14,220;"Eighteen, I believe."
02:14,220;02:15,320;"So that works."
02:15,320;02:19,420;"Breaking the record of do you remember the."
02:19,420;02:22,820;"The team is something with the bears."
02:23,120;02:23,620;"Yes."
02:23,620;02:24,120;"Is it?"
02:24,120;02:30,620;"It's a bears from 1933 and 34, which doesn't really count because they're playing against"
02:30,620;02:32,120;"like mechanics and shit."
02:32,120;02:33,120;"So."
02:33,120;02:36,240;"Yeah, that's not real football."
02:36,240;02:42,680;"But the NFL only recognizes the regular season one and not the one with the playoffs."
02:42,680;02:46,160;"I mean, let's think it's in between World War one and World War two."
02:46,160;02:47,160;"This is true."
02:47,160;02:48,160;"Yeah."
02:48,160;02:52,120;"Like I don't even know if planes were a thing then."
02:52,120;02:53,760;"they were close."
02:53,760;02:56,880;"They were like blimps were the way to go."
02:56,880;02:57,360;"Yeah."
02:57,360;02:58,080;"Yeah."
02:58,080;03:00,240;"Blimps were the new hotness ships."
03:00,240;03:01,360;"Ships is how you got around."
03:01,360;03:02,320;"I'd say you got to the new world."
03:02,320;03:03,760;"Yeah."
03:03,760;03:04,840;"How do you play it?"
03:04,840;03:06,520;"Like different cities."
03:06,520;03:08,040;"You took the train."
03:08,040;03:09,360;"We're strong carriage."
03:09,360;03:11,200;"Oh, sure."
03:11,200;03:12,640;"We're going to need two weeks."
03:12,640;03:13,880;"We got to go to the West Coast."
03:13,880;03:15,200;"They might have had buses."
03:15,200;03:17,960;"Well, they probably didn't also have that many teams back in the thirties."
03:17,960;03:20,320;"That was before the AFL and NFL merged."
03:21,280;03:23,280;"So it's probably only like six teams back then."
03:23,280;03:27,920;"So winning a bunch of games against the same team."
03:27,920;03:31,980;"It's like, it's like playing like wreck soccer, like the men's"
03:31,980;03:34,320;"over 30 league and going on a win streak there."
03:34,320;03:36,320;"You're playing the same like six teams anyway."
03:36,320;03:37,560;"That's true."
03:37,560;03:42,760;"So it's not not as impressive as doing it in the age of salary cap"
03:42,760;03:44,600;"and all of this."
03:44,600;03:47,880;"Do you think that's record will ever be broken because they lose next"
03:47,880;03:51,140;"week and this is the last game they win, which I'm grateful"
03:51,140;03:53,140;"for because it's against the Jets."
03:53,140;03:54,140;"Correct."
03:54,140;04:04,300;"Yeah, I feel like we've talked about this before and I think it was a split decision between"
04:04,300;04:07,500;"you, me and Greg, who's not here this week."
04:07,500;04:11,460;"How could that be a split decision if there's three people?"
04:11,460;04:13,940;"Well, we weren't unanimous is what I'm saying."
04:13,940;04:14,940;"Oh, yeah."
04:14,940;04:16,140;"I know we ever unanimous."
04:16,140;04:21,780;"Well, I think it was I was hard against saying this will ever get broken."
04:21,780;04:23,420;"I was saying it'll never be broken."
04:23,420;04:26,980;"Greg was this will definitely get broken and you were somewhere in the middle."
04:26,980;04:27,660;"So let's put this in."
04:27,660;04:31,140;"I was always switch firmly to Greg's side."
04:31,140;04:32,380;"You're outnumbered, out-noted."
04:32,380;04:33,380;"You think so?"
04:33,380;04:34,740;"It'll get broken."
04:34,740;04:42,460;"I just think because it's any given Sunday that being able to win broken"
04:42,460;04:46,580;"then like Tom Brady's Super Bowl championships and those records that he's setting."
04:46,580;04:48,620;"There are definitely records that will not be broken."
04:48,620;04:48,820;"Yeah."
04:48,820;04:53,220;"Um, I think, you know, passing, well, even passing records, if you look up"
04:53,220;04:57,020;"records or whatever, but like the winning of titles for one player,"
04:57,020;05:00,900;"yeah, I'm pretty is kind of got that locked up, especially since he recently,"
05:00,900;05:05,500;"I think it may have even been today talking about how he thinks he can play till 50."
05:05,500;05:07,860;"No, I believe it."
05:07,860;05:08,940;"Yeah, I would too."
05:10,300;05:14,500;"I mean, until he until he shows sides with slowing down, I'm just going to trust whatever he says."
05:14,500;05:16,000;"Yeah, I have my fantasy team now."
05:16,000;05:19,200;"I bet on sports betting is legal in Virginia now."
05:19,200;05:19,800;"Oh, yeah."
05:19,800;05:22,500;"So I can put money on Tom Brady."
05:22,500;05:23,400;"I never did that."
05:23,400;05:28,000;"I was a field on the Patriots because I'm already like emotionally invested."
05:28,000;05:28,500;"I'm going to see."
05:28,500;05:28,700;"Fine."
05:28,700;05:34,300;"See, when I was doing like pickums and stuff, I would always pick against the Patriots every week."
05:35,700;05:40,700;"That way I either got the pick right or the page is one."
05:40,700;05:43,620;"- Yeah, I feel like I remember that being a strategy."
05:43,620;05:46,980;"- Yep, just for cell preservation more than,"
05:46,980;05:48,260;"I didn't win many leagues."
05:48,260;05:54,020;"- I'm actually gonna have 150 NFL shop gift card."
05:54,020;05:54,860;"- Damn."
05:54,860;05:55,860;"- From one of the betting apps,"
05:55,860;05:58,620;"so you just sign up and they give it to you pretty much."
05:58,620;05:59,780;"- Okay."
05:59,780;06:00,620;"- What are you gonna get with it?"
06:00,620;06:01,580;"- Oh, what I can get, I don't know."
06:01,580;06:02,660;"We gotta help you figure that out."
06:02,660;06:04,820;"- So this was a question that I actually had too,"
06:04,820;06:06,540;"before we get in this game,"
06:06,540;06:10,340;"only because I was back at our parents' house this weekend,"
06:10,340;06:14,100;"or this week helping dad hang drywall on the ceiling,"
06:14,100;06:15,800;"which good times."
06:15,800;06:17,780;"But I was in the basement"
06:17,780;06:22,940;"and I stumbled across Greg's box of Patriots memorabilia."
06:22,940;06:24,780;"So I found, remember we talked ages ago"
06:24,780;06:26,260;"about the Drew Bledzo poster?"
06:26,260;06:27,100;"- Yeah, I see something."
06:27,100;06:28,980;"- The 10 ways Drew Bledzo will kick your butt."
06:28,980;06:30,700;"- So you have the original poster."
06:30,700;06:31,580;"- So I now have it, yeah."
06:31,580;06:32,420;"It's a family house. - It's a family house."
06:32,420;06:33,260;"- It's an image on the internet."
06:33,260;06:35,180;"I didn't know that was the OG poster."
06:35,180;06:37,940;"- Oh yes, that is the poster."
06:37,940;06:39,220;"- From the shrine room."
06:39,220;06:40,700;"- Yep, so I found that."
06:40,700;06:42,580;"So it got me thinking all day today,"
06:42,580;06:48,460;"do you have a favorite piece of,"
06:48,460;06:50,660;"I'll probably have to ask Greg this next week when he's here."
06:50,660;06:52,160;"- That's right, I'm definitely having a favorite piece."
06:52,160;06:54,320;"- A favorite piece of pages memorabilia."
06:54,320;07:02,080;"- No, I have one of hockey memorabilia though."
07:02,080;07:03,640;"Oh, okay. I think I know which one that says."
07:03,640;07:05,000;"- Ryan, Bobby, or picture I have?"
07:05,000;07:06,120;"- Yeah, yeah, yeah."
07:06,120;07:08,160;"- I wanna essay writing, ""Contest in fourth grade."""
07:08,160;07:10,600;"And the prize was, ""Meet Bobby Orr."""
07:10,600;07:12,680;"- I mean, that's good motivation, right?"
07:12,680;07:14,120;"And that's so, isn't it?"
07:14,120;07:16,120;"- I don't even remember what I wrote."
07:16,120;07:17,120;"- Doesn't matter."
07:17,120;07:18,440;"- Doesn't matter."
07:18,440;07:20,760;"- Good enough to meet Bobby Orr."
07:20,760;07:21,600;"- I don't know if I have one."
07:21,600;07:24,040;"I think I had,"
07:24,040;07:29,040;"oh, I had a signed Patriots hat"
07:29,040;07:30,560;"that was signed by a bunch of players,"
07:30,560;07:32,800;"'cause they came and like some of the,"
07:32,800;07:35,040;"like, you know, all the backups came"
07:35,040;07:37,440;"and played basketball at the high school"
07:37,440;07:39,640;"against like all the athletes of the high school"
07:39,640;07:41,080;"and they just mop the floor with them."
07:41,080;07:41,920;"- Right, of course."
07:41,920;07:46,340;"- But I won the raffle where I got to shoot from half court"
07:46,340;07:48,080;"for like a thousand bucks,"
07:48,080;07:51,760;"which I obviously missed 'cause I was like 10."
07:51,760;07:53,360;"(laughs)"
07:53,360;07:55,160;"- Maybe you're not even good at basketball now"
07:55,160;07:56,000;"and you probably weren't ever."
07:56,000;07:57,480;"- Right, yeah, I still couldn't hit that,"
07:57,480;07:59,960;"but I mean, at least I would have made a competitive now."
07:59,960;08:02,680;"But yeah, but that I got a hat signed by all of them."
08:02,680;08:06,520;"And I think the most famous guy was Scott's CQLs"
08:06,520;08:08,960;"at the time, the back of corner back, did you bled so?"
08:08,960;08:09,860;"- That's great."
08:09,860;08:13,400;"- So, but I lost that, that hat."
08:13,400;08:16,240;"And then I got a paid for shark tooth hat,"
08:16,240;08:17,080;"remember those?"
08:17,080;08:18,160;"- Well, things are, they're back."
08:18,160;08:19,640;"I got Greg's one of the Christmas players."
08:19,640;08:20,680;"- Yeah, yeah."
08:20,680;08:22,520;"And then that got stolen like the third day"
08:22,520;08:24,560;"at Ward's school, was heartbroken."
08:24,560;08:26,240;"- I still have Greg's starter jacket."
08:26,240;08:27,680;"I wear it all the time in the winter."
08:27,680;08:29,920;"- Mm, yep, starter jacket's a little kid."
08:29,920;08:32,640;"This thing is ridiculous."
08:32,640;08:33,960;"Still fits you?"
08:33,960;08:40,320;"Yeah, it's a maybe a touch short on the sleeves on me, but is that that like poofy one?"
08:40,320;08:42,160;"Did I have right here?"
08:42,160;08:43,160;"Show me."
08:43,160;08:47,640;"I didn't see this because I used to have on like way back in the day, back in the Parcels"
08:47,640;08:51,360;"era, like the pullover starter jacket."
08:51,360;08:55,720;"And I now have acquired something similar, but it has Jude blood so on the back of it,"
08:55,720;08:56,720;"which is pretty legit."
08:56,720;09:00,920;"I'll send you a picture. I worked with a Red Sox game."
09:00,920;09:03,680;"Yeah, send me the picture and we'll post it on Twitter."
09:03,680;09:05,280;"See if anybody else has any questions."
09:05,280;09:08,960;"And then ask for suggestions on what we should spend this gift card on."
09:08,960;09:10,280;"All right. Yeah, we'll do that."
09:10,280;09:10,920;"All right."
09:10,920;09:13,440;"I look for Troy Brown jersey. There was not one."
09:13,440;09:15,160;"No. Yeah. That's a shame."
09:15,160;09:17,160;"But they do have the red treasure, is he said, huh?"
09:17,160;09:19,640;"Has to be NFL shop, like NFL."
09:19,640;09:21,000;"Yeah, yeah."
09:21,000;09:23,560;"But don't they? I thought the NFL shop had..."
09:23,560;09:24,760;"I know the page is pro shop."
09:24,760;09:29,240;"has like the the old like white blue with the stripes and though I"
09:29,240;09:34,560;"Thought they had like it was like a brew ski and someone else made me Guinness"
09:34,560;09:39,360;"There was a brew ski when I think I saw the military something like that. Yeah, I'm after Troy Brown"
09:39,360;09:47,920;"I know yeah, we get a custom one for 360 bucks. Oh, that's a lot of money"
09:51,720;09:58,580;"All right, well, we'll find we'll ask our listeners if you have any any ideas you can text the dicey hotline"
09:58,580;10:06,580;"603-505-8043 and tell see which is spent his money on or if you have any bets that you think you should pick"
10:06,580;10:09,440;"You know a Mac Jones prop bet perhaps"
10:09,440;10:13,240;"Text us betting on the Patriots. I just told you that"
10:13,240;10:17,900;"All right bet on Zach Wilson then that's not the Patriots"
10:17,900;10:20,680;"How many interceptions will Zach"
10:20,760;10:23,840;"Wilson throw yeah over under Sam darnold I"
10:23,840;10:27,680;"Am about the fuck the Jets life"
10:27,680;10:32,720;"They'll ruin him just like they did Sam. I love it. So"
10:32,720;10:35,960;"So kind of like a mirror image of"
10:35,960;10:42,720;"This current week's matchup where both the Patriots and the Jets are winless at 0 and 1"
10:42,720;10:46,280;"Back in 2004 week 7"
10:46,840;10:48,280;"This was actually the opposite."
10:48,280;10:53,840;"This was a battle of the unbeaten, both Pat and Jets at 5 and 0 coming into this."
10:53,840;10:57,400;"Two of the last three undefeated teams in the league."
10:57,400;10:58,840;"Did you catch who the third one was?"
10:58,840;10:59,840;"No, I did not."
10:59,840;11:03,840;"The Philadelphia Eagles had won today in this game."
11:03,840;11:04,840;"Oh, yeah."
11:04,840;11:06,520;"The actual opponent in the Super Bowl."
11:06,520;11:07,520;"Correct."
11:07,520;11:15,600;"So, some high-flying teams and also the other team that we will see in the next episode"
11:15,600;11:20,240;"on their bi-week this week, the Pittsburgh Steelers with rookie Ben Rothelsberger are"
11:20,240;11:23,660;"sitting at four in one. So not bad either."
11:23,660;11:25,740;"Yeah, big balance. Good."
11:25,740;11:27,100;"Not the gate. Yeah."
11:27,100;11:34,620;"They a bit more about this streak. They're talking about it had been 391 days since the"
11:34,620;11:39,340;"Patriots had lost to the Redskins back in 2002."
11:39,340;11:43,660;"No, 2000, beginning in 2003."
11:43,660;11:44,860;"Yes."
11:45,460;11:49,180;"The last time they lost at home was the end of 2002."
11:49,180;11:51,300;"That's why I got that confused to"
11:51,300;11:54,420;"Chad Bennington and the Jets."
11:54,420;11:54,780;"Yeah."
11:54,780;11:58,420;"Some more things that have changed."
11:58,420;12:03,020;"Like this was kind of peak Boston sports weekend"
12:03,020;12:07,580;"because last episode we talked about how the Red Sox were down three"
12:07,580;12:08,900;"games and nothing to the Yankees."
12:08,900;12:13,060;"Things have changed since then in a week."
12:13,700;12:19,180;"And the Red Sox are now currently one game up in the World Series"
12:19,180;12:22,500;"after having completed their comeback for games of three."
12:22,500;12:23,660;"What a wild week."
12:23,660;12:24,180;"Yeah."
12:24,180;12:25,780;"And they actually posted a"
12:25,780;12:28,020;"the Patriots set the record for most wins in a row."
12:28,020;12:29,660;"Yeah, it's nice."
12:29,660;12:30,780;"Yeah."
12:30,780;12:33,220;"Yeah. So they they showed a"
12:33,220;12:39,820;"stat thing before the game title good times in Beantown this weekend in New England sports."
12:39,820;12:43,620;"The New England Patriots 20 game winning streak defending Super Bowl champions."
12:43,620;12:48,620;"Boston Red Sox World Series versus the St. Louis Cardinals lead the series won nothing,"
12:48,620;12:54,140;"game two tonight. And Boston College had just defeated Notre Dame the day before 24/23"
12:54,140;13:00,780;"in a big upset. I think Notre Dame was ranked or something. So good day to be a sports fan"
13:00,780;13:07,500;"in New England. Just a little ridiculous. It's good week. Well, yeah, we're just like,"
13:07,500;13:12,500;"We're spoiled for professional sports in New England."
13:12,500;13:20,220;"- We haven't done this in a while."
13:20,220;13:22,700;"You wanna give this game a watchability score?"
13:22,700;13:25,300;"- Yeah, it wasn't a very watchable game."
13:25,300;13:26,500;"- No, it was not."
13:26,500;13:28,700;"- Two maybe two and a half Lombardis."
13:28,700;13:33,500;"Maybe, yeah, that's two and a half, solid."
13:33,500;13:34,860;"- Out of six, yeah."
13:34,860;13:39,300;"I think two was probably as high as I would go."
13:39,300;13:40,020;"Two lumbar."
13:40,020;13:41,740;"He's got a six David Givens balls out."
13:41,740;13:42,860;"He does."
13:42,860;13:43,140;"Yeah."
13:43,140;13:44,660;"He does ball out."
13:44,660;13:46,900;"He finished with over a hundred receiving as I believe."
13:46,900;13:48,060;"Yeah."
13:48,060;13:51,260;"One oh seven, five catches all for first downs."
13:51,260;13:52,980;"It's not too shabby."
13:52,980;13:56,020;"And they were talking about how every single catch he's had this year has been for."
13:56,020;13:56,580;"Yeah."
13:56,580;14:00,620;"And it was, I think by the end of the game, it was because he did it in this game."
14:00,620;14:01,860;"Two every catch was the first down."
14:01,860;14:05,580;"So he ended, I think he's at like 22 or 23 on the season."
14:05,580;14:07,140;"- He's like 25."
14:07,140;14:08,380;"- Something like that."
14:08,380;14:09,820;"- And they said that at the beginning,"
14:09,820;14:11,500;"he said 20 this year."
14:11,500;14:12,340;"- Yeah."
14:12,340;14:14,020;"- And then he got five more in this game."
14:14,020;14:14,920;"- Oh, I swear, yeah."
14:14,920;14:18,300;"So, and I actually tried to look it up,"
14:18,300;14:22,140;"but it's un-Googleable, I guess, I don't know."
14:22,140;14:27,620;"But I'm wondering how many the longest streak is"
14:27,620;14:31,340;"of catches that go for first down."
14:31,340;14:33,380;"That could be a record that you're not going to break either, right?"
14:33,380;14:35,780;"We did Tucker something that he'll figure out."
14:35,780;14:37,340;"Oh, that's a good idea."
14:37,340;14:37,700;"Yeah."
14:37,700;14:39,220;"Oh, I like that."
14:39,220;14:41,100;"Full of good ideas today, Steve."
14:41,100;14:41,740;"Got them all."
14:41,740;14:43,620;"Got that barbecue, dude."
14:43,620;14:45,940;"Just, you know, the meaty goodness."
14:45,940;14:49,780;"There's nothing better than just like a slab of meat that you can eat."
14:49,780;14:51,140;"As much as you want."
14:51,140;14:51,420;"Yep."
14:51,420;14:53,900;"Yeah, just house and house and."
14:53,900;14:55,380;"Yeah."
14:55,380;14:57,100;"Dead animal."
14:57,100;15:00,340;"Givens is what I hope to kill will be."
15:00,340;15:09,020;"Yeah. He's just when he catches the ball, he, his fight for the extra yard reminds me"
15:09,020;15:14,900;"of like a big Edelman. If that's same, like I'm going to get this extra yard every time"
15:14,900;15:21,460;"and I'm going to carry two guys to do it. But he's also physical specimen too and David"
15:21,460;15:23,460;"Gibbons. It's a big dude."
15:23,460;15:27,220;"Man, this is the re-watchcon schemes reminds what I loved him."
15:27,220;15:30,220;"Oh yeah. Yeah. He was your favorite guy for a while, isn't he?"
15:30,220;15:31,220;"Oh yeah, by far."
15:31,220;15:34,220;"Yeah. That's the time of year when I was watching this and this little kid."
15:34,220;15:35,220;"Oh God, yeah."
15:35,220;15:39,220;"Yeah. Cause how old would you have been in 2004?"
15:39,220;15:41,220;"Don't make me do math."
15:41,220;15:43,220;"I think I was 21."
15:43,220;15:46,220;"They were like six years apart. They'd go."
15:46,220;15:51,220;"So, yeah. Mid-teen danger. Perfect time."
15:51,220;15:53,220;"Of course."
15:55,220;15:58,020;"But that was really the only my watchable part of this game."
15:58,020;16:02,020;"Yeah, I mean, you could watch the first half because it takes about"
16:02,020;16:06,980;"30 minutes. Yeah, because the clock didn't stop there was"
16:06,980;16:12,420;"they actually showed a stat right before the Patriots got the ball and we're like running no"
16:12,420;16:14,660;"inside two minutes left and a half."
16:14,660;16:19,380;"Where is it?"
16:19,380;16:22,020;"Both teams"
16:23,780;16:28,740;"had had two drives each in the first half and they were averaging seven minutes per drive."
16:28,740;16:35,220;"And the score before that was seven, six jets."
16:35,220;16:46,900;"It was rough. But then at the end of the half, Patreton, Noah Huddle just goes straight down"
16:46,900;16:51,540;"the field and score a touchdown, Barry de Patton, five seconds left and a half."
16:52,580;16:54,180;"And that was all this."
16:54,180;16:55,380;"But there was."
16:55,380;16:56,820;"There wasn't anymore."
16:56,820;17:00,580;"With the second half, just it was a slog."
17:00,580;17:02,460;"Yeah, lots of three and outs."
17:02,460;17:05,980;"Well, people are not running the ball anywhere."
17:05,980;17:07,860;"Either running back is having a great game."
17:07,860;17:12,060;"Yeah, the only drive that had any promise was the one long one"
17:12,060;17:14,340;"at the end of the third quarter where the Pat"
17:14,340;17:17,940;"started their own nine and then Dylan had that huge run"
17:17,940;17:20,180;"to end the quarter."
17:20,180;17:25,980;"And then Brady hit Pat into the 20, but then Pat and got up and just like tossed the ball to the guy who's covering him."
17:25,980;17:29,060;"And they call it taunting on him, so brought the play all the way back."
17:29,060;17:31,900;"And I think it was like the next play."
17:31,900;17:35,500;"They tried to run a screen and here's something we should talk about."
17:35,500;17:38,300;"They tried to run a screenplay to the full back."
17:38,300;17:42,180;"Only the full back wasn't Patrick Pass like it normally is because he was hurt."
17:42,180;17:44,100;"So the backup full back."
17:44,100;17:45,420;"Who was this?"
17:45,420;17:46,500;"You brown and clacko."
17:46,500;17:47,780;"He's Stan clacko."
17:47,780;17:49,980;"Your nose tackle number 90."
17:49,980;17:55,060;"He actually that the first play from scrimmage was a throw to"
17:55,060;17:55,980;"Klekko out of the backfield."
17:55,980;17:56,540;"Yeah."
17:56,540;17:58,060;"Like they just love throwing to him."
17:58,060;17:59,380;"And then this was a second."
17:59,380;18:03,660;"Well, a second reception of the game, they ran a screen, a"
18:03,660;18:09,580;"screen of full back screen to Dan Klekko who got hit hard."
18:09,580;18:12,780;"The fumble, the ball and left the games and come back."
18:12,780;18:13,540;"Yeah."
18:13,540;18:18,540;"He was big in this like featured, I guess, there."
18:18,540;18:18,860;"Yeah."
18:19,060;18:21,800;"- Yeah, it felt a lot like..."
18:21,800;18:23,700;"- And he can move for a big man, but he just kind of"
18:23,700;18:26,480;"mad like he's not used to carrying a ball, I think."
18:26,480;18:28,180;"- No, well, there was also one play."
18:28,180;18:29,880;"- I don't think that he picked up that he missed too, I saw."
18:29,880;18:31,120;"- Yeah, yeah, there was one play,"
18:31,120;18:34,840;"the deep shot to Gibbons."
18:34,840;18:36,320;"I don't remember what it was."
18:36,320;18:39,680;"That on the sideline, like he was lined up"
18:39,680;18:41,040;"in the backfield as a full back,"
18:41,040;18:44,120;"and then he motioned out to be a tight end."
18:44,120;18:45,960;"But then he obviously didn't know what to do on the place,"
18:45,960;18:46,880;"he just kind of like stood around,"
18:46,880;18:48,820;"like looking for somebody to block."
18:48,820;18:51,700;"Like first you turn around, look at Bray, he's like, oh shit, it's a passing play."
18:51,700;18:54,380;"And there's kind of like ran around trying to find somebody blocking it."
18:54,380;18:55,900;"Wasn't anybody is hysterical."
18:55,900;18:57,820;"All right."
18:57,820;18:58,240;"I miss that."
18:58,240;18:59,020;"You have to put them on the site."
18:59,020;18:59,540;"Yeah."
18:59,540;19:01,900;"I think it's the big, the deep pass by."
19:01,900;19:05,620;"So if you find the deep pass player to, to give in, you'll, you'll keep an eye on"
19:05,620;19:06,860;"the fullback, that play."
